"No.","Time","Source","Destination","Protocol","Length","Info"
"1","0.000000","LiteonTe_f7:82:e7","Broadcast","ARP","42","Who has 192.168.43.1? Tell 192.168.43.240"
"2","0.054356","HuaweiTe_d8:6e:c7","LiteonTe_f7:82:e7","ARP","42","192.168.43.1 is at 50:04:b8:d8:6e:c7"
"3","0.331677","192.168.43.240","192.168.43.1","DNS","67","Standard query 0xf71e A msrv.su"
"4","0.332168","192.168.43.240","192.168.43.1","DNS","75","Standard query 0xa2d5 A ui.ff.avast.com"
"5","0.337282","192.168.43.240","192.168.43.1","DNS","71","Standard query 0xcedb A browsec.com"
"6","0.338950","192.168.43.240","192.168.43.255","NBNS","92","Name query NB WPAD<00>"
"7","0.339245","fe80::85f5:a9e0:4b59:b0f1","ff02::1:3","LLMNR","84","Standard query 0xb093 A wpad"
"8","0.339360","192.168.43.240","224.0.0.252","LLMNR","64","Standard query 0xb093 A wpad"
"9","0.391470","192.168.43.1","192.168.43.240","DNS","313","Standard query response 0xf71e A msrv.su A 176.9.18.162 NS ns1.first-ns.de NS robotns3.second-ns.com NS robotns2.second-ns.de A 193.47.99.3 AAAA 2001:67c:192c::add:a3 A 213.133.105.6 AAAA 2a01:4f8:d0a:2004::2 A 213.239.242.238 AAAA 2a01:4f8:0:a101::a:1"
"10","0.392415","192.168.43.240","192.168.43.1","DNS","88","Standard query 0x9acf A drah7iczdw1tu.cloudfront.net"
"11","0.397486","192.168.43.1","192.168.43.240","DNS","454","Standard query response 0xa2d5 A ui.ff.avast.com CNAME urlinfo.ns1.ff.avast.com A 5.45.58.26 A 5.45.59.38 A 5.45.58.100 NS ns01.ns1dnsavast.com NS dns1.p02.nsone.net NS ns03.ns1dnsavast.com NS ns02.ns1dnsavast.com NS ns04.ns1dnsavast.com NS dns3.p02.nsone.net NS dns2.p02.nsone.net NS dns4.p02.nsone.net A 198.51.44.2 A 198.51.45.2 A 198.51.44.66 A 198.51.45.66 A 185.51.231.1 A 185.51.231.65 A 185.51.231.129 A 185.51.231.193"
"12","0.400280","192.168.43.240","192.168.43.1","DNS","76","Standard query 0xdfef A publicsuffix.org"
"13","0.462891","192.168.43.240","192.168.43.1","DNS","71","Standard query 0xcedb A browsec.com"
"14","0.524565","192.168.43.240","192.168.43.1","DNS","76","Standard query 0xdfef A publicsuffix.org"
"15","0.524565","192.168.43.240","192.168.43.1","DNS","88","Standard query 0x9acf A drah7iczdw1tu.cloudfront.net"
"16","0.535525","192.168.43.1","192.168.43.240","DNS","372","Standard query response 0xcedb A browsec.com A 138.201.57.222 NS ns-1465.awsdns-55.org NS ns-248.awsdns-31.com NS ns-635.awsdns-15.net NS ns-1850.awsdns-39.co.uk A 205.251.197.185 AAAA 2600:9000:5305:b900::1 A 205.251.199.58 AAAA 2600:9000:5307:3a00::1 A 205.251.192.248 A 205.251.194.123 AAAA 2600:9000:5302:7b00::1"
"17","0.535629","192.168.43.1","192.168.43.240","DNS","529","Standard query response 0x9acf A drah7iczdw1tu.cloudfront.net A 13.32.56.92 A 13.32.56.195 A 13.32.56.30 A 13.32.56.89 A 13.32.56.58 A 13.32.56.84 A 13.32.56.222 A 13.32.56.129 NS ns-1199.awsdns-21.org NS ns-634.awsdns-15.net NS ns-1563.awsdns-03.co.uk NS ns-317.awsdns-39.com A 205.251.196.175 AAAA 2600:9000:5304:af00::1 A 205.251.198.27 AAAA 2600:9000:5306:1b00::1 A 205.251.193.61 AAAA 2600:9000:5301:3d00::1 A 205.251.194.122 AAAA 2600:9000:5302:7a00::1"
"18","0.535629","192.168.43.1","192.168.43.240","DNS","375","Standard query response 0xdfef A publicsuffix.org A 63.245.213.25 NS ns-2045.awsdns-63.co.uk NS ns-787.awsdns-34.net NS ns-1334.awsdns-38.org NS ns-1.awsdns-00.com A 205.251.192.1 A 205.251.197.54 AAAA 2600:9000:5305:3600::1 A 205.251.199.253 AAAA 2600:9000:5307:fd00::1 A 205.251.195.19 AAAA 2600:9000:5303:1300::1"
"19","0.535630","192.168.43.1","192.168.43.240","DNS","87","Standard query response 0xcedb A browsec.com A 138.201.57.222"
"20","0.536323","192.168.43.240","192.168.43.1","DNS","84","Standard query 0xae0f A ssl.google-analytics.com"
"21","0.536323","192.168.43.240","192.168.43.1","DNS","67","Standard query 0x8173 A mail.ru"
"22","0.537312","192.168.43.1","192.168.43.240","DNS","216","Standard query response 0x9acf A drah7iczdw1tu.cloudfront.net A 13.32.56.129 A 13.32.56.222 A 13.32.56.84 A 13.32.56.58 A 13.32.56.89 A 13.32.56.30 A 13.32.56.195 A 13.32.56.92"
"23","0.537313","192.168.43.1","192.168.43.240","DNS","92","Standard query response 0xdfef A publicsuffix.org A 63.245.213.25"
"24","0.660668","192.168.43.240","192.168.43.1","DNS","84","Standard query 0xae0f A ssl.google-analytics.com"
"25","0.660668","192.168.43.240","192.168.43.1","DNS","67","Standard query 0x8173 A mail.ru"
"26","0.708309","192.168.43.1","192.168.43.240","DNS","334","Standard query response 0x8173 A mail.ru A 94.100.180.201 A 94.100.180.200 A 217.69.139.201 A 217.69.139.200 NS ns2.mail.ru NS ns3.mail.ru NS ns1.mail.ru A 185.30.176.202 AAAA 2a00:1148:db00::2 A 94.100.180.138 AAAA 2a00:1148:db00::1 A 217.69.139.112 AAAA 2a00:1148:db00::2"
"27","0.708532","192.168.43.1","192.168.43.240","DNS","392","Standard query response 0xae0f A ssl.google-analytics.com CNAME ssl-google-analytics.l.google.com A 172.217.21.168 NS ns4.google.com NS ns3.google.com NS ns1.google.com NS ns2.google.com A 216.239.34.10 AAAA 2001:4860:4802:34::a A 216.239.32.10 AAAA 2001:4860:4802:32::a A 216.239.36.10 AAAA 2001:4860:4802:36::a A 216.239.38.10 AAAA 2001:4860:4802:38::a"
"28","0.708533","192.168.43.1","192.168.43.240","DNS","147","Standard query response 0xae0f A ssl.google-analytics.com CNAME ssl-google-analytics.l.google.com A 172.217.21.168"
"29","0.708680","192.168.43.1","192.168.43.240","DNS","131","Standard query response 0x8173 A mail.ru A 217.69.139.200 A 217.69.139.201 A 94.100.180.200 A 94.100.180.201"
"30","0.780010","fe80::85f5:a9e0:4b59:b0f1","ff02::1:3","LLMNR","84","Standard query 0xb093 A wpad"
"31","0.780104","192.168.43.240","224.0.0.252","LLMNR","64","Standard query 0xb093 A wpad"
"32","1.089989","192.168.43.240","192.168.43.255","NBNS","92","Name query NB WPAD<00>"
"33","1.339369","192.168.43.240","46.4.235.72","TCP","66","2306  >  80 [SYN] Seq=0 Win=8192 Len=0 MSS=1460 WS=256 SACK_PERM=1"
"34","1.339843","192.168.43.240","192.168.43.1","DNS","76","Standard query 0xbefc A mtalk.google.com"
"35","1.340188","192.168.43.240","172.217.21.168","QUIC","1392","Client Hello, PKN: 1, CID: 17504889374410825644"
"36","1.340473","192.168.43.240","5.45.58.26","TCP","66","2307  >  80 [SYN] Seq=0 Win=8192 Len=0 MSS=1460 WS=256 SACK_PERM=1"
"37","1.341971","192.168.43.240","46.4.235.70","TCP","66","2308  >  80 [SYN] Seq=0 Win=8192 Len=0 MSS=1460 WS=256 SACK_PERM=1"
"38","1.342156","192.168.43.240","46.4.235.70","TCP","66","2309  >  80 [SYN] Seq=0 Win=8192 Len=0 MSS=1460 WS=256 SACK_PERM=1"
"39","1.342296","192.168.43.240","46.4.235.70","TCP","66","2310  >  80 [SYN] Seq=0 Win=8192 Len=0 MSS=1460 WS=256 SACK_PERM=1"
"40","1.486103","192.168.43.240","192.168.43.1","DNS","79","Standard query 0x994d A accounts.google.com"
"41","1.493156","192.168.43.240","192.168.43.1","DNS","76","Standard query 0xbefc A mtalk.google.com"
"42","1.500295","192.168.43.1","192.168.43.240","DNS","369","Standard query response 0xbefc A mtalk.google.com CNAME mobile-gtalk.l.google.com A 64.233.164.188 NS ns3.google.com NS ns1.google.com NS ns4.google.com NS ns2.google.com A 216.239.34.10 AAAA 2001:4860:4802:34::a A 216.239.32.10 AAAA 2001:4860:4802:32::a A 216.239.36.10 AAAA 2001:4860:4802:36::a A 216.239.38.10 AAAA 2001:4860:4802:38::a"
"43","1.500296","172.217.21.168","192.168.43.240","QUIC","1392","Payload (Encrypted), PKN: 1, CID: 17504889374410825644"
"44","1.500297","172.217.21.168","192.168.43.240","QUIC","1392","Payload (Encrypted), PKN: 2, CID: 17504889374410825644"
"45","1.500297","46.4.235.72","192.168.43.240","TCP","66","80  >  2306 [SYN, ACK] Seq=0 Ack=1 Win=14600 Len=0 MSS=1400 SACK_PERM=1 WS=512"
"46","1.500298","5.45.58.26","192.168.43.240","TCP","66","80  >  2307 [SYN, ACK] Seq=0 Ack=1 Win=2920 Len=0 MSS=1400 SACK_PERM=1 WS=8192"
"47","1.500298","46.4.235.70","192.168.43.240","TCP","66","80  >  2309 [SYN, ACK] Seq=0 Ack=1 Win=14600 Len=0 MSS=1400 SACK_PERM=1 WS=512"
"48","1.500299","46.4.235.70","192.168.43.240","TCP","66","80  >  2310 [SYN, ACK] Seq=0 Ack=1 Win=14600 Len=0 MSS=1400 SACK_PERM=1 WS=512"
"49","1.500299","46.4.235.70","192.168.43.240","TCP","66","80  >  2308 [SYN, ACK] Seq=0 Ack=1 Win=14600 Len=0 MSS=1400 SACK_PERM=1 WS=512"
"50","1.500299","192.168.43.1","192.168.43.240","DNS","131","Standard query response 0xbefc A mtalk.google.com CNAME mobile-gtalk.l.google.com A 64.233.164.188"
"51","1.500562","192.168.43.240","46.4.235.72","TCP","54","2306  >  80 [ACK] Seq=1 Ack=1 Win=65792 Len=0"
"52","1.500620","192.168.43.240","5.45.58.26","TCP","54","2307  >  80 [ACK] Seq=1 Ack=1 Win=65792 Len=0"
"53","1.500653","192.168.43.240","46.4.235.70","TCP","54","2309  >  80 [ACK] Seq=1 Ack=1 Win=65792 Len=0"
"54","1.500680","192.168.43.240","46.4.235.70","TCP","54","2310  >  80 [ACK] Seq=1 Ack=1 Win=65792 Len=0"
"55","1.500706","192.168.43.240","46.4.235.70","TCP","54","2308  >  80 [ACK] Seq=1 Ack=1 Win=65792 Len=0"
"56","1.504409","192.168.43.240","172.217.21.168","QUIC","80","Payload (Encrypted), PKN: 2, CID: 17504889374410825644"
"57","1.504768","192.168.43.240","46.4.235.72","HTTP","458","GET / HTTP/1.1 "
"58","1.504905","192.168.43.240","5.45.58.26","HTTP","481","GET /v5/ruleUpdate HTTP/1.1 "
"59","1.517448","192.168.43.240","64.233.164.188","TCP","66","2314  >  5228 [SYN] Seq=0 Win=8192 Len=0 MSS=1460 WS=256 SACK_PERM=1"
"60","1.520358","192.168.43.1","192.168.43.240","DNS","343","Standard query response 0x994d A accounts.google.com A 216.58.211.141 NS ns4.google.com NS ns1.google.com NS ns3.google.com NS ns2.google.com A 216.239.34.10 AAAA 2001:4860:4802:34::a A 216.239.32.10 AAAA 2001:4860:4802:32::a A 216.239.36.10 AAAA 2001:4860:4802:36::a A 216.239.38.10 AAAA 2001:4860:4802:38::a"
"61","1.528797","192.168.43.240","216.58.211.141","QUIC","1392","Client Hello, PKN: 1, CID: 2990740619611634455"
"62","1.587680","192.168.43.240","172.217.21.168","TCP","66","2315  >  443 [SYN] Seq=0 Win=8192 Len=0 MSS=1460 WS=256 SACK_PERM=1"
"63","1.589851","192.168.43.240","64.233.164.188","TCP","66","2316  >  5228 [SYN] Seq=0 Win=8192 Len=0 MSS=1460 WS=256 SACK_PERM=1"
"64","1.622159","192.168.43.240","239.255.255.250","SSDP","216","M-SEARCH * HTTP/1.1 "
"65","1.629549","192.168.43.240","172.217.21.168","QUIC","1392","Client Hello, PKN: 3, CID: 17504889374410825644"
"66","1.629943","192.168.43.240","172.217.21.168","QUIC","277","Payload (Encrypted), PKN: 4, CID: 17504889374410825644"
"67","1.637571","192.168.43.240","13.32.56.92","TCP","66","2317  >  443 [SYN] Seq=0 Win=8192 Len=0 MSS=1460 WS=256 SACK_PERM=1"
"68","1.638293","192.168.43.240","13.32.56.92","TCP","66","2318  >  443 [SYN] Seq=0 Win=8192 Len=0 MSS=1460 WS=256 SACK_PERM=1"
"69","1.640211","192.168.43.240","138.201.57.222","TCP","66","2319  >  443 [SYN] Seq=0 Win=8192 Len=0 MSS=1460 WS=256 SACK_PERM=1"
"70","1.673822","64.233.164.188","192.168.43.240","TCP","66","5228  >  2314 [SYN, ACK] Seq=0 Ack=1 Win=42780 Len=0 MSS=1380 SACK_PERM=1 WS=256"
"71","1.673925","192.168.43.240","64.233.164.188","TCP","54","2314  >  5228 [ACK] Seq=1 Ack=1 Win=66048 Len=0"
"72","1.674094","192.168.43.240","64.233.164.188","TCP","240","2314  >  5228 [PSH, ACK] Seq=1 Ack=1 Win=66048 Len=186"
"73","1.674182","216.58.211.141","192.168.43.240","QUIC","1392","Payload (Encrypted), PKN: 1, CID: 2990740619611634455"
"74","1.680171","216.58.211.141","192.168.43.240","QUIC","1392","Payload (Encrypted), PKN: 2, CID: 2990740619611634455"
"75","1.680172","46.4.235.72","192.168.43.240","TCP","54","80  >  2306 [ACK] Seq=1 Ack=405 Win=15872 Len=0"
"76","1.681059","46.4.235.72","192.168.43.240","HTTP","391","HTTP/1.1 302 Found  (text/html)"
"77","1.681060","5.45.58.26","192.168.43.240","TCP","54","80  >  2307 [ACK] Seq=1 Ack=428 Win=8192 Len=0"
"78","1.681061","5.45.58.26","192.168.43.240","TCP","1454","80  >  2307 [ACK] Seq=1 Ack=428 Win=8192 Len=1400 [TCP segment of a reassembled PDU]"
"79","1.681064","5.45.58.26","192.168.43.240","TCP","1454","80  >  2307 [ACK] Seq=1401 Ack=428 Win=8192 Len=1400 [TCP segment of a reassembled PDU]"
"80","1.681066","5.45.58.26","192.168.43.240","TCP","1454","80  >  2307 [ACK] Seq=2801 Ack=428 Win=8192 Len=1400 [TCP segment of a reassembled PDU]"
"81","1.681067","5.45.58.26","192.168.43.240","TCP","1454","80  >  2307 [ACK] Seq=4201 Ack=428 Win=8192 Len=1400 [TCP segment of a reassembled PDU]"
"82","1.681220","192.168.43.240","5.45.58.26","TCP","54","2307  >  80 [ACK] Seq=428 Ack=5601 Win=65792 Len=0"
"83","1.682448","5.45.58.26","192.168.43.240","TCP","1454","80  >  2307 [ACK] Seq=5601 Ack=428 Win=8192 Len=1400 [TCP segment of a reassembled PDU]"
"84","1.682450","5.45.58.26","192.168.43.240","TCP","1454","80  >  2307 [ACK] Seq=7001 Ack=428 Win=8192 Len=1400 [TCP segment of a reassembled PDU]"
"85","1.682450","5.45.58.26","192.168.43.240","TCP","1454","80  >  2307 [ACK] Seq=8401 Ack=428 Win=8192 Len=1400 [TCP segment of a reassembled PDU]"
"86","1.682453","5.45.58.26","192.168.43.240","TCP","1454","80  >  2307 [ACK] Seq=9801 Ack=428 Win=8192 Len=1400 [TCP segment of a reassembled PDU]"
"87","1.682453","5.45.58.26","192.168.43.240","TCP","1454","80  >  2307 [ACK] Seq=11201 Ack=428 Win=8192 Len=1400 [TCP segment of a reassembled PDU]"
"88","1.682454","5.45.58.26","192.168.43.240","TCP","1454","80  >  2307 [ACK] Seq=12601 Ack=428 Win=8192 Len=1400 [TCP segment of a reassembled PDU]"
"89","1.682455","64.233.164.188","192.168.43.240","TCP","66","5228  >  2316 [SYN, ACK] Seq=0 Ack=1 Win=42780 Len=0 MSS=1380 SACK_PERM=1 WS=256"
"90","1.682456","172.217.21.168","192.168.43.240","TCP","66","443  >  2315 [SYN, ACK] Seq=0 Ack=1 Win=42780 Len=0 MSS=1380 SACK_PERM=1 WS=256"
"91","1.682456","172.217.21.168","192.168.43.240","QUIC","1392","Payload (Encrypted), PKN: 3"
"92","1.682457","172.217.21.168","192.168.43.240","QUIC","73","Payload (Encrypted), PKN: 4"
"93","1.682457","13.32.56.92","192.168.43.240","TCP","66","443  >  2317 [SYN, ACK] Seq=0 Ack=1 Win=29200 Len=0 MSS=1400 SACK_PERM=1 WS=256"
"94","1.682656","192.168.43.240","5.45.58.26","TCP","54","2307  >  80 [ACK] Seq=428 Ack=14001 Win=65792 Len=0"
"95","1.682711","192.168.43.240","64.233.164.188","TCP","54","2316  >  5228 [ACK] Seq=1 Ack=1 Win=66048 Len=0"
"96","1.682746","192.168.43.240","172.217.21.168","TCP","54","2315  >  443 [ACK] Seq=1 Ack=1 Win=66048 Len=0"
"97","1.682861","192.168.43.240","13.32.56.92","TCP","54","2317  >  443 [ACK] Seq=1 Ack=1 Win=65792 Len=0"
"98","1.683757","192.168.43.240","216.58.211.141","QUIC","80","Payload (Encrypted), PKN: 2, CID: 2990740619611634455"
"99","1.684594","192.168.43.240","172.217.21.168","QUIC","83","Payload (Encrypted), PKN: 5, CID: 17504889374410825644"
"100","1.684722","192.168.43.240","172.217.21.168","QUIC","80","Payload (Encrypted), PKN: 6, CID: 17504889374410825644"
"101","1.684949","192.168.43.240","172.217.21.168","TLSv1.2","266","Client Hello"
"102","1.685140","192.168.43.240","13.32.56.92","TLSv1.2","270","Client Hello"
"103","1.688050","192.168.43.240","216.58.211.141","QUIC","1392","Client Hello, PKN: 3, CID: 2990740619611634455"
"104","1.689083","192.168.43.240","176.9.18.162","TCP","66","2320  >  443 [SYN] Seq=0 Win=8192 Len=0 MSS=1460 WS=256 SACK_PERM=1"
"105","1.689350","192.168.43.240","176.9.18.162","TCP","66","2321  >  443 [SYN] Seq=0 Win=8192 Len=0 MSS=1460 WS=256 SACK_PERM=1"
"106","1.689573","192.168.43.240","176.9.18.162","TCP","66","2322  >  443 [SYN] Seq=0 Win=8192 Len=0 MSS=1460 WS=256 SACK_PERM=1"
"107","1.700175","192.168.43.240","46.4.235.70","HTTP","1093","GET /?token=ziqh0 HTTP/1.1 "
"108","1.703560","192.168.43.240","192.168.43.1","DNS","76","Standard query 0x1033 A uib.ff.avast.com"
"109","1.730379","192.168.43.240","46.4.235.72","TCP","54","2306  >  80 [ACK] Seq=405 Ack=338 Win=65280 Len=0"
"110","1.743854","192.168.43.240","192.168.43.1","DNS","84","Standard query 0x6019 A translate.googleapis.com"
"111","1.743854","192.168.43.240","192.168.43.1","DNS","89","Standard query 0x5d1a A clientservices.googleapis.com"
"112","1.817962","13.32.56.92","192.168.43.240","TCP","66","443  >  2318 [SYN, ACK] Seq=0 Ack=1 Win=29200 Len=0 MSS=1400 SACK_PERM=1 WS=256"
"113","1.817963","138.201.57.222","192.168.43.240","TCP","66","443  >  2319 [SYN, ACK] Seq=0 Ack=1 Win=29200 Len=0 MSS=1400 SACK_PERM=1 WS=128"
"114","1.817963","64.233.164.188","192.168.43.240","TCP","54","5228  >  2314 [ACK] Seq=1 Ack=187 Win=44032 Len=0"
"115","1.818083","192.168.43.240","13.32.56.92","TCP","54","2318  >  443 [ACK] Seq=1 Ack=1 Win=65792 Len=0"
"116","1.818131","192.168.43.240","138.201.57.222","TCP","54","2319  >  443 [ACK] Seq=1 Ack=1 Win=65792 Len=0"
"117","1.818218","192.168.43.240","13.32.56.92","TLSv1.2","270","Client Hello"
"118","1.818321","192.168.43.240","138.201.57.222","TLSv1.2","253","Client Hello"
"119","1.819528","64.233.164.188","192.168.43.240","TCP","1454","5228  >  2314 [ACK] Seq=1 Ack=187 Win=44032 Len=1400"
"120","1.819529","64.233.164.188","192.168.43.240","TCP","1454","5228  >  2314 [ACK] Seq=1401 Ack=187 Win=44032 Len=1400"
"121","1.819531","172.217.21.168","192.168.43.240","TCP","54","443  >  2315 [ACK] Seq=1 Ack=213 Win=44032 Len=0"
"122","1.819531","172.217.21.168","192.168.43.240","QUIC","246","Payload (Encrypted), PKN: 5"
"123","1.819531","64.233.164.188","192.168.43.240","TCP","1454","5228  >  2314 [ACK] Seq=2801 Ack=187 Win=44032 Len=1400"
"124","1.819532","64.233.164.188","192.168.43.240","TCP","215","5228  >  2314 [PSH, ACK] Seq=4201 Ack=187 Win=44032 Len=161"
"125","1.819532","192.168.43.1","192.168.43.240","DNS","455","Standard query response 0x1033 A uib.ff.avast.com CNAME urlinfo.ns1.ff.avast.com A 5.45.59.38 A 5.45.58.100 A 5.45.58.26 NS dns3.p02.nsone.net NS ns03.ns1dnsavast.com NS dns4.p02.nsone.net NS ns01.ns1dnsavast.com NS dns1.p02.nsone.net NS ns04.ns1dnsavast.com NS dns2.p02.nsone.net NS ns02.ns1dnsavast.com A 198.51.44.2 A 198.51.45.2 A 198.51.44.66 A 198.51.45.66 A 185.51.231.1 A 185.51.231.65 A 185.51.231.129 A 185.51.231.193"
"126","1.819533","216.58.211.141","192.168.43.240","QUIC","1392","Payload (Encrypted), PKN: 3"
"127","1.819533","216.58.211.141","192.168.43.240","QUIC","73","Payload (Encrypted), PKN: 4"
"128","1.819533","172.217.21.168","192.168.43.240","TLSv1.2","1454","Server Hello"
"129","1.819534","172.217.21.168","192.168.43.240","TCP","1454","443  >  2315 [ACK] Seq=1401 Ack=213 Win=44032 Len=1400 [TCP segment of a reassembled PDU]"
"130","1.819535","172.217.21.168","192.168.43.240","TLSv1.2","384","Certificate, Server Key Exchange, Server Hello Done"
"131","1.819535","13.32.56.92","192.168.43.240","TCP","54","443  >  2317 [ACK] Seq=1 Ack=217 Win=30464 Len=0"
"132","1.819535","13.32.56.92","192.168.43.240","TLSv1.2","1454","Server Hello"
"133","1.819595","192.168.43.240","64.233.164.188","TCP","54","2314  >  5228 [ACK] Seq=187 Ack=2801 Win=66048 Len=0"
"134","1.819671","192.168.43.240","64.233.164.188","TCP","54","2314  >  5228 [ACK] Seq=187 Ack=4362 Win=66048 Len=0"
"135","1.819768","192.168.43.240","172.217.21.168","TCP","54","2315  >  443 [ACK] Seq=213 Ack=3131 Win=66048 Len=0"
"136","1.821459","13.32.56.92","192.168.43.240","TCP","1454","443  >  2317 [ACK] Seq=1401 Ack=217 Win=30464 Len=1400 [TCP segment of a reassembled PDU]"
"137","1.821491","192.168.43.240","13.32.56.92","TCP","54","2317  >  443 [ACK] Seq=217 Ack=2801 Win=65792 Len=0"
"138","1.822876","192.168.43.240","64.233.164.188","TCP","312","2314  >  5228 [PSH, ACK] Seq=187 Ack=4362 Win=66048 Len=258"
"139","1.823471","192.168.43.240","216.58.211.141","QUIC","81","Payload (Encrypted), PKN: 4, CID: 2990740619611634455"
"140","1.823486","13.32.56.92","192.168.43.240","TLSv1.2","1454","Certificate [TCP segment of a reassembled PDU]"
"141","1.823487","13.32.56.92","192.168.43.240","TLSv1.2","797","Certificate Status, Server Key Exchange, Server Hello Done"
"142","1.823487","5.45.58.26","192.168.43.240","TCP","1454","80  >  2307 [ACK] Seq=14001 Ack=428 Win=8192 Len=1400 [TCP segment of a reassembled PDU]"
"143","1.823489","5.45.58.26","192.168.43.240","TCP","1454","80  >  2307 [PSH, ACK] Seq=15401 Ack=428 Win=8192 Len=1400 [TCP segment of a reassembled PDU]"
"144","1.823489","5.45.58.26","192.168.43.240","TCP","1454","80  >  2307 [ACK] Seq=16801 Ack=428 Win=8192 Len=1400 [TCP segment of a reassembled PDU]"
"145","1.823490","5.45.58.26","192.168.43.240","TCP","1454","80  >  2307 [ACK] Seq=18201 Ack=428 Win=8192 Len=1400 [TCP segment of a reassembled PDU]"
"146","1.823570","192.168.43.240","13.32.56.92","TCP","54","2317  >  443 [ACK] Seq=217 Ack=4944 Win=65792 Len=0"
"147","1.823592","192.168.43.240","216.58.211.141","QUIC","80","Payload (Encrypted), PKN: 5, CID: 2990740619611634455"
"148","1.823604","192.168.43.240","5.45.58.26","TCP","54","2307  >  80 [ACK] Seq=428 Ack=19601 Win=65792 Len=0"
"149","1.825651","192.168.43.240","172.217.21.168","TLSv1.2","312","Client Key Exchange, Change Cipher Spec, Encrypted Handshake Message, Encrypted Handshake Message"
"150","1.826335","5.45.58.26","192.168.43.240","TCP","1454","80  >  2307 [ACK] Seq=19601 Ack=428 Win=8192 Len=1400 [TCP segment of a reassembled PDU]"
"151","1.826504","5.45.58.26","192.168.43.240","TCP","1454","80  >  2307 [ACK] Seq=21001 Ack=428 Win=8192 Len=1400 [TCP segment of a reassembled PDU]"
"152","1.826505","5.45.58.26","192.168.43.240","HTTP","169","HTTP/1.1 200 OK  (application/octet-stream)"
"153","1.826545","192.168.43.240","5.45.58.26","TCP","54","2307  >  80 [ACK] Seq=428 Ack=22516 Win=65792 Len=0"
"154","1.827492","192.168.43.240","13.32.56.92","TLSv1.2","180","Client Key Exchange, Change Cipher Spec, Encrypted Handshake Message"
"155","1.827566","176.9.18.162","192.168.43.240","TCP","66","443  >  2322 [SYN, ACK] Seq=0 Ack=1 Win=29200 Len=0 MSS=1400 SACK_PERM=1 WS=512"
"156","1.827566","176.9.18.162","192.168.43.240","TCP","66","443  >  2320 [SYN, ACK] Seq=0 Ack=1 Win=29200 Len=0 MSS=1400 SACK_PERM=1 WS=512"
"157","1.827567","176.9.18.162","192.168.43.240","TCP","66","443  >  2321 [SYN, ACK] Seq=0 Ack=1 Win=29200 Len=0 MSS=1400 SACK_PERM=1 WS=512"
"158","1.827567","192.168.43.1","192.168.43.240","DNS","360","Standard query response 0x5d1a A clientservices.googleapis.com A 216.58.211.131 NS ns4.google.com NS ns2.google.com NS ns1.google.com NS ns3.google.com A 216.239.34.10 AAAA 2001:4860:4802:34::a A 216.239.32.10 AAAA 2001:4860:4802:32::a A 216.239.36.10 AAAA 2001:4860:4802:36::a A 216.239.38.10 AAAA 2001:4860:4802:38::a"
"159","1.827568","192.168.43.1","192.168.43.240","DNS","355","Standard query response 0x6019 A translate.googleapis.com A 216.58.211.138 NS ns3.google.com NS ns2.google.com NS ns1.google.com NS ns4.google.com A 216.239.34.10 AAAA 2001:4860:4802:34::a A 216.239.32.10 AAAA 2001:4860:4802:32::a A 216.239.36.10 AAAA 2001:4860:4802:36::a A 216.239.38.10 AAAA 2001:4860:4802:38::a"
"160","1.827568","46.4.235.70","192.168.43.240","TCP","54","80  >  2309 [ACK] Seq=1 Ack=1040 Win=16896 Len=0"
"161","1.827568","46.4.235.70","192.168.43.240","HTTP","965","HTTP/1.1 200 OK  (text/html)"
"162","1.827699","192.168.43.240","176.9.18.162","TCP","54","2322  >  443 [ACK] Seq=1 Ack=1 Win=65792 Len=0"
"163","1.827732","192.168.43.240","176.9.18.162","TCP","54","2320  >  443 [ACK] Seq=1 Ack=1 Win=65792 Len=0"
"164","1.827757","192.168.43.240","176.9.18.162","TCP","54","2321  >  443 [ACK] Seq=1 Ack=1 Win=65792 Len=0"
"165","1.827851","192.168.43.240","5.45.59.38","TCP","66","2327  >  443 [SYN] Seq=0 Win=8192 Len=0 MSS=1460 WS=256 SACK_PERM=1"
"166","1.828354","192.168.43.240","216.58.211.141","QUIC","1206","Payload (Encrypted), PKN: 6, CID: 2990740619611634455"
"167","1.828440","192.168.43.240","216.58.211.141","QUIC","67","Payload (Encrypted), PKN: 7, CID: 2990740619611634455"
"168","1.828890","192.168.43.240","216.58.211.138","TCP","66","2328  >  443 [SYN] Seq=0 Win=8192 Len=0 MSS=1460 WS=256 SACK_PERM=1"
"169","1.829082","192.168.43.240","176.9.18.162","TLSv1.2","249","Client Hello"
"170","1.829207","192.168.43.240","176.9.18.162","TLSv1.2","249","Client Hello"
"171","1.829324","192.168.43.240","176.9.18.162","TLSv1.2","249","Client Hello"
"172","1.838779","192.168.43.240","13.32.56.92","TLSv1.2","489","Application Data"
"173","1.839939","192.168.43.240","216.58.211.131","TCP","66","2329  >  443 [SYN] Seq=0 Win=8192 Len=0 MSS=1460 WS=256 SACK_PERM=1"
"174","1.840487","192.168.43.240","192.168.43.255","NBNS","92","Name query NB WPAD<00>"
"175","1.848512","192.168.43.240","172.217.21.168","QUIC","77","Payload (Encrypted), PKN: 7, CID: 17504889374410825644"
"176","1.880968","192.168.43.240","46.4.235.70","TCP","54","2309  >  80 [ACK] Seq=1040 Ack=912 Win=64768 Len=0"
"177","1.953609","192.168.43.240","5.45.59.38","TCP","66","2330  >  443 [SYN] Seq=0 Win=8192 Len=0 MSS=1460 WS=256 SACK_PERM=1"
"178","1.955840","192.168.43.240","5.45.59.38","TCP","66","2331  >  443 [SYN] Seq=0 Win=8192 Len=0 MSS=1460 WS=256 SACK_PERM=1"
"179","1.978712","64.233.164.188","192.168.43.240","TCP","375","5228  >  2314 [PSH, ACK] Seq=4362 Ack=445 Win=45056 Len=321"
"180","1.978717","216.58.211.138","192.168.43.240","TCP","66","443  >  2328 [SYN, ACK] Seq=0 Ack=1 Win=42780 Len=0 MSS=1380 SACK_PERM=1 WS=256"
"181","1.978718","13.32.56.92","192.168.43.240","TCP","797","[TCP Spurious Retransmission] 443  >  2317 [PSH, ACK] Seq=4201 Ack=217 Win=30464 Len=743[Reassembly error, protocol TCP: New fragment overlaps old data (retransmission?)]"
"182","1.978726","216.58.211.131","192.168.43.240","TCP","66","443  >  2329 [SYN, ACK] Seq=0 Ack=1 Win=42780 Len=0 MSS=1380 SACK_PERM=1 WS=256"
"183","1.978727","172.217.21.168","192.168.43.240","TLSv1.2","332","New Session Ticket, Change Cipher Spec, Encrypted Handshake Message"
"184","1.979237","192.168.43.240","13.32.56.92","TCP","66","[TCP Dup ACK 146#1] 2317  >  443 [ACK] Seq=778 Ack=4944 Win=65792 Len=0 SLE=4201 SRE=4944"
"185","1.979358","192.168.43.240","216.58.211.138","TCP","54","2328  >  443 [ACK] Seq=1 Ack=1 Win=66048 Len=0"
"186","1.979387","192.168.43.240","216.58.211.131","TCP","54","2329  >  443 [ACK] Seq=1 Ack=1 Win=66048 Len=0"
"187","1.979537","192.168.43.240","216.58.211.138","TLSv1.2","262","Client Hello"
"188","1.979651","172.217.21.168","192.168.43.240","TLSv1.2","123","Application Data"
"189","1.979652","216.58.211.141","192.168.43.240","QUIC","78","Payload (Encrypted), PKN: 5"
"190","1.979652","13.32.56.92","192.168.43.240","TCP","54","443  >  2318 [ACK] Seq=1 Ack=217 Win=30464 Len=0"
"191","1.979653","13.32.56.92","192.168.43.240","TLSv1.2","312","New Session Ticket, Change Cipher Spec, Encrypted Handshake Message"
"192","1.979653","13.32.56.92","192.168.43.240","TLSv1.2","1454","Server Hello"
"193","1.979654","13.32.56.92","192.168.43.240","TCP","1454","443  >  2318 [ACK] Seq=1401 Ack=217 Win=30464 Len=1400 [TCP segment of a reassembled PDU]"
"194","1.979655","13.32.56.92","192.168.43.240","TLSv1.2","1454","Certificate [TCP segment of a reassembled PDU]"
"195","1.979657","13.32.56.92","192.168.43.240","TLSv1.2","797","Certificate Status, Server Key Exchange, Server Hello Done"
"196","1.979657","216.58.211.141","192.168.43.240","QUIC","1091","Payload (Encrypted), PKN: 6"
"197","1.979658","216.58.211.141","192.168.43.240","QUIC","70","Payload (Encrypted), PKN: 7"
"198","1.979658","216.58.211.141","192.168.43.240","QUIC","103","Payload (Encrypted), PKN: 8"
"199","1.979658","138.201.57.222","192.168.43.240","TCP","54","443  >  2319 [ACK] Seq=1 Ack=200 Win=30336 Len=0"
"200","1.979659","176.9.18.162","192.168.43.240","TCP","54","443  >  2322 [ACK] Seq=1 Ack=196 Win=30720 Len=0"
"201","1.979659","176.9.18.162","192.168.43.240","TCP","54","443  >  2320 [ACK] Seq=1 Ack=196 Win=30720 Len=0"
"202","1.979659","192.168.43.240","216.58.211.131","TLSv1.2","267","Client Hello"
"203","1.979659","176.9.18.162","192.168.43.240","TCP","54","443  >  2321 [ACK] Seq=1 Ack=196 Win=30720 Len=0"
"204","1.979660","5.45.59.38","192.168.43.240","TCP","66","443  >  2327 [SYN, ACK] Seq=0 Ack=1 Win=2920 Len=0 MSS=1400 SACK_PERM=1 WS=8192"
"205","1.979710","192.168.43.240","172.217.21.168","TCP","54","2315  >  443 [ACK] Seq=471 Ack=3478 Win=65792 Len=0"
"206","1.979811","192.168.43.240","13.32.56.92","TCP","54","2318  >  443 [ACK] Seq=217 Ack=4944 Win=65792 Len=0"
"207","1.979919","192.168.43.240","5.45.59.38","TCP","54","2327  >  443 [ACK] Seq=1 Ack=1 Win=65792 Len=0"
"208","1.980629","176.9.18.162","192.168.43.240","TLSv1.2","1454","Server Hello"
"209","1.980630","176.9.18.162","192.168.43.240","TCP","1454","443  >  2322 [ACK] Seq=1401 Ack=196 Win=30720 Len=1400 [TCP segment of a reassembled PDU]"
"210","1.980631","176.9.18.162","192.168.43.240","TLSv1.2","1454","Certificate [TCP segment of a reassembled PDU]"
"211","1.980633","176.9.18.162","192.168.43.240","TLSv1.2","142","Server Key Exchange, Server Hello Done"
"212","1.980633","138.201.57.222","192.168.43.240","TLSv1.2","1454","Server Hello"
"213","1.980634","138.201.57.222","192.168.43.240","TCP","1454","443  >  2319 [ACK] Seq=1401 Ack=200 Win=30336 Len=1400 [TCP segment of a reassembled PDU]"
"214","1.980635","138.201.57.222","192.168.43.240","TLSv1.2","1454","Certificate [TCP segment of a reassembled PDU]"
"215","1.980707","192.168.43.240","176.9.18.162","TCP","54","2322  >  443 [ACK] Seq=196 Ack=4289 Win=65792 Len=0"
"216","1.980739","192.168.43.240","138.201.57.222","TCP","54","2319  >  443 [ACK] Seq=200 Ack=4201 Win=65792 Len=0"
"217","1.981753","138.201.57.222","192.168.43.240","TLSv1.2","1197","Certificate Status, Server Key Exchange, Server Hello Done"
"218","1.981757","176.9.18.162","192.168.43.240","TLSv1.2","1454","Server Hello"
"219","1.981761","176.9.18.162","192.168.43.240","TCP","1454","443  >  2320 [ACK] Seq=1401 Ack=196 Win=30720 Len=1400 [TCP segment of a reassembled PDU]"
"220","1.981767","176.9.18.162","192.168.43.240","TLSv1.2","1454","Certificate [TCP segment of a reassembled PDU]"
"221","1.981769","176.9.18.162","192.168.43.240","TLSv1.2","142","Server Key Exchange, Server Hello Done"
"222","1.981771","176.9.18.162","192.168.43.240","TLSv1.2","1454","Server Hello"
"223","1.982212","192.168.43.240","138.201.57.222","TCP","54","2319  >  443 [ACK] Seq=200 Ack=5344 Win=64512 Len=0"
"224","1.982405","192.168.43.240","176.9.18.162","TCP","54","2320  >  443 [ACK] Seq=196 Ack=4289 Win=65792 Len=0"
"225","1.982447","192.168.43.240","13.32.56.92","TLSv1.2","180","Client Key Exchange, Change Cipher Spec, Encrypted Handshake Message"
"226","1.982663","176.9.18.162","192.168.43.240","TCP","1454","443  >  2321 [ACK] Seq=1401 Ack=196 Win=30720 Len=1400 [TCP segment of a reassembled PDU]"
"227","1.982664","176.9.18.162","192.168.43.240","TLSv1.2","1454","Certificate [TCP segment of a reassembled PDU]"
"228","1.982665","176.9.18.162","192.168.43.240","TLSv1.2","142","Server Key Exchange, Server Hello Done"
"229","1.982665","13.32.56.92","192.168.43.240","TCP","54","443  >  2317 [ACK] Seq=5202 Ack=778 Win=31488 Len=0"
"230","1.982666","13.32.56.92","192.168.43.240","TLSv1.2","1304","Application Data"
"231","1.982667","13.32.56.92","192.168.43.240","TLSv1.2","88","Application Data"
"232","1.982742","192.168.43.240","176.9.18.162","TCP","54","2321  >  443 [ACK] Seq=196 Ack=4289 Win=65792 Len=0"
"233","1.982777","192.168.43.240","13.32.56.92","TCP","54","2317  >  443 [ACK] Seq=778 Ack=6486 Win=65792 Len=0"
"234","1.985160","192.168.43.240","216.58.211.141","QUIC","83","Payload (Encrypted), PKN: 8, CID: 2990740619611634455"
"235","1.987640","192.168.43.240","176.9.18.162","TLSv1.2","180","Client Key Exchange, Change Cipher Spec, Encrypted Handshake Message"
"236","1.991334","192.168.43.240","138.201.57.222","TLSv1.2","180","Client Key Exchange, Change Cipher Spec, Encrypted Handshake Message"
"237","1.995898","192.168.43.240","176.9.18.162","TLSv1.2","180","Client Key Exchange, Change Cipher Spec, Encrypted Handshake Message"
"238","1.997314","192.168.43.240","176.9.18.162","TLSv1.2","180","Client Key Exchange, Change Cipher Spec, Encrypted Handshake Message"
"239","1.998950","192.168.43.240","5.45.59.38","TLSv1.2","258","Client Hello"
"240","1.999205","192.168.43.240","64.233.164.188","TCP","238","2314  >  5228 [PSH, ACK] Seq=445 Ack=4683 Win=65792 Len=184"
"241","1.999415","192.168.43.240","13.32.56.92","TLSv1.2","402","Application Data"
"242","2.010603","192.168.43.240","216.58.211.141","QUIC","77","Payload (Encrypted), PKN: 9, CID: 2990740619611634455"
"243","2.138944","5.45.59.38","192.168.43.240","TCP","66","443  >  2330 [SYN, ACK] Seq=0 Ack=1 Win=2920 Len=0 MSS=1400 SACK_PERM=1 WS=8192"
"244","2.138945","5.45.59.38","192.168.43.240","TCP","66","443  >  2331 [SYN, ACK] Seq=0 Ack=1 Win=2920 Len=0 MSS=1400 SACK_PERM=1 WS=8192"
"245","2.138945","216.58.211.138","192.168.43.240","TCP","54","443  >  2328 [ACK] Seq=1 Ack=209 Win=44032 Len=0"
"246","2.138946","216.58.211.131","192.168.43.240","TCP","54","443  >  2329 [ACK] Seq=1 Ack=214 Win=44032 Len=0"
"247","2.139061","192.168.43.240","5.45.59.38","TCP","54","2330  >  443 [ACK] Seq=1 Ack=1 Win=65792 Len=0"
"248","2.139100","192.168.43.240","5.45.59.38","TCP","54","2331  >  443 [ACK] Seq=1 Ack=1 Win=65792 Len=0"
"249","2.139214","192.168.43.240","5.45.59.38","TLSv1.2","258","Client Hello"
"250","2.140759","64.233.164.188","192.168.43.240","TCP","84","5228  >  2314 [PSH, ACK] Seq=4683 Ack=629 Win=46080 Len=30"
"251","2.140760","216.58.211.131","192.168.43.240","TLSv1.2","1454","Server Hello"
"252","2.140761","216.58.211.131","192.168.43.240","TLSv1.2","1308","Certificate, Server Key Exchange, Server Hello Done"
"253","2.140761","216.58.211.138","192.168.43.240","TLSv1.2","1454","Server Hello"
"254","2.140763","216.58.211.138","192.168.43.240","TLSv1.2","1308","Certificate, Server Key Exchange, Server Hello Done"
"255","2.140763","64.233.164.188","192.168.43.240","TCP","173","5228  >  2314 [PSH, ACK] Seq=4713 Ack=629 Win=46080 Len=119"
"256","2.140763","13.32.56.92","192.168.43.240","TLSv1.2","312","New Session Ticket, Change Cipher Spec, Encrypted Handshake Message"
"257","2.140764","64.233.164.188","192.168.43.240","TCP","188","5228  >  2314 [PSH, ACK] Seq=4832 Ack=629 Win=46080 Len=134"
"258","2.140764","138.201.57.222","192.168.43.240","TLSv1.2","312","New Session Ticket, Change Cipher Spec, Encrypted Handshake Message"
"259","2.140764","176.9.18.162","192.168.43.240","TLSv1.2","312","New Session Ticket, Change Cipher Spec, Encrypted Handshake Message"
"260","2.140765","176.9.18.162","192.168.43.240","TLSv1.2","312","New Session Ticket, Change Cipher Spec, Encrypted Handshake Message"
"261","2.140765","176.9.18.162","192.168.43.240","TLSv1.2","312","New Session Ticket, Change Cipher Spec, Encrypted Handshake Message"
"262","2.140765","5.45.59.38","192.168.43.240","TCP","54","443  >  2327 [ACK] Seq=1 Ack=205 Win=8192 Len=0"
"263","2.140766","5.45.59.38","192.168.43.240","TLSv1.2","1454","Server Hello"
"264","2.140766","5.45.59.38","192.168.43.240","TCP","1454","443  >  2327 [ACK] Seq=1401 Ack=205 Win=8192 Len=1400 [TCP segment of a reassembled PDU]"
"265","2.140767","5.45.59.38","192.168.43.240","TCP","1454","443  >  2327 [ACK] Seq=2801 Ack=205 Win=8192 Len=1400 [TCP segment of a reassembled PDU]"
"266","2.140767","5.45.59.38","192.168.43.240","TLSv1.2","785","Certificate, Certificate Status, Server Key Exchange, Server Hello Done"
"267","2.140768","13.32.56.92","192.168.43.240","TCP","54","443  >  2318 [ACK] Seq=5202 Ack=691 Win=31488 Len=0"
"268","2.140768","13.32.56.92","192.168.43.240","TCP","1454","443  >  2318 [ACK] Seq=5202 Ack=691 Win=31488 Len=1400 [TCP segment of a reassembled PDU]"
"269","2.140945","192.168.43.240","216.58.211.131","TCP","54","2329  >  443 [ACK] Seq=214 Ack=2655 Win=66048 Len=0"
"270","2.140979","192.168.43.240","216.58.211.138","TCP","54","2328  >  443 [ACK] Seq=209 Ack=2655 Win=66048 Len=0"
"271","2.141007","192.168.43.240","64.233.164.188","TCP","54","2314  >  5228 [ACK] Seq=629 Ack=4966 Win=65536 Len=0"
"272","2.141031","192.168.43.240","13.32.56.92","TCP","54","2318  >  443 [ACK] Seq=691 Ack=6602 Win=65792 Len=0"
"273","2.141053","192.168.43.240","5.45.59.38","TCP","54","2327  >  443 [ACK] Seq=205 Ack=4932 Win=65792 Len=0"
"274","2.141975","192.168.43.240","216.58.211.131","TLSv1.2","147","Client Key Exchange, Change Cipher Spec, Encrypted Handshake Message"
"275","2.142725","13.32.56.92","192.168.43.240","TLSv1.2","948","Application Data"
"276","2.142726","13.32.56.92","192.168.43.240","TLSv1.2","88","Application Data"
"277","2.142774","192.168.43.240","13.32.56.92","TCP","54","2318  >  443 [ACK] Seq=691 Ack=7530 Win=64768 Len=0"
"278","2.143689","192.168.43.240","216.58.211.138","TLSv1.2","147","Client Key Exchange, Change Cipher Spec, Encrypted Handshake Message"
"279","2.147541","192.168.43.240","5.45.59.38","TLSv1.2","180","Client Key Exchange, Change Cipher Spec, Encrypted Handshake Message"
"280","2.155547","192.168.43.240","216.58.211.131","TLSv1.2","147","Application Data"
"281","2.160920","192.168.43.240","216.58.211.138","TLSv1.2","147","Application Data"
"282","2.161402","192.168.43.240","216.58.211.131","TLSv1.2","322","Application Data"
"283","2.161521","192.168.43.240","138.201.57.222","TLSv1.2","489","Application Data"
"284","2.161605","192.168.43.240","216.58.211.138","TLSv1.2","291","Application Data"
"285","2.162061","192.168.43.240","176.9.18.162","TLSv1.2","847","Application Data"
"286","2.181786","192.168.43.240","176.9.18.162","TCP","54","2320  >  443 [ACK] Seq=322 Ack=4547 Win=65536 Len=0"
"287","2.181786","192.168.43.240","176.9.18.162","TCP","54","2321  >  443 [ACK] Seq=322 Ack=4547 Win=65536 Len=0"
"288","2.298413","216.58.211.131","192.168.43.240","TLSv1.2","284","New Session Ticket, Change Cipher Spec, Encrypted Handshake Message"
"289","2.298575","216.58.211.131","192.168.43.240","TLSv1.2","123","Application Data"
"290","2.298575","216.58.211.131","192.168.43.240","TLSv1.2","92","Application Data"
"291","2.298613","192.168.43.240","216.58.211.131","TCP","54","2329  >  443 [ACK] Seq=668 Ack=2992 Win=65792 Len=0"
"292","2.298688","192.168.43.240","216.58.211.131","TLSv1.2","92","Application Data"
"293","2.298694","216.58.211.138","192.168.43.240","TLSv1.2","284","New Session Ticket, Change Cipher Spec, Encrypted Handshake Message"
"294","2.298694","216.58.211.138","192.168.43.240","TLSv1.2","123","Application Data"
"295","2.298695","216.58.211.138","192.168.43.240","TLSv1.2","92","Application Data"
"296","2.298695","5.45.59.38","192.168.43.240","TCP","54","443  >  2330 [ACK] Seq=1 Ack=205 Win=8192 Len=0"
"297","2.298695","216.58.211.138","192.168.43.240","TLSv1.2","400","Application Data"
"298","2.298745","192.168.43.240","216.58.211.138","TCP","54","2328  >  443 [ACK] Seq=632 Ack=3338 Win=65536 Len=0"
"299","2.298876","216.58.211.138","192.168.43.240","TLSv1.2","1257","Application Data"
"300","2.298878","216.58.211.138","192.168.43.240","TLSv1.2","179","Application Data"
"301","2.298878","216.58.211.138","192.168.43.240","TLSv1.2","100","Application Data"
"302","2.298918","192.168.43.240","216.58.211.138","TCP","54","2328  >  443 [ACK] Seq=632 Ack=4712 Win=66048 Len=0"
"303","2.299000","216.58.211.131","192.168.43.240","TLSv1.2","299","Application Data"
"304","2.299000","216.58.211.131","192.168.43.240","TLSv1.2","92","Application Data"
"305","2.299001","216.58.211.131","192.168.43.240","TLSv1.2","100","Application Data"
"306","2.299045","192.168.43.240","216.58.211.131","TCP","54","2329  >  443 [ACK] Seq=706 Ack=3321 Win=65536 Len=0"
"307","2.299330","192.168.43.240","216.58.211.138","TLSv1.2","92","Application Data"
"308","2.299371","192.168.43.240","216.58.211.138","TLSv1.2","100","Application Data"
"309","2.299589","192.168.43.240","216.58.211.131","TLSv1.2","100","Application Data"
"310","2.300598","5.45.59.38","192.168.43.240","TLSv1.2","1454","Server Hello"
"311","2.300599","5.45.59.38","192.168.43.240","TCP","1454","443  >  2330 [ACK] Seq=1401 Ack=205 Win=8192 Len=1400 [TCP segment of a reassembled PDU]"
"312","2.300600","5.45.59.38","192.168.43.240","TCP","1454","443  >  2330 [ACK] Seq=2801 Ack=205 Win=8192 Len=1400 [TCP segment of a reassembled PDU]"
"313","2.300602","5.45.59.38","192.168.43.240","TLSv1.2","786","Certificate, Certificate Status, Server Key Exchange, Server Hello Done"
