"No.","Time","Source","Destination","Protocol","Length","Info"
"1","02:59:11,055383","ZyxelCom_9f:c2:bc","Broadcast","ARP","42","Who has 192.168.1.34? Tell 192.168.1.1"
"2","02:59:11,098105","192.168.1.37","87.240.129.71","SSL","55","Continuation Data"
"3","02:59:11,103956","87.240.129.71","192.168.1.37","TCP","66","443  >  2478 [ACK] Seq=1 Ack=2 Win=198 Len=0 SLE=1 SRE=2"
"4","02:59:11,644500","64.233.162.155","192.168.1.37","TLSv1.2","109","Application Data"
"5","02:59:11,644641","64.233.162.155","192.168.1.37","TCP","54","443  >  2399 [FIN, ACK] Seq=56 Ack=1 Win=180 Len=0"
"6","02:59:11,644683","192.168.1.37","64.233.162.155","TCP","54","2399  >  443 [ACK] Seq=1 Ack=57 Win=258 Len=0"
"7","02:59:11,644718","192.168.1.37","64.233.162.155","TCP","54","2399  >  443 [FIN, ACK] Seq=1 Ack=57 Win=258 Len=0"
"8","02:59:11,656554","64.233.162.155","192.168.1.37","TCP","54","443  >  2399 [ACK] Seq=57 Ack=2 Win=180 Len=0"
"9","02:59:12,057017","ZyxelCom_9f:c2:bc","Broadcast","ARP","42","Who has 192.168.1.34? Tell 192.168.1.1"
"10","02:59:14,125384","192.168.1.37","87.250.250.36","SSL","55","Continuation Data"
"11","02:59:14,141106","87.250.250.36","192.168.1.37","TCP","66","443  >  2480 [ACK] Seq=1 Ack=2 Win=119 Len=0 SLE=1 SRE=2"
"12","02:59:16,375804","173.194.221.104","192.168.1.37","TLSv1.2","109","Application Data"
"13","02:59:16,375805","173.194.221.104","192.168.1.37","TCP","54","443  >  2439 [FIN, ACK] Seq=56 Ack=1 Win=182 Len=0"
"14","02:59:16,375882","192.168.1.37","173.194.221.104","TCP","54","2439  >  443 [ACK] Seq=1 Ack=57 Win=255 Len=0"
"15","02:59:16,376055","192.168.1.37","173.194.221.104","TCP","54","2439  >  443 [FIN, ACK] Seq=1 Ack=57 Win=255 Len=0"
"16","02:59:16,386054","173.194.221.104","192.168.1.37","TCP","54","443  >  2439 [ACK] Seq=57 Ack=2 Win=182 Len=0"
"17","02:59:16,504678","178.237.20.79","192.168.1.37","TLSv1.2","548","Application Data"
"18","02:59:16,558293","192.168.1.37","178.237.20.79","TCP","54","2413  >  443 [ACK] Seq=1 Ack=495 Win=256 Len=0"
"19","02:59:17,126093","ZyxelCom_9f:c2:bc","Broadcast","ARP","42","Who has 192.168.1.34? Tell 192.168.1.1"
"20","02:59:17,488292","192.168.1.37","178.237.20.79","TLSv1.2","604","Application Data"
"21","02:59:17,528926","178.237.20.79","192.168.1.37","TCP","54","443  >  2413 [ACK] Seq=495 Ack=551 Win=81 Len=0"
"22","02:59:17,636227","173.194.221.156","192.168.1.37","TLSv1.2","109","Application Data"
"23","02:59:17,636354","173.194.221.156","192.168.1.37","TCP","54","443  >  2433 [FIN, ACK] Seq=56 Ack=1 Win=219 Len=0"
"24","02:59:17,636388","192.168.1.37","173.194.221.156","TCP","54","2433  >  443 [ACK] Seq=1 Ack=57 Win=256 Len=0"
"25","02:59:17,636469","192.168.1.37","173.194.221.156","TCP","54","2433  >  443 [FIN, ACK] Seq=1 Ack=57 Win=256 Len=0"
"26","02:59:17,642100","173.194.221.156","192.168.1.37","TCP","54","443  >  2433 [ACK] Seq=57 Ack=2 Win=219 Len=0"
"27","02:59:17,667001","173.194.221.138","192.168.1.37","TLSv1.2","109","Application Data"
"28","02:59:17,667002","173.194.221.138","192.168.1.37","TCP","54","443  >  2258 [FIN, ACK] Seq=56 Ack=1 Win=350 Len=0"
"29","02:59:17,667064","192.168.1.37","173.194.221.138","TCP","54","2258  >  443 [ACK] Seq=1 Ack=57 Win=257 Len=0"
"30","02:59:17,667271","192.168.1.37","173.194.221.138","TCP","54","2258  >  443 [FIN, ACK] Seq=1 Ack=57 Win=257 Len=0"
"31","02:59:17,676239","173.194.221.138","192.168.1.37","TCP","54","443  >  2258 [ACK] Seq=57 Ack=2 Win=350 Len=0"
"32","02:59:18,127945","ZyxelCom_9f:c2:bc","Broadcast","ARP","42","Who has 192.168.1.34? Tell 192.168.1.1"
"33","02:59:18,906076","64.233.162.154","192.168.1.37","TLSv1.2","109","Application Data"
"34","02:59:18,906204","64.233.162.154","192.168.1.37","TCP","54","443  >  2335 [FIN, ACK] Seq=56 Ack=1 Win=187 Len=0"
"35","02:59:18,906237","192.168.1.37","64.233.162.154","TCP","54","2335  >  443 [ACK] Seq=1 Ack=57 Win=254 Len=0"
"36","02:59:18,906318","192.168.1.37","64.233.162.154","TCP","54","2335  >  443 [FIN, ACK] Seq=1 Ack=57 Win=254 Len=0"
"37","02:59:18,912565","64.233.162.154","192.168.1.37","TCP","54","443  >  2335 [ACK] Seq=57 Ack=2 Win=187 Len=0"
"38","02:59:18,917829","64.233.162.155","192.168.1.37","TLSv1.2","109","Application Data"
"39","02:59:18,917829","64.233.162.155","192.168.1.37","TCP","54","443  >  2336 [FIN, ACK] Seq=56 Ack=1 Win=180 Len=0"
"40","02:59:18,917877","192.168.1.37","64.233.162.155","TCP","54","2336  >  443 [ACK] Seq=1 Ack=57 Win=256 Len=0"
"41","02:59:18,918104","192.168.1.37","64.233.162.155","TCP","54","2336  >  443 [FIN, ACK] Seq=1 Ack=57 Win=256 Len=0"
"42","02:59:18,926161","213.180.204.147","192.168.1.37","TCP","207","5222  >  2257 [PSH, ACK] Seq=1 Ack=1 Win=21 Len=153 [TCP segment of a reassembled PDU]"
"43","02:59:18,926456","192.168.1.37","213.180.204.147","TCP","271","2257  >  5222 [PSH, ACK] Seq=1 Ack=154 Win=258 Len=217 [TCP segment of a reassembled PDU]"
"44","02:59:18,928154","64.233.162.155","192.168.1.37","TCP","54","443  >  2336 [ACK] Seq=57 Ack=2 Win=180 Len=0"
"45","02:59:18,984772","213.180.204.147","192.168.1.37","TCP","54","5222  >  2257 [ACK] Seq=154 Ack=218 Win=21 Len=0"
"46","02:59:19,129141","ZyxelCom_9f:c2:bc","Broadcast","ARP","42","Who has 192.168.1.34? Tell 192.168.1.1"
"47","02:59:19,485964","192.168.1.37","77.88.55.50","TCP","1464","2266  >  443 [ACK] Seq=1 Ack=1 Win=255 Len=1410 [TCP segment of a reassembled PDU]"
"48","02:59:19,485979","192.168.1.37","77.88.55.50","TLSv1.2","723","Application Data"
"49","02:59:19,516414","77.88.55.50","192.168.1.37","TCP","54","443  >  2266 [ACK] Seq=1 Ack=2080 Win=711 Len=0"
"50","02:59:19,516415","77.88.55.50","192.168.1.37","TLSv1.2","301","Application Data, Application Data"
"51","02:59:19,567365","192.168.1.37","77.88.55.50","TCP","54","2266  >  443 [ACK] Seq=2080 Ack=248 Win=255 Len=0"
"52","02:59:19,746617","173.194.221.132","192.168.1.37","TLSv1.2","109","Application Data"
"53","02:59:19,746618","173.194.221.132","192.168.1.37","TCP","54","443  >  2440 [FIN, ACK] Seq=56 Ack=1 Win=202 Len=0"
"54","02:59:19,746683","192.168.1.37","173.194.221.132","TCP","54","2440  >  443 [ACK] Seq=1 Ack=57 Win=258 Len=0"
"55","02:59:19,746851","192.168.1.37","173.194.221.132","TCP","54","2440  >  443 [FIN, ACK] Seq=1 Ack=57 Win=258 Len=0"
"56","02:59:19,754311","173.194.221.132","192.168.1.37","TCP","54","443  >  2440 [ACK] Seq=57 Ack=2 Win=202 Len=0"
"57","02:59:20,068372","64.233.162.156","192.168.1.37","TLSv1.2","109","Application Data"
"58","02:59:20,068609","192.168.1.37","64.233.162.156","TCP","54","2444  >  443 [FIN, ACK] Seq=1 Ack=56 Win=257 Len=0"
"59","02:59:20,069344","64.233.162.156","192.168.1.37","TCP","54","443  >  2444 [FIN, ACK] Seq=56 Ack=1 Win=238 Len=0"
"60","02:59:20,069372","192.168.1.37","64.233.162.156","TCP","54","2444  >  443 [ACK] Seq=2 Ack=57 Win=257 Len=0"
"61","02:59:20,074154","64.233.162.156","192.168.1.37","TCP","54","443  >  2444 [ACK] Seq=57 Ack=2 Win=238 Len=0"
"62","02:59:20,427818","64.233.161.156","192.168.1.37","TLSv1.2","109","Application Data"
"63","02:59:20,427819","64.233.161.156","192.168.1.37","TCP","54","443  >  2449 [FIN, ACK] Seq=56 Ack=1 Win=189 Len=0"
"64","02:59:20,427888","192.168.1.37","64.233.161.156","TCP","54","2449  >  443 [ACK] Seq=1 Ack=57 Win=253 Len=0"
"65","02:59:20,428069","192.168.1.37","64.233.161.156","TCP","54","2449  >  443 [FIN, ACK] Seq=1 Ack=57 Win=253 Len=0"
"66","02:59:20,428808","64.233.161.156","192.168.1.37","TCP","54","[TCP Out-Of-Order] 443  >  2449 [FIN, ACK] Seq=56 Ack=1 Win=189 Len=0"
"67","02:59:20,428843","192.168.1.37","64.233.161.156","TCP","54","[TCP Dup ACK 64#1] 2449  >  443 [ACK] Seq=2 Ack=57 Win=253 Len=0"
"68","02:59:20,435043","64.233.161.156","192.168.1.37","TCP","54","443  >  2449 [ACK] Seq=57 Ack=2 Win=189 Len=0"
"69","02:59:20,485819","192.168.1.37","77.88.55.50","TCP","1464","2266  >  443 [ACK] Seq=2080 Ack=248 Win=255 Len=1410 [TCP segment of a reassembled PDU]"
"70","02:59:20,485834","192.168.1.37","77.88.55.50","TLSv1.2","976","Application Data"
"71","02:59:20,507156","77.88.55.50","192.168.1.37","TCP","54","443  >  2266 [ACK] Seq=248 Ack=4412 Win=711 Len=0"
"72","02:59:20,507157","77.88.55.50","192.168.1.37","TLSv1.2","301","Application Data, Application Data"
"73","02:59:20,557131","192.168.1.37","77.88.55.50","TCP","54","2266  >  443 [ACK] Seq=4412 Ack=495 Win=254 Len=0"
"74","02:59:20,588149","192.168.1.37","87.250.250.41","SSL","55","Continuation Data"
"75","02:59:20,653005","87.250.250.41","192.168.1.37","TCP","66","443  >  2232 [ACK] Seq=1 Ack=2 Win=159 Len=0 SLE=1 SRE=2"
"76","02:59:20,768493","64.233.162.157","192.168.1.37","TLSv1.2","109","Application Data"
"77","02:59:20,768494","64.233.162.157","192.168.1.37","TCP","54","443  >  2234 [FIN, ACK] Seq=56 Ack=1 Win=202 Len=0"
"78","02:59:20,768495","64.233.162.97","192.168.1.37","TLSv1.2","109","Application Data"
"79","02:59:20,768495","64.233.162.97","192.168.1.37","TCP","54","443  >  2271 [FIN, ACK] Seq=56 Ack=1 Win=230 Len=0"
"80","02:59:20,768564","192.168.1.37","64.233.162.157","TCP","54","2234  >  443 [ACK] Seq=1 Ack=57 Win=255 Len=0"
"81","02:59:20,768641","192.168.1.37","64.233.162.97","TCP","54","2271  >  443 [ACK] Seq=1 Ack=57 Win=254 Len=0"
"82","02:59:20,768780","192.168.1.37","64.233.162.97","TCP","54","2271  >  443 [FIN, ACK] Seq=1 Ack=57 Win=254 Len=0"
"83","02:59:20,768951","192.168.1.37","64.233.162.157","TCP","54","2234  >  443 [FIN, ACK] Seq=1 Ack=57 Win=255 Len=0"
"84","02:59:20,774735","64.233.162.97","192.168.1.37","TCP","54","443  >  2271 [ACK] Seq=57 Ack=2 Win=230 Len=0"
"85","02:59:20,774857","64.233.162.157","192.168.1.37","TCP","54","443  >  2234 [ACK] Seq=57 Ack=2 Win=202 Len=0"
"86","02:59:23,341556","87.240.129.131","192.168.1.37","TLSv1.2","334","Application Data"
"87","02:59:23,383658","192.168.1.37","87.240.129.131","TLSv1.2","190","Application Data"
"88","02:59:23,386177","87.240.129.131","192.168.1.37","TCP","54","443  >  2532 [ACK] Seq=281 Ack=137 Win=110 Len=0"
"89","02:59:24,198545","ZyxelCom_9f:c2:bc","Broadcast","ARP","42","Who has 192.168.1.34? Tell 192.168.1.1"
"90","02:59:24,420402","192.168.1.37","213.180.204.29","SSL","55","Continuation Data"
"91","02:59:24,437402","213.180.204.29","192.168.1.37","TCP","54","443  >  2544 [ACK] Seq=1 Ack=2 Win=129 Len=0"
"92","02:59:25,199319","ZyxelCom_9f:c2:bc","Broadcast","ARP","42","Who has 192.168.1.34? Tell 192.168.1.1"
"93","02:59:26,201183","ZyxelCom_9f:c2:bc","Broadcast","ARP","42","Who has 192.168.1.34? Tell 192.168.1.1"
"94","02:59:26,891200","192.168.1.37","192.168.1.255","NBNS","92","Name query NB WPAD<00>"
"95","02:59:26,891534","fe80::d5d4:e1d6:8319:3e4","ff02::1:3","LLMNR","84","Standard query 0x681c A wpad"
"96","02:59:26,891652","192.168.1.37","224.0.0.252","LLMNR","64","Standard query 0x681c A wpad"
"97","02:59:26,891917","fe80::d5d4:e1d6:8319:3e4","ff02::1:3","LLMNR","84","Standard query 0x4f70 AAAA wpad"
"98","02:59:26,892015","192.168.1.37","224.0.0.252","LLMNR","64","Standard query 0x4f70 AAAA wpad"
"99","02:59:26,924445","192.168.1.37","192.168.1.1","DNS","77","Standard query 0x5154 A platform.bing.com"
"100","02:59:26,933267","192.168.1.1","192.168.1.37","DNS","242","Standard query response 0x5154 A platform.bing.com CNAME platform-bing-com.a-0001.a-msedge.net CNAME a-0001.a-msedge.net A 13.107.21.200 A 204.79.197.200 NS ns1.a-msedge.net NS ns2.a-msedge.net A 204.79.197.1 A 204.79.197.2"
"101","02:59:26,936150","192.168.1.37","13.107.21.200","TCP","66","2554  >  80 [SYN] Seq=0 Win=65535 Len=0 MSS=1460 WS=256 SACK_PERM=1"
"102","02:59:26,982752","13.107.21.200","192.168.1.37","TCP","66","80  >  2554 [SYN, ACK] Seq=0 Ack=1 Win=65535 Len=0 MSS=1440 WS=256 SACK_PERM=1"
"103","02:59:26,982863","192.168.1.37","13.107.21.200","TCP","54","2554  >  80 [ACK] Seq=1 Ack=1 Win=262144 Len=0"
"104","02:59:26,983028","192.168.1.37","13.107.21.200","HTTP","335","GET /dataaccessor/ais HTTP/1.1 "
"105","02:59:27,032347","13.107.21.200","192.168.1.37","TCP","54","80  >  2554 [ACK] Seq=1 Ack=282 Win=262400 Len=0"
"106","02:59:27,053995","13.107.21.200","192.168.1.37","HTTP","1003","HTTP/1.1 200 OK  (text/plain)"
"107","02:59:27,054073","192.168.1.37","13.107.21.200","TCP","54","2554  >  80 [ACK] Seq=282 Ack=950 Win=261120 Len=0"
"108","02:59:27,303266","fe80::d5d4:e1d6:8319:3e4","ff02::1:3","LLMNR","84","Standard query 0x4f70 AAAA wpad"
"109","02:59:27,303285","fe80::d5d4:e1d6:8319:3e4","ff02::1:3","LLMNR","84","Standard query 0x681c A wpad"
"110","02:59:27,303380","192.168.1.37","224.0.0.252","LLMNR","64","Standard query 0x681c A wpad"
"111","02:59:27,303438","192.168.1.37","224.0.0.252","LLMNR","64","Standard query 0x4f70 AAAA wpad"
"112","02:59:27,490269","192.168.1.37","192.168.1.1","DNS","74","Standard query 0x3afe A login.live.com"
"113","02:59:27,495004","87.240.129.186","192.168.1.37","TLSv1.2","338","Application Data"
"114","02:59:27,495005","192.168.1.1","192.168.1.37","DNS","536","Standard query response 0x3afe A login.live.com CNAME login.msa.akadns6.net CNAME ipv4.login.msa.akadns6.net A 131.253.61.64 A 131.253.61.68 A 131.253.61.70 NS a1-131.akadns6.net NS a3-128.akadns6.net NS a18-131.akadns.org NS a5-129.akadns.org NS a9-131.akadns6.net NS a6-130.akadns.org NS a11-128.akadns6.net NS a12-130.akadns.org NS a13-129.akadns.org NS a7-130.akadns6.net A 193.108.88.131 AAAA 2600:1403:11::83 A 96.7.49.128 AAAA 2600:1408:1c::80 A 95.100.168.129 A 23.211.133.130 A 23.61.199.130"
"115","02:59:27,497734","192.168.1.37","131.253.61.64","TCP","66","2555  >  443 [SYN] Seq=0 Win=8192 Len=0 MSS=1460 WS=256 SACK_PERM=1"
"116","02:59:27,545062","192.168.1.37","151.101.36.134","SSL","55","Continuation Data"
"117","02:59:27,545074","192.168.1.37","87.240.129.186","TCP","54","2531  >  443 [ACK] Seq=1 Ack=285 Win=256 Len=0"
"118","02:59:27,582245","151.101.36.134","192.168.1.37","TCP","66","443  >  2244 [ACK] Seq=1 Ack=2 Win=66 Len=0 SLE=1 SRE=2"
"119","02:59:27,641640","192.168.1.37","192.168.1.255","NBNS","92","Name query NB WPAD<00>"
"120","02:59:27,712766","131.253.61.64","192.168.1.37","TCP","58","443  >  2555 [SYN, ACK] Seq=0 Ack=1 Win=4380 Len=0 MSS=1460"
"121","02:59:27,712844","192.168.1.37","131.253.61.64","TCP","54","2555  >  443 [ACK] Seq=1 Ack=1 Win=64240 Len=0"
"122","02:59:27,713214","192.168.1.37","131.253.61.64","TLSv1.2","229","Client Hello"
"123","02:59:27,905405","131.253.61.64","192.168.1.37","TCP","58","[TCP Window Update] 443  >  2555 [ACK] Seq=1 Ack=1 Win=8192 Len=0"
"124","02:59:27,905520","131.253.61.64","192.168.1.37","TCP","54","443  >  2555 [ACK] Seq=1 Ack=176 Win=64240 Len=0"
"125","02:59:27,910691","131.253.61.64","192.168.1.37","TCP","1514","443  >  2555 [ACK] Seq=1 Ack=176 Win=64240 Len=1460 [TCP segment of a reassembled PDU]"
"126","02:59:27,910800","131.253.61.64","192.168.1.37","TCP","1514","443  >  2555 [ACK] Seq=1461 Ack=176 Win=64240 Len=1460 [TCP segment of a reassembled PDU]"
"127","02:59:27,910828","192.168.1.37","131.253.61.64","TCP","54","2555  >  443 [ACK] Seq=176 Ack=2921 Win=64240 Len=0"
"128","02:59:27,912547","131.253.61.64","192.168.1.37","TCP","1514","443  >  2555 [ACK] Seq=2921 Ack=176 Win=64240 Len=1460 [TCP segment of a reassembled PDU]"
"129","02:59:27,912560","131.253.61.64","192.168.1.37","TCP","1514","443  >  2555 [ACK] Seq=4381 Ack=176 Win=64240 Len=1460 [TCP segment of a reassembled PDU]"
"130","02:59:27,912602","192.168.1.37","131.253.61.64","TCP","54","2555  >  443 [ACK] Seq=176 Ack=5841 Win=64240 Len=0"
"131","02:59:28,105329","131.253.61.64","192.168.1.37","TLSv1.2","194","Server Hello, Certificate, Certificate Status, Server Key Exchange, Server Hello Done"
"132","02:59:28,156444","192.168.1.37","131.253.61.64","TCP","54","2555  >  443 [ACK] Seq=176 Ack=5981 Win=64100 Len=0"
"133","02:59:28,171574","192.168.1.37","131.253.61.64","TLSv1.2","268","Client Key Exchange, Change Cipher Spec, Encrypted Handshake Message"
"134","02:59:28,369383","131.253.61.64","192.168.1.37","TLSv1.2","161","Change Cipher Spec, Encrypted Handshake Message"
"135","02:59:28,370337","192.168.1.37","131.253.61.64","TLSv1.2","555","Application Data"
"136","02:59:28,370545","192.168.1.37","131.253.61.64","TCP","1514","2555  >  443 [ACK] Seq=891 Ack=6088 Win=63993 Len=1460 [TCP segment of a reassembled PDU]"
"137","02:59:28,370551","192.168.1.37","131.253.61.64","TCP","1514","2555  >  443 [ACK] Seq=2351 Ack=6088 Win=63993 Len=1460 [TCP segment of a reassembled PDU]"
"138","02:59:28,370554","192.168.1.37","131.253.61.64","TCP","1514","2555  >  443 [ACK] Seq=3811 Ack=6088 Win=63993 Len=1460 [TCP segment of a reassembled PDU]"
"139","02:59:28,395196","192.168.1.37","192.168.1.255","NBNS","92","Name query NB WPAD<00>"
"140","02:59:28,571325","131.253.61.64","192.168.1.37","TCP","60","443  >  2555 [ACK] Seq=6088 Ack=2351 Win=64240 Len=0"
"141","02:59:28,571326","131.253.61.64","192.168.1.37","TCP","60","443  >  2555 [ACK] Seq=6088 Ack=5271 Win=64240 Len=0"
"142","02:59:28,571387","192.168.1.37","131.253.61.64","TCP","1514","2555  >  443 [ACK] Seq=5271 Ack=6088 Win=63993 Len=1460 [TCP segment of a reassembled PDU]"
"143","02:59:28,571394","192.168.1.37","131.253.61.64","TLSv1.2","987","Application Data"
"144","02:59:28,577109","178.237.20.122","192.168.1.37","TLSv1.2","85","Encrypted Alert"
"145","02:59:28,577223","178.237.20.122","192.168.1.37","TCP","54","443  >  2552 [FIN, ACK] Seq=32 Ack=1 Win=64 Len=0"
"146","02:59:28,577253","192.168.1.37","178.237.20.122","TCP","54","2552  >  443 [ACK] Seq=1 Ack=33 Win=255 Len=0"
"147","02:59:28,763336","131.253.61.64","192.168.1.37","TCP","60","443  >  2555 [ACK] Seq=6088 Ack=7664 Win=64240 Len=0"
"148","02:59:28,938482","131.253.61.64","192.168.1.37","TCP","1514","443  >  2555 [ACK] Seq=6088 Ack=7664 Win=64240 Len=1460 [TCP segment of a reassembled PDU]"
"149","02:59:28,938751","131.253.61.64","192.168.1.37","TCP","1514","443  >  2555 [ACK] Seq=7548 Ack=7664 Win=64240 Len=1460 [TCP segment of a reassembled PDU]"
"150","02:59:28,938752","131.253.61.64","192.168.1.37","TCP","1514","443  >  2555 [ACK] Seq=9008 Ack=7664 Win=64240 Len=1460 [TCP segment of a reassembled PDU]"
"151","02:59:28,938755","131.253.61.64","192.168.1.37","TCP","1514","443  >  2555 [ACK] Seq=10468 Ack=7664 Win=64240 Len=1460 [TCP segment of a reassembled PDU]"
"152","02:59:28,938802","192.168.1.37","131.253.61.64","TCP","54","2555  >  443 [ACK] Seq=7664 Ack=11928 Win=64240 Len=0"
"153","02:59:28,939136","131.253.61.64","192.168.1.37","TCP","1514","443  >  2555 [ACK] Seq=11928 Ack=7664 Win=64240 Len=1460 [TCP segment of a reassembled PDU]"
"154","02:59:28,939137","131.253.61.64","192.168.1.37","TCP","1514","443  >  2555 [ACK] Seq=13388 Ack=7664 Win=64240 Len=1460 [TCP segment of a reassembled PDU]"
"155","02:59:28,939138","131.253.61.64","192.168.1.37","TCP","1514","443  >  2555 [ACK] Seq=14848 Ack=7664 Win=64240 Len=1460 [TCP segment of a reassembled PDU]"
"156","02:59:28,939186","192.168.1.37","131.253.61.64","TCP","54","2555  >  443 [ACK] Seq=7664 Ack=16308 Win=64240 Len=0"
"157","02:59:28,939329","131.253.61.64","192.168.1.37","TCP","1514","443  >  2555 [ACK] Seq=16308 Ack=7664 Win=64240 Len=1460 [TCP segment of a reassembled PDU]"
"158","02:59:28,939348","192.168.1.37","131.253.61.64","TCP","54","2555  >  443 [ACK] Seq=7664 Ack=17768 Win=64240 Len=0"
"159","02:59:29,131955","131.253.61.64","192.168.1.37","TCP","1514","[TCP Previous segment not captured] 443  >  2555 [ACK] Seq=19228 Ack=7664 Win=64240 Len=1460 [TCP segment of a reassembled PDU]"
"160","02:59:29,132028","192.168.1.37","131.253.61.64","TCP","54","[TCP Dup ACK 158#1] 2555  >  443 [ACK] Seq=7664 Ack=17768 Win=64240 Len=0"
"161","02:59:29,136280","131.253.61.64","192.168.1.37","TCP","1514","[TCP Out-Of-Order] 443  >  2555 [ACK] Seq=17768 Ack=7664 Win=64240 Len=1460 [TCP segment of a reassembled PDU]"
"162","02:59:29,136285","131.253.61.64","192.168.1.37","TCP","1514","443  >  2555 [ACK] Seq=20688 Ack=7664 Win=64240 Len=1460 [TCP segment of a reassembled PDU]"
"163","02:59:29,136287","131.253.61.64","192.168.1.37","TLSv1.2","1140","Application Data, Application Data"
"164","02:59:29,136395","192.168.1.37","131.253.61.64","TCP","54","2555  >  443 [ACK] Seq=7664 Ack=20688 Win=64240 Len=0"
"165","02:59:29,136518","192.168.1.37","131.253.61.64","TCP","54","2555  >  443 [ACK] Seq=7664 Ack=23235 Win=64240 Len=0"
"166","02:59:29,138089","192.168.1.37","131.253.61.64","TLSv1.2","139","Encrypted Alert"
"167","02:59:29,138203","192.168.1.37","131.253.61.64","TCP","54","2555  >  443 [FIN, ACK] Seq=7749 Ack=23235 Win=64240 Len=0"
"168","02:59:29,322082","192.168.1.37","192.168.1.1","DNS","72","Standard query 0x4634 A ssl.bing.com"
"169","02:59:29,334181","131.253.61.64","192.168.1.37","TCP","60","443  >  2555 [ACK] Seq=23235 Ack=7750 Win=64155 Len=0"
"170","02:59:29,347085","192.168.1.37","192.168.1.1","DNS","72","Standard query 0x4634 A ssl.bing.com"
"171","02:59:29,393689","192.168.1.1","192.168.1.37","DNS","232","Standard query response 0x4634 A ssl.bing.com CNAME ssl-bing-com.a-0001.a-msedge.net CNAME a-0001.a-msedge.net A 204.79.197.200 A 13.107.21.200 NS ns1.a-msedge.net NS ns2.a-msedge.net A 204.79.197.1 A 204.79.197.2"
"172","02:59:29,394386","192.168.1.37","204.79.197.200","TCP","66","2556  >  443 [SYN] Seq=0 Win=65535 Len=0 MSS=1460 WS=256 SACK_PERM=1"
"173","02:59:29,394756","192.168.1.1","192.168.1.37","DNS","232","Standard query response 0x4634 A ssl.bing.com CNAME ssl-bing-com.a-0001.a-msedge.net CNAME a-0001.a-msedge.net A 204.79.197.200 A 13.107.21.200 NS ns2.a-msedge.net NS ns1.a-msedge.net A 204.79.197.1 A 204.79.197.2"
"174","02:59:29,429963","204.79.197.200","192.168.1.37","TCP","66","443  >  2556 [SYN, ACK] Seq=0 Ack=1 Win=65535 Len=0 MSS=1440 WS=256 SACK_PERM=1"
"175","02:59:29,430047","192.168.1.37","204.79.197.200","TCP","54","2556  >  443 [ACK] Seq=1 Ack=1 Win=262144 Len=0"
"176","02:59:29,432241","192.168.1.37","204.79.197.200","TLSv1.2","227","Client Hello"
"177","02:59:29,474827","204.79.197.200","192.168.1.37","TCP","54","443  >  2556 [ACK] Seq=1 Ack=174 Win=262400 Len=0"
"178","02:59:29,474828","204.79.197.200","192.168.1.37","TCP","1514","443  >  2556 [ACK] Seq=1 Ack=174 Win=262400 Len=1460 [TCP segment of a reassembled PDU]"
"179","02:59:29,474829","204.79.197.200","192.168.1.37","TCP","1514","443  >  2556 [ACK] Seq=1461 Ack=174 Win=262400 Len=1460 [TCP segment of a reassembled PDU]"
"180","02:59:29,474830","204.79.197.200","192.168.1.37","TCP","1514","443  >  2556 [ACK] Seq=2921 Ack=174 Win=262400 Len=1460 [TCP segment of a reassembled PDU]"
"181","02:59:29,474833","204.79.197.200","192.168.1.37","TCP","1514","443  >  2556 [ACK] Seq=4381 Ack=174 Win=262400 Len=1460 [TCP segment of a reassembled PDU]"
"182","02:59:29,474834","204.79.197.200","192.168.1.37","TLSv1.2","1035","Server Hello, Certificate, Certificate Status, Server Key Exchange, Server Hello Done"
"183","02:59:29,474928","192.168.1.37","204.79.197.200","TCP","54","2556  >  443 [ACK] Seq=174 Ack=6822 Win=262144 Len=0"
"184","02:59:29,556788","192.168.1.37","192.168.1.1","DNS","77","Standard query 0x5e78 A ocsp.digicert.com"
"185","02:59:29,561573","192.168.1.1","192.168.1.37","DNS","249","Standard query response 0x5e78 A ocsp.digicert.com CNAME cs9.wac.phicdn.net A 93.184.220.29 NS ns2.phicdn.net NS ns1.phicdn.net A 72.21.80.5 AAAA 2606:2800:1::5 A 72.21.80.6 AAAA 2606:2800:1::6"
"186","02:59:29,562064","192.168.1.37","93.184.220.29","TCP","66","2557  >  80 [SYN] Seq=0 Win=8192 Len=0 MSS=1460 WS=256 SACK_PERM=1"
"187","02:59:29,591385","93.184.220.29","192.168.1.37","TCP","66","80  >  2557 [SYN, ACK] Seq=0 Ack=1 Win=65535 Len=0 MSS=1460 SACK_PERM=1 WS=512"
"188","02:59:29,591483","192.168.1.37","93.184.220.29","TCP","54","2557  >  80 [ACK] Seq=1 Ack=1 Win=65536 Len=0"
"189","02:59:29,591625","192.168.1.37","93.184.220.29","HTTP","289","GET /MFEwTzBNMEswSTAJBgUrDgMCGgUABBTBL0V27RVZ7LBduom%2FnYB45SPUEwQU5Z1ZMIJHWMys%2BghUNoZ7OrUETfACEAiIzVJfGSRETRSlgpHeuVI%3D HTTP/1.1 "
"190","02:59:29,610031","93.184.220.29","192.168.1.37","TCP","54","80  >  2557 [ACK] Seq=1 Ack=236 Win=147456 Len=0"
"191","02:59:29,610310","93.184.220.29","192.168.1.37","OCSP","842","Response"
"192","02:59:29,646456","192.168.1.37","204.79.197.200","TLSv1.2","220","Client Key Exchange, Change Cipher Spec, Encrypted Handshake Message"
"193","02:59:29,646810","192.168.1.37","204.79.197.200","TLSv1.2","1387","Application Data"
"194","02:59:29,661437","192.168.1.37","93.184.220.29","TCP","54","2557  >  80 [ACK] Seq=236 Ack=789 Win=64768 Len=0"
"195","02:59:29,681001","204.79.197.200","192.168.1.37","TCP","54","443  >  2556 [ACK] Seq=6822 Ack=340 Win=262400 Len=0"
"196","02:59:29,681831","204.79.197.200","192.168.1.37","TCP","54","443  >  2556 [ACK] Seq=6822 Ack=1673 Win=262656 Len=0"
"197","02:59:29,681974","204.79.197.200","192.168.1.37","TLSv1.2","145","Change Cipher Spec, Encrypted Handshake Message"
"198","02:59:29,682016","192.168.1.37","204.79.197.200","TCP","54","2556  >  443 [ACK] Seq=1673 Ack=6913 Win=261888 Len=0"
"199","02:59:29,723931","204.79.197.200","192.168.1.37","TLSv1.2","1419","Application Data"
"200","02:59:29,723997","192.168.1.37","204.79.197.200","TCP","54","2556  >  443 [ACK] Seq=1673 Ack=8278 Win=262144 Len=0"
"201","02:59:30,307201","192.168.1.37","151.101.36.64","SSL","55","Continuation Data"
"202","02:59:30,342539","151.101.36.64","192.168.1.37","TCP","66","443  >  2302 [ACK] Seq=1 Ack=2 Win=64 Len=0 SLE=1 SRE=2"
"203","02:59:31,270875","ZyxelCom_9f:c2:bc","Broadcast","ARP","42","Who has 192.168.1.34? Tell 192.168.1.1"
"204","02:59:31,320503","94.100.180.3","192.168.1.37","TLSv1.2","85","Application Data"
"205","02:59:31,320723","192.168.1.37","94.100.180.3","TLSv1.2","89","Application Data"
"206","02:59:31,405862","94.100.180.3","192.168.1.37","TCP","54","443  >  2305 [ACK] Seq=32 Ack=36 Win=273 Len=0"
"207","02:59:31,748692","192.168.1.37","192.168.1.1","DNS","90","Standard query 0x8b9a A sports.services.appex.bing.com"
"208","02:59:31,751696","192.168.1.1","192.168.1.37","DNS","496","Standard query response 0x8b9a A sports.services.appex.bing.com CNAME sports.services.appex.bing.com.edgekey.net CNAME e10675.g.akamaiedge.net A 184.86.55.239 NS n1g.akamaiedge.net NS n3g.akamaiedge.net NS n0g.akamaiedge.net NS n5g.akamaiedge.net NS n6g.akamaiedge.net NS n2g.akamaiedge.net NS n4g.akamaiedge.net NS n7g.akamaiedge.net A 88.221.81.192 AAAA 2600:1480:e800::c0 A 217.212.252.230 A 217.212.252.229 A 217.212.252.236 A 2.22.63.13 A 217.212.252.221 A 88.221.216.126 A 193.229.109.218"
"209","02:59:31,752453","192.168.1.37","184.86.55.239","TCP","66","2558  >  80 [SYN] Seq=0 Win=65535 Len=0 MSS=1460 WS=256 SACK_PERM=1"
"210","02:59:31,768824","184.86.55.239","192.168.1.37","TCP","66","80  >  2558 [SYN, ACK] Seq=0 Ack=1 Win=29200 Len=0 MSS=1460 SACK_PERM=1 WS=32"
"211","02:59:31,768937","192.168.1.37","184.86.55.239","TCP","54","2558  >  80 [ACK] Seq=1 Ack=1 Win=262144 Len=0"
"212","02:59:31,772354","192.168.1.37","184.86.55.239","HTTP","912","GET /AppConfigV1.svc/AllSportsInfo/?response=sdi&mkt=RU-RU&lang=RU&version=4&timezone=Kaliningrad%20Standard%20Time&client=Tablet_V5&ET=1&FORM=APXS01&cmstype=PROD&Client-AppVersion=3.0.2.233 HTTP/1.1 "
"213","02:59:31,791991","184.86.55.239","192.168.1.37","TCP","54","80  >  2558 [ACK] Seq=1 Ack=859 Win=30944 Len=0"
"214","02:59:32,018188","184.86.55.239","192.168.1.37","TCP","1514","80  >  2558 [ACK] Seq=1 Ack=859 Win=30944 Len=1460 [TCP segment of a reassembled PDU]"
"215","02:59:32,018257","192.168.1.37","184.86.55.239","TCP","54","2558  >  80 [ACK] Seq=859 Ack=1461 Win=262144 Len=0"
"216","02:59:32,018757","184.86.55.239","192.168.1.37","TCP","1514","80  >  2558 [ACK] Seq=1461 Ack=859 Win=30944 Len=1460 [TCP segment of a reassembled PDU]"
"217","02:59:32,018760","184.86.55.239","192.168.1.37","TCP","1514","80  >  2558 [ACK] Seq=2921 Ack=859 Win=30944 Len=1460 [TCP segment of a reassembled PDU]"
"218","02:59:32,018809","192.168.1.37","184.86.55.239","TCP","54","2558  >  80 [ACK] Seq=859 Ack=4381 Win=262144 Len=0"
"219","02:59:32,019095","184.86.55.239","192.168.1.37","TCP","1514","80  >  2558 [ACK] Seq=4381 Ack=859 Win=30944 Len=1460 [TCP segment of a reassembled PDU]"
"220","02:59:32,019097","184.86.55.239","192.168.1.37","TCP","1514","80  >  2558 [ACK] Seq=5841 Ack=859 Win=30944 Len=1460 [TCP segment of a reassembled PDU]"
"221","02:59:32,019098","184.86.55.239","192.168.1.37","TCP","1514","80  >  2558 [ACK] Seq=7301 Ack=859 Win=30944 Len=1460 [TCP segment of a reassembled PDU]"
"222","02:59:32,019141","192.168.1.37","184.86.55.239","TCP","54","2558  >  80 [ACK] Seq=859 Ack=8761 Win=262144 Len=0"
"223","02:59:32,019364","184.86.55.239","192.168.1.37","TCP","1514","80  >  2558 [ACK] Seq=8761 Ack=859 Win=30944 Len=1460 [TCP segment of a reassembled PDU]"
"224","02:59:32,019397","192.168.1.37","184.86.55.239","TCP","54","2558  >  80 [ACK] Seq=859 Ack=10221 Win=262144 Len=0"
"225","02:59:32,019836","184.86.55.239","192.168.1.37","HTTP","1013","HTTP/1.1 200 OK  (application/json)"
"226","02:59:32,019943","192.168.1.37","184.86.55.239","TCP","54","2558  >  80 [ACK] Seq=859 Ack=11180 Win=261120 Len=0"
"227","02:59:32,271333","ZyxelCom_9f:c2:bc","Broadcast","ARP","42","Who has 192.168.1.34? Tell 192.168.1.1"
"228","02:59:32,313863","192.168.1.37","87.240.129.134","SSL","55","Continuation Data"
"229","02:59:32,316628","87.240.129.134","192.168.1.37","TCP","66","443  >  2533 [ACK] Seq=1 Ack=2 Win=77 Len=0 SLE=1 SRE=2"
"230","02:59:32,485186","192.168.1.37","178.237.20.122","TCP","54","2552  >  443 [FIN, ACK] Seq=1 Ack=33 Win=255 Len=0"
"231","02:59:32,485304","192.168.1.37","178.237.20.122","TCP","54","2552  >  443 [RST, ACK] Seq=2 Ack=33 Win=0 Len=0"
"232","02:59:32,485726","192.168.1.37","77.88.55.50","TCP","1464","2266  >  443 [ACK] Seq=4412 Ack=495 Win=254 Len=1410 [TCP segment of a reassembled PDU]"
"233","02:59:32,485736","192.168.1.37","77.88.55.50","TLSv1.2","723","Application Data"
"234","02:59:32,499704","178.237.20.122","192.168.1.37","TCP","54","443  >  2552 [ACK] Seq=33 Ack=2 Win=64 Len=0"
"235","02:59:32,516018","77.88.55.50","192.168.1.37","TCP","66","[TCP Dup ACK 71#1] 443  >  2266 [ACK] Seq=495 Ack=4412 Win=711 Len=0 SLE=5822 SRE=6491"
"236","02:59:32,516019","77.88.55.50","192.168.1.37","TCP","60","443  >  2266 [ACK] Seq=495 Ack=6491 Win=706 Len=0"
"237","02:59:32,517877","77.88.55.50","192.168.1.37","TLSv1.2","301","Application Data, Application Data"
"238","02:59:32,567679","192.168.1.37","77.88.55.50","TCP","54","2266  >  443 [ACK] Seq=6491 Ack=742 Win=258 Len=0"
"239","02:59:33,273308","ZyxelCom_9f:c2:bc","Broadcast","ARP","42","Who has 192.168.1.34? Tell 192.168.1.1"
"240","02:59:33,386091","192.168.1.37","213.180.204.179","SSL","55","Continuation Data"
"241","02:59:33,404502","213.180.204.179","192.168.1.37","TCP","66","443  >  2206 [ACK] Seq=1 Ack=2 Win=137 Len=0 SLE=1 SRE=2"
"242","02:59:33,418749","192.168.1.1","239.255.255.250","SSDP","435","NOTIFY * HTTP/1.1 "
"243","02:59:33,423473","192.168.1.1","239.255.255.250","SSDP","507","NOTIFY * HTTP/1.1 "
"244","02:59:33,427595","192.168.1.1","239.255.255.250","SSDP","444","NOTIFY * HTTP/1.1 "
"245","02:59:33,432255","192.168.1.1","239.255.255.250","SSDP","503","NOTIFY * HTTP/1.1 "
"246","02:59:33,436480","192.168.1.1","239.255.255.250","SSDP","444","NOTIFY * HTTP/1.1 "
"247","02:59:33,441092","192.168.1.1","239.255.255.250","SSDP","483","NOTIFY * HTTP/1.1 "
"248","02:59:33,445205","192.168.1.1","239.255.255.250","SSDP","444","NOTIFY * HTTP/1.1 "
"249","02:59:33,449921","192.168.1.1","239.255.255.250","SSDP","515","NOTIFY * HTTP/1.1 "
"250","02:59:33,454610","192.168.1.1","239.255.255.250","SSDP","497","NOTIFY * HTTP/1.1 "
"251","02:59:33,459193","192.168.1.1","239.255.255.250","SSDP","499","NOTIFY * HTTP/1.1 "
"252","02:59:33,463821","192.168.1.1","239.255.255.250","SSDP","499","NOTIFY * HTTP/1.1 "
"253","02:59:33,484927","192.168.1.37","77.88.55.50","TCP","1464","2266  >  443 [ACK] Seq=6491 Ack=742 Win=258 Len=1410 [TCP segment of a reassembled PDU]"
"254","02:59:33,484940","192.168.1.37","77.88.55.50","TLSv1.2","976","Application Data"
"255","02:59:33,502206","77.88.55.50","192.168.1.37","TCP","54","443  >  2266 [ACK] Seq=742 Ack=8823 Win=711 Len=0"
"256","02:59:33,503158","77.88.55.50","192.168.1.37","TLSv1.2","301","Application Data, Application Data"
"257","02:59:33,552838","192.168.1.37","77.88.55.50","TCP","54","2266  >  443 [ACK] Seq=8823 Ack=989 Win=257 Len=0"
"258","02:59:33,617931","192.168.1.37","151.101.36.133","SSL","55","Continuation Data"
"259","02:59:33,651686","151.101.36.133","192.168.1.37","TCP","66","443  >  2311 [ACK] Seq=1 Ack=2 Win=62 Len=0 SLE=1 SRE=2"
"260","02:59:33,818180","192.168.1.37","151.101.36.133","SSL","55","Continuation Data"
"261","02:59:33,875266","151.101.36.133","192.168.1.37","TCP","66","443  >  2312 [ACK] Seq=1 Ack=2 Win=62 Len=0 SLE=1 SRE=2"
"262","02:59:34,033248","192.168.1.37","151.101.36.133","SSL","55","Continuation Data"
"263","02:59:34,067671","151.101.36.133","192.168.1.37","TCP","66","443  >  2313 [ACK] Seq=1 Ack=2 Win=62 Len=0 SLE=1 SRE=2"
"264","02:59:35,754298","192.168.1.37","192.168.1.1","DNS","80","Standard query 0xb13b A asgcdn.azureedge.net"
"265","02:59:35,760978","192.168.1.37","192.168.1.1","DNS","90","Standard query 0xcf81 A mucp.api.account.microsoft.com"
"266","02:59:35,778870","192.168.1.37","192.168.1.1","DNS","80","Standard query 0xb13b A asgcdn.azureedge.net"
"267","02:59:35,786035","192.168.1.37","192.168.1.1","DNS","90","Standard query 0xcf81 A mucp.api.account.microsoft.com"
"268","02:59:35,848527","192.168.1.1","192.168.1.37","DNS","272","Standard query response 0xb13b A asgcdn.azureedge.net CNAME asgcdn.ec.azureedge.net CNAME cs9.wpc.v0cdn.net A 93.184.221.200 NS ns1.v0cdn.net NS ns2.v0cdn.net A 72.21.80.5 AAAA 2606:2800:1::5 A 72.21.80.6 AAAA 2606:2800:1::6"
"269","02:59:35,848528","192.168.1.1","192.168.1.37","DNS","272","Standard query response 0xb13b A asgcdn.azureedge.net CNAME asgcdn.ec.azureedge.net CNAME cs9.wpc.v0cdn.net A 93.184.221.200 NS ns1.v0cdn.net NS ns2.v0cdn.net A 72.21.80.5 AAAA 2606:2800:1::5 A 72.21.80.6 AAAA 2606:2800:1::6"
"270","02:59:35,848528","192.168.1.1","192.168.1.37","DNS","538","Standard query response 0xcf81 A mucp.api.account.microsoft.com CNAME api.mucp.microsoft.com.akadns.net A 65.52.108.105 NS a13-130.akadns.org NS a7-131.akadns.net NS a1-128.akadns.net NS a18-128.akadns.org NS a12-131.akadns.org NS a5-130.akadns.org NS a3-129.akadns.net NS a9-128.akadns.net NS a11-129.akadns.net NS a28-129.akadns.org A 193.108.88.128 A 96.7.49.129 A 95.100.168.130 A 23.61.199.131 A 184.85.248.128 A 84.53.139.129 A 184.26.160.131 A 2.22.230.130 A 95.101.36.128 A 95.100.173.129"
"271","02:59:35,848529","192.168.1.1","192.168.1.37","DNS","538","Standard query response 0xcf81 A mucp.api.account.microsoft.com CNAME api.mucp.microsoft.com.akadns.net A 65.52.108.105 NS a5-130.akadns.org NS a13-130.akadns.org NS a11-129.akadns.net NS a28-129.akadns.org NS a12-131.akadns.org NS a7-131.akadns.net NS a9-128.akadns.net NS a18-128.akadns.org NS a1-128.akadns.net NS a3-129.akadns.net A 193.108.88.128 A 96.7.49.129 A 95.100.168.130 A 23.61.199.131 A 184.85.248.128 A 84.53.139.129 A 184.26.160.131 A 2.22.230.130 A 95.101.36.128 A 95.100.173.129"
"272","02:59:35,852582","192.168.1.37","65.52.108.105","TCP","66","2559  >  443 [SYN] Seq=0 Win=65535 Len=0 MSS=1460 WS=256 SACK_PERM=1"
"273","02:59:35,852582","192.168.1.37","93.184.221.200","TCP","66","2560  >  443 [SYN] Seq=0 Win=65535 Len=0 MSS=1460 WS=256 SACK_PERM=1"
"274","02:59:35,852583","192.168.1.37","93.184.221.200","TCP","66","2562  >  443 [SYN] Seq=0 Win=65535 Len=0 MSS=1460 WS=256 SACK_PERM=1"
"275","02:59:35,852583","192.168.1.37","93.184.221.200","TCP","66","2561  >  443 [SYN] Seq=0 Win=65535 Len=0 MSS=1460 WS=256 SACK_PERM=1"
"276","02:59:35,852814","192.168.1.37","93.184.221.200","TCP","66","2563  >  443 [SYN] Seq=0 Win=65535 Len=0 MSS=1460 WS=256 SACK_PERM=1"
"277","02:59:35,852830","192.168.1.37","93.184.221.200","TCP","66","2564  >  443 [SYN] Seq=0 Win=65535 Len=0 MSS=1460 WS=256 SACK_PERM=1"
"278","02:59:35,852830","192.168.1.37","93.184.221.200","TCP","66","2565  >  443 [SYN] Seq=0 Win=65535 Len=0 MSS=1460 WS=256 SACK_PERM=1"
"279","02:59:35,886503","93.184.221.200","192.168.1.37","TCP","66","443  >  2562 [SYN, ACK] Seq=0 Ack=1 Win=65535 Len=0 MSS=1460 SACK_PERM=1 WS=512"
"280","02:59:35,886505","93.184.221.200","192.168.1.37","TCP","66","443  >  2561 [SYN, ACK] Seq=0 Ack=1 Win=65535 Len=0 MSS=1460 SACK_PERM=1 WS=512"
"281","02:59:35,886505","93.184.221.200","192.168.1.37","TCP","66","443  >  2560 [SYN, ACK] Seq=0 Ack=1 Win=65535 Len=0 MSS=1460 SACK_PERM=1 WS=512"
"282","02:59:35,886633","192.168.1.37","93.184.221.200","TCP","54","2562  >  443 [ACK] Seq=1 Ack=1 Win=262144 Len=0"
"283","02:59:35,886724","192.168.1.37","93.184.221.200","TCP","54","2561  >  443 [ACK] Seq=1 Ack=1 Win=262144 Len=0"
"284","02:59:35,886763","192.168.1.37","93.184.221.200","TCP","54","2560  >  443 [ACK] Seq=1 Ack=1 Win=262144 Len=0"
"285","02:59:35,888407","93.184.221.200","192.168.1.37","TCP","66","443  >  2563 [SYN, ACK] Seq=0 Ack=1 Win=65535 Len=0 MSS=1460 SACK_PERM=1 WS=512"
"286","02:59:35,888408","93.184.221.200","192.168.1.37","TCP","66","443  >  2564 [SYN, ACK] Seq=0 Ack=1 Win=65535 Len=0 MSS=1460 SACK_PERM=1 WS=512"
"287","02:59:35,888409","93.184.221.200","192.168.1.37","TCP","66","443  >  2565 [SYN, ACK] Seq=0 Ack=1 Win=65535 Len=0 MSS=1460 SACK_PERM=1 WS=512"
"288","02:59:35,888537","192.168.1.37","93.184.221.200","TCP","54","2563  >  443 [ACK] Seq=1 Ack=1 Win=262144 Len=0"
"289","02:59:35,888606","192.168.1.37","93.184.221.200","TCP","54","2564  >  443 [ACK] Seq=1 Ack=1 Win=262144 Len=0"
"290","02:59:35,888648","192.168.1.37","93.184.221.200","TCP","54","2565  >  443 [ACK] Seq=1 Ack=1 Win=262144 Len=0"
"291","02:59:35,889398","192.168.1.37","93.184.221.200","TLSv1.2","235","Client Hello"
"292","02:59:35,889439","192.168.1.37","93.184.221.200","TLSv1.2","235","Client Hello"
"293","02:59:35,889456","192.168.1.37","93.184.221.200","TLSv1.2","235","Client Hello"
"294","02:59:35,889553","192.168.1.37","93.184.221.200","TLSv1.2","235","Client Hello"
"295","02:59:35,889566","192.168.1.37","93.184.221.200","TLSv1.2","235","Client Hello"
"296","02:59:35,890299","192.168.1.37","93.184.221.200","TLSv1.2","235","Client Hello"
"297","02:59:35,904598","93.184.221.200","192.168.1.37","TCP","54","443  >  2561 [ACK] Seq=1 Ack=182 Win=147456 Len=0"
"298","02:59:35,904761","93.184.221.200","192.168.1.37","TCP","54","443  >  2563 [ACK] Seq=1 Ack=182 Win=147456 Len=0"
"299","02:59:35,904761","93.184.221.200","192.168.1.37","TCP","54","443  >  2560 [ACK] Seq=1 Ack=182 Win=147456 Len=0"
"300","02:59:35,904762","93.184.221.200","192.168.1.37","TCP","54","443  >  2564 [ACK] Seq=1 Ack=182 Win=147456 Len=0"
"301","02:59:35,905140","93.184.221.200","192.168.1.37","TCP","54","443  >  2565 [ACK] Seq=1 Ack=182 Win=147456 Len=0"
"302","02:59:35,905333","93.184.221.200","192.168.1.37","TLSv1.2","1514","Server Hello"
"303","02:59:35,905376","192.168.1.37","93.184.221.200","TCP","54","2561  >  443 [ACK] Seq=182 Ack=1461 Win=262144 Len=0"
"304","02:59:35,905624","93.184.221.200","192.168.1.37","TCP","1514","443  >  2561 [ACK] Seq=1461 Ack=182 Win=147456 Len=1460 [TCP segment of a reassembled PDU]"
"305","02:59:35,905625","93.184.221.200","192.168.1.37","TCP","1230","443  >  2561 [PSH, ACK] Seq=2921 Ack=182 Win=147456 Len=1176 [TCP segment of a reassembled PDU]"
"306","02:59:35,905653","192.168.1.37","93.184.221.200","TCP","54","2561  >  443 [ACK] Seq=182 Ack=4097 Win=262144 Len=0"
"307","02:59:35,906220","93.184.221.200","192.168.1.37","TCP","1514","443  >  2561 [ACK] Seq=4097 Ack=182 Win=147456 Len=1460 [TCP segment of a reassembled PDU]"
"308","02:59:35,906221","93.184.221.200","192.168.1.37","TLSv1.2","1514","Certificate [TCP segment of a reassembled PDU]"
"309","02:59:35,906254","192.168.1.37","93.184.221.200","TCP","54","2561  >  443 [ACK] Seq=182 Ack=7017 Win=262144 Len=0"
"310","02:59:35,906797","93.184.221.200","192.168.1.37","TCP","1230","443  >  2561 [PSH, ACK] Seq=7017 Ack=182 Win=147456 Len=1176 [TCP segment of a reassembled PDU]"
