"No.","Time","Source","Destination","Protocol","Length","Info"
"1","09:52:47,736774","fe80::d5d4:e1d6:8319:3e4","ff02::2","ICMPv6","70","Router Solicitation from 20:68:9d:6b:2c:4b"
"2","09:52:48,457573","193.200.241.195","192.168.43.171","TCP","597","9001  >  58529 [PSH, ACK] Seq=1 Ack=1 Win=1418 Len=543"
"3","09:52:48,517242","192.168.43.171","193.200.241.195","TCP","54","58529  >  9001 [ACK] Seq=1 Ack=544 Win=254 Len=0"
"4","09:52:50,506867","HuaweiTe_d8:6e:c7","LiteonTe_6b:2c:4b","ARP","42","Who has 192.168.43.171? Tell 192.168.43.1"
"5","09:52:50,506891","LiteonTe_6b:2c:4b","HuaweiTe_d8:6e:c7","ARP","42","192.168.43.171 is at 20:68:9d:6b:2c:4b"
"6","09:52:51,489495","192.168.43.171","192.168.43.1","DNS","82","Standard query 0xabc2 A avatars.mds.yandex.net"
"7","09:52:51,524683","192.168.43.171","192.168.43.255","NBNS","92","Name query NB WPAD<00>"
"8","09:52:51,528271","fe80::d5d4:e1d6:8319:3e4","ff02::1:3","LLMNR","84","Standard query 0x8ce8 A wpad"
"9","09:52:51,528449","192.168.43.171","224.0.0.252","LLMNR","64","Standard query 0x8ce8 A wpad"
"10","09:52:51,547970","192.168.43.1","192.168.43.171","DNS","360","Standard query response 0xabc2 A avatars.mds.yandex.net A 87.250.247.181 A 87.250.247.184 A 87.250.247.183 A 87.250.247.182 NS ns4.yandex.ru NS ns6.yandex.ru NS ns3.yandex.ru A 77.88.21.1 AAAA 2a02:6b8:0:1::1:1 A 52.58.15.159 AAAA 2a05:d014:484:fd00::ffff:1 A 87.250.250.1 AAAA 2a02:6b8::1001"
"11","09:52:51,548178","192.168.43.171","192.168.43.1","DNS","85","Standard query 0x69da A sovetnik.market.yandex.ru"
"12","09:52:51,579479","192.168.43.1","192.168.43.171","DNS","388","Standard query response 0x69da A sovetnik.market.yandex.ru CNAME sovetnik.market.http.yandex.ru A 87.250.250.41 NS ns9.z5h64q92x9.net NS ns1.yandex.ru NS ns2.yandex.ru A 213.180.193.1 AAAA 2a02:6b8::1 A 195.156.199.201 AAAA 2a05:d014:484:fd80:ffff:ffff:0:1 A 93.158.134.1 AAAA 2a02:6b8:0:1::1"
"13","09:52:51,643410","192.168.43.171","193.200.241.195","TCP","597","58529  >  9001 [PSH, ACK] Seq=1 Ack=544 Win=254 Len=543"
"14","09:52:51,728638","193.200.241.195","192.168.43.171","TCP","54","9001  >  58529 [ACK] Seq=544 Ack=544 Win=1427 Len=0"
"15","09:52:51,747583","193.200.241.195","192.168.43.171","TCP","597","9001  >  58529 [PSH, ACK] Seq=544 Ack=544 Win=1427 Len=543"
"16","09:52:51,756189","192.168.43.171","193.200.241.195","TCP","597","58529  >  9001 [PSH, ACK] Seq=544 Ack=1087 Win=252 Len=543"
"17","09:52:51,912683","193.200.241.195","192.168.43.171","TCP","54","9001  >  58529 [ACK] Seq=1087 Ack=1087 Win=1435 Len=0"
"18","09:52:51,927385","fe80::d5d4:e1d6:8319:3e4","ff02::1:3","LLMNR","84","Standard query 0x8ce8 A wpad"
"19","09:52:51,927542","192.168.43.171","224.0.0.252","LLMNR","64","Standard query 0x8ce8 A wpad"
"20","09:52:52,069796","193.200.241.195","192.168.43.171","TCP","597","9001  >  58529 [PSH, ACK] Seq=1087 Ack=1087 Win=1435 Len=543"
"21","09:52:52,078386","192.168.43.171","193.200.241.195","TCP","597","58529  >  9001 [PSH, ACK] Seq=1087 Ack=1630 Win=257 Len=543"
"22","09:52:52,195383","193.200.241.195","192.168.43.171","TCP","54","9001  >  58529 [ACK] Seq=1630 Ack=1630 Win=1444 Len=0"
"23","09:52:52,268456","192.168.43.171","192.168.43.255","NBNS","92","Name query NB WPAD<00>"
"24","09:52:52,368410","193.200.241.195","192.168.43.171","TCP","597","9001  >  58529 [PSH, ACK] Seq=1630 Ack=1630 Win=1444 Len=543"
"25","09:52:52,420011","192.168.43.171","193.200.241.195","TCP","54","58529  >  9001 [ACK] Seq=1630 Ack=2173 Win=254 Len=0"
"26","09:52:52,629032","192.168.43.171","192.168.43.1","DNS","81","Standard query 0x8171 A api.browser.yandex.ru"
"27","09:52:52,681212","192.168.43.1","192.168.43.171","DNS","388","Standard query response 0x8171 A api.browser.yandex.ru A 213.180.204.82 A 213.180.193.82 A 87.250.251.82 A 87.250.250.82 A 93.158.134.82 NS ns9.z5h64q92x9.net NS ns2.yandex.ru NS ns1.yandex.ru A 213.180.193.1 AAAA 2a02:6b8::1 A 195.156.199.201 AAAA 2a05:d014:484:fd80:ffff:ffff:0:1 A 93.158.134.1 AAAA 2a02:6b8:0:1::1"
"28","09:52:52,684359","192.168.43.171","213.180.204.82","TCP","66","58700  >  443 [SYN] Seq=0 Win=8192 Len=0 MSS=1460 WS=256 SACK_PERM=1"
"29","09:52:52,684934","192.168.43.171","213.180.204.82","TCP","66","58701  >  443 [SYN] Seq=0 Win=8192 Len=0 MSS=1460 WS=256 SACK_PERM=1"
"30","09:52:52,708073","192.168.43.171","213.180.204.179","TCP","66","58702  >  443 [SYN] Seq=0 Win=8192 Len=0 MSS=1460 WS=256 SACK_PERM=1"
"31","09:52:52,719703","192.168.43.171","192.168.43.1","DNS","74","Standard query 0xed89 A mail.yandex.ru"
"32","09:52:52,738249","213.180.204.82","192.168.43.171","TCP","66","443  >  58701 [SYN, ACK] Seq=0 Ack=1 Win=42300 Len=0 MSS=1400 SACK_PERM=1 WS=4096"
"33","09:52:52,738344","192.168.43.171","213.180.204.82","TCP","54","58701  >  443 [ACK] Seq=1 Ack=1 Win=65792 Len=0"
"34","09:52:52,738754","192.168.43.171","213.180.204.82","TLSv1.2","263","Client Hello"
"35","09:52:52,739747","213.180.204.82","192.168.43.171","TCP","66","443  >  58700 [SYN, ACK] Seq=0 Ack=1 Win=42300 Len=0 MSS=1400 SACK_PERM=1 WS=4096"
"36","09:52:52,739834","192.168.43.171","213.180.204.82","TCP","54","58700  >  443 [ACK] Seq=1 Ack=1 Win=65792 Len=0"
"37","09:52:52,740369","192.168.43.171","213.180.204.82","TLSv1.2","263","Client Hello"
"38","09:52:52,764267","192.168.43.1","192.168.43.171","DNS","364","Standard query response 0xed89 A mail.yandex.ru A 213.180.204.125 A 213.180.193.125 A 87.250.250.125 A 93.158.134.125 A 87.250.251.125 NS ns4.yandex.ru NS ns3.yandex.ru NS ns6.yandex.ru A 77.88.21.1 AAAA 2a02:6b8:0:1::1:1 A 87.250.250.1 AAAA 2a02:6b8::1001 A 52.58.15.159 AAAA 2a05:d014:484:fd00::ffff:1"
"39","09:52:52,770777","213.180.204.179","192.168.43.171","TCP","66","443  >  58702 [SYN, ACK] Seq=0 Ack=1 Win=28200 Len=0 MSS=1400 SACK_PERM=1 WS=256"
"40","09:52:52,770886","192.168.43.171","213.180.204.179","TCP","54","58702  >  443 [ACK] Seq=1 Ack=1 Win=65792 Len=0"
"41","09:52:52,771268","192.168.43.171","213.180.204.179","TLSv1.2","238","Client Hello"
"42","09:52:52,774194","192.168.43.171","213.180.204.125","TCP","66","58703  >  443 [SYN] Seq=0 Win=8192 Len=0 MSS=1460 WS=256 SACK_PERM=1"
"43","09:52:52,790347","213.180.204.82","192.168.43.171","TCP","54","443  >  58701 [ACK] Seq=1 Ack=210 Win=45056 Len=0"
"44","09:52:52,791826","213.180.204.82","192.168.43.171","TCP","54","443  >  58700 [ACK] Seq=1 Ack=210 Win=45056 Len=0"
"45","09:52:52,818850","213.180.204.82","192.168.43.171","TLSv1.2","1416","Server Hello"
"46","09:52:52,833315","213.180.204.82","192.168.43.171","TCP","1416","443  >  58700 [ACK] Seq=1363 Ack=210 Win=45056 Len=1362 [TCP segment of a reassembled PDU]"
"47","09:52:52,833385","192.168.43.171","213.180.204.82","TCP","54","58700  >  443 [ACK] Seq=210 Ack=2725 Win=65792 Len=0"
"48","09:52:52,858834","213.180.204.82","192.168.43.171","TCP","1416","443  >  58700 [ACK] Seq=2725 Ack=210 Win=45056 Len=1362 [TCP segment of a reassembled PDU]"
"49","09:52:52,871613","192.168.43.171","59.106.19.206","TCP","66","58704  >  80 [SYN] Seq=0 Win=8192 Len=0 MSS=1460 WS=256 SACK_PERM=1"
"50","09:52:52,873326","213.180.204.82","192.168.43.171","TLSv1.2","1416","Certificate [TCP segment of a reassembled PDU]"
"51","09:52:52,873381","192.168.43.171","213.180.204.82","TCP","54","58700  >  443 [ACK] Seq=210 Ack=5449 Win=65792 Len=0"
"52","09:52:52,884213","213.180.204.82","192.168.43.171","TLSv1.2","743","Certificate Status, Server Key Exchange, Server Hello Done"
"53","09:52:52,890380","192.168.43.171","213.180.204.82","TLSv1.2","180","Client Key Exchange, Change Cipher Spec, Encrypted Handshake Message"
"54","09:52:52,915863","213.180.204.82","192.168.43.171","TLSv1.2","1416","Server Hello"
"55","09:52:52,928869","213.180.204.82","192.168.43.171","TCP","1416","443  >  58701 [ACK] Seq=1363 Ack=210 Win=45056 Len=1362 [TCP segment of a reassembled PDU]"
"56","09:52:52,928931","192.168.43.171","213.180.204.82","TCP","54","58701  >  443 [ACK] Seq=210 Ack=2725 Win=65792 Len=0"
"57","09:52:52,941384","213.180.204.82","192.168.43.171","TCP","1416","443  >  58701 [ACK] Seq=2725 Ack=210 Win=45056 Len=1362 [TCP segment of a reassembled PDU]"
"58","09:52:52,943284","192.168.43.171","213.180.204.82","TCP","1454","58700  >  443 [ACK] Seq=336 Ack=6138 Win=65024 Len=1400 [TCP segment of a reassembled PDU]"
"59","09:52:52,943298","192.168.43.171","213.180.204.82","TLSv1.2","311","Application Data"
"60","09:52:52,953896","213.180.204.82","192.168.43.171","TLSv1.2","1416","Certificate [TCP segment of a reassembled PDU]"
"61","09:52:52,953961","192.168.43.171","213.180.204.82","TCP","54","58701  >  443 [ACK] Seq=210 Ack=5449 Win=65792 Len=0"
"62","09:52:52,969537","192.168.43.171","213.180.204.125","TCP","66","58705  >  443 [SYN] Seq=0 Win=8192 Len=0 MSS=1460 WS=256 SACK_PERM=1"
"63","09:52:52,999917","213.180.204.82","192.168.43.171","TLSv1.2","743","Certificate Status, Server Key Exchange, Server Hello Done"
"64","09:52:53,003914","213.180.204.125","192.168.43.171","TCP","66","443  >  58703 [SYN, ACK] Seq=0 Ack=1 Win=28200 Len=0 MSS=1400 SACK_PERM=1 WS=256"
"65","09:52:53,003997","192.168.43.171","213.180.204.125","TCP","54","58703  >  443 [ACK] Seq=1 Ack=1 Win=65792 Len=0"
"66","09:52:53,006039","192.168.43.171","213.180.204.82","TLSv1.2","180","Client Key Exchange, Change Cipher Spec, Encrypted Handshake Message"
"67","09:52:53,006647","192.168.43.171","213.180.204.125","TLSv1.2","256","Client Hello"
"68","09:52:53,006907","213.180.204.179","192.168.43.171","TCP","54","443  >  58702 [ACK] Seq=1 Ack=185 Win=29440 Len=0"
"69","09:52:53,017469","192.168.43.171","213.180.204.82","TCP","1454","58701  >  443 [ACK] Seq=336 Ack=6138 Win=65024 Len=1400 [TCP segment of a reassembled PDU]"
"70","09:52:53,017483","192.168.43.171","213.180.204.82","TLSv1.2","291","Application Data"
"71","09:52:53,019007","192.168.43.171","192.168.43.255","NBNS","92","Name query NB WPAD<00>"
"72","09:52:53,019418","213.180.204.179","192.168.43.171","TLSv1.2","1454","Server Hello"
"73","09:52:53,036445","213.180.204.179","192.168.43.171","TCP","1454","443  >  58702 [ACK] Seq=1401 Ack=185 Win=29440 Len=1400 [TCP segment of a reassembled PDU]"
"74","09:52:53,036512","192.168.43.171","213.180.204.179","TCP","54","58702  >  443 [ACK] Seq=185 Ack=2801 Win=65792 Len=0"
"75","09:52:53,060493","213.180.204.179","192.168.43.171","TCP","1454","443  >  58702 [ACK] Seq=2801 Ack=185 Win=29440 Len=1400 [TCP segment of a reassembled PDU]"
"76","09:52:53,074477","213.180.204.179","192.168.43.171","TLSv1.2","1454","Certificate [TCP segment of a reassembled PDU]"
"77","09:52:53,074543","192.168.43.171","213.180.204.179","TCP","54","58702  >  443 [ACK] Seq=185 Ack=5601 Win=65792 Len=0"
"78","09:52:53,089484","213.180.204.179","192.168.43.171","TLSv1.2","804","Certificate Status, Server Key Exchange, Server Hello Done"
"79","09:52:53,095721","192.168.43.171","213.180.204.179","TLSv1.2","180","Client Key Exchange, Change Cipher Spec, Encrypted Handshake Message"
"80","09:52:53,098488","213.180.204.82","192.168.43.171","TCP","743","[TCP Spurious Retransmission] 443  >  58700 [PSH, ACK] Seq=5449 Ack=210 Win=45056 Len=689[Reassembly error, protocol TCP: New fragment overlaps old data (retransmission?)]"
"81","09:52:53,098540","192.168.43.171","213.180.204.82","TCP","66","[TCP Dup ACK 53#1] 58700  >  443 [ACK] Seq=1993 Ack=6138 Win=65024 Len=0 SLE=5449 SRE=6138"
"82","09:52:53,107501","213.180.204.82","192.168.43.171","TCP","743","[TCP Spurious Retransmission] 443  >  58701 [PSH, ACK] Seq=5449 Ack=210 Win=45056 Len=689[Reassembly error, protocol TCP: New fragment overlaps old data (retransmission?)]"
"83","09:52:53,107554","192.168.43.171","213.180.204.82","TCP","66","[TCP Dup ACK 66#1] 58701  >  443 [ACK] Seq=1973 Ack=6138 Win=65024 Len=0 SLE=5449 SRE=6138"
"84","09:52:53,117002","213.180.204.179","192.168.43.171","TCP","804","[TCP Spurious Retransmission] 443  >  58702 [PSH, ACK] Seq=5601 Ack=185 Win=29440 Len=750[Reassembly error, protocol TCP: New fragment overlaps old data (retransmission?)]"
"85","09:52:53,117053","192.168.43.171","213.180.204.179","TCP","66","[TCP Dup ACK 79#1] 58702  >  443 [ACK] Seq=311 Ack=6351 Win=65024 Len=0 SLE=5601 SRE=6351"
"86","09:52:53,121297","192.168.43.171","59.106.19.206","TCP","66","58706  >  80 [SYN] Seq=0 Win=8192 Len=0 MSS=1460 WS=256 SACK_PERM=1"
"87","09:52:53,121485","213.180.204.82","192.168.43.171","TLSv1.2","328","New Session Ticket, Change Cipher Spec, Encrypted Handshake Message"
"88","09:52:53,123002","213.180.204.125","192.168.43.171","TCP","66","443  >  58705 [SYN, ACK] Seq=0 Ack=1 Win=28200 Len=0 MSS=1400 SACK_PERM=1 WS=256"
"89","09:52:53,123097","192.168.43.171","213.180.204.125","TCP","54","58705  >  443 [ACK] Seq=1 Ack=1 Win=65792 Len=0"
"90","09:52:53,124497","213.180.204.125","192.168.43.171","TCP","54","443  >  58703 [ACK] Seq=1 Ack=203 Win=29440 Len=0"
"91","09:52:53,125999","213.180.204.82","192.168.43.171","TCP","54","443  >  58701 [ACK] Seq=6138 Ack=1736 Win=49152 Len=0"
"92","09:52:53,128009","213.180.204.82","192.168.43.171","TCP","54","443  >  58700 [ACK] Seq=6412 Ack=1993 Win=49152 Len=0"
"93","09:52:53,140518","213.180.204.125","192.168.43.171","TLSv1.2","1454","Server Hello"
"94","09:52:53,152549","192.168.43.171","213.180.204.82","TCP","54","58700  >  443 [ACK] Seq=1993 Ack=6412 Win=64768 Len=0"
"95","09:52:53,185548","213.180.204.125","192.168.43.171","TCP","1454","443  >  58703 [ACK] Seq=1401 Ack=203 Win=29440 Len=1400 [TCP segment of a reassembled PDU]"
"96","09:52:53,185611","192.168.43.171","213.180.204.125","TCP","54","58703  >  443 [ACK] Seq=203 Ack=2801 Win=65792 Len=0"
"97","09:52:53,211563","213.180.204.125","192.168.43.171","TCP","1454","443  >  58703 [ACK] Seq=2801 Ack=203 Win=29440 Len=1400 [TCP segment of a reassembled PDU]"
"98","09:52:53,226072","213.180.204.125","192.168.43.171","TLSv1.2","1454","Certificate [TCP segment of a reassembled PDU]"
"99","09:52:53,226132","192.168.43.171","213.180.204.125","TCP","54","58703  >  443 [ACK] Seq=203 Ack=5601 Win=65792 Len=0"
"100","09:52:53,233575","213.180.204.125","192.168.43.171","TLSv1.2","843","Certificate Status, Server Key Exchange, Server Hello Done"
"101","09:52:53,239881","192.168.43.171","213.180.204.125","TLSv1.2","180","Client Key Exchange, Change Cipher Spec, Encrypted Handshake Message"
"102","09:52:53,248083","213.180.204.82","192.168.43.171","TLSv1.2","1026","Application Data"
"103","09:52:53,251351","192.168.43.171","213.180.204.125","TCP","1454","58703  >  443 [ACK] Seq=329 Ack=6390 Win=64768 Len=1400 [TCP segment of a reassembled PDU]"
"104","09:52:53,251369","192.168.43.171","213.180.204.125","TLSv1.2","331","Application Data"
"105","09:52:53,252580","213.180.204.82","192.168.43.171","TLSv1.2","328","New Session Ticket, Change Cipher Spec, Encrypted Handshake Message"
"106","09:52:53,259594","213.180.204.82","192.168.43.171","TLSv1.2","769","Application Data"
"107","09:52:53,259655","192.168.43.171","213.180.204.82","TCP","54","58701  >  443 [ACK] Seq=1973 Ack=7127 Win=65792 Len=0"
"108","09:52:53,267101","213.180.204.179","192.168.43.171","TLSv1.2","312","New Session Ticket, Change Cipher Spec, Encrypted Handshake Message"
"109","09:52:53,268581","59.106.19.206","192.168.43.171","TCP","66","80  >  58704 [SYN, ACK] Seq=0 Ack=1 Win=65535 Len=0 MSS=1400 WS=64 SACK_PERM=1"
"110","09:52:53,268659","192.168.43.171","59.106.19.206","TCP","54","58704  >  80 [ACK] Seq=1 Ack=1 Win=65792 Len=0"
"111","09:52:53,268864","192.168.43.171","59.106.19.206","HTTP","370","GET /ru/q/favicon.ico HTTP/1.1 "
"112","09:52:53,278786","192.168.43.171","213.180.204.179","TCP","1454","58702  >  443 [ACK] Seq=311 Ack=6609 Win=64768 Len=1400 [TCP segment of a reassembled PDU]"
"113","09:52:53,278801","192.168.43.171","213.180.204.179","TLSv1.2","575","Application Data"
"114","09:52:53,279617","192.168.43.171","213.180.204.82","TCP","54","58700  >  443 [ACK] Seq=1993 Ack=7384 Win=65792 Len=0"
"115","09:52:53,317133","213.180.204.125","192.168.43.171","TCP","54","443  >  58703 [ACK] Seq=6390 Ack=2006 Win=32768 Len=0"
"116","09:52:53,324641","213.180.204.125","192.168.43.171","TLSv1.2","312","New Session Ticket, Change Cipher Spec, Encrypted Handshake Message"
"117","09:52:53,334640","213.180.204.125","192.168.43.171","TLSv1.2","1160","Application Data"
"118","09:52:53,334699","192.168.43.171","213.180.204.125","TCP","54","58703  >  443 [ACK] Seq=2006 Ack=7754 Win=65792 Len=0"
"119","09:52:53,349220","213.180.204.179","192.168.43.171","TCP","54","443  >  58702 [ACK] Seq=6609 Ack=2232 Win=35072 Len=0"
"120","09:52:53,355160","213.180.204.179","192.168.43.171","TLSv1.2","343","Application Data"
"121","09:52:53,367664","213.180.204.179","192.168.43.171","TLSv1.2","135","Application Data"
"122","09:52:53,367719","192.168.43.171","213.180.204.179","TCP","54","58702  >  443 [ACK] Seq=2232 Ack=6979 Win=64256 Len=0"
"123","09:52:53,414699","59.106.19.206","192.168.43.171","TCP","66","80  >  58706 [SYN, ACK] Seq=0 Ack=1 Win=65535 Len=0 MSS=1400 WS=64 SACK_PERM=1"
"124","09:52:53,414788","192.168.43.171","59.106.19.206","TCP","54","58706  >  80 [ACK] Seq=1 Ack=1 Win=65792 Len=0"
"125","09:52:53,475804","192.168.43.171","87.250.250.82","TCP","66","58707  >  443 [SYN] Seq=0 Win=8192 Len=0 MSS=1460 WS=256 SACK_PERM=1"
"126","09:52:53,482552","192.168.43.171","192.168.43.1","DNS","75","Standard query 0xeeec A radio.yandex.ru"
"127","09:52:53,510180","192.168.43.1","192.168.43.171","DNS","312","Standard query response 0xeeec A radio.yandex.ru A 77.88.21.186 NS ns9.z5h64q92x9.net NS ns1.yandex.ru NS ns2.yandex.ru A 213.180.193.1 AAAA 2a02:6b8::1 A 195.156.199.201 AAAA 2a05:d014:484:fd80:ffff:ffff:0:1 A 93.158.134.1 AAAA 2a02:6b8:0:1::1"
"128","09:52:53,510936","192.168.43.171","77.88.21.186","TCP","66","58708  >  443 [SYN] Seq=0 Win=8192 Len=0 MSS=1460 WS=256 SACK_PERM=1"
"129","09:52:53,525270","87.250.250.82","192.168.43.171","TCP","66","443  >  58707 [SYN, ACK] Seq=0 Ack=1 Win=42300 Len=0 MSS=1400 SACK_PERM=1 WS=4096"
"130","09:52:53,525365","192.168.43.171","87.250.250.82","TCP","54","58707  >  443 [ACK] Seq=1 Ack=1 Win=65792 Len=0"
"131","09:52:53,525743","192.168.43.171","87.250.250.82","TLSv1.2","260","Client Hello"
"132","09:52:53,555805","59.106.19.206","192.168.43.171","TCP","54","[TCP Window Update] 80  >  58704 [ACK] Seq=1 Ack=1 Win=131584 Len=0"
"133","09:52:53,558837","77.88.21.186","192.168.43.171","TCP","66","443  >  58708 [SYN, ACK] Seq=0 Ack=1 Win=28200 Len=0 MSS=1400 SACK_PERM=1 WS=256"
"134","09:52:53,558959","192.168.43.171","77.88.21.186","TCP","54","58708  >  443 [ACK] Seq=1 Ack=1 Win=65792 Len=0"
"135","09:52:53,559368","192.168.43.171","77.88.21.186","TLSv1.2","257","Client Hello"
"136","09:52:53,588969","87.250.250.82","192.168.43.171","TCP","54","443  >  58707 [ACK] Seq=1 Ack=207 Win=45056 Len=0"
"137","09:52:53,604830","87.250.250.82","192.168.43.171","TLSv1.2","1454","Server Hello"
"138","09:52:53,624834","192.168.43.171","87.250.250.82","TCP","54","58707  >  443 [ACK] Seq=207 Ack=1401 Win=65792 Len=0"
"139","09:52:53,631341","87.250.250.82","192.168.43.171","TCP","1454","443  >  58707 [ACK] Seq=1401 Ack=207 Win=45056 Len=1400 [TCP segment of a reassembled PDU]"
"140","09:52:53,651349","192.168.43.171","87.250.250.82","TCP","54","58707  >  443 [ACK] Seq=207 Ack=2801 Win=65792 Len=0"
"141","09:52:53,668403","87.250.250.82","192.168.43.171","TCP","1454","443  >  58707 [ACK] Seq=2801 Ack=207 Win=45056 Len=1400 [TCP segment of a reassembled PDU]"
"142","09:52:53,684390","87.250.250.82","192.168.43.171","TLSv1.2","1454","Certificate [TCP segment of a reassembled PDU]"
"143","09:52:53,684461","192.168.43.171","87.250.250.82","TCP","54","58707  >  443 [ACK] Seq=207 Ack=5601 Win=65792 Len=0"
"144","09:52:53,699931","87.250.250.82","192.168.43.171","TLSv1.2","591","Certificate Status, Server Key Exchange, Server Hello Done"
"145","09:52:53,706562","192.168.43.171","87.250.250.82","TLSv1.2","180","Client Key Exchange, Change Cipher Spec, Encrypted Handshake Message"
"146","09:52:53,731758","192.168.43.171","87.250.250.82","TLSv1.2","485","Application Data"
"147","09:52:53,740497","77.88.21.186","192.168.43.171","TCP","54","443  >  58708 [ACK] Seq=1 Ack=204 Win=29440 Len=0"
"148","09:52:53,755421","77.88.21.186","192.168.43.171","TLSv1.2","1454","Server Hello"
"149","09:52:53,767965","77.88.21.186","192.168.43.171","TCP","1454","443  >  58708 [ACK] Seq=1401 Ack=204 Win=29440 Len=1400 [TCP segment of a reassembled PDU]"
"150","09:52:53,768045","192.168.43.171","77.88.21.186","TCP","54","58708  >  443 [ACK] Seq=204 Ack=2801 Win=65792 Len=0"
"151","09:52:53,806508","77.88.21.186","192.168.43.171","TLSv1.2","1454","Certificate [TCP segment of a reassembled PDU]"
"152","09:52:53,816969","77.88.21.186","192.168.43.171","TLSv1.2","331","Server Key Exchange, Server Hello Done"
"153","09:52:53,817028","192.168.43.171","77.88.21.186","TCP","54","58708  >  443 [ACK] Seq=204 Ack=4478 Win=65792 Len=0"
"154","09:52:53,819955","59.106.19.206","192.168.43.171","TCP","54","80  >  58704 [ACK] Seq=1 Ack=317 Win=131584 Len=0"
"155","09:52:53,824882","192.168.43.171","77.88.21.186","TLSv1.2","180","Client Key Exchange, Change Cipher Spec, Encrypted Handshake Message"
"156","09:52:53,832478","59.106.19.206","192.168.43.171","TCP","1454","80  >  58704 [ACK] Seq=1 Ack=317 Win=131584 Len=1400 [TCP segment of a reassembled PDU]"
"157","09:52:53,835174","192.168.43.171","77.88.21.186","TCP","1454","58708  >  443 [ACK] Seq=330 Ack=4478 Win=65792 Len=1400 [TCP segment of a reassembled PDU]"
"158","09:52:53,835191","192.168.43.171","77.88.21.186","TLSv1.2","377","Application Data"
"159","09:52:53,844986","59.106.19.206","192.168.43.171","TCP","1454","80  >  58704 [ACK] Seq=1401 Ack=317 Win=131584 Len=1400 [TCP segment of a reassembled PDU]"
"160","09:52:53,845045","192.168.43.171","59.106.19.206","TCP","54","58704  >  80 [ACK] Seq=317 Ack=2801 Win=65792 Len=0"
"161","09:52:53,932254","59.106.19.206","192.168.43.171","TCP","1454","80  >  58704 [ACK] Seq=2801 Ack=317 Win=131584 Len=1400 [TCP segment of a reassembled PDU]"
"162","09:52:53,934045","59.106.19.206","192.168.43.171","HTTP","134","HTTP/1.1 404 Not Found  (text/html)"
"163","09:52:53,934103","192.168.43.171","59.106.19.206","TCP","54","58704  >  80 [ACK] Seq=317 Ack=4281 Win=65792 Len=0"
"164","09:52:53,935036","59.106.19.206","192.168.43.171","TCP","54","[TCP Window Update] 80  >  58706 [ACK] Seq=1 Ack=1 Win=131584 Len=0"
"165","09:52:53,955060","77.88.21.186","192.168.43.171","TCP","331","[TCP Spurious Retransmission] 443  >  58708 [PSH, ACK] Seq=4201 Ack=204 Win=29440 Len=277[Reassembly error, protocol TCP: New fragment overlaps old data (retransmission?)]"
"166","09:52:53,955111","192.168.43.171","77.88.21.186","TCP","66","[TCP Dup ACK 153#1] 58708  >  443 [ACK] Seq=2053 Ack=4478 Win=65792 Len=0 SLE=4201 SRE=4478"
"167","09:52:53,957171","87.250.250.82","192.168.43.171","TCP","54","443  >  58707 [ACK] Seq=6138 Ack=764 Win=45056 Len=0"
"168","09:52:53,961561","87.250.250.82","192.168.43.171","TLSv1.2","328","New Session Ticket, Change Cipher Spec, Encrypted Handshake Message"
"169","09:52:53,975155","87.250.250.82","192.168.43.171","TLSv1.2","492","Application Data"
"170","09:52:53,975394","192.168.43.171","87.250.250.82","TCP","54","58707  >  443 [ACK] Seq=764 Ack=6850 Win=64512 Len=0"
"171","09:52:54,002203","77.88.21.186","192.168.43.171","TLSv1.2","296","New Session Ticket, Change Cipher Spec, Encrypted Handshake Message"
"172","09:52:54,027332","87.250.250.82","192.168.43.171","TLSv1.2","492","[TCP Spurious Retransmission] , Application Data"
"173","09:52:54,027386","192.168.43.171","87.250.250.82","TCP","66","[TCP Dup ACK 170#1] 58707  >  443 [ACK] Seq=764 Ack=6850 Win=64512 Len=0 SLE=6412 SRE=6850"
"174","09:52:54,032609","192.168.43.171","77.88.21.186","TCP","54","58708  >  443 [ACK] Seq=2053 Ack=4720 Win=65536 Len=0"
"175","09:52:54,043122","77.88.21.186","192.168.43.171","TCP","54","443  >  58708 [ACK] Seq=4720 Ack=2053 Win=35072 Len=0"
"176","09:52:54,247963","77.88.21.186","192.168.43.171","TLSv1.2","598","Application Data, Application Data"
"177","09:52:54,249364","77.88.21.186","192.168.43.171","TLSv1.2","88","Application Data"
"178","09:52:54,249497","192.168.43.171","77.88.21.186","TCP","54","58708  >  443 [ACK] Seq=2053 Ack=5298 Win=64768 Len=0"
"179","09:52:54,825128","192.168.43.171","178.154.131.216","TCP","66","58709  >  443 [SYN] Seq=0 Win=8192 Len=0 MSS=1460 WS=256 SACK_PERM=1"
"180","09:52:54,826725","192.168.43.171","87.250.250.41","TCP","66","58710  >  443 [SYN] Seq=0 Win=8192 Len=0 MSS=1460 WS=256 SACK_PERM=1"
"181","09:52:54,869572","178.154.131.216","192.168.43.171","TCP","66","443  >  58709 [SYN, ACK] Seq=0 Ack=1 Win=42300 Len=0 MSS=1400 SACK_PERM=1 WS=4096"
"182","09:52:54,869669","192.168.43.171","178.154.131.216","TCP","54","58709  >  443 [ACK] Seq=1 Ack=1 Win=65792 Len=0"
"183","09:52:54,870087","192.168.43.171","178.154.131.216","TLSv1.2","254","Client Hello"
"184","09:52:54,871982","87.250.250.41","192.168.43.171","TCP","66","443  >  58710 [SYN, ACK] Seq=0 Ack=1 Win=28200 Len=0 MSS=1400 SACK_PERM=1 WS=256"
"185","09:52:54,872083","192.168.43.171","87.250.250.41","TCP","54","58710  >  443 [ACK] Seq=1 Ack=1 Win=65792 Len=0"
"186","09:52:54,872526","192.168.43.171","87.250.250.41","TLSv1.2","267","Client Hello"
"187","09:52:54,928212","178.154.131.216","192.168.43.171","TCP","54","443  >  58709 [ACK] Seq=1 Ack=201 Win=45056 Len=0"
"188","09:52:54,953725","178.154.131.216","192.168.43.171","TLSv1.2","1454","Server Hello"
"189","09:52:54,967600","178.154.131.216","192.168.43.171","TCP","1454","443  >  58709 [ACK] Seq=1401 Ack=201 Win=45056 Len=1400 [TCP segment of a reassembled PDU]"
"190","09:52:54,967663","192.168.43.171","178.154.131.216","TCP","54","58709  >  443 [ACK] Seq=201 Ack=2801 Win=65792 Len=0"
"191","09:52:54,985839","178.154.131.216","192.168.43.171","TCP","1350","443  >  58709 [PSH, ACK] Seq=2801 Ack=201 Win=45056 Len=1296 [TCP segment of a reassembled PDU]"
"192","09:52:54,987922","87.250.250.41","192.168.43.171","TCP","54","443  >  58710 [ACK] Seq=1 Ack=214 Win=29440 Len=0"
"193","09:52:55,050409","192.168.43.171","178.154.131.216","TCP","54","58709  >  443 [ACK] Seq=201 Ack=4097 Win=64256 Len=0"
"194","09:52:55,062361","87.250.250.41","192.168.43.171","TLSv1.2","1454","Server Hello"
"195","09:52:55,076368","87.250.250.41","192.168.43.171","TCP","1454","443  >  58710 [ACK] Seq=1401 Ack=214 Win=29440 Len=1400 [TCP segment of a reassembled PDU]"
"196","09:52:55,076432","192.168.43.171","87.250.250.41","TCP","54","58710  >  443 [ACK] Seq=214 Ack=2801 Win=65792 Len=0"
"197","09:52:55,089375","87.250.250.41","192.168.43.171","TCP","1454","443  >  58710 [ACK] Seq=2801 Ack=214 Win=29440 Len=1400 [TCP segment of a reassembled PDU]"
"198","09:52:55,102383","87.250.250.41","192.168.43.171","TLSv1.2","1454","Certificate [TCP segment of a reassembled PDU]"
"199","09:52:55,102444","192.168.43.171","87.250.250.41","TCP","54","58710  >  443 [ACK] Seq=214 Ack=5601 Win=65792 Len=0"
"200","09:52:55,110389","87.250.250.41","192.168.43.171","TLSv1.2","272","Server Key Exchange, Server Hello Done"
"201","09:52:55,116430","192.168.43.171","87.250.250.41","TLSv1.2","180","Client Key Exchange, Change Cipher Spec, Encrypted Handshake Message"
"202","09:52:55,121404","178.154.131.216","192.168.43.171","TLSv1.2","363","Certificate, Server Key Exchange, Server Hello Done"
"203","09:52:55,124389","87.250.250.41","192.168.43.171","TCP","272","[TCP Spurious Retransmission] 443  >  58710 [PSH, ACK] Seq=5601 Ack=214 Win=29440 Len=218[Reassembly error, protocol TCP: New fragment overlaps old data (retransmission?)]"
"204","09:52:55,124434","192.168.43.171","87.250.250.41","TCP","66","[TCP Dup ACK 201#1] 58710  >  443 [ACK] Seq=340 Ack=5819 Win=65536 Len=0 SLE=5601 SRE=5819"
"205","09:52:55,126176","192.168.43.171","178.154.131.216","TLSv1.2","139","Client Key Exchange, Change Cipher Spec, Encrypted Handshake Message"
"206","09:52:55,126941","192.168.43.171","87.250.250.41","TCP","1454","58710  >  443 [ACK] Seq=340 Ack=5819 Win=65536 Len=1400 [TCP segment of a reassembled PDU]"
"207","09:52:55,126956","192.168.43.171","87.250.250.41","TCP","1454","58710  >  443 [ACK] Seq=1740 Ack=5819 Win=65536 Len=1400 [TCP segment of a reassembled PDU]"
"208","09:52:55,126962","192.168.43.171","87.250.250.41","TLSv1.2","1238","Application Data"
"209","09:52:55,127105","192.168.43.171","87.250.250.41","TLSv1.2","96","Application Data"
"210","09:52:55,133154","192.168.43.171","178.154.131.216","TLSv1.2","477","Application Data"
"211","09:52:55,143709","178.154.131.216","192.168.43.171","TCP","363","[TCP Spurious Retransmission] 443  >  58709 [PSH, ACK] Seq=4097 Ack=201 Win=45056 Len=309[Reassembly error, protocol TCP: New fragment overlaps old data (retransmission?)]"
"212","09:52:55,143762","192.168.43.171","178.154.131.216","TCP","66","[TCP Dup ACK 205#1] 58709  >  443 [ACK] Seq=709 Ack=4406 Win=65792 Len=0 SLE=4097 SRE=4406"
"213","09:52:55,207702","178.154.131.216","192.168.43.171","TLSv1.2","304","New Session Ticket, Change Cipher Spec, Encrypted Handshake Message"
"214","09:52:55,212392","178.154.131.216","192.168.43.171","TCP","1454","443  >  58709 [ACK] Seq=4656 Ack=709 Win=45056 Len=1400 [TCP segment of a reassembled PDU]"
"215","09:52:55,212461","192.168.43.171","178.154.131.216","TCP","54","58709  >  443 [ACK] Seq=709 Ack=6056 Win=65792 Len=0"
"216","09:52:55,224755","178.154.131.216","192.168.43.171","TCP","1454","443  >  58709 [ACK] Seq=6056 Ack=709 Win=45056 Len=1400 [TCP segment of a reassembled PDU]"
"217","09:52:55,237827","178.154.131.216","192.168.43.171","TCP","1454","443  >  58709 [ACK] Seq=7456 Ack=709 Win=45056 Len=1400 [TCP segment of a reassembled PDU]"
"218","09:52:55,237899","192.168.43.171","178.154.131.216","TCP","54","58709  >  443 [ACK] Seq=709 Ack=8856 Win=65792 Len=0"
"219","09:52:55,255887","178.154.131.216","192.168.43.171","TCP","1454","443  >  58709 [ACK] Seq=8856 Ack=709 Win=45056 Len=1400 [TCP segment of a reassembled PDU]"
"220","09:52:55,260483","fe80::d5d4:e1d6:8319:3e4","ff02::1:2","DHCPv6","146","Solicit XID: 0x2ad5c5 CID: 000100011f6b088550b7c3696b35 "
"221","09:52:55,271774","178.154.131.216","192.168.43.171","TCP","1454","443  >  58709 [ACK] Seq=10256 Ack=709 Win=45056 Len=1400 [TCP segment of a reassembled PDU]"
"222","09:52:55,271844","192.168.43.171","178.154.131.216","TCP","54","58709  >  443 [ACK] Seq=709 Ack=11656 Win=65792 Len=0"
"223","09:52:55,277276","178.154.131.216","192.168.43.171","TCP","1454","443  >  58709 [ACK] Seq=11656 Ack=709 Win=45056 Len=1400 [TCP segment of a reassembled PDU]"
"224","09:52:55,293516","178.154.131.216","192.168.43.171","TCP","1454","443  >  58709 [ACK] Seq=13056 Ack=709 Win=45056 Len=1400 [TCP segment of a reassembled PDU]"
"225","09:52:55,293578","192.168.43.171","178.154.131.216","TCP","54","58709  >  443 [ACK] Seq=709 Ack=14456 Win=65792 Len=0"
"226","09:52:55,307313","178.154.131.216","192.168.43.171","TCP","1454","443  >  58709 [ACK] Seq=14456 Ack=709 Win=45056 Len=1400 [TCP segment of a reassembled PDU]"
"227","09:52:55,338540","178.154.131.216","192.168.43.171","TCP","1454","443  >  58709 [ACK] Seq=15856 Ack=709 Win=45056 Len=1400 [TCP segment of a reassembled PDU]"
"228","09:52:55,338614","192.168.43.171","178.154.131.216","TCP","54","58709  >  443 [ACK] Seq=709 Ack=17256 Win=65792 Len=0"
"229","09:52:55,385440","178.154.131.216","192.168.43.171","TCP","1454","443  >  58709 [ACK] Seq=17256 Ack=709 Win=45056 Len=1400 [TCP segment of a reassembled PDU]"
"230","09:52:55,385442","178.154.131.216","192.168.43.171","TCP","1454","443  >  58709 [ACK] Seq=18656 Ack=709 Win=45056 Len=1400 [TCP segment of a reassembled PDU]"
"231","09:52:55,385522","192.168.43.171","178.154.131.216","TCP","54","58709  >  443 [ACK] Seq=709 Ack=20056 Win=65792 Len=0"
"232","09:52:55,397161","178.154.131.216","192.168.43.171","TLSv1.2","1454","Application Data [TCP segment of a reassembled PDU]"
"233","09:52:55,397561","178.154.131.216","192.168.43.171","TCP","1454","443  >  58709 [ACK] Seq=21456 Ack=709 Win=45056 Len=1400 [TCP segment of a reassembled PDU]"
"234","09:52:55,397604","192.168.43.171","178.154.131.216","TCP","54","58709  >  443 [ACK] Seq=709 Ack=22856 Win=65792 Len=0"
"235","09:52:55,404689","178.154.131.216","192.168.43.171","TCP","1454","443  >  58709 [ACK] Seq=22856 Ack=709 Win=45056 Len=1400 [TCP segment of a reassembled PDU]"
"236","09:52:55,416655","87.250.250.41","192.168.43.171","TLSv1.2","312","New Session Ticket, Change Cipher Spec, Encrypted Handshake Message"
"237","09:52:55,432309","87.250.250.41","192.168.43.171","TCP","54","443  >  58710 [ACK] Seq=6077 Ack=3140 Win=35072 Len=0"
"238","09:52:55,439255","87.250.250.41","192.168.43.171","TCP","54","443  >  58710 [ACK] Seq=6077 Ack=4366 Win=37888 Len=0"
"239","09:52:55,439256","87.250.250.41","192.168.43.171","TLSv1.2","786","Application Data, Application Data"
"240","09:52:55,439259","178.154.131.216","192.168.43.171","TCP","1454","443  >  58709 [ACK] Seq=24256 Ack=709 Win=45056 Len=1400 [TCP segment of a reassembled PDU]"
"241","09:52:55,439346","192.168.43.171","87.250.250.41","TCP","54","58710  >  443 [ACK] Seq=4366 Ack=6809 Win=64512 Len=0"
"242","09:52:55,439441","192.168.43.171","178.154.131.216","TCP","54","58709  >  443 [ACK] Seq=709 Ack=25656 Win=65792 Len=0"
"243","09:52:55,439602","178.154.131.216","192.168.43.171","TCP","1454","443  >  58709 [ACK] Seq=25656 Ack=709 Win=45056 Len=1400 [TCP segment of a reassembled PDU]"
"244","09:52:55,446122","178.154.131.216","192.168.43.171","TCP","1454","443  >  58709 [ACK] Seq=27056 Ack=709 Win=45056 Len=1400 [TCP segment of a reassembled PDU]"
"245","09:52:55,446206","192.168.43.171","178.154.131.216","TCP","54","58709  >  443 [ACK] Seq=709 Ack=28456 Win=65792 Len=0"
"246","09:52:55,454267","178.154.131.216","192.168.43.171","TCP","1454","443  >  58709 [ACK] Seq=28456 Ack=709 Win=45056 Len=1400 [TCP segment of a reassembled PDU]"
"247","09:52:55,463288","178.154.131.216","192.168.43.171","TCP","1454","443  >  58709 [ACK] Seq=29856 Ack=709 Win=45056 Len=1400 [TCP segment of a reassembled PDU]"
"248","09:52:55,463348","192.168.43.171","178.154.131.216","TCP","54","58709  >  443 [ACK] Seq=709 Ack=31256 Win=65792 Len=0"
"249","09:52:55,469285","178.154.131.216","192.168.43.171","TCP","1454","443  >  58709 [ACK] Seq=31256 Ack=709 Win=45056 Len=1400 [TCP segment of a reassembled PDU]"
"250","09:52:55,475638","178.154.131.216","192.168.43.171","TCP","1454","443  >  58709 [ACK] Seq=32656 Ack=709 Win=45056 Len=1400 [TCP segment of a reassembled PDU]"
"251","09:52:55,475706","192.168.43.171","178.154.131.216","TCP","54","58709  >  443 [ACK] Seq=709 Ack=34056 Win=65792 Len=0"
"252","09:52:55,482175","178.154.131.216","192.168.43.171","TCP","1454","443  >  58709 [ACK] Seq=34056 Ack=709 Win=45056 Len=1400 [TCP segment of a reassembled PDU]"
"253","09:52:55,499628","178.154.131.216","192.168.43.171","TCP","1454","443  >  58709 [ACK] Seq=35456 Ack=709 Win=45056 Len=1400 [TCP segment of a reassembled PDU]"
"254","09:52:55,499686","192.168.43.171","178.154.131.216","TCP","54","58709  >  443 [ACK] Seq=709 Ack=36856 Win=65792 Len=0"
"255","09:52:55,506591","178.154.131.216","192.168.43.171","TLSv1.2","1454","Application Data [TCP segment of a reassembled PDU]"
"256","09:52:55,512756","178.154.131.216","192.168.43.171","TCP","1454","443  >  58709 [ACK] Seq=38256 Ack=709 Win=45056 Len=1400 [TCP segment of a reassembled PDU]"
"257","09:52:55,512813","192.168.43.171","178.154.131.216","TCP","54","58709  >  443 [ACK] Seq=709 Ack=39656 Win=65792 Len=0"
"258","09:52:55,521453","178.154.131.216","192.168.43.171","TCP","1454","443  >  58709 [ACK] Seq=39656 Ack=709 Win=45056 Len=1400 [TCP segment of a reassembled PDU]"
"259","09:52:55,529329","87.250.250.41","192.168.43.171","TLSv1.2","786","[TCP Spurious Retransmission] , Application Data, Application Data"
"260","09:52:55,529371","192.168.43.171","87.250.250.41","TCP","66","[TCP Dup ACK 241#1] 58710  >  443 [ACK] Seq=4366 Ack=6809 Win=64512 Len=0 SLE=6077 SRE=6809"
"261","09:52:55,535883","178.154.131.216","192.168.43.171","TCP","1454","443  >  58709 [ACK] Seq=41056 Ack=709 Win=45056 Len=1400 [TCP segment of a reassembled PDU]"
"262","09:52:55,535951","192.168.43.171","178.154.131.216","TCP","54","58709  >  443 [ACK] Seq=709 Ack=42456 Win=65792 Len=0"
"263","09:52:55,543286","178.154.131.216","192.168.43.171","TCP","1454","443  >  58709 [ACK] Seq=42456 Ack=709 Win=45056 Len=1400 [TCP segment of a reassembled PDU]"
"264","09:52:55,549899","178.154.131.216","192.168.43.171","TCP","1454","443  >  58709 [ACK] Seq=43856 Ack=709 Win=45056 Len=1400 [TCP segment of a reassembled PDU]"
"265","09:52:55,549959","192.168.43.171","178.154.131.216","TCP","54","58709  >  443 [ACK] Seq=709 Ack=45256 Win=65792 Len=0"
"266","09:52:55,556198","178.154.131.216","192.168.43.171","TCP","1454","443  >  58709 [ACK] Seq=45256 Ack=709 Win=45056 Len=1400 [TCP segment of a reassembled PDU]"
"267","09:52:55,612811","178.154.131.216","192.168.43.171","TCP","1454","443  >  58709 [ACK] Seq=46656 Ack=709 Win=45056 Len=1400 [TCP segment of a reassembled PDU]"
"268","09:52:55,612813","178.154.131.216","192.168.43.171","TCP","1454","443  >  58709 [ACK] Seq=48056 Ack=709 Win=45056 Len=1400 [TCP segment of a reassembled PDU]"
"269","09:52:55,612879","192.168.43.171","178.154.131.216","TCP","54","58709  >  443 [ACK] Seq=709 Ack=49456 Win=65792 Len=0"
"270","09:52:55,615523","178.154.131.216","192.168.43.171","TCP","1454","443  >  58709 [ACK] Seq=49456 Ack=709 Win=45056 Len=1400 [TCP segment of a reassembled PDU]"
"271","09:52:55,615526","178.154.131.216","192.168.43.171","TCP","1454","443  >  58709 [ACK] Seq=50856 Ack=709 Win=45056 Len=1400 [TCP segment of a reassembled PDU]"
"272","09:52:55,615528","178.154.131.216","192.168.43.171","TCP","1454","443  >  58709 [ACK] Seq=52256 Ack=709 Win=45056 Len=1400 [TCP segment of a reassembled PDU]"
"273","09:52:55,615529","178.154.131.216","192.168.43.171","TLSv1.2","1454","Application Data [TCP segment of a reassembled PDU]"
"274","09:52:55,615601","192.168.43.171","178.154.131.216","TCP","54","58709  >  443 [ACK] Seq=709 Ack=55056 Win=65792 Len=0"
"275","09:52:55,617480","178.154.131.216","192.168.43.171","TCP","1454","443  >  58709 [ACK] Seq=55056 Ack=709 Win=45056 Len=1400 [TCP segment of a reassembled PDU]"
"276","09:52:55,617543","192.168.43.171","178.154.131.216","TCP","54","58709  >  443 [ACK] Seq=709 Ack=56456 Win=65792 Len=0"
"277","09:52:55,620282","178.154.131.216","192.168.43.171","TCP","1454","443  >  58709 [ACK] Seq=56456 Ack=709 Win=45056 Len=1400 [TCP segment of a reassembled PDU]"
"278","09:52:55,630761","178.154.131.216","192.168.43.171","TCP","1454","443  >  58709 [ACK] Seq=57856 Ack=709 Win=45056 Len=1400 [TCP segment of a reassembled PDU]"
"279","09:52:55,630975","192.168.43.171","178.154.131.216","TCP","54","58709  >  443 [ACK] Seq=709 Ack=59256 Win=65792 Len=0"
"280","09:52:55,634595","178.154.131.216","192.168.43.171","TCP","1454","443  >  58709 [ACK] Seq=59256 Ack=709 Win=45056 Len=1400 [TCP segment of a reassembled PDU]"
"281","09:52:55,637579","178.154.131.216","192.168.43.171","TCP","1454","443  >  58709 [ACK] Seq=60656 Ack=709 Win=45056 Len=1400 [TCP segment of a reassembled PDU]"
"282","09:52:55,637705","192.168.43.171","178.154.131.216","TCP","54","58709  >  443 [ACK] Seq=709 Ack=62056 Win=65792 Len=0"
"283","09:52:55,648611","178.154.131.216","192.168.43.171","TCP","1454","443  >  58709 [ACK] Seq=62056 Ack=709 Win=45056 Len=1400 [TCP segment of a reassembled PDU]"
"284","09:52:55,650502","178.154.131.216","192.168.43.171","TCP","1454","443  >  58709 [ACK] Seq=63456 Ack=709 Win=45056 Len=1400 [TCP segment of a reassembled PDU]"
"285","09:52:55,650562","192.168.43.171","178.154.131.216","TCP","54","58709  >  443 [ACK] Seq=709 Ack=64856 Win=65792 Len=0"
"286","09:52:55,652519","178.154.131.216","192.168.43.171","TCP","1454","443  >  58709 [ACK] Seq=64856 Ack=709 Win=45056 Len=1400 [TCP segment of a reassembled PDU]"
