"No.","Time","Source","Destination","Protocol","Length","Info"
"1","0.000000000","173.194.221.189","192.168.1.34","QUIC","113","Payload (Encrypted), PKN: 52"
"2","0.000020845","192.168.1.34","173.194.221.189","ICMP","141","Destination unreachable (Port unreachable)"
"3","0.177542149","192.168.1.34","192.168.1.1","DNS","112","Standard query 0x95e0 A prd.col.aria.browser.skypedata.akadns.net OPT"
"4","2.088353063","fe80::e947:4933:d8f3:d302","ff02::fb","MDNS","102","Standard query 0x0000 PTR _pgpkey-hkp._tcp.local, ""QM"" question"
"5","2.088388916","192.168.1.34","224.0.0.251","MDNS","82","Standard query 0x0000 PTR _pgpkey-hkp._tcp.local, ""QM"" question"
"6","2.101171902","192.168.1.34","192.168.1.1","DNS","87","Standard query 0xdd81 A api.snapcraft.io OPT"
"7","2.101539422","192.168.1.34","192.168.1.1","DNS","87","Standard query 0xa12c AAAA api.snapcraft.io OPT"
"8","3.060174276","192.168.1.34","192.168.1.1","DNS","95","Standard query 0xbe48 A detectportal.firefox.com OPT"
"9","3.060463637","192.168.1.34","192.168.1.1","DNS","95","Standard query 0x80d7 AAAA detectportal.firefox.com OPT"
"10","3.089600663","fe80::e947:4933:d8f3:d302","ff02::fb","MDNS","102","Standard query 0x0000 PTR _pgpkey-hkp._tcp.local, ""QM"" question"
"11","3.089636503","192.168.1.34","224.0.0.251","MDNS","82","Standard query 0x0000 PTR _pgpkey-hkp._tcp.local, ""QM"" question"
"12","3.189713418","13.81.211.255","192.168.1.34","TCP","54","443  >  48332 [RST, ACK] Seq=1 Ack=1 Win=0 Len=0"
"13","3.427489041","192.168.1.34","192.168.1.1","DNS","112","Standard query 0x95e0 A prd.col.aria.browser.skypedata.akadns.net OPT"
"14","3.455745236","192.168.1.1","192.168.1.34","DNS","212","Standard query response 0x95e0 A prd.col.aria.browser.skypedata.akadns.net CNAME pipe.skype.com CNAME pipe.prd.skypedata.akadns.net CNAME pipe.cloudapp.aria.akadns.net A 52.114.74.43 OPT"
"15","3.456822134","192.168.1.34","52.114.74.43","TCP","74","52160  >  443 [SYN] Seq=0 Win=29200 Len=0 MSS=1460 SACK_PERM=1 TSval=3953859213 TSecr=0 WS=128"
"16","3.592180199","192.168.1.34","52.114.74.43","TCP","74","52162  >  443 [SYN] Seq=0 Win=29200 Len=0 MSS=1460 SACK_PERM=1 TSval=3953859348 TSecr=0 WS=128"
"17","3.674461707","52.114.74.43","192.168.1.34","TCP","74","443  >  52162 [SYN, ACK] Seq=0 Ack=1 Win=8192 Len=0 MSS=1440 WS=256 SACK_PERM=1 TSval=148281713 TSecr=3953859348"
"18","3.674508531","192.168.1.34","52.114.74.43","TCP","66","52162  >  443 [ACK] Seq=1 Ack=1 Win=29312 Len=0 TSval=3953859430 TSecr=148281713"
"19","3.674637310","192.168.1.34","52.114.74.43","TLSv1.2","317","Client Hello"
"20","3.773828168","192.168.1.34","192.168.1.1","DNS","97","Standard query 0x9280 A tiles.services.mozilla.com OPT"
"21","3.774211897","192.168.1.34","192.168.1.1","DNS","97","Standard query 0x0d5b AAAA tiles.services.mozilla.com OPT"
"22","4.025553679","192.168.1.34","52.114.74.43","TCP","317","[TCP Retransmission] 52162  >  443 [PSH, ACK] Seq=1 Ack=1 Win=29312 Len=251 TSval=3953859781 TSecr=148281713"
"23","4.084481987","52.114.74.43","192.168.1.34","TCP","1514","443  >  52162 [ACK] Seq=1 Ack=252 Win=131584 Len=1448 TSval=148281751 TSecr=3953859430 [TCP segment of a reassembled PDU]"
"24","4.084501993","192.168.1.34","52.114.74.43","TCP","66","52162  >  443 [ACK] Seq=252 Ack=1449 Win=32128 Len=0 TSval=3953859840 TSecr=148281751"
"25","4.086365726","52.114.74.43","192.168.1.34","TCP","78","[TCP Dup ACK 23#1] 443  >  52162 [ACK] Seq=1449 Ack=252 Win=131584 Len=0 TSval=148281756 TSecr=3953859430 SLE=1 SRE=252"
"26","4.135119124","52.114.74.43","192.168.1.34","TCP","1514","443  >  52162 [ACK] Seq=1449 Ack=252 Win=131584 Len=1448 TSval=148281761 TSecr=3953859840 [TCP segment of a reassembled PDU]"
"27","4.135133892","192.168.1.34","52.114.74.43","TCP","66","52162  >  443 [ACK] Seq=252 Ack=2897 Win=35072 Len=0 TSval=3953859891 TSecr=148281761"
"28","4.170083571","52.114.74.43","192.168.1.34","TCP","1514","443  >  52162 [ACK] Seq=2897 Ack=252 Win=131584 Len=1448 TSval=148281761 TSecr=3953859840 [TCP segment of a reassembled PDU]"
"29","4.170099038","192.168.1.34","52.114.74.43","TCP","66","52162  >  443 [ACK] Seq=252 Ack=4345 Win=37888 Len=0 TSval=3953859926 TSecr=148281761"
"30","4.184227145","52.114.74.43","192.168.1.34","TLSv1.2","1271","Server Hello, Certificate, Certificate Status, Server Key Exchange, Server Hello Done"
"31","4.184246044","192.168.1.34","52.114.74.43","TCP","66","52162  >  443 [ACK] Seq=252 Ack=5550 Win=40832 Len=0 TSval=3953859940 TSecr=148281766"
"32","4.186641758","192.168.1.34","52.114.74.43","TLSv1.2","248","Client Key Exchange, Change Cipher Spec, Encrypted Handshake Message"
"33","4.199514836","192.168.1.34","192.168.1.1","DNS","95","Standard query 0x2fc7 A snippets.cdn.mozilla.net OPT"
"34","4.199806245","192.168.1.34","192.168.1.1","DNS","95","Standard query 0xb5db AAAA snippets.cdn.mozilla.net OPT"
"35","4.236523042","52.114.74.43","192.168.1.34","TLSv1.2","141","Change Cipher Spec, Encrypted Handshake Message"
"36","4.236957589","192.168.1.34","52.114.74.43","TLSv1.2","967","Application Data"
"37","4.237004785","192.168.1.34","52.114.74.43","TCP","1494","52162  >  443 [ACK] Seq=1335 Ack=5625 Win=40832 Len=1428 TSval=3953859993 TSecr=148281771 [TCP segment of a reassembled PDU]"
"38","4.237007979","192.168.1.34","52.114.74.43","TCP","1494","52162  >  443 [ACK] Seq=2763 Ack=5625 Win=40832 Len=1428 TSval=3953859993 TSecr=148281771 [TCP segment of a reassembled PDU]"
"39","4.244058992","192.168.1.34","52.114.74.43","TCP","1494","52162  >  443 [ACK] Seq=4191 Ack=5625 Win=40832 Len=1428 TSval=3953860000 TSecr=148281771 [TCP segment of a reassembled PDU]"
"40","4.244068739","192.168.1.34","52.114.74.43","TLSv1.2","539","Application Data"
"41","4.342855513","52.114.74.43","192.168.1.34","TCP","66","443  >  52162 [ACK] Seq=5625 Ack=1335 Win=130560 Len=0 TSval=148281781 TSecr=3953859993"
"42","4.363477709","52.114.74.43","192.168.1.34","TCP","66","443  >  52162 [ACK] Seq=5625 Ack=4191 Win=131584 Len=0 TSval=148281784 TSecr=3953859993"
"43","4.378434996","52.114.74.43","192.168.1.34","TCP","66","443  >  52162 [ACK] Seq=5625 Ack=6092 Win=131584 Len=0 TSval=148281785 TSecr=3953860000"
"44","4.395126422","52.114.74.43","192.168.1.34","TLSv1.2","519","Application Data"
"45","4.445562281","192.168.1.34","52.114.74.43","TCP","66","52162  >  443 [ACK] Seq=6092 Ack=6078 Win=43776 Len=0 TSval=3953860151 TSecr=148281785"
"46","4.473569155","192.168.1.34","52.114.74.43","TCP","74","[TCP Retransmission] 52160  >  443 [SYN] Seq=0 Win=29200 Len=0 MSS=1460 SACK_PERM=1 TSval=3953860230 TSecr=0 WS=128"
"47","4.825737033","192.168.1.34","192.168.1.1","DNS","98","Standard query 0xb6a4 A safebrowsing.googleapis.com OPT"
"48","4.826675794","192.168.1.34","192.168.1.1","DNS","98","Standard query 0x1a77 AAAA safebrowsing.googleapis.com OPT"
"49","4.853887306","192.168.1.1","192.168.1.34","DNS","114","Standard query response 0xb6a4 A safebrowsing.googleapis.com A 173.194.221.95 OPT"
"50","4.859477541","192.168.1.1","192.168.1.34","DNS","126","Standard query response 0x1a77 AAAA safebrowsing.googleapis.com AAAA 2a00:1450:4010:c0a::5f OPT"
"51","4.860821285","192.168.1.34","173.194.221.95","TCP","74","46852  >  443 [SYN] Seq=0 Win=29200 Len=0 MSS=1460 SACK_PERM=1 TSval=4127644383 TSecr=0 WS=128"
"52","4.876400187","173.194.221.95","192.168.1.34","TCP","74","443  >  46852 [SYN, ACK] Seq=0 Ack=1 Win=42408 Len=0 MSS=1380 SACK_PERM=1 TSval=3770796441 TSecr=4127644383 WS=256"
"53","4.876428040","192.168.1.34","173.194.221.95","TCP","66","46852  >  443 [ACK] Seq=1 Ack=1 Win=29312 Len=0 TSval=4127644399 TSecr=3770796441"
"54","4.876978176","192.168.1.34","173.194.221.95","TLSv1.2","270","Client Hello"
"55","4.898021249","173.194.221.95","192.168.1.34","TCP","66","443  >  46852 [ACK] Seq=1 Ack=205 Win=43520 Len=0 TSval=3770796455 TSecr=4127644399"
"56","5.091926364","fe80::e947:4933:d8f3:d302","ff02::fb","MDNS","102","Standard query 0x0000 PTR _pgpkey-hkp._tcp.local, ""QM"" question"
"57","5.092009475","192.168.1.34","224.0.0.251","MDNS","82","Standard query 0x0000 PTR _pgpkey-hkp._tcp.local, ""QM"" question"
"58","5.177548690","192.168.1.34","192.168.1.1","DNS","87","Standard query 0xdd81 A api.snapcraft.io OPT"
"59","5.177697946","192.168.1.34","192.168.1.1","DNS","87","Standard query 0xa12c AAAA api.snapcraft.io OPT"
"60","5.210602347","192.168.1.1","192.168.1.34","DNS","151","Standard query response 0xa12c AAAA api.snapcraft.io SOA ns1.canonical.com OPT"
"61","5.762023254","192.168.1.34","192.168.1.1","DNS","76","Standard query 0x7045 A ok.ru OPT"
"62","5.762949264","192.168.1.34","192.168.1.1","DNS","76","Standard query 0x2cc3 AAAA ok.ru OPT"
"63","5.780727353","192.168.1.1","192.168.1.34","DNS","141","Standard query response 0x2cc3 AAAA ok.ru SOA ns1.ok.ru OPT"
"64","6.178016453","192.168.1.34","192.168.1.1","DNS","95","Standard query 0xbe48 A detectportal.firefox.com OPT"
"65","6.178415124","192.168.1.34","192.168.1.1","DNS","95","Standard query 0x80d7 AAAA detectportal.firefox.com OPT"
"66","6.191335059","192.168.1.1","192.168.1.34","DNS","208","Standard query response 0xbe48 A detectportal.firefox.com CNAME detectportal.firefox.com.edgesuite.net CNAME a1089.d.akamai.net A 212.30.134.222 A 212.30.134.205 OPT"
"67","6.489567106","192.168.1.34","52.114.74.43","TCP","74","[TCP Retransmission] 52160  >  443 [SYN] Seq=0 Win=29200 Len=0 MSS=1460 SACK_PERM=1 TSval=3953862246 TSecr=0 WS=128"
"68","7.178078487","192.168.1.34","192.168.1.1","DNS","97","Standard query 0x9280 A tiles.services.mozilla.com OPT"
"69","7.178439884","192.168.1.34","192.168.1.1","DNS","97","Standard query 0x0d5b AAAA tiles.services.mozilla.com OPT"
"70","7.678028718","192.168.1.34","192.168.1.1","DNS","95","Standard query 0x2fc7 A snippets.cdn.mozilla.net OPT"
"71","7.678220504","192.168.1.34","192.168.1.1","DNS","95","Standard query 0xb5db AAAA snippets.cdn.mozilla.net OPT"
"72","7.927644401","192.168.1.34","192.168.1.1","DNS","76","Standard query 0x7045 A ok.ru OPT"
"73","7.945974064","192.168.1.1","192.168.1.34","DNS","124","Standard query response 0x7045 A ok.ru A 217.20.147.1 A 5.61.23.11 A 217.20.155.13 OPT"
"74","7.947316117","192.168.1.34","192.168.1.1","DNS","84","Standard query 0x9675 AAAA www.google.ru OPT"
"75","8.427858989","192.168.1.34","192.168.1.1","DNS","87","Standard query 0xdd81 A api.snapcraft.io OPT"
"76","8.441450141","192.168.1.1","192.168.1.34","DNS","119","Standard query response 0xdd81 A api.snapcraft.io A 91.189.92.20 A 91.189.92.19 OPT"
"77","8.442489088","192.168.1.34","91.189.92.20","TCP","74","56064  >  443 [SYN] Seq=0 Win=29200 Len=0 MSS=1460 SACK_PERM=1 TSval=1417164511 TSecr=0 WS=128"
"78","9.096673660","fe80::e947:4933:d8f3:d302","ff02::fb","MDNS","102","Standard query 0x0000 PTR _pgpkey-hkp._tcp.local, ""QM"" question"
"79","9.096763915","192.168.1.34","224.0.0.251","MDNS","82","Standard query 0x0000 PTR _pgpkey-hkp._tcp.local, ""QM"" question"
"80","9.465624549","192.168.1.34","91.189.92.20","TCP","74","[TCP Retransmission] 56064  >  443 [SYN] Seq=0 Win=29200 Len=0 MSS=1460 SACK_PERM=1 TSval=1417165534 TSecr=0 WS=128"
"81","9.520083048","91.189.92.20","192.168.1.34","TCP","74","443  >  56064 [SYN, ACK] Seq=0 Ack=1 Win=28960 Len=0 MSS=1460 SACK_PERM=1 TSval=968623051 TSecr=1417164511 WS=128"
"82","9.520140698","192.168.1.34","91.189.92.20","TCP","66","56064  >  443 [ACK] Seq=1 Ack=1 Win=29312 Len=0 TSval=1417165589 TSecr=968623051"
"83","9.522403924","192.168.1.34","91.189.92.20","TLSv1","251","Client Hello"
"84","9.536231102","91.189.92.20","192.168.1.34","TCP","74","[TCP Out-Of-Order] 443  >  56064 [SYN, ACK] Seq=0 Ack=1 Win=28960 Len=0 MSS=1460 SACK_PERM=1 TSval=968623056 TSecr=1417164511 WS=128"
"85","9.536250938","192.168.1.34","91.189.92.20","TCP","66","[TCP Dup ACK 82#1] 56064  >  443 [ACK] Seq=186 Ack=1 Win=29312 Len=0 TSval=1417165605 TSecr=968623051"
"86","10.553953992","192.168.1.34","52.114.74.43","TCP","74","[TCP Retransmission] 52160  >  443 [SYN] Seq=0 Win=29200 Len=0 MSS=1460 SACK_PERM=1 TSval=3953866312 TSecr=0 WS=128"
"87","11.429093653","192.168.1.34","192.168.1.1","DNS","89","Standard query 0xebde AAAA a1089.d.akamai.net OPT"
"88","11.430343313","192.168.1.34","192.168.1.1","DNS","84","Standard query 0x9675 AAAA www.google.ru OPT"
"89","11.512603007","192.168.1.1","192.168.1.34","DNS","150","Standard query response 0xebde AAAA a1089.d.akamai.net SOA n0d.akamai.net OPT"
"90","11.513556720","192.168.1.34","212.30.134.205","TCP","74","44494  >  80 [SYN] Seq=0 Win=29200 Len=0 MSS=1460 SACK_PERM=1 TSval=2070524678 TSecr=0 WS=128"
"91","11.514540122","192.168.1.34","192.168.1.1","DNS","89","Standard query 0x439e A studwifi.spbstu.ru OPT"
"92","11.557642989","192.168.1.1","192.168.1.34","DNS","124","Standard query response 0x439e A studwifi.spbstu.ru CNAME cndw.spbstu.ru A 194.190.225.233 OPT"
"93","11.559357273","212.30.134.205","192.168.1.34","TCP","74","80  >  44494 [SYN, ACK] Seq=0 Ack=1 Win=28960 Len=0 MSS=1460 SACK_PERM=1 TSval=1398809244 TSecr=2070524678 WS=128"
"94","11.559375638","192.168.1.34","192.168.1.1","DNS","85","Standard query 0xffbe AAAA cndw.spbstu.ru OPT"
"95","11.559394587","192.168.1.34","212.30.134.205","TCP","66","44494  >  80 [ACK] Seq=1 Ack=1 Win=29312 Len=0 TSval=2070524724 TSecr=1398809244"
"96","11.559602833","192.168.1.34","212.30.134.205","HTTP","362","GET /success.txt HTTP/1.1 "
"97","11.581682997","212.30.134.205","192.168.1.34","TCP","74","[TCP Out-Of-Order] 80  >  44494 [SYN, ACK] Seq=0 Ack=1 Win=28960 Len=0 MSS=1460 SACK_PERM=1 TSval=1398809271 TSecr=2070524678 WS=128"
"98","11.581713345","192.168.1.34","212.30.134.205","TCP","66","[TCP Dup ACK 95#1] 44494  >  80 [ACK] Seq=297 Ack=1 Win=29312 Len=0 TSval=2070524746 TSecr=1398809244"
"99","11.598571368","192.168.1.1","192.168.1.34","DNS","131","Standard query response 0xffbe AAAA cndw.spbstu.ru SOA cnd.spbstu.ru OPT"
"100","11.600301596","192.168.1.34","192.168.1.1","DNS","92","Standard query 0xb7d8 A developer.mozilla.org OPT"
"101","11.627308055","212.30.134.205","192.168.1.34","TCP","66","80  >  44494 [ACK] Seq=1 Ack=297 Win=30080 Len=0 TSval=1398809327 TSecr=2070524724"
"102","11.662143467","212.30.134.205","192.168.1.34","HTTP","450","HTTP/1.1 200 OK  (text/plain)"
"103","11.662181456","192.168.1.34","212.30.134.205","TCP","66","44494  >  80 [ACK] Seq=297 Ack=385 Win=30336 Len=0 TSval=2070524827 TSecr=1398809327"
"104","11.689443833","192.168.1.1","192.168.1.34","DNS","264","Standard query response 0xb7d8 A developer.mozilla.org CNAME mdn-prod.moz.works CNAME prod.mdn.moz.works CNAME a8583e1be9a3711e7b1e70287e8e34e8-2077023531.us-west-2.elb.amazonaws.com A 34.212.89.102 A 52.24.17.241 OPT"
"105","11.694249074","192.168.1.34","192.168.1.1","DNS","142","Standard query 0xe089 AAAA a8583e1be9a3711e7b1e70287e8e34e8-2077023531.us-west-2.elb.amazonaws.com OPT"
"106","11.833614179","192.168.1.34","91.189.92.20","TCP","251","[TCP Retransmission] 56064  >  443 [PSH, ACK] Seq=1 Ack=1 Win=29312 Len=185 TSval=1417167903 TSecr=968623051"
"107","12.105640146","192.168.1.34","91.189.92.19","TCP","74","39980  >  443 [SYN] Seq=0 Win=29200 Len=0 MSS=1460 SACK_PERM=1 TSval=1740248348 TSecr=0 WS=128"
"108","12.153567905","91.189.92.19","192.168.1.34","TCP","74","443  >  39980 [SYN, ACK] Seq=0 Ack=1 Win=28960 Len=0 MSS=1460 SACK_PERM=1 TSval=1001176629 TSecr=1740248348 WS=128"
"109","12.153624290","192.168.1.34","91.189.92.19","TCP","66","39980  >  443 [ACK] Seq=1 Ack=1 Win=29312 Len=0 TSval=1740248396 TSecr=1001176629"
"110","12.153933953","192.168.1.34","91.189.92.19","TLSv1","251","Client Hello"
"111","12.264704554","91.189.92.19","192.168.1.34","SSL","1514","[TCP Previous segment not captured] , Continuation Data"
"112","12.264722073","192.168.1.34","91.189.92.19","TCP","78","[TCP Window Update] 39980  >  443 [ACK] Seq=186 Ack=1 Win=32128 Len=0 TSval=1740248507 TSecr=1001176629 SLE=1449 SRE=2897"
"113","12.427812952","192.168.1.34","192.168.1.1","DNS","97","Standard query 0x9280 A tiles.services.mozilla.com OPT"
"114","12.428224026","192.168.1.34","192.168.1.1","DNS","97","Standard query 0x0d5b AAAA tiles.services.mozilla.com OPT"
"115","12.538265060","192.168.1.1","192.168.1.34","DNS","251","Standard query response 0x9280 A tiles.services.mozilla.com CNAME tiles.r53-2.services.mozilla.com A 35.160.98.184 A 52.40.133.43 A 52.25.175.166 A 52.34.107.172 A 35.161.241.69 A 52.39.131.77 A 35.160.58.123 A 52.32.92.108 OPT"
"116","12.546050040","192.168.1.1","192.168.1.34","DNS","205","Standard query response 0x0d5b AAAA tiles.services.mozilla.com CNAME tiles.r53-2.services.mozilla.com SOA ns-1507.awsdns-60.org OPT"
"117","12.546084502","52.114.74.43","192.168.1.34","TCP","70","443  >  52160 [SYN, ACK] Seq=0 Ack=1 Win=65535 Len=0 MSS=1440 SACK_PERM=1 TSval=148272764 TSecr=3953859213"
"118","12.546129549","192.168.1.34","52.114.74.43","TCP","66","52160  >  443 [ACK] Seq=1 Ack=1 Win=29200 Len=0 TSval=3953868305 TSecr=148272764"
"119","12.547245508","192.168.1.34","192.168.1.1","DNS","103","Standard query 0xbfeb AAAA tiles.r53-2.services.mozilla.com OPT"
"120","12.558062763","192.168.1.1","192.168.1.34","DNS","185","Standard query response 0xbfeb AAAA tiles.r53-2.services.mozilla.com SOA ns-1507.awsdns-60.org OPT"
"121","12.559206764","192.168.1.34","52.32.92.108","TCP","74","38506  >  443 [SYN] Seq=0 Win=29200 Len=0 MSS=1460 SACK_PERM=1 TSval=1110475654 TSecr=0 WS=128"
"122","12.559341302","192.168.1.34","52.32.92.108","TCP","74","38508  >  443 [SYN] Seq=0 Win=29200 Len=0 MSS=1460 SACK_PERM=1 TSval=1110475654 TSecr=0 WS=128"
"123","12.559988280","192.168.1.34","192.168.1.1","DNS","88","Standard query 0x75d7 A stackoverflow.com OPT"
"124","12.560904637","192.168.1.34","192.168.1.1","DNS","88","Standard query 0x4d46 AAAA stackoverflow.com OPT"
"125","12.609221371","91.189.92.19","192.168.1.34","TCP","1514","[TCP Retransmission] 443  >  39980 [ACK] Seq=1 Ack=186 Win=30080 Len=1448 TSval=1001176735 TSecr=1740248507"
"126","12.609267396","192.168.1.34","91.189.92.19","TCP","66","39980  >  443 [ACK] Seq=186 Ack=2897 Win=35072 Len=0 TSval=1740248852 TSecr=1001176735"
"127","12.677980133","192.168.1.34","192.168.1.1","DNS","142","Standard query 0xe089 AAAA a8583e1be9a3711e7b1e70287e8e34e8-2077023531.us-west-2.elb.amazonaws.com OPT"
"128","12.678892801","192.168.1.1","192.168.1.34","DNS","170","Standard query response 0x4d46 AAAA stackoverflow.com SOA ns-1033.awsdns-01.org OPT"
"129","12.679770870","192.168.1.34","192.168.1.1","DNS","95","Standard query 0xb5db AAAA snippets.cdn.mozilla.net OPT"
"130","12.680142526","192.168.1.34","192.168.1.1","DNS","95","Standard query 0x2fc7 A snippets.cdn.mozilla.net OPT"
"131","12.766249052","192.168.1.1","192.168.1.34","DNS","220","Standard query response 0xe089 AAAA a8583e1be9a3711e7b1e70287e8e34e8-2077023531.us-west-2.elb.amazonaws.com SOA ns-332.awsdns-41.com OPT"
"132","12.767317676","192.168.1.34","192.168.1.1","DNS","88","Standard query 0x28c8 A www.sitepoint.com OPT"
"133","12.779871248","192.168.1.1","192.168.1.34","DNS","215","Standard query response 0xb5db AAAA snippets.cdn.mozilla.net CNAME drcwo519tnci7.cloudfront.net SOA ns-377.awsdns-47.com OPT"
"134","12.780273012","192.168.1.34","192.168.1.1","DNS","99","Standard query 0x461c AAAA drcwo519tnci7.cloudfront.net OPT"
"135","12.786874441","192.168.1.1","192.168.1.34","DNS","150","Standard query response 0x2fc7 A snippets.cdn.mozilla.net CNAME drcwo519tnci7.cloudfront.net A 13.33.47.238 OPT"
"136","12.808892038","52.32.92.108","192.168.1.34","TCP","74","443  >  38506 [SYN, ACK] Seq=0 Ack=1 Win=26847 Len=0 MSS=1460 SACK_PERM=1 TSval=53558167 TSecr=1110475654 WS=256"
"137","12.808914482","192.168.1.34","52.32.92.108","TCP","66","38506  >  443 [ACK] Seq=1 Ack=1 Win=29312 Len=0 TSval=1110475904 TSecr=53558167"
"138","12.809056577","192.168.1.34","52.32.92.108","TLSv1","269","Client Hello"
"139","12.810189219","192.168.1.34","52.32.92.108","TCP","74","38510  >  443 [SYN] Seq=0 Win=29200 Len=0 MSS=1460 SACK_PERM=1 TSval=1110475905 TSecr=0 WS=128"
"140","12.838320466","192.168.1.1","192.168.1.34","DNS","104","Standard query response 0x28c8 A www.sitepoint.com A 54.148.84.95 OPT"
"141","12.838912615","192.168.1.34","192.168.1.1","DNS","88","Standard query 0x41b5 AAAA www.sitepoint.com OPT"
"142","12.838999609","192.168.1.1","192.168.1.34","DNS","180","Standard query response 0x461c AAAA drcwo519tnci7.cloudfront.net SOA ns-377.awsdns-47.com OPT"
"143","12.839379799","192.168.1.34","13.33.47.238","TCP","74","54930  >  443 [SYN] Seq=0 Win=29200 Len=0 MSS=1460 SACK_PERM=1 TSval=2959507216 TSecr=0 WS=128"
"144","12.914684124","13.33.47.238","192.168.1.34","TCP","74","443  >  54930 [SYN, ACK] Seq=0 Ack=1 Win=28960 Len=0 MSS=1460 SACK_PERM=1 TSval=1721497505 TSecr=2959507216 WS=256"
"145","12.914738572","192.168.1.34","13.33.47.238","TCP","66","54930  >  443 [ACK] Seq=1 Ack=1 Win=29312 Len=0 TSval=2959507292 TSecr=1721497505"
"146","12.915073755","192.168.1.34","13.33.47.238","TLSv1","267","Client Hello"
"147","12.926800777","192.168.1.1","192.168.1.34","DNS","145","Standard query response 0x41b5 AAAA www.sitepoint.com SOA ns10.dnsmadeeasy.com OPT"
"148","12.928554849","192.168.1.34","192.168.1.1","DNS","86","Standard query 0xa478 A gist.github.com OPT"
"149","12.990263954","13.33.47.238","192.168.1.34","TCP","66","443  >  54930 [ACK] Seq=1 Ack=202 Win=30208 Len=0 TSval=1721497512 TSecr=2959507292"
"150","13.148601878","13.33.47.238","192.168.1.34","SSL","124","[TCP Previous segment not captured] , Continuation Data"
"151","13.148639142","192.168.1.34","13.33.47.238","TCP","78","[TCP Window Update] 54930  >  443 [ACK] Seq=202 Ack=1 Win=30336 Len=0 TSval=2959507525 TSecr=1721497512 SLE=4345 SRE=4403"
"152","13.201507162","52.32.92.108","192.168.1.34","TCP","66","443  >  38506 [ACK] Seq=1 Ack=204 Win=30464 Len=0 TSval=53558291 TSecr=1110475904"
"153","13.234702984","52.32.92.108","192.168.1.34","TCP","74","443  >  38510 [SYN, ACK] Seq=0 Ack=1 Win=26847 Len=0 MSS=1460 SACK_PERM=1 TSval=53558291 TSecr=1110475905 WS=256"
"154","13.234777767","192.168.1.34","52.32.92.108","TCP","66","38510  >  443 [ACK] Seq=1 Ack=1 Win=29312 Len=0 TSval=1110476330 TSecr=53558291"
"155","13.235080757","192.168.1.34","52.32.92.108","TLSv1","269","Client Hello"
"156","13.561600605","192.168.1.34","52.32.92.108","TCP","74","[TCP Retransmission] 38508  >  443 [SYN] Seq=0 Win=29200 Len=0 MSS=1460 SACK_PERM=1 TSval=1110476657 TSecr=0 WS=128"
"157","13.783191052","52.32.92.108","192.168.1.34","TCP","74","443  >  38508 [SYN, ACK] Seq=0 Ack=1 Win=26847 Len=0 MSS=1460 SACK_PERM=1 TSval=53558423 TSecr=1110476657 WS=256"
"158","13.783246898","192.168.1.34","52.32.92.108","TCP","66","38508  >  443 [ACK] Seq=1 Ack=1 Win=29312 Len=0 TSval=1110476878 TSecr=53558423"
"159","13.783624107","192.168.1.34","52.32.92.108","TLSv1","269","Client Hello"
"160","13.927965546","192.168.1.34","192.168.1.1","DNS","86","Standard query 0xa478 A gist.github.com OPT"
"161","13.928367165","192.168.1.34","192.168.1.1","DNS","88","Standard query 0x75d7 A stackoverflow.com OPT"
"162","13.945071742","192.168.1.1","192.168.1.34","DNS","118","Standard query response 0xa478 A gist.github.com A 192.30.253.118 A 192.30.253.119 OPT"
"163","13.946639025","192.168.1.34","192.168.1.1","DNS","86","Standard query 0x35b3 AAAA gist.github.com OPT"
"164","13.982681672","192.168.1.1","192.168.1.34","DNS","170","Standard query response 0x35b3 AAAA gist.github.com SOA ns-1707.awsdns-21.co.uk OPT"
"165","13.984440651","192.168.1.34","192.168.1.1","DNS","83","Standard query 0x52c4 A codeburst.io OPT"
"166","14.052002008","52.32.92.108","192.168.1.34","TCP","66","443  >  38508 [ACK] Seq=1 Ack=204 Win=30464 Len=0 TSval=53558533 TSecr=1110476879"
"167","14.105623471","192.168.1.34","52.32.92.108","TCP","269","[TCP Retransmission] 38510  >  443 [PSH, ACK] Seq=1 Ack=1 Win=29312 Len=203 TSval=1110477201 TSecr=53558291"
"168","14.167828906","52.32.92.108","192.168.1.34","SSL","184","[TCP Previous segment not captured] , Continuation Data"
"169","14.167862251","192.168.1.34","52.32.92.108","TCP","78","[TCP Window Update] 38508  >  443 [ACK] Seq=204 Ack=1 Win=30336 Len=0 TSval=1110477263 TSecr=53558533 SLE=2897 SRE=3015"
"170","14.192620964","52.32.92.108","192.168.1.34","SSL","184","[TCP Previous segment not captured] , Continuation Data"
"171","14.192653958","192.168.1.34","52.32.92.108","TCP","78","[TCP Window Update] 38506  >  443 [ACK] Seq=204 Ack=1 Win=30336 Len=0 TSval=1110477288 TSecr=53558291 SLE=2897 SRE=3015"
"172","14.192681336","192.168.1.1","192.168.1.34","DNS","275","Standard query response 0x52c4 A codeburst.io A 52.4.175.111 A 52.1.119.170 A 52.6.46.142 A 52.4.240.221 A 52.5.181.79 A 52.6.3.192 A 52.1.173.203 A 52.4.225.124 A 52.4.38.70 A 52.1.147.205 A 52.4.145.119 A 52.0.16.118 OPT"
"173","14.194309804","192.168.1.34","192.168.1.1","DNS","83","Standard query 0x9fdb AAAA codeburst.io OPT"
"174","14.345118206","52.32.92.108","192.168.1.34","TCP","78","[TCP Previous segment not captured] 443  >  38510 [ACK] Seq=3015 Ack=204 Win=28160 Len=0 TSval=53558614 TSecr=1110477201 SLE=1 SRE=204"
"175","14.612089563","52.32.92.108","192.168.1.34","TCP","1514","[TCP Retransmission] 443  >  38508 [ACK] Seq=1449 Ack=204 Win=30464 Len=1448 TSval=53558658 TSecr=1110477263"
"176","14.612123488","192.168.1.34","52.32.92.108","TCP","78","[TCP Window Update] 38508  >  443 [ACK] Seq=204 Ack=1 Win=33280 Len=0 TSval=1110477707 TSecr=53558533 SLE=1449 SRE=3015"
"177","14.905569375","192.168.1.34","173.194.221.95","TCP","66","[TCP Keep-Alive] 46852  >  443 [ACK] Seq=204 Ack=1 Win=29312 Len=0 TSval=4127644420 TSecr=3770796455"
"178","14.953763705","173.194.221.95","192.168.1.34","TCP","66","[TCP Previous segment not captured] 443  >  46852 [FIN, ACK] Seq=2409 Ack=205 Win=43520 Len=0 TSval=3770806478 TSecr=4127644399"
"179","14.953798314","192.168.1.34","173.194.221.95","TCP","78","[TCP Dup ACK 53#1] 46852  >  443 [ACK] Seq=205 Ack=1 Win=29312 Len=0 TSval=4127654479 TSecr=3770796455 SLE=2409 SRE=2410"
"180","14.959278637","173.194.221.95","192.168.1.34","TCP","66","[TCP Dup ACK 55#1] 443  >  46852 [ACK] Seq=2410 Ack=205 Win=43520 Len=0 TSval=3770806503 TSecr=4127644399"
"181","15.161598450","192.168.1.34","91.189.92.20","TCP","251","[TCP Retransmission] 56064  >  443 [PSH, ACK] Seq=1 Ack=1 Win=29312 Len=185 TSval=1417171232 TSecr=968623051"
"182","15.177687407","192.168.1.34","192.168.1.1","DNS","83","Standard query 0x9fdb AAAA codeburst.io OPT"
"183","15.225401727","91.189.92.20","192.168.1.34","TCP","78","[TCP Previous segment not captured] 443  >  56064 [ACK] Seq=2897 Ack=186 Win=30080 Len=0 TSval=968624479 TSecr=1417171232 SLE=1 SRE=186"
"184","15.621783241","173.194.221.95","192.168.1.34","TCP","1484","[TCP Retransmission] 443  >  46852 [ACK] Seq=1 Ack=205 Win=43520 Len=1418 TSval=3770807183 TSecr=4127654479"
"185","15.621825761","192.168.1.34","173.194.221.95","TCP","78","46852  >  443 [ACK] Seq=205 Ack=1419 Win=32128 Len=0 TSval=4127655147 TSecr=3770807183 SLE=2409 SRE=2410"
"186","15.634508919","173.194.221.95","192.168.1.34","TCP","1056","[TCP Retransmission] 443  >  46852 [PSH, ACK] Seq=1419 Ack=205 Win=43520 Len=990 TSval=3770807199 TSecr=4127655147"
"187","15.634553316","192.168.1.34","173.194.221.95","TCP","66","46852  >  443 [ACK] Seq=205 Ack=2410 Win=34944 Len=0 TSval=4127655160 TSecr=3770807199"
"188","15.644222360","192.168.1.34","173.194.221.95","TLSv1.2","159","Client Key Exchange, Change Cipher Spec, Encrypted Handshake Message"
"189","15.644505816","192.168.1.34","173.194.221.95","TCP","66","46852  >  443 [FIN, ACK] Seq=298 Ack=2410 Win=34944 Len=0 TSval=4127655170 TSecr=3770807199"
"190","15.647736273","192.168.1.34","192.168.1.1","DNS","84","Standard query 0xeda6 A ocsp.pki.goog OPT"
"191","15.648127166","192.168.1.34","192.168.1.1","DNS","88","Standard query 0x75d7 A stackoverflow.com OPT"
"192","15.649050515","192.168.1.34","192.168.1.1","DNS","84","Standard query 0x24be AAAA ocsp.pki.goog OPT"
"193","15.651933271","192.168.1.34","192.168.1.1","DNS","98","Standard query 0xc0f2 A shavar.services.mozilla.com OPT"
"194","15.652919394","192.168.1.34","192.168.1.1","DNS","98","Standard query 0x9e80 AAAA shavar.services.mozilla.com OPT"
"195","15.708858217","173.194.221.95","192.168.1.34","TCP","54","443  >  46852 [RST] Seq=2410 Win=0 Len=0"
"196","15.713832550","192.168.1.1","192.168.1.34","DNS","152","Standard query response 0x75d7 A stackoverflow.com A 151.101.1.69 A 151.101.129.69 A 151.101.193.69 A 151.101.65.69 OPT"
"197","15.713867767","192.168.1.1","192.168.1.34","DNS","211","Standard query response 0xeda6 A ocsp.pki.goog CNAME www3.l.google.com A 173.194.221.138 A 173.194.221.102 A 173.194.221.100 A 173.194.221.101 A 173.194.221.113 A 173.194.221.139 OPT"
"198","15.715800686","173.194.221.95","192.168.1.34","TCP","54","443  >  46852 [RST] Seq=2410 Win=0 Len=0"
"199","15.716465247","192.168.1.34","192.168.1.1","DNS","85","Standard query 0xb644 A www.kirupa.com OPT"
"200","15.717401078","192.168.1.34","192.168.1.1","DNS","85","Standard query 0xe1d6 AAAA www.kirupa.com OPT"
"201","15.728354249","192.168.1.1","192.168.1.34","DNS","143","Standard query response 0x24be AAAA ocsp.pki.goog CNAME www3.l.google.com AAAA 2a00:1450:4010:c0a::8b OPT"
"202","15.728397411","192.168.1.1","192.168.1.34","DNS","230","Standard query response 0xc0f2 A shavar.services.mozilla.com CNAME shavar.prod.mozaws.net A 52.42.20.106 A 52.34.90.23 A 52.10.11.113 A 54.201.205.103 A 35.164.63.113 A 54.191.46.28 OPT"
"203","15.728410724","192.168.1.1","192.168.1.34","DNS","216","Standard query response 0x9e80 AAAA shavar.services.mozilla.com CNAME shavar.prod.mozaws.net SOA ns-1260.awsdns-29.org OPT"
"204","15.728421154","192.168.1.1","192.168.1.34","DNS","101","Standard query response 0xb644 A www.kirupa.com A 70.32.72.117 OPT"
"205","15.730026724","192.168.1.34","173.194.221.139","TCP","74","35238  >  80 [SYN] Seq=0 Win=29200 Len=0 MSS=1460 SACK_PERM=1 TSval=3562629634 TSecr=0 WS=128"
"206","15.731197595","192.168.1.34","192.168.1.1","DNS","93","Standard query 0x8807 AAAA shavar.prod.mozaws.net OPT"
"207","15.745521483","173.194.221.139","192.168.1.34","TCP","74","80  >  35238 [SYN, ACK] Seq=0 Ack=1 Win=42408 Len=0 MSS=1380 SACK_PERM=1 TSval=1881571138 TSecr=3562629634 WS=256"
"208","15.745593053","192.168.1.34","173.194.221.139","TCP","66","35238  >  80 [ACK] Seq=1 Ack=1 Win=29312 Len=0 TSval=3562629649 TSecr=1881571138"
"209","15.745925345","192.168.1.34","173.194.221.139","OCSP","501","Request"
"210","15.771090108","192.168.1.1","192.168.1.34","DNS","178","Standard query response 0x8807 AAAA shavar.prod.mozaws.net SOA ns-1260.awsdns-29.org OPT"
"211","15.772298561","192.168.1.34","54.191.46.28","TCP","74","33484  >  443 [SYN] Seq=0 Win=29200 Len=0 MSS=1460 SACK_PERM=1 TSval=111171038 TSecr=0 WS=128"
