"No.","Time","Source","Destination","Protocol","Length","Info"
"1","0.000000","192.168.0.101","95.215.48.50","TCP","55","55216  >  42276 [ACK] Seq=1 Ack=1 Win=65392 Len=1"
"2","0.025430","95.215.48.50","192.168.0.101","TCP","54","[TCP ZeroWindow] 42276  >  55216 [ACK] Seq=1 Ack=1 Win=0 Len=0"
"3","0.531252","192.168.0.101","95.215.48.50","TCP","55","55836  >  42276 [ACK] Seq=1 Ack=1 Win=65392 Len=1"
"4","0.555701","95.215.48.50","192.168.0.101","TCP","54","[TCP ZeroWindow] 42276  >  55836 [ACK] Seq=1 Ack=1 Win=0 Len=0"
"5","1.234791","fe80::2846:51e6:68f:3097","ff02::c","SSDP","208","M-SEARCH * HTTP/1.1 "
"6","1.673651","192.168.0.101","149.154.163.64","SSL","143","Continuation Data"
"7","1.713490","149.154.163.64","192.168.0.101","SSL","143","Continuation Data"
"8","1.921622","192.168.0.101","149.154.163.64","TCP","54","49164  >  443 [ACK] Seq=90 Ack=90 Win=63706 Len=0"
"9","2.575857","192.168.0.101","239.255.255.250","UDP","698","59080  >  3702 Len=656"
"10","2.766442","192.168.0.101","239.255.255.250","UDP","698","59080  >  3702 Len=656"
"11","4.234381","fe80::2846:51e6:68f:3097","ff02::c","SSDP","208","M-SEARCH * HTTP/1.1 "
"12","4.608963","HonHaiPr_82:36:c5","D-Link_e9:93:52","ARP","42","Who has 192.168.0.1? Tell 192.168.0.101"
"13","4.620641","D-Link_e9:93:52","HonHaiPr_82:36:c5","ARP","42","192.168.0.1 is at 00:24:01:e9:93:52"
"14","6.721561","192.168.0.1","239.255.255.250","SSDP","322","NOTIFY * HTTP/1.1 "
"15","6.722553","192.168.0.1","239.255.255.250","SSDP","394","NOTIFY * HTTP/1.1 "
"16","6.723088","192.168.0.1","239.255.255.250","SSDP","370","NOTIFY * HTTP/1.1 "
"17","6.724327","192.168.0.1","239.255.255.250","SSDP","402","NOTIFY * HTTP/1.1 "
"18","6.724805","192.168.0.1","239.255.255.250","SSDP","390","NOTIFY * HTTP/1.1 "
"19","6.725269","192.168.0.1","239.255.255.250","SSDP","386","NOTIFY * HTTP/1.1 "
"20","6.726084","192.168.0.1","239.255.255.250","SSDP","384","NOTIFY * HTTP/1.1 "
"21","6.729954","192.168.0.1","239.255.255.250","SSDP","386","NOTIFY * HTTP/1.1 "
"22","6.730411","192.168.0.1","239.255.255.250","SSDP","386","NOTIFY * HTTP/1.1 "
"23","6.732420","192.168.0.1","239.255.255.250","SSDP","396","NOTIFY * HTTP/1.1 "
"24","7.234208","fe80::2846:51e6:68f:3097","ff02::c","SSDP","208","M-SEARCH * HTTP/1.1 "
"25","7.314009","192.168.0.101","192.168.0.255","NBNS","95","Name query NB YAROSLAV-PC<1c>."""""
"26","8.062014","192.168.0.101","192.168.0.255","NBNS","95","Name query NB YAROSLAV-PC<1c>."""""
"27","8.811974","192.168.0.101","192.168.0.255","NBNS","95","Name query NB YAROSLAV-PC<1c>."""""
"28","11.297481","fe80::2846:51e6:68f:3097","ff02::c","SSDP","208","M-SEARCH * HTTP/1.1 "
"29","13.999208","192.168.0.101","95.215.48.50","TCP","55","54749  >  42276 [ACK] Seq=1 Ack=1 Win=65392 Len=1"
"30","14.024329","95.215.48.50","192.168.0.101","TCP","54","[TCP ZeroWindow] 42276  >  54749 [ACK] Seq=1 Ack=1 Win=0 Len=0"
"31","14.296240","fe80::2846:51e6:68f:3097","ff02::c","SSDP","208","M-SEARCH * HTTP/1.1 "
"32","17.184018","192.168.0.101","192.168.0.1","DNS","80","Standard query 0x3a85 A connect.facebook.net"
"33","17.187502","192.168.0.1","192.168.0.101","DNS","163","Standard query response 0x3a85 A connect.facebook.net CNAME scontent.xx.fbcdn.net A 31.13.72.12 NS b.ns.xx.fbcdn.net NS a.ns.xx.fbcdn.net"
"34","17.232150","192.168.0.101","192.168.0.1","DNS","72","Standard query 0x4402 A mc.yandex.ru"
"35","17.235730","192.168.0.1","192.168.0.101","DNS","280","Standard query response 0x4402 A mc.yandex.ru A 87.250.251.119 A 93.158.134.119 A 213.180.193.119 A 87.250.250.119 NS ns9.z5h64q92x9.net NS ns1.yandex.ru NS ns2.yandex.ru A 195.156.199.201 AAAA 2a05:d014:484:fd80:ffff:ffff:0:1 A 213.180.193.1 A 93.158.134.1"
"36","17.296161","fe80::2846:51e6:68f:3097","ff02::c","SSDP","208","M-SEARCH * HTTP/1.1 "
"37","17.353869","192.168.0.101","192.168.0.1","DNS","75","Standard query 0x1928 A redir.opera.com"
"38","17.353869","192.168.0.101","192.168.0.1","DNS","77","Standard query 0x4e8a A rtk.rmcontrol.net"
"39","17.362472","192.168.0.1","192.168.0.101","DNS","152","Standard query response 0x4e8a A rtk.rmcontrol.net A 178.62.247.171 NS dns1.registrar-servers.com NS dns2.registrar-servers.com"
"40","17.365408","192.168.0.101","192.168.0.1","DNS","75","Standard query 0xcd75 A scdn.cxense.com"
"41","17.417557","192.168.0.1","192.168.0.101","DNS","431","Standard query response 0xcd75 A scdn.cxense.com CNAME cdn.cxense.com.edgekey.net CNAME e9867.dscb.akamaiedge.net A 184.86.52.181 NS n0dscb.akamaiedge.net NS n7dscb.akamaiedge.net NS n4dscb.akamaiedge.net NS n2dscb.akamaiedge.net NS n1dscb.akamaiedge.net NS n3dscb.akamaiedge.net NS n6dscb.akamaiedge.net NS n5dscb.akamaiedge.net A 217.212.252.221 A 217.212.252.215 A 88.221.216.126 A 217.212.252.230 A 88.221.81.192 A 217.212.252.236"
"42","17.419423","192.168.0.101","192.168.0.1","DNS","85","Standard query 0xdcd4 A sovetnik.market.yandex.ru"
"43","17.424589","192.168.0.1","192.168.0.101","DNS","280","Standard query response 0xdcd4 A sovetnik.market.yandex.ru CNAME sovetnik.market.http.yandex.ru A 87.250.250.41 NS ns2.yandex.ru NS ns1.yandex.ru NS ns9.z5h64q92x9.net A 195.156.199.201 AAAA 2a05:d014:484:fd80:ffff:ffff:0:1 A 213.180.193.1 A 93.158.134.1"
"44","17.429364","192.168.0.1","192.168.0.101","DNS","220","Standard query response 0x1928 A redir.opera.com CNAME redir.geo.opera.com A 82.145.215.91 NS geo6.opera.com NS geo4.opera.com NS geo5.opera.com A 185.26.183.161 A 107.167.100.88 A 107.167.110.155"
"45","17.497151","192.168.0.101","192.168.0.1","DNS","83","Standard query 0x8e5a A www-static.operacdn.com"
"46","17.498928","192.168.0.101","192.168.0.1","DNS","84","Standard query 0xbc08 A www.google-analytics.com"
"47","17.502473","192.168.0.1","192.168.0.101","DNS","296","Standard query response 0xbc08 A www.google-analytics.com CNAME www-google-analytics.l.google.com A 173.194.222.102 A 173.194.222.100 A 173.194.222.138 A 173.194.222.101 A 173.194.222.113 A 173.194.222.139 NS ns2.google.com NS ns1.google.com NS ns3.google.com NS ns4.google.com"
"48","17.504496","192.168.0.101","192.168.0.1","DNS","84","Standard query 0x7971 A www.googletagmanager.com"
"49","17.507190","192.168.0.1","192.168.0.101","DNS","216","Standard query response 0x7971 A www.googletagmanager.com CNAME www-googletagmanager.l.google.com A 173.194.222.97 NS ns3.google.com NS ns4.google.com NS ns2.google.com NS ns1.google.com"
"50","17.508776","192.168.0.101","192.168.0.1","DNS","72","Standard query 0xe9a1 A yastatic.net"
"51","17.513210","192.168.0.1","192.168.0.101","DNS","120","Standard query response 0xe9a1 A yastatic.net A 178.154.131.216 A 178.154.131.217 A 178.154.131.215"
"52","17.532942","192.168.0.1","192.168.0.101","DNS","259","Standard query response 0x8e5a A www-static.operacdn.com CNAME m.shared.global.fastly.net A 151.101.37.178 NS ns1.fastly.net NS ns2.fastly.net NS ns3.fastly.net NS ns4.fastly.net A 23.235.32.32 A 23.235.36.32 A 104.156.84.32"
"53","19.038041","D-Link_e9:93:52","HonHaiPr_82:36:c5","ARP","42","Who has 192.168.0.101? Tell 192.168.0.1"
"54","19.038086","HonHaiPr_82:36:c5","D-Link_e9:93:52","ARP","42","192.168.0.101 is at 48:e2:44:82:36:c5"
"55","19.835288","fe80::224:1ff:fee9:9352","ff02::1","ICMPv6","118","Router Advertisement from 00:24:01:e9:93:52"
"56","20.873872","192.168.0.101","95.215.48.50","TCP","55","54968  >  42276 [ACK] Seq=1 Ack=1 Win=65392 Len=1"
"57","20.905857","95.215.48.50","192.168.0.101","TCP","54","[TCP ZeroWindow] 42276  >  54968 [ACK] Seq=1 Ack=1 Win=0 Len=0"
"58","21.296086","fe80::2846:51e6:68f:3097","ff02::c","SSDP","208","M-SEARCH * HTTP/1.1 "
"59","23.430764","192.168.0.101","192.168.0.1","DNS","78","Standard query 0xe9ca A exchange.opera.com"
"60","23.473500","192.168.0.1","192.168.0.101","DNS","254","Standard query response 0xe9ca A exchange.opera.com A 185.26.182.111 A 185.26.182.112 NS nic3.opera.com NS nic1.opera.com NS nic4.opera.com NS nic2.opera.no A 103.83.123.78 AAAA 2001:4c28:4000:727:185:26:183:160 A 37.228.109.145"
"61","23.475362","192.168.0.101","185.26.182.111","TCP","66","65003  >  443 [SYN] Seq=0 Win=8192 Len=0 MSS=1460 WS=4 SACK_PERM=1"
"62","23.476211","192.168.0.101","185.26.182.111","TCP","66","65004  >  443 [SYN] Seq=0 Win=8192 Len=0 MSS=1460 WS=4 SACK_PERM=1"
"63","23.476853","192.168.0.101","185.26.182.111","TCP","66","65005  >  443 [SYN] Seq=0 Win=8192 Len=0 MSS=1460 WS=4 SACK_PERM=1"
"64","23.520715","185.26.182.111","192.168.0.101","TCP","66","443  >  65003 [SYN, ACK] Seq=0 Ack=1 Win=29200 Len=0 MSS=1460 SACK_PERM=1 WS=512"
"65","23.520938","192.168.0.101","185.26.182.111","TCP","54","65003  >  443 [ACK] Seq=1 Ack=1 Win=131400 Len=0"
"66","23.521392","185.26.182.111","192.168.0.101","TCP","66","443  >  65004 [SYN, ACK] Seq=0 Ack=1 Win=29200 Len=0 MSS=1460 SACK_PERM=1 WS=512"
"67","23.521450","192.168.0.101","185.26.182.111","TCP","54","65004  >  443 [ACK] Seq=1 Ack=1 Win=131400 Len=0"
"68","23.521817","185.26.182.111","192.168.0.101","TCP","66","443  >  65005 [SYN, ACK] Seq=0 Ack=1 Win=29200 Len=0 MSS=1460 SACK_PERM=1 WS=512"
"69","23.521872","192.168.0.101","185.26.182.111","TCP","54","65005  >  443 [ACK] Seq=1 Ack=1 Win=131400 Len=0"
"70","23.523731","192.168.0.101","185.26.182.111","TLSv1.2","256","Client Hello"
"71","23.524381","192.168.0.101","185.26.182.111","TLSv1.2","256","Client Hello"
"72","23.525318","192.168.0.101","185.26.182.111","TLSv1.2","256","Client Hello"
"73","23.558377","185.26.182.111","192.168.0.101","TCP","54","443  >  65003 [ACK] Seq=1 Ack=203 Win=30720 Len=0"
"74","23.558547","185.26.182.111","192.168.0.101","TCP","54","443  >  65004 [ACK] Seq=1 Ack=203 Win=30720 Len=0"
"75","23.565978","185.26.182.111","192.168.0.101","TCP","54","443  >  65005 [ACK] Seq=1 Ack=203 Win=30720 Len=0"
"76","23.566984","185.26.182.111","192.168.0.101","TLSv1.2","1514","Server Hello"
"77","23.567410","185.26.182.111","192.168.0.101","TLSv1.2","1514","Certificate [TCP segment of a reassembled PDU]"
"78","23.567479","192.168.0.101","185.26.182.111","TCP","54","65004  >  443 [ACK] Seq=203 Ack=2921 Win=131400 Len=0"
"79","23.567697","185.26.182.111","192.168.0.101","TLSv1.2","131","Server Key Exchange, Server Hello Done"
"80","23.567764","185.26.182.111","192.168.0.101","TLSv1.2","1514","Server Hello"
"81","23.567847","185.26.182.111","192.168.0.101","TLSv1.2","1514","Certificate [TCP segment of a reassembled PDU]"
"82","23.567902","192.168.0.101","185.26.182.111","TCP","54","65003  >  443 [ACK] Seq=203 Ack=2921 Win=131400 Len=0"
"83","23.568121","185.26.182.111","192.168.0.101","TLSv1.2","131","Server Key Exchange, Server Hello Done"
"84","23.568187","185.26.182.111","192.168.0.101","TLSv1.2","1514","Server Hello"
"85","23.568272","185.26.182.111","192.168.0.101","TLSv1.2","1514","Certificate [TCP segment of a reassembled PDU]"
"86","23.568315","192.168.0.101","185.26.182.111","TCP","54","65005  >  443 [ACK] Seq=203 Ack=2921 Win=131400 Len=0"
"87","23.568592","185.26.182.111","192.168.0.101","TLSv1.2","131","Server Key Exchange, Server Hello Done"
"88","23.628634","192.168.0.101","185.26.182.111","TLSv1.2","180","Client Key Exchange, Change Cipher Spec, Encrypted Handshake Message"
"89","23.638796","192.168.0.101","185.26.182.111","TLSv1.2","180","Client Key Exchange, Change Cipher Spec, Encrypted Handshake Message"
"90","23.649937","192.168.0.101","185.26.182.111","TLSv1.2","180","Client Key Exchange, Change Cipher Spec, Encrypted Handshake Message"
"91","23.664026","185.26.182.111","192.168.0.101","TLSv1.2","312","New Session Ticket, Change Cipher Spec, Encrypted Handshake Message"
"92","23.675441","185.26.182.111","192.168.0.101","TLSv1.2","312","New Session Ticket, Change Cipher Spec, Encrypted Handshake Message"
"93","23.685332","185.26.182.111","192.168.0.101","TLSv1.2","312","New Session Ticket, Change Cipher Spec, Encrypted Handshake Message"
"94","23.824260","192.168.0.101","178.62.247.171","TCP","66","65006  >  443 [SYN] Seq=0 Win=8192 Len=0 MSS=1460 WS=4 SACK_PERM=1"
"95","23.858081","192.168.0.101","185.26.182.111","TCP","54","65004  >  443 [ACK] Seq=329 Ack=3256 Win=131064 Len=0"
"96","23.861554","178.62.247.171","192.168.0.101","TCP","66","443  >  65006 [SYN, ACK] Seq=0 Ack=1 Win=29200 Len=0 MSS=1460 SACK_PERM=1 WS=256"
"97","23.861693","192.168.0.101","178.62.247.171","TCP","54","65006  >  443 [ACK] Seq=1 Ack=1 Win=131400 Len=0"
"98","23.862569","192.168.0.101","178.62.247.171","TLSv1.2","255","Client Hello"
"99","23.887307","192.168.0.101","185.26.182.111","TCP","54","65005  >  443 [ACK] Seq=329 Ack=3256 Win=131064 Len=0"
"100","23.900140","178.62.247.171","192.168.0.101","TCP","54","443  >  65006 [ACK] Seq=1 Ack=202 Win=30464 Len=0"
"101","23.904249","178.62.247.171","192.168.0.101","TLSv1.2","1514","Server Hello"
"102","23.904638","178.62.247.171","192.168.0.101","TLSv1.2","1514","Certificate [TCP segment of a reassembled PDU]"
"103","23.904722","192.168.0.101","178.62.247.171","TCP","54","65006  >  443 [ACK] Seq=202 Ack=2921 Win=131400 Len=0"
"104","23.905527","178.62.247.171","192.168.0.101","TLSv1.2","879","Certificate Status, Server Key Exchange, Server Hello Done"
"105","23.914121","192.168.0.101","178.62.247.171","TLSv1.2","180","Client Key Exchange, Change Cipher Spec, Encrypted Handshake Message"
"106","23.930233","185.26.182.111","192.168.0.101","TCP","312","[TCP Retransmission] 443  >  65003 [PSH, ACK] Seq=2998 Ack=329 Win=30720 Len=258"
"107","23.930302","192.168.0.101","185.26.182.111","TCP","66","65003  >  443 [ACK] Seq=329 Ack=3256 Win=131064 Len=0 SLE=2998 SRE=3256"
"108","23.951003","178.62.247.171","192.168.0.101","TLSv1.2","312","New Session Ticket, Change Cipher Spec, Encrypted Handshake Message"
"109","24.149023","192.168.0.101","178.62.247.171","TCP","54","65006  >  443 [ACK] Seq=328 Ack=4004 Win=130316 Len=0"
"110","24.248827","fe80::2846:51e6:68f:3097","ff02::c","SSDP","208","M-SEARCH * HTTP/1.1 "
"111","26.688529","192.168.0.1","239.255.255.250","SSDP","322","NOTIFY * HTTP/1.1 "
"112","26.689082","192.168.0.1","239.255.255.250","SSDP","394","NOTIFY * HTTP/1.1 "
"113","26.689605","192.168.0.1","239.255.255.250","SSDP","370","NOTIFY * HTTP/1.1 "
"114","26.690471","192.168.0.1","239.255.255.250","SSDP","402","NOTIFY * HTTP/1.1 "
"115","26.690979","192.168.0.1","239.255.255.250","SSDP","390","NOTIFY * HTTP/1.1 "
"116","26.692201","192.168.0.1","239.255.255.250","SSDP","386","NOTIFY * HTTP/1.1 "
"117","26.692727","192.168.0.1","239.255.255.250","SSDP","384","NOTIFY * HTTP/1.1 "
"118","26.693274","192.168.0.1","239.255.255.250","SSDP","386","NOTIFY * HTTP/1.1 "
"119","26.694072","192.168.0.1","239.255.255.250","SSDP","386","NOTIFY * HTTP/1.1 "
"120","26.694525","192.168.0.1","239.255.255.250","SSDP","396","NOTIFY * HTTP/1.1 "
"121","27.201962","fe80::2846:51e6:68f:3097","ff02::c","SSDP","208","M-SEARCH * HTTP/1.1 "
"122","27.890986","192.168.0.101","87.250.250.41","TCP","66","65007  >  443 [SYN] Seq=0 Win=8192 Len=0 MSS=1460 WS=4 SACK_PERM=1"
"123","27.907321","87.250.250.41","192.168.0.101","TCP","66","443  >  65007 [SYN, ACK] Seq=0 Ack=1 Win=28200 Len=0 MSS=1410 SACK_PERM=1 WS=256"
"124","27.907445","192.168.0.101","87.250.250.41","TCP","54","65007  >  443 [ACK] Seq=1 Ack=1 Win=131128 Len=0"
"125","27.908283","192.168.0.101","87.250.250.41","TLSv1.2","267","Client Hello"
"126","27.925122","87.250.250.41","192.168.0.101","TCP","54","443  >  65007 [ACK] Seq=1 Ack=214 Win=29440 Len=0"
"127","27.925523","87.250.250.41","192.168.0.101","TLSv1.2","1464","Server Hello"
"128","27.925936","87.250.250.41","192.168.0.101","TCP","1464","443  >  65007 [ACK] Seq=1411 Ack=214 Win=29440 Len=1410 [TCP segment of a reassembled PDU]"
"129","27.926007","192.168.0.101","87.250.250.41","TCP","54","65007  >  443 [ACK] Seq=214 Ack=2821 Win=131128 Len=0"
"130","27.926395","87.250.250.41","192.168.0.101","TCP","1464","443  >  65007 [ACK] Seq=2821 Ack=214 Win=29440 Len=1410 [TCP segment of a reassembled PDU]"
"131","27.929171","87.250.250.41","192.168.0.101","TLSv1.2","1464","Certificate [TCP segment of a reassembled PDU]"
"132","27.929173","87.250.250.41","192.168.0.101","TLSv1.2","232","Server Key Exchange, Server Hello Done"
"133","27.929248","192.168.0.101","87.250.250.41","TCP","54","65007  >  443 [ACK] Seq=214 Ack=5819 Win=131128 Len=0"
"134","27.937996","192.168.0.101","87.250.250.41","TLSv1.2","180","Client Key Exchange, Change Cipher Spec, Encrypted Handshake Message"
"135","27.954736","87.250.250.41","192.168.0.101","TLSv1.2","312","New Session Ticket, Change Cipher Spec, Encrypted Handshake Message"
"136","28.132210","192.168.0.101","185.26.182.111","TLSv1.2","338","Application Data"
"137","28.132899","192.168.0.101","185.26.182.111","TLSv1.2","338","Application Data"
"138","28.133637","192.168.0.101","185.26.182.111","TLSv1.2","338","Application Data"
"139","28.152721","192.168.0.101","87.250.250.41","TCP","54","65007  >  443 [ACK] Seq=340 Ack=6077 Win=130872 Len=0"
"140","28.167563","185.26.182.111","192.168.0.101","TCP","1514","443  >  65004 [ACK] Seq=3256 Ack=613 Win=31744 Len=1460 [TCP segment of a reassembled PDU]"
"141","28.171440","185.26.182.111","192.168.0.101","TLSv1.2","503","Application Data"
"142","28.171533","192.168.0.101","185.26.182.111","TCP","54","65004  >  443 [ACK] Seq=613 Ack=5165 Win=131400 Len=0"
"143","28.178588","185.26.182.111","192.168.0.101","TCP","1514","443  >  65005 [ACK] Seq=3256 Ack=613 Win=31744 Len=1460 [TCP segment of a reassembled PDU]"
"144","28.178956","185.26.182.111","192.168.0.101","TCP","1514","443  >  65005 [ACK] Seq=4716 Ack=613 Win=31744 Len=1460 [TCP segment of a reassembled PDU]"
"145","28.179062","192.168.0.101","185.26.182.111","TCP","54","65005  >  443 [ACK] Seq=613 Ack=6176 Win=131400 Len=0"
"146","28.179219","185.26.182.111","192.168.0.101","TCP","1514","443  >  65005 [ACK] Seq=6176 Ack=613 Win=31744 Len=1460 [TCP segment of a reassembled PDU]"
"147","28.179269","185.26.182.111","192.168.0.101","TCP","1514","443  >  65005 [ACK] Seq=7636 Ack=613 Win=31744 Len=1460 [TCP segment of a reassembled PDU]"
"148","28.179302","192.168.0.101","185.26.182.111","TCP","54","65005  >  443 [ACK] Seq=613 Ack=9096 Win=131400 Len=0"
"149","28.179928","185.26.182.111","192.168.0.101","TLSv1.2","1149","Application Data"
"150","28.180002","185.26.182.111","192.168.0.101","TCP","1514","443  >  65003 [ACK] Seq=3256 Ack=613 Win=31744 Len=1460 [TCP segment of a reassembled PDU]"
"151","28.180072","185.26.182.111","192.168.0.101","TCP","1514","443  >  65003 [ACK] Seq=4716 Ack=613 Win=31744 Len=1460 [TCP segment of a reassembled PDU]"
"152","28.180112","192.168.0.101","185.26.182.111","TCP","54","65003  >  443 [ACK] Seq=613 Ack=6176 Win=131400 Len=0"
"153","28.180607","185.26.182.111","192.168.0.101","TCP","1514","443  >  65003 [ACK] Seq=6176 Ack=613 Win=31744 Len=1460 [TCP segment of a reassembled PDU]"
"154","28.180685","185.26.182.111","192.168.0.101","TCP","1514","443  >  65003 [ACK] Seq=7636 Ack=613 Win=31744 Len=1460 [TCP segment of a reassembled PDU]"
"155","28.180729","192.168.0.101","185.26.182.111","TCP","54","65003  >  443 [ACK] Seq=613 Ack=9096 Win=131400 Len=0"
"156","28.181145","185.26.182.111","192.168.0.101","TLSv1.2","701","Application Data"
"157","28.258506","192.168.0.101","87.250.250.41","TCP","1464","65007  >  443 [ACK] Seq=340 Ack=6077 Win=130872 Len=1410 [TCP segment of a reassembled PDU]"
"158","28.258524","192.168.0.101","87.250.250.41","TCP","1464","65007  >  443 [ACK] Seq=1750 Ack=6077 Win=130872 Len=1410 [TCP segment of a reassembled PDU]"
"159","28.279548","87.250.250.41","192.168.0.101","TCP","54","443  >  65007 [ACK] Seq=6077 Ack=3160 Win=35072 Len=0"
"160","28.279627","192.168.0.101","87.250.250.41","TLSv1.2","1280","Application Data, Application Data"
"161","28.302965","87.250.250.41","192.168.0.101","TLSv1.2","835","Application Data, Application Data"
"162","28.379271","192.168.0.101","185.26.182.111","TCP","54","65005  >  443 [ACK] Seq=613 Ack=10191 Win=130304 Len=0"
"163","28.379276","192.168.0.101","185.26.182.111","TCP","54","65003  >  443 [ACK] Seq=613 Ack=9743 Win=130752 Len=0"
"164","28.500357","192.168.0.101","87.250.250.41","TCP","54","65007  >  443 [ACK] Seq=4386 Ack=6858 Win=130088 Len=0"
"165","30.977355","fe80::2846:51e6:68f:3097","ff02::c","SSDP","208","M-SEARCH * HTTP/1.1 "
"166","33.857930","fe80::2846:51e6:68f:3097","ff02::c","SSDP","208","M-SEARCH * HTTP/1.1 "
"167","34.747410","192.168.0.101","192.168.0.1","DNS","84","Standard query 0xb5c3 A autoupdate.geo.opera.com"
"168","34.750419","192.168.0.1","192.168.0.101","DNS","205","Standard query response 0xb5c3 A autoupdate.geo.opera.com A 185.26.182.122 NS geo5.opera.com NS geo6.opera.com NS geo4.opera.com A 185.26.183.161 A 107.167.100.88 A 107.167.110.155"
"169","34.922212","192.168.0.101","185.26.182.122","TCP","66","65008  >  443 [SYN] Seq=0 Win=8192 Len=0 MSS=1460 WS=4 SACK_PERM=1"
"170","34.990442","185.26.182.122","192.168.0.101","TCP","66","443  >  65008 [SYN, ACK] Seq=0 Ack=1 Win=29200 Len=0 MSS=1460 SACK_PERM=1 WS=512"
"171","34.990572","192.168.0.101","185.26.182.122","TCP","54","65008  >  443 [ACK] Seq=1 Ack=1 Win=131400 Len=0"
"172","35.000170","192.168.0.101","185.26.182.122","TLSv1.2","251","Client Hello"
"173","35.036191","185.26.182.122","192.168.0.101","TCP","54","443  >  65008 [ACK] Seq=1 Ack=198 Win=30720 Len=0"
"174","35.046528","185.26.182.122","192.168.0.101","TLSv1.2","1514","Server Hello"
"175","35.052951","185.26.182.122","192.168.0.101","TCP","1514","443  >  65008 [ACK] Seq=1461 Ack=198 Win=30720 Len=1460 [TCP segment of a reassembled PDU]"
"176","35.053039","192.168.0.101","185.26.182.122","TCP","54","65008  >  443 [ACK] Seq=198 Ack=2921 Win=131400 Len=0"
"177","35.054208","185.26.182.122","192.168.0.101","TLSv1.2","1514","Certificate [TCP segment of a reassembled PDU]"
"178","35.054282","185.26.182.122","192.168.0.101","TLSv1.2","1155","Certificate Status, Server Key Exchange, Server Hello Done"
"179","35.054318","192.168.0.101","185.26.182.122","TCP","54","65008  >  443 [ACK] Seq=198 Ack=5482 Win=131400 Len=0"
"180","35.305584","192.168.0.101","185.26.182.122","TLSv1.2","372","Client Key Exchange, Change Cipher Spec, Encrypted Handshake Message"
"181","35.344824","185.26.182.122","192.168.0.101","TLSv1.2","105","Change Cipher Spec, Encrypted Handshake Message"
"182","35.349460","192.168.0.101","185.26.182.122","TLSv1.2","1114","Application Data"
"183","35.424988","185.26.182.122","192.168.0.101","TCP","54","443  >  65008 [ACK] Seq=5533 Ack=1576 Win=33792 Len=0"
"184","35.501769","185.26.182.122","192.168.0.101","TLSv1.2","808","Application Data"
"185","35.503492","192.168.0.101","185.26.182.122","TLSv1.2","85","Encrypted Alert"
"186","35.504265","192.168.0.101","185.26.182.122","TCP","54","65008  >  443 [FIN, ACK] Seq=1607 Ack=6287 Win=130592 Len=0"
"187","35.536704","185.26.182.122","192.168.0.101","TCP","54","443  >  65008 [ACK] Seq=6287 Ack=1607 Win=33792 Len=0"
"188","35.536805","185.26.182.122","192.168.0.101","TCP","54","443  >  65008 [FIN, ACK] Seq=6287 Ack=1607 Win=33792 Len=0"
"189","35.536849","192.168.0.101","185.26.182.122","TCP","54","65008  >  443 [ACK] Seq=1608 Ack=6288 Win=130592 Len=0"
"190","35.537239","185.26.182.122","192.168.0.101","TCP","54","443  >  65008 [ACK] Seq=6288 Ack=1608 Win=33792 Len=0"
"191","35.857494","192.168.0.101","95.215.48.50","TCP","55","57291  >  42276 [ACK] Seq=1 Ack=1 Win=65392 Len=1"
"192","35.857635","192.168.0.101","95.215.48.50","TCP","55","55482  >  42276 [ACK] Seq=1 Ack=1 Win=65392 Len=1"
"193","35.857695","192.168.0.101","95.215.48.50","TCP","55","55761  >  42276 [ACK] Seq=1 Ack=1 Win=65392 Len=1"
"194","35.886469","95.215.48.50","192.168.0.101","TCP","54","[TCP ZeroWindow] 42276  >  57291 [ACK] Seq=1 Ack=1 Win=0 Len=0"
"195","35.886560","95.215.48.50","192.168.0.101","TCP","54","[TCP ZeroWindow] 42276  >  55761 [ACK] Seq=1 Ack=1 Win=0 Len=0"
"196","35.886788","95.215.48.50","192.168.0.101","TCP","54","[TCP ZeroWindow] 42276  >  55482 [ACK] Seq=1 Ack=1 Win=0 Len=0"
"197","36.826578","fe80::2846:51e6:68f:3097","ff02::c","SSDP","208","M-SEARCH * HTTP/1.1 "
