"No.","Time","Source","Destination","Protocol","Length","Info"
"1","0.000000","192.168.0.102","192.168.0.1","DNS","75","Standard query 0x619b A ui.ff.avast.com"
"2","0.001769","192.168.0.102","192.168.0.1","DNS","71","Standard query 0xaabb A browsec.com"
"3","0.002073","192.168.0.1","192.168.0.102","DNS","454","Standard query response 0x619b A ui.ff.avast.com CNAME urlinfo.ns1.ff.avast.com A 5.45.59.38 A 5.45.59.39 A 5.45.58.99 NS ns01.ns1dnsavast.com NS dns2.p02.nsone.net NS ns02.ns1dnsavast.com NS dns4.p02.nsone.net NS dns1.p02.nsone.net NS ns04.ns1dnsavast.com NS ns03.ns1dnsavast.com NS dns3.p02.nsone.net A 198.51.44.2 A 198.51.45.2 A 198.51.44.66 A 198.51.45.66 A 185.51.231.1 A 185.51.231.65 A 185.51.231.129 A 185.51.231.193"
"4","0.003191","192.168.0.1","192.168.0.102","DNS","400","Standard query response 0xaabb A browsec.com A 138.201.57.222 NS ns-1850.awsdns-39.co.uk NS ns-248.awsdns-31.com NS ns-635.awsdns-15.net NS ns-1465.awsdns-55.org A 205.251.192.248 AAAA 2600:9000:5300:f800::1 A 205.251.194.123 AAAA 2600:9000:5302:7b00::1 A 205.251.197.185 AAAA 2600:9000:5305:b900::1 A 205.251.199.58 AAAA 2600:9000:5307:3a00::1"
"5","0.004865","192.168.0.102","192.168.0.1","DNS","88","Standard query 0x0b7d A drah7iczdw1tu.cloudfront.net"
"6","0.014954","192.168.0.102","192.168.0.255","NBNS","92","Name query NB WPAD<00>"
"7","0.027102","fe80::6c53:d78a:dbf9:cacc","ff02::1:3","LLMNR","84","Standard query 0x3196 A wpad"
"8","0.027177","192.168.0.1","192.168.0.102","DNS","529","Standard query response 0x0b7d A drah7iczdw1tu.cloudfront.net A 13.33.23.196 A 13.33.23.41 A 13.33.23.191 A 13.33.23.194 A 13.33.23.203 A 13.33.23.22 A 13.33.23.213 A 13.33.23.177 NS ns-634.awsdns-15.net NS ns-317.awsdns-39.com NS ns-1199.awsdns-21.org NS ns-1563.awsdns-03.co.uk A 205.251.193.61 AAAA 2600:9000:5301:3d00::1 A 205.251.194.122 AAAA 2600:9000:5302:7a00::1 A 205.251.196.175 AAAA 2600:9000:5304:af00::1 A 205.251.198.27 AAAA 2600:9000:5306:1b00::1"
"9","0.029588","192.168.0.102","192.168.0.1","DNS","84","Standard query 0x9783 A ssl.google-analytics.com"
"10","0.031196","192.168.0.1","192.168.0.102","DNS","392","Standard query response 0x9783 A ssl.google-analytics.com CNAME ssl-google-analytics.l.google.com A 173.194.73.97 NS ns3.google.com NS ns2.google.com NS ns4.google.com NS ns1.google.com A 216.239.32.10 AAAA 2001:4860:4802:32::a A 216.239.34.10 AAAA 2001:4860:4802:34::a A 216.239.36.10 AAAA 2001:4860:4802:36::a A 216.239.38.10 AAAA 2001:4860:4802:38::a"
"11","0.031864","192.168.0.102","192.168.0.1","DNS","76","Standard query 0x25c6 A publicsuffix.org"
"12","0.039132","192.168.0.102","224.0.0.252","LLMNR","64","Standard query 0x3196 A wpad"
"13","0.043892","192.168.0.102","192.168.0.1","DNS","76","Standard query 0x5be0 A uib.ff.avast.com"
"14","0.045223","192.168.0.1","192.168.0.102","DNS","455","Standard query response 0x5be0 A uib.ff.avast.com CNAME urlinfo.ns1.ff.avast.com A 5.45.59.38 A 5.45.58.99 A 5.45.59.39 NS ns03.ns1dnsavast.com NS dns3.p02.nsone.net NS dns1.p02.nsone.net NS ns04.ns1dnsavast.com NS ns01.ns1dnsavast.com NS dns4.p02.nsone.net NS dns2.p02.nsone.net NS ns02.ns1dnsavast.com A 198.51.44.2 A 198.51.45.2 A 198.51.44.66 A 198.51.45.66 A 185.51.231.1 A 185.51.231.65 A 185.51.231.129 A 185.51.231.193"
"15","0.050220","192.168.0.1","192.168.0.102","DNS","347","Standard query response 0x25c6 A publicsuffix.org A 63.245.213.25 NS ns-2045.awsdns-63.co.uk NS ns-1334.awsdns-38.org NS ns-787.awsdns-34.net NS ns-1.awsdns-00.com A 205.251.192.1 A 205.251.195.19 A 205.251.197.54 AAAA 2600:9000:5305:3600::1 A 205.251.199.253 AAAA 2600:9000:5307:fd00::1"
"16","0.060085","192.168.0.102","192.168.0.1","DNS","67","Standard query 0x7bfd A mail.ru"
"17","0.063209","192.168.0.1","192.168.0.102","DNS","317","Standard query response 0x7bfd A mail.ru A 94.100.180.200 A 217.69.139.201 A 217.69.139.200 A 94.100.180.201 NS ns1.mail.ru NS ns2.mail.ru NS ns3.mail.ru A 217.69.139.112 AAAA 2a00:1148:db00::2 A 94.100.180.138 AAAA 2a00:1148:db00::1 A 185.30.176.202 AAAA 2a00:1148:db00::2"
"18","0.494315","fe80::6c53:d78a:dbf9:cacc","ff02::1:3","LLMNR","84","Standard query 0x3196 A wpad"
"19","0.494449","192.168.0.102","224.0.0.252","LLMNR","64","Standard query 0x3196 A wpad"
"20","0.720335","192.168.0.1","239.255.255.250","SSDP","306","NOTIFY * HTTP/1.1 "
"21","0.756412","192.168.0.102","192.168.0.255","NBNS","92","Name query NB WPAD<00>"
"22","0.823885","192.168.0.1","239.255.255.250","SSDP","315","NOTIFY * HTTP/1.1 "
"23","0.927963","192.168.0.1","239.255.255.250","SSDP","378","NOTIFY * HTTP/1.1 "
"24","1.008100","192.168.0.102","46.4.235.72","TCP","66","50021  >  80 [SYN] Seq=0 Win=8192 Len=0 MSS=1460 WS=256 SACK_PERM=1"
"25","1.012799","192.168.0.102","192.168.0.1","DNS","76","Standard query 0xc13f A mtalk.google.com"
"26","1.014843","192.168.0.102","46.4.235.70","TCP","66","50022  >  80 [SYN] Seq=0 Win=8192 Len=0 MSS=1460 WS=256 SACK_PERM=1"
"27","1.016313","192.168.0.1","192.168.0.102","DNS","369","Standard query response 0xc13f A mtalk.google.com CNAME mobile-gtalk.l.google.com A 64.233.162.188 NS ns4.google.com NS ns1.google.com NS ns3.google.com NS ns2.google.com A 216.239.32.10 AAAA 2001:4860:4802:32::a A 216.239.34.10 AAAA 2001:4860:4802:34::a A 216.239.36.10 AAAA 2001:4860:4802:36::a A 216.239.38.10 AAAA 2001:4860:4802:38::a"
"28","1.016452","192.168.0.102","46.4.235.70","TCP","66","50023  >  80 [SYN] Seq=0 Win=8192 Len=0 MSS=1460 WS=256 SACK_PERM=1"
"29","1.020692","192.168.0.102","64.233.162.188","TCP","66","50024  >  5228 [SYN] Seq=0 Win=8192 Len=0 MSS=1460 WS=256 SACK_PERM=1"
"30","1.025477","64.233.162.188","192.168.0.102","TCP","66","5228  >  50024 [SYN, ACK] Seq=0 Ack=1 Win=42780 Len=0 MSS=1380 SACK_PERM=1 WS=256"
"31","1.028066","192.168.0.102","64.233.162.188","TCP","54","50024  >  5228 [ACK] Seq=1 Ack=1 Win=66048 Len=0"
"32","1.028316","192.168.0.102","64.233.162.188","TCP","240","50024  >  5228 [PSH, ACK] Seq=1 Ack=1 Win=66048 Len=186"
"33","1.032027","192.168.0.1","239.255.255.250","SSDP","370","NOTIFY * HTTP/1.1 "
"34","1.034034","64.233.162.188","192.168.0.102","TCP","60","5228  >  50024 [ACK] Seq=1 Ack=187 Win=44032 Len=0"
"35","1.034035","64.233.162.188","192.168.0.102","TCP","1484","5228  >  50024 [ACK] Seq=1 Ack=187 Win=44032 Len=1430"
"36","1.034036","64.233.162.188","192.168.0.102","TCP","1484","5228  >  50024 [ACK] Seq=1431 Ack=187 Win=44032 Len=1430"
"37","1.034037","64.233.162.188","192.168.0.102","TCP","1484","5228  >  50024 [ACK] Seq=2861 Ack=187 Win=44032 Len=1430"
"38","1.034038","64.233.162.188","192.168.0.102","TCP","126","5228  >  50024 [PSH, ACK] Seq=4291 Ack=187 Win=44032 Len=72"
"39","1.034114","192.168.0.102","64.233.162.188","TCP","54","50024  >  5228 [ACK] Seq=187 Ack=4363 Win=66048 Len=0"
"40","1.047053","46.4.235.72","192.168.0.102","TCP","66","80  >  50021 [SYN, ACK] Seq=0 Ack=1 Win=14600 Len=0 MSS=1460 SACK_PERM=1 WS=512"
"41","1.049091","192.168.0.102","46.4.235.72","TCP","54","50021  >  80 [ACK] Seq=1 Ack=1 Win=65536 Len=0"
"42","1.051037","46.4.235.70","192.168.0.102","TCP","66","80  >  50022 [SYN, ACK] Seq=0 Ack=1 Win=14600 Len=0 MSS=1460 SACK_PERM=1 WS=512"
"43","1.053395","192.168.0.102","46.4.235.70","TCP","54","50022  >  80 [ACK] Seq=1 Ack=1 Win=65536 Len=0"
"44","1.054331","46.4.235.70","192.168.0.102","TCP","66","80  >  50023 [SYN, ACK] Seq=0 Ack=1 Win=14600 Len=0 MSS=1460 SACK_PERM=1 WS=512"
"45","1.056494","192.168.0.102","46.4.235.70","TCP","54","50023  >  80 [ACK] Seq=1 Ack=1 Win=65536 Len=0"
"46","1.136121","192.168.0.1","239.255.255.250","SSDP","315","NOTIFY * HTTP/1.1 "
"47","1.205405","192.168.0.102","173.194.73.97","QUIC","1392","Client Hello, PKN: 1, CID: 638633674934579938"
"48","1.205820","192.168.0.102","46.4.235.72","HTTP","458","GET / HTTP/1.1 "
"49","1.207449","192.168.0.102","13.33.23.196","TCP","66","50025  >  443 [SYN] Seq=0 Win=8192 Len=0 MSS=1460 WS=256 SACK_PERM=1"
"50","1.211176","173.194.73.97","192.168.0.102","QUIC","1392","Rejection, PKN: 1, CID: 638633674934579938"
"51","1.211178","173.194.73.97","192.168.0.102","QUIC","1392","Payload (Encrypted), PKN: 2, CID: 638633674934579938"
"52","1.217443","192.168.0.102","173.194.73.97","QUIC","80","Payload (Encrypted), PKN: 2, CID: 638633674934579938"
"53","1.219108","192.168.0.102","173.194.73.97","TCP","66","50026  >  443 [SYN] Seq=0 Win=8192 Len=0 MSS=1460 WS=256 SACK_PERM=1"
"54","1.222189","13.33.23.196","192.168.0.102","TCP","66","443  >  50025 [SYN, ACK] Seq=0 Ack=1 Win=29200 Len=0 MSS=1460 SACK_PERM=1 WS=256"
"55","1.224899","192.168.0.102","13.33.23.196","TCP","54","50025  >  443 [ACK] Seq=1 Ack=1 Win=65536 Len=0"
"56","1.225046","173.194.73.97","192.168.0.102","TCP","66","443  >  50026 [SYN, ACK] Seq=0 Ack=1 Win=42780 Len=0 MSS=1380 SACK_PERM=1 WS=256"
"57","1.225072","192.168.0.102","13.33.23.196","TLSv1.2","270","Client Hello"
"58","1.227985","192.168.0.102","173.194.73.97","TCP","54","50026  >  443 [ACK] Seq=1 Ack=1 Win=66048 Len=0"
"59","1.228441","192.168.0.102","173.194.73.97","TLSv1.2","266","Client Hello"
"60","1.235537","173.194.73.97","192.168.0.102","TCP","60","443  >  50026 [ACK] Seq=1 Ack=213 Win=44032 Len=0"
"61","1.235538","173.194.73.97","192.168.0.102","TLSv1.2","1484","Server Hello"
"62","1.235539","173.194.73.97","192.168.0.102","TLSv1.2","1484","Certificate [TCP segment of a reassembled PDU]"
"63","1.235540","173.194.73.97","192.168.0.102","TLSv1.2","324","Server Key Exchange, Server Hello Done"
"64","1.235631","192.168.0.102","173.194.73.97","TCP","54","50026  >  443 [ACK] Seq=213 Ack=3131 Win=66048 Len=0"
"65","1.236171","173.194.73.97","192.168.0.102","QUIC","80","Payload (Encrypted), PKN: 3, CID: 638633674934579938"
"66","1.239179","13.33.23.196","192.168.0.102","TCP","60","443  >  50025 [ACK] Seq=1 Ack=217 Win=30464 Len=0"
"67","1.240188","192.168.0.1","239.255.255.250","SSDP","354","NOTIFY * HTTP/1.1 "
"68","1.243193","46.4.235.72","192.168.0.102","TCP","60","80  >  50021 [ACK] Seq=1 Ack=405 Win=15872 Len=0"
"69","1.243195","46.4.235.72","192.168.0.102","HTTP","391","HTTP/1.1 302 Found  (text/html)"
"70","1.243195","13.33.23.196","192.168.0.102","TLSv1.2","1514","Server Hello"
"71","1.243196","13.33.23.196","192.168.0.102","TCP","1514","443  >  50025 [ACK] Seq=1461 Ack=217 Win=30464 Len=1460 [TCP segment of a reassembled PDU]"
"72","1.243197","13.33.23.196","192.168.0.102","TLSv1.2","1514","Certificate [TCP segment of a reassembled PDU]"
"73","1.243198","13.33.23.196","192.168.0.102","TLSv1.2","617","Certificate Status, Server Key Exchange, Server Hello Done"
"74","1.243296","192.168.0.102","13.33.23.196","TCP","54","50025  >  443 [ACK] Seq=217 Ack=4944 Win=65536 Len=0"
"75","1.246332","192.168.0.102","13.33.23.196","TLSv1.2","180","Client Key Exchange, Change Cipher Spec, Encrypted Handshake Message"
"76","1.254900","192.168.0.102","192.168.0.1","DNS","67","Standard query 0xdb9f A msrv.su"
"77","1.256194","192.168.0.1","192.168.0.102","DNS","285","Standard query response 0xdb9f A msrv.su A 176.9.18.162 NS ns1.first-ns.de NS robotns3.second-ns.com NS robotns2.second-ns.de A 213.239.242.238 AAAA 2a01:4f8:0:a101::a:1 A 213.133.105.6 A 193.47.99.3 AAAA 2001:67c:192c::add:a3"
"78","1.260561","192.168.0.102","176.9.18.162","TCP","66","50027  >  443 [SYN] Seq=0 Win=8192 Len=0 MSS=1460 WS=256 SACK_PERM=1"
"79","1.262165","13.33.23.196","192.168.0.102","TLSv1.2","312","New Session Ticket, Change Cipher Spec, Encrypted Handshake Message"
"80","1.262303","192.168.0.102","176.9.18.162","TCP","66","50028  >  443 [SYN] Seq=0 Win=8192 Len=0 MSS=1460 WS=256 SACK_PERM=1"
"81","1.265715","192.168.0.102","13.33.23.196","TLSv1.2","402","Application Data"
"82","1.293666","192.168.0.102","64.233.162.188","TCP","312","50024  >  5228 [PSH, ACK] Seq=187 Ack=4363 Win=66048 Len=258"
"83","1.294327","192.168.0.102","173.194.73.97","TLSv1.2","312","Client Key Exchange, Change Cipher Spec, Encrypted Handshake Message, Encrypted Handshake Message"
"84","1.295259","192.168.0.102","46.4.235.72","TCP","54","50021  >  80 [ACK] Seq=405 Ack=338 Win=65280 Len=0"
"85","1.295999","192.168.0.102","173.194.73.97","QUIC","1392","Client Hello, PKN: 3, CID: 638633674934579938"
"86","1.296394","192.168.0.102","173.194.73.97","QUIC","277","Payload (Encrypted), PKN: 4, CID: 638633674934579938"
"87","1.297257","176.9.18.162","192.168.0.102","TCP","66","443  >  50027 [SYN, ACK] Seq=0 Ack=1 Win=29200 Len=0 MSS=1460 SACK_PERM=1 WS=512"
"88","1.298866","192.168.0.102","46.4.235.70","HTTP","1087","GET /?token=ziqh0 HTTP/1.1 "
"89","1.299551","173.194.73.97","192.168.0.102","TLSv1.2","375","New Session Ticket, Change Cipher Spec, Encrypted Handshake Message"
"90","1.299555","173.194.73.97","192.168.0.102","TLSv1.2","123","Application Data"
"91","1.299680","192.168.0.102","173.194.73.97","TCP","54","50026  >  443 [ACK] Seq=471 Ack=3521 Win=65792 Len=0"
"92","1.299789","192.168.0.102","176.9.18.162","TCP","54","50027  >  443 [ACK] Seq=1 Ack=1 Win=65536 Len=0"
"93","1.299945","192.168.0.102","176.9.18.162","TLSv1.2","249","Client Hello"
"94","1.300224","64.233.162.188","192.168.0.102","TCP","375","5228  >  50024 [PSH, ACK] Seq=4363 Ack=445 Win=45056 Len=321"
"95","1.300225","176.9.18.162","192.168.0.102","TCP","66","443  >  50028 [SYN, ACK] Seq=0 Ack=1 Win=29200 Len=0 MSS=1460 SACK_PERM=1 WS=512"
"96","1.302469","192.168.0.102","176.9.18.162","TCP","54","50028  >  443 [ACK] Seq=1 Ack=1 Win=65536 Len=0"
"97","1.302632","192.168.0.102","176.9.18.162","TLSv1.2","249","Client Hello"
"98","1.303230","173.194.73.97","192.168.0.102","QUIC","1392","Payload (Encrypted), PKN: 4"
"99","1.303231","173.194.73.97","192.168.0.102","QUIC","73","Payload (Encrypted), PKN: 5"
"100","1.303231","173.194.73.97","192.168.0.102","QUIC","72","Payload (Encrypted), PKN: 6"
"101","1.303231","173.194.73.97","192.168.0.102","QUIC","230","Payload (Encrypted), PKN: 7"
"102","1.305620","192.168.0.102","173.194.73.97","QUIC","83","Payload (Encrypted), PKN: 5, CID: 638633674934579938"
"103","1.305774","192.168.0.102","173.194.73.97","QUIC","83","Payload (Encrypted), PKN: 6, CID: 638633674934579938"
"104","1.306056","192.168.0.102","64.233.162.188","TCP","238","50024  >  5228 [PSH, ACK] Seq=445 Ack=4684 Win=65792 Len=184"
"105","1.311023","64.233.162.188","192.168.0.102","TCP","84","5228  >  50024 [PSH, ACK] Seq=4684 Ack=629 Win=46080 Len=30"
"106","1.313929","64.233.162.188","192.168.0.102","TCP","173","5228  >  50024 [PSH, ACK] Seq=4714 Ack=629 Win=46080 Len=119"
"107","1.313986","192.168.0.102","64.233.162.188","TCP","54","50024  >  5228 [ACK] Seq=629 Ack=4833 Win=65536 Len=0"
"108","1.315554","64.233.162.188","192.168.0.102","TCP","188","5228  >  50024 [PSH, ACK] Seq=4833 Ack=629 Win=46080 Len=134"
"109","1.323251","13.33.23.196","192.168.0.102","TCP","60","443  >  50025 [ACK] Seq=5202 Ack=691 Win=31488 Len=0"
"110","1.331031","192.168.0.102","173.194.73.97","QUIC","80","Payload (Encrypted), PKN: 7, CID: 638633674934579938"
"111","1.335255","46.4.235.70","192.168.0.102","TCP","60","80  >  50022 [ACK] Seq=1 Ack=1034 Win=16896 Len=0"
"112","1.336255","173.194.73.97","192.168.0.102","QUIC","72","Payload (Encrypted), PKN: 8"
"113","1.336256","176.9.18.162","192.168.0.102","TCP","60","443  >  50027 [ACK] Seq=1 Ack=196 Win=30720 Len=0"
"114","1.338255","46.4.235.70","192.168.0.102","HTTP","965","HTTP/1.1 200 OK  (text/html)"
"115","1.340263","176.9.18.162","192.168.0.102","TLSv1.2","1514","Server Hello"
"116","1.340265","176.9.18.162","192.168.0.102","TCP","1514","443  >  50027 [ACK] Seq=1461 Ack=196 Win=30720 Len=1460 [TCP segment of a reassembled PDU]"
"117","1.340266","176.9.18.162","192.168.0.102","TLSv1.2","1422","Certificate, Server Key Exchange, Server Hello Done"
"118","1.340364","192.168.0.102","176.9.18.162","TCP","54","50027  >  443 [ACK] Seq=196 Ack=4289 Win=65536 Len=0"
"119","1.341251","176.9.18.162","192.168.0.102","TCP","60","443  >  50028 [ACK] Seq=1 Ack=196 Win=30720 Len=0"
"120","1.342829","192.168.0.102","176.9.18.162","TLSv1.2","180","Client Key Exchange, Change Cipher Spec, Encrypted Handshake Message"
"121","1.344284","192.168.0.1","239.255.255.250","SSDP","386","NOTIFY * HTTP/1.1 "
"122","1.347273","176.9.18.162","192.168.0.102","TLSv1.2","1514","Server Hello"
"123","1.347275","176.9.18.162","192.168.0.102","TCP","1514","443  >  50028 [ACK] Seq=1461 Ack=196 Win=30720 Len=1460 [TCP segment of a reassembled PDU]"
"124","1.347276","176.9.18.162","192.168.0.102","TLSv1.2","1422","Certificate, Server Key Exchange, Server Hello Done"
"125","1.347370","192.168.0.102","176.9.18.162","TCP","54","50028  >  443 [ACK] Seq=196 Ack=4289 Win=65536 Len=0"
"126","1.350400","192.168.0.102","176.9.18.162","TLSv1.2","180","Client Key Exchange, Change Cipher Spec, Encrypted Handshake Message"
"127","1.363331","192.168.0.102","64.233.162.188","TCP","54","50024  >  5228 [ACK] Seq=629 Ack=4967 Win=65536 Len=0"
"128","1.365236","192.168.0.102","13.33.23.196","TCP","66","50029  >  443 [SYN] Seq=0 Win=8192 Len=0 MSS=1460 WS=256 SACK_PERM=1"
"129","1.380296","13.33.23.196","192.168.0.102","TCP","66","443  >  50029 [SYN, ACK] Seq=0 Ack=1 Win=29200 Len=0 MSS=1460 SACK_PERM=1 WS=256"
"130","1.380297","176.9.18.162","192.168.0.102","TLSv1.2","312","New Session Ticket, Change Cipher Spec, Encrypted Handshake Message"
"131","1.382958","192.168.0.102","13.33.23.196","TCP","54","50029  >  443 [ACK] Seq=1 Ack=1 Win=65536 Len=0"
"132","1.383390","192.168.0.102","13.33.23.196","TLSv1.2","571","Client Hello"
"133","1.389248","192.168.0.102","46.4.235.70","TCP","54","50022  >  80 [ACK] Seq=1034 Ack=912 Win=64768 Len=0"
"134","1.389289","176.9.18.162","192.168.0.102","TLSv1.2","312","New Session Ticket, Change Cipher Spec, Encrypted Handshake Message"
"135","1.389393","192.168.0.102","5.45.59.38","TCP","66","50030  >  80 [SYN] Seq=0 Win=8192 Len=0 MSS=1460 WS=256 SACK_PERM=1"
"136","1.398309","13.33.23.196","192.168.0.102","TCP","60","443  >  50029 [ACK] Seq=1 Ack=518 Win=30464 Len=0"
"137","1.398310","13.33.23.196","192.168.0.102","TLSv1.2","210","Server Hello, Change Cipher Spec, Encrypted Handshake Message"
"138","1.398966","192.168.0.102","13.33.23.196","TLSv1.2","105","Change Cipher Spec, Encrypted Handshake Message"
"139","1.401924","192.168.0.102","13.33.23.196","TLSv1.2","488","Application Data"
"140","1.416338","13.33.23.196","192.168.0.102","TCP","60","443  >  50029 [ACK] Seq=157 Ack=1003 Win=31488 Len=0"
"141","1.418328","192.168.0.102","192.168.0.1","DNS","89","Standard query 0xb764 A clientservices.googleapis.com"
"142","1.419374","192.168.0.1","192.168.0.102","DNS","360","Standard query response 0xb764 A clientservices.googleapis.com A 173.194.221.94 NS ns2.google.com NS ns3.google.com NS ns1.google.com NS ns4.google.com A 216.239.32.10 AAAA 2001:4860:4802:32::a A 216.239.34.10 AAAA 2001:4860:4802:34::a A 216.239.36.10 AAAA 2001:4860:4802:36::a A 216.239.38.10 AAAA 2001:4860:4802:38::a"
"143","1.421029","192.168.0.102","192.168.0.1","DNS","84","Standard query 0xaa2f A translate.googleapis.com"
"144","1.425279","192.168.0.102","173.194.221.94","TCP","66","50031  >  443 [SYN] Seq=0 Win=8192 Len=0 MSS=1460 WS=256 SACK_PERM=1"
"145","1.428706","192.168.0.1","192.168.0.102","DNS","355","Standard query response 0xaa2f A translate.googleapis.com A 173.194.221.95 NS ns2.google.com NS ns1.google.com NS ns4.google.com NS ns3.google.com A 216.239.32.10 AAAA 2001:4860:4802:32::a A 216.239.34.10 AAAA 2001:4860:4802:34::a A 216.239.36.10 AAAA 2001:4860:4802:36::a A 216.239.38.10 AAAA 2001:4860:4802:38::a"
"146","1.429376","192.168.0.102","176.9.18.162","TCP","54","50027  >  443 [ACK] Seq=322 Ack=4547 Win=65280 Len=0"
"147","1.433149","192.168.0.102","173.194.221.95","TCP","66","50032  >  443 [SYN] Seq=0 Win=8192 Len=0 MSS=1460 WS=256 SACK_PERM=1"
"148","1.433256","173.194.221.94","192.168.0.102","TCP","66","443  >  50031 [SYN, ACK] Seq=0 Ack=1 Win=42780 Len=0 MSS=1380 SACK_PERM=1 WS=256"
"149","1.435866","192.168.0.102","173.194.221.94","TCP","54","50031  >  443 [ACK] Seq=1 Ack=1 Win=66048 Len=0"
"150","1.436308","192.168.0.102","173.194.221.94","TLSv1.2","267","Client Hello"
"151","1.439335","173.194.221.95","192.168.0.102","TCP","66","443  >  50032 [SYN, ACK] Seq=0 Ack=1 Win=42780 Len=0 MSS=1380 SACK_PERM=1 WS=256"
"152","1.442005","192.168.0.102","173.194.221.95","TCP","54","50032  >  443 [ACK] Seq=1 Ack=1 Win=66048 Len=0"
"153","1.442172","192.168.0.102","173.194.221.95","TLSv1.2","262","Client Hello"
"154","1.442503","173.194.221.94","192.168.0.102","TCP","60","443  >  50031 [ACK] Seq=1 Ack=214 Win=44032 Len=0"
"155","1.442503","173.194.221.94","192.168.0.102","TLSv1.2","1484","Server Hello"
"156","1.442504","173.194.221.94","192.168.0.102","TLSv1.2","1278","Certificate, Server Key Exchange, Server Hello Done"
"157","1.442569","192.168.0.102","173.194.221.94","TCP","54","50031  >  443 [ACK] Seq=214 Ack=2655 Win=66048 Len=0"
"158","1.444526","192.168.0.102","173.194.221.94","TLSv1.2","147","Client Key Exchange, Change Cipher Spec, Encrypted Handshake Message"
"159","1.447546","173.194.221.95","192.168.0.102","TCP","60","443  >  50032 [ACK] Seq=1 Ack=209 Win=44032 Len=0"
"160","1.447547","173.194.221.95","192.168.0.102","TLSv1.2","1484","Server Hello"
"161","1.447548","173.194.221.95","192.168.0.102","TLSv1.2","1279","Certificate, Server Key Exchange, Server Hello Done"
"162","1.447657","192.168.0.102","173.194.221.95","TCP","54","50032  >  443 [ACK] Seq=209 Ack=2656 Win=66048 Len=0"
"163","1.447758","192.168.0.102","176.9.18.162","TCP","54","50028  >  443 [ACK] Seq=322 Ack=4547 Win=65280 Len=0"
"164","1.448334","192.168.0.1","239.255.255.250","SSDP","315","NOTIFY * HTTP/1.1 "
"165","1.449643","192.168.0.102","173.194.221.95","TLSv1.2","147","Client Key Exchange, Change Cipher Spec, Encrypted Handshake Message"
"166","1.449676","173.194.221.94","192.168.0.102","TLSv1.2","338","New Session Ticket, Change Cipher Spec, Encrypted Handshake Message"
"167","1.449677","173.194.221.94","192.168.0.102","TLSv1.2","123","Application Data"
"168","1.449732","192.168.0.102","173.194.221.94","TCP","54","50031  >  443 [ACK] Seq=307 Ack=3008 Win=65792 Len=0"
"169","1.451328","5.45.59.38","192.168.0.102","TCP","66","80  >  50030 [SYN, ACK] Seq=0 Ack=1 Win=2920 Len=0 MSS=1460 SACK_PERM=1 WS=8192"
"170","1.452554","192.168.0.102","173.194.221.94","TLSv1.2","147","Application Data"
"171","1.452903","192.168.0.102","173.194.221.94","TLSv1.2","92","Application Data"
"172","1.453040","192.168.0.102","173.194.221.94","TLSv1.2","322","Application Data"
"173","1.453893","192.168.0.102","5.45.59.38","TCP","54","50030  >  80 [ACK] Seq=1 Ack=1 Win=65536 Len=0"
"174","1.454068","192.168.0.102","5.45.59.38","HTTP","481","GET /v5/ruleUpdate HTTP/1.1 "
"175","1.455790","173.194.221.95","192.168.0.102","TLSv1.2","338","New Session Ticket, Change Cipher Spec, Encrypted Handshake Message"
"176","1.455791","173.194.221.95","192.168.0.102","TLSv1.2","123","Application Data"
"177","1.455870","192.168.0.102","173.194.221.95","TCP","54","50032  >  443 [ACK] Seq=302 Ack=3009 Win=65792 Len=0"
"178","1.458086","192.168.0.102","173.194.221.95","TLSv1.2","147","Application Data"
"179","1.458356","173.194.221.94","192.168.0.102","TLSv1.2","92","Application Data"
"180","1.458357","173.194.221.94","192.168.0.102","TCP","60","443  >  50031 [ACK] Seq=3046 Ack=706 Win=45056 Len=0"
"181","1.458413","192.168.0.102","173.194.221.95","TLSv1.2","92","Application Data"
"182","1.458511","192.168.0.102","173.194.221.95","TLSv1.2","291","Application Data"
"183","1.460650","192.168.0.102","138.201.57.222","TCP","66","50033  >  443 [SYN] Seq=0 Win=8192 Len=0 MSS=1460 WS=256 SACK_PERM=1"
"184","1.463097","173.194.221.94","192.168.0.102","TLSv1.2","299","Application Data"
"185","1.463098","173.194.221.94","192.168.0.102","TLSv1.2","92","Application Data"
"186","1.463098","173.194.221.94","192.168.0.102","TLSv1.2","100","Application Data"
"187","1.463099","173.194.221.95","192.168.0.102","TLSv1.2","92","Application Data"
"188","1.463207","192.168.0.102","173.194.221.94","TCP","54","50031  >  443 [ACK] Seq=706 Ack=3375 Win=65280 Len=0"
"189","1.463756","192.168.0.102","173.194.221.94","TLSv1.2","100","Application Data"
"190","1.464086","173.194.221.95","192.168.0.102","TCP","60","443  >  50032 [ACK] Seq=3047 Ack=670 Win=45056 Len=0"
"191","1.469884","173.194.221.95","192.168.0.102","TLSv1.2","400","Application Data"
"192","1.469885","173.194.221.95","192.168.0.102","TLSv1.2","1249","Application Data"
"193","1.469887","173.194.221.95","192.168.0.102","TLSv1.2","96","Application Data"
"194","1.469887","173.194.221.95","192.168.0.102","TLSv1.2","100","Application Data"
"195","1.469995","192.168.0.102","173.194.221.95","TCP","54","50032  >  443 [ACK] Seq=670 Ack=4676 Win=66048 Len=0"
"196","1.470916","192.168.0.102","173.194.221.95","TLSv1.2","100","Application Data"
"197","1.488374","13.33.23.196","192.168.0.102","TLSv1.2","1304","Application Data"
"198","1.488377","13.33.23.196","192.168.0.102","TLSv1.2","88","Application Data"
"199","1.488490","192.168.0.102","13.33.23.196","TCP","54","50029  >  443 [ACK] Seq=1003 Ack=1441 Win=64256 Len=0"
"200","1.500390","138.201.57.222","192.168.0.102","TCP","66","443  >  50033 [SYN, ACK] Seq=0 Ack=1 Win=29200 Len=0 MSS=1460 SACK_PERM=1 WS=128"
"201","1.502961","192.168.0.102","138.201.57.222","TCP","54","50033  >  443 [ACK] Seq=1 Ack=1 Win=65536 Len=0"
"202","1.503263","192.168.0.102","138.201.57.222","TLSv1.2","253","Client Hello"
"203","1.506457","192.168.0.102","192.168.0.255","NBNS","92","Name query NB WPAD<00>"
"204","1.509407","173.194.221.94","192.168.0.102","TCP","60","443  >  50031 [ACK] Seq=3375 Ack=752 Win=45056 Len=0"
"205","1.515388","5.45.59.38","192.168.0.102","TCP","60","80  >  50030 [ACK] Seq=1 Ack=428 Win=8192 Len=0"
"206","1.516396","5.45.59.38","192.168.0.102","TCP","1514","80  >  50030 [ACK] Seq=1 Ack=428 Win=8192 Len=1460 [TCP segment of a reassembled PDU]"
"207","1.516397","5.45.59.38","192.168.0.102","TCP","1514","80  >  50030 [ACK] Seq=1461 Ack=428 Win=8192 Len=1460 [TCP segment of a reassembled PDU]"
"208","1.516399","5.45.59.38","192.168.0.102","TCP","1514","80  >  50030 [ACK] Seq=2921 Ack=428 Win=8192 Len=1460 [TCP segment of a reassembled PDU]"
"209","1.516400","5.45.59.38","192.168.0.102","TCP","1514","80  >  50030 [ACK] Seq=4381 Ack=428 Win=8192 Len=1460 [TCP segment of a reassembled PDU]"
"210","1.516401","5.45.59.38","192.168.0.102","TCP","1514","80  >  50030 [ACK] Seq=5841 Ack=428 Win=8192 Len=1460 [TCP segment of a reassembled PDU]"
"211","1.516507","192.168.0.102","5.45.59.38","TCP","54","50030  >  80 [ACK] Seq=428 Ack=7301 Win=65536 Len=0"
"212","1.517395","5.45.59.38","192.168.0.102","TCP","1514","80  >  50030 [ACK] Seq=7301 Ack=428 Win=8192 Len=1460 [TCP segment of a reassembled PDU]"
"213","1.517397","5.45.59.38","192.168.0.102","TCP","1514","80  >  50030 [ACK] Seq=8761 Ack=428 Win=8192 Len=1460 [TCP segment of a reassembled PDU]"
"214","1.517399","5.45.59.38","192.168.0.102","TCP","1514","80  >  50030 [ACK] Seq=10221 Ack=428 Win=8192 Len=1460 [TCP segment of a reassembled PDU]"
"215","1.517399","5.45.59.38","192.168.0.102","TCP","1514","80  >  50030 [ACK] Seq=11681 Ack=428 Win=8192 Len=1460 [TCP segment of a reassembled PDU]"
"216","1.517400","5.45.59.38","192.168.0.102","TCP","1514","80  >  50030 [ACK] Seq=13141 Ack=428 Win=8192 Len=1460 [TCP segment of a reassembled PDU]"
"217","1.517496","192.168.0.102","5.45.59.38","TCP","54","50030  >  80 [ACK] Seq=428 Ack=14601 Win=65536 Len=0"
"218","1.518381","173.194.221.95","192.168.0.102","TCP","60","443  >  50032 [ACK] Seq=4676 Ack=716 Win=45056 Len=0"
"219","1.531281","13.33.23.196","192.168.0.102","TCP","1514","443  >  50025 [ACK] Seq=5202 Ack=691 Win=31488 Len=1460 [TCP segment of a reassembled PDU]"
"220","1.532405","13.33.23.196","192.168.0.102","TLSv1.2","889","Application Data"
"221","1.532406","13.33.23.196","192.168.0.102","TLSv1.2","88","Application Data"
"222","1.532487","192.168.0.102","13.33.23.196","TCP","54","50025  >  443 [ACK] Seq=691 Ack=7531 Win=65536 Len=0"
"223","1.541214","138.201.57.222","192.168.0.102","TCP","60","443  >  50033 [ACK] Seq=1 Ack=200 Win=30336 Len=0"
"224","1.546309","192.168.0.102","239.255.255.250","SSDP","216","M-SEARCH * HTTP/1.1 "
"225","1.551643","192.168.0.1","239.255.255.250","SSDP","374","NOTIFY * HTTP/1.1 "
"226","1.553799","138.201.57.222","192.168.0.102","TLSv1.2","1514","Server Hello"
"227","1.553801","138.201.57.222","192.168.0.102","TCP","1514","443  >  50033 [ACK] Seq=1461 Ack=200 Win=30336 Len=1460 [TCP segment of a reassembled PDU]"
"228","1.553802","138.201.57.222","192.168.0.102","TLSv1.2","1514","Certificate [TCP segment of a reassembled PDU]"
"229","1.553804","138.201.57.222","192.168.0.102","TLSv1.2","1017","Certificate Status, Server Key Exchange, Server Hello Done"
"230","1.553903","192.168.0.102","138.201.57.222","TCP","54","50033  >  443 [ACK] Seq=200 Ack=5344 Win=65536 Len=0"
"231","1.560134","192.168.0.102","138.201.57.222","TLSv1.2","180","Client Key Exchange, Change Cipher Spec, Encrypted Handshake Message"
"232","1.578163","5.45.59.38","192.168.0.102","TCP","1514","80  >  50030 [ACK] Seq=14601 Ack=428 Win=8192 Len=1460 [TCP segment of a reassembled PDU]"
"233","1.578164","5.45.59.38","192.168.0.102","TCP","1514","80  >  50030 [PSH, ACK] Seq=16061 Ack=428 Win=8192 Len=1460 [TCP segment of a reassembled PDU]"
"234","1.578264","192.168.0.102","5.45.59.38","TCP","54","50030  >  80 [ACK] Seq=428 Ack=17521 Win=65536 Len=0"
"235","1.579166","5.45.59.38","192.168.0.102","TCP","1514","80  >  50030 [ACK] Seq=17521 Ack=428 Win=8192 Len=1460 [TCP segment of a reassembled PDU]"
"236","1.579169","5.45.59.38","192.168.0.102","TCP","1514","80  >  50030 [ACK] Seq=18981 Ack=428 Win=8192 Len=1460 [TCP segment of a reassembled PDU]"
"237","1.579170","5.45.59.38","192.168.0.102","TCP","1514","80  >  50030 [ACK] Seq=20441 Ack=428 Win=8192 Len=1460 [TCP segment of a reassembled PDU]"
"238","1.579171","5.45.59.38","192.168.0.102","HTTP","669","HTTP/1.1 200 OK  (application/octet-stream)"
"239","1.579272","192.168.0.102","5.45.59.38","TCP","54","50030  >  80 [ACK] Seq=428 Ack=22516 Win=65536 Len=0"
"240","1.599171","138.201.57.222","192.168.0.102","TLSv1.2","312","New Session Ticket, Change Cipher Spec, Encrypted Handshake Message"
"241","1.609818","192.168.0.102","138.201.57.222","TLSv1.2","489","Application Data"
"242","1.650964","138.201.57.222","192.168.0.102","TLSv1.2","1128","Application Data"
"243","1.655698","192.168.0.1","239.255.255.250","SSDP","368","NOTIFY * HTTP/1.1 "
"244","1.669636","192.168.0.102","5.45.59.38","TCP","66","50037  >  443 [SYN] Seq=0 Win=8192 Len=0 MSS=1460 WS=256 SACK_PERM=1"
"245","1.675996","192.168.0.102","176.9.18.162","TLSv1.2","847","Application Data"
"246","1.705787","192.168.0.102","138.201.57.222","TCP","54","50033  >  443 [ACK] Seq=761 Ack=6676 Win=64256 Len=0"
"247","1.713308","176.9.18.162","192.168.0.102","TLSv1.2","520","Application Data"
"248","1.730767","5.45.59.38","192.168.0.102","TCP","66","443  >  50037 [SYN, ACK] Seq=0 Ack=1 Win=2920 Len=0 MSS=1460 SACK_PERM=1 WS=8192"
"249","1.733701","192.168.0.102","5.45.59.38","TCP","54","50037  >  443 [ACK] Seq=1 Ack=1 Win=65536 Len=0"
"250","1.733887","192.168.0.102","5.45.59.38","TLSv1.2","258","Client Hello"
"251","1.735257","192.168.0.102","46.4.235.70","HTTP","1129","GET /9d9/rtk/x5g5 HTTP/1.1 "
"252","1.759873","192.168.0.1","239.255.255.250","SSDP","315","NOTIFY * HTTP/1.1 "
"253","1.762280","192.168.0.102","176.9.18.162","TCP","54","50027  >  443 [ACK] Seq=1115 Ack=5013 Win=64768 Len=0"
"254","1.799705","5.45.59.38","192.168.0.102","TCP","60","443  >  50037 [ACK] Seq=1 Ack=205 Win=8192 Len=0"
"255","1.802889","5.45.59.38","192.168.0.102","TLSv1.2","1514","Server Hello"
"256","1.803658","5.45.59.38","192.168.0.102","TCP","1514","443  >  50037 [ACK] Seq=1461 Ack=205 Win=8192 Len=1460 [TCP segment of a reassembled PDU]"
"257","1.803660","5.45.59.38","192.168.0.102","TLSv1.2","1514","Certificate [TCP segment of a reassembled PDU]"
"258","1.803660","5.45.59.38","192.168.0.102","TLSv1.2","604","Certificate Status, Server Key Exchange, Server Hello Done"
"259","1.803721","192.168.0.102","5.45.59.38","TCP","54","50037  >  443 [ACK] Seq=205 Ack=4931 Win=65536 Len=0"
"260","1.805823","192.168.0.102","5.45.59.38","TLSv1.2","180","Client Key Exchange, Change Cipher Spec, Encrypted Handshake Message"
"261","1.814425","46.4.235.70","192.168.0.102","TCP","60","80  >  50022 [ACK] Seq=912 Ack=2109 Win=18944 Len=0"
"262","1.863639","192.168.0.1","239.255.255.250","SSDP","370","NOTIFY * HTTP/1.1 "
"263","1.867622","5.45.59.38","192.168.0.102","TLSv1.2","312","New Session Ticket, Change Cipher Spec, Encrypted Handshake Message"
"264","1.870384","46.4.235.70","192.168.0.102","HTTP","1203","HTTP/1.1 302 Found  (text/html) (text/html)"
"265","1.875264","192.168.0.102","5.45.59.38","TLSv1.2","1091","Application Data"
"266","1.879037","192.168.0.102","192.168.0.1","DNS","70","Standard query 0x8e21 A prftja.com"
"267","1.880483","192.168.0.1","192.168.0.102","DNS","440","Standard query response 0x8e21 A prftja.com A 88.198.0.60 NS ns2.reg.ru NS ns1.reg.ru A 176.99.13.13 A 176.99.13.15 A 176.99.13.17 A 194.58.117.11 A 194.58.117.13 A 194.58.117.15 A 194.58.117.17 A 176.99.13.11 AAAA 2a00:f940:4::47 A 194.58.117.12 A 194.58.117.14 A 194.58.117.16 A 194.58.117.18 A 176.99.13.12 A 176.99.13.14 A 176.99.13.16 A 176.99.13.18 AAAA 2a00:f940:5::190"
"268","1.887280","192.168.0.102","88.198.0.60","TCP","66","50042  >  443 [SYN] Seq=0 Win=8192 Len=0 MSS=1460 WS=256 SACK_PERM=1"
"269","1.888946","192.168.0.102","88.198.0.60","TCP","66","50043  >  443 [SYN] Seq=0 Win=8192 Len=0 MSS=1460 WS=256 SACK_PERM=1"
"270","1.895572","192.168.0.102","192.168.0.1","DNS","79","Standard query 0x9651 A accounts.google.com"
"271","1.896461","192.168.0.1","192.168.0.102","DNS","343","Standard query response 0x9651 A accounts.google.com A 173.194.221.84 NS ns4.google.com NS ns3.google.com NS ns2.google.com NS ns1.google.com A 216.239.32.10 AAAA 2001:4860:4802:32::a A 216.239.34.10 AAAA 2001:4860:4802:34::a A 216.239.36.10 AAAA 2001:4860:4802:36::a A 216.239.38.10 AAAA 2001:4860:4802:38::a"
"272","1.903417","192.168.0.102","173.194.221.84","QUIC","1392","Client Hello, PKN: 1, CID: 12046187412198497246"
"273","1.905315","192.168.0.102","173.194.221.84","TCP","66","50044  >  443 [SYN] Seq=0 Win=8192 Len=0 MSS=1460 WS=256 SACK_PERM=1"
"274","1.908982","173.194.221.84","192.168.0.102","QUIC","1392","Rejection, PKN: 1, CID: 12046187412198497246"
"275","1.909522","192.168.0.102","5.45.59.38","TCP","66","50045  >  443 [SYN] Seq=0 Win=8192 Len=0 MSS=1460 WS=256 SACK_PERM=1"
"276","1.910163","173.194.221.84","192.168.0.102","QUIC","1392","Payload (Encrypted), PKN: 2, CID: 12046187412198497246"
"277","1.911063","173.194.221.84","192.168.0.102","TCP","66","443  >  50044 [SYN, ACK] Seq=0 Ack=1 Win=42780 Len=0 MSS=1380 SACK_PERM=1 WS=256"
"278","1.913361","192.168.0.102","173.194.221.84","TCP","54","50044  >  443 [ACK] Seq=1 Ack=1 Win=66048 Len=0"
"279","1.913393","192.168.0.102","173.194.221.84","QUIC","80","Payload (Encrypted), PKN: 2, CID: 12046187412198497246"
"280","1.913617","192.168.0.102","173.194.221.84","TLSv1.2","261","Client Hello"
"281","1.916189","192.168.0.102","173.194.221.84","QUIC","1392","Client Hello, PKN: 3, CID: 12046187412198497246"
"282","1.918414","173.194.221.84","192.168.0.102","TCP","60","443  >  50044 [ACK] Seq=1 Ack=208 Win=44032 Len=0"
"283","1.920422","173.194.221.84","192.168.0.102","TLSv1.2","1484","Server Hello"
"284","1.920423","173.194.221.84","192.168.0.102","TCP","1484","443  >  50044 [ACK] Seq=1431 Ack=208 Win=44032 Len=1430 [TCP segment of a reassembled PDU]"
"285","1.920424","173.194.221.84","192.168.0.102","TLSv1.2","1017","Certificate, Server Key Exchange, Server Hello Done"
"286","1.920498","192.168.0.102","173.194.221.84","TCP","54","50044  >  443 [ACK] Seq=208 Ack=3824 Win=66048 Len=0"
"287","1.922151","173.194.221.84","192.168.0.102","QUIC","1392","Payload (Encrypted), PKN: 3"
"288","1.922151","173.194.221.84","192.168.0.102","QUIC","73","Payload (Encrypted), PKN: 4"
"289","1.922435","192.168.0.102","46.4.235.70","TCP","54","50022  >  80 [ACK] Seq=2109 Ack=2061 Win=65536 Len=0"
"290","1.922508","192.168.0.102","173.194.221.84","TLSv1.2","312","Client Key Exchange, Change Cipher Spec, Encrypted Handshake Message, Encrypted Handshake Message"
"291","1.923078","192.168.0.102","173.194.221.84","QUIC","81","Payload (Encrypted), PKN: 4, CID: 12046187412198497246"
"292","1.923201","192.168.0.102","173.194.221.84","QUIC","80","Payload (Encrypted), PKN: 5, CID: 12046187412198497246"
"293","1.923491","192.168.0.102","173.194.221.84","QUIC","1210","Payload (Encrypted), PKN: 6, CID: 12046187412198497246"
"294","1.923563","192.168.0.102","173.194.221.84","QUIC","67","Payload (Encrypted), PKN: 7, CID: 12046187412198497246"
"295","1.924971","88.198.0.60","192.168.0.102","TCP","66","443  >  50043 [SYN, ACK] Seq=0 Ack=1 Win=29200 Len=0 MSS=1460 SACK_PERM=1 WS=512"
"296","1.927299","192.168.0.102","88.198.0.60","TCP","54","50043  >  443 [ACK] Seq=1 Ack=1 Win=65536 Len=0"
"297","1.927526","192.168.0.102","88.198.0.60","TLSv1.2","252","Client Hello"
"298","1.928093","88.198.0.60","192.168.0.102","TCP","66","443  >  50042 [SYN, ACK] Seq=0 Ack=1 Win=29200 Len=0 MSS=1460 SACK_PERM=1 WS=512"
"299","1.928102","173.194.221.84","192.168.0.102","TLSv1.2","375","New Session Ticket, Change Cipher Spec, Encrypted Handshake Message"
"300","1.928102","173.194.221.84","192.168.0.102","TLSv1.2","123","Application Data"
"301","1.928180","192.168.0.102","173.194.221.84","TCP","54","50044  >  443 [ACK] Seq=466 Ack=4214 Win=65792 Len=0"
"302","1.930193","192.168.0.102","88.198.0.60","TCP","54","50042  >  443 [ACK] Seq=1 Ack=1 Win=65536 Len=0"
"303","1.930291","173.194.221.84","192.168.0.102","QUIC","78","Payload (Encrypted), PKN: 5"
"304","1.930359","192.168.0.102","88.198.0.60","TLSv1.2","252","Client Hello"
"305","1.937437","5.45.59.38","192.168.0.102","TLSv1.2","275","Application Data"
"306","1.938445","173.194.221.84","192.168.0.102","QUIC","1095","Payload (Encrypted), PKN: 6"
"307","1.938446","173.194.221.84","192.168.0.102","QUIC","70","Payload (Encrypted), PKN: 7"
"308","1.938447","173.194.221.84","192.168.0.102","QUIC","130","Payload (Encrypted), PKN: 8"
"309","1.938779","192.168.0.102","173.194.221.84","QUIC","83","Payload (Encrypted), PKN: 8, CID: 12046187412198497246"
"310","1.938998","192.168.0.102","5.45.59.38","TLSv1.2","1135","Application Data"
"311","1.964240","192.168.0.102","173.194.221.84","QUIC","77","Payload (Encrypted), PKN: 9, CID: 12046187412198497246"
"312","1.964454","88.198.0.60","192.168.0.102","TCP","60","443  >  50043 [ACK] Seq=1 Ack=199 Win=30720 Len=0"
"313","1.966210","88.198.0.60","192.168.0.102","TLSv1.2","1514","Server Hello"
"314","1.966213","88.198.0.60","192.168.0.102","TLSv1.2","1514","Certificate [TCP segment of a reassembled PDU]"
"315","1.966214","88.198.0.60","192.168.0.102","TLSv1.2","571","Certificate Status, Server Key Exchange, Server Hello Done"
"316","1.966311","192.168.0.102","88.198.0.60","TCP","54","50043  >  443 [ACK] Seq=199 Ack=3438 Win=65536 Len=0"
"317","1.968462","192.168.0.1","239.255.255.250","SSDP","380","NOTIFY * HTTP/1.1 "
"318","1.970158","192.168.0.102","88.198.0.60","TLSv1.2","180","Client Key Exchange, Change Cipher Spec, Encrypted Handshake Message"
"319","1.970536","5.45.59.38","192.168.0.102","TCP","66","443  >  50045 [SYN, ACK] Seq=0 Ack=1 Win=2920 Len=0 MSS=1460 SACK_PERM=1 WS=8192"
"320","1.970543","88.198.0.60","192.168.0.102","TCP","60","443  >  50042 [ACK] Seq=1 Ack=199 Win=30720 Len=0"
"321","1.970544","88.198.0.60","192.168.0.102","TLSv1.2","1514","Server Hello"
"322","1.970545","88.198.0.60","192.168.0.102","TLSv1.2","1514","Certificate [TCP segment of a reassembled PDU]"
"323","1.970546","88.198.0.60","192.168.0.102","TLSv1.2","571","Certificate Status, Server Key Exchange, Server Hello Done"
"324","1.970647","192.168.0.102","88.198.0.60","TCP","54","50042  >  443 [ACK] Seq=199 Ack=3438 Win=65536 Len=0"
