"No.","Time","Source","Destination","Protocol","Length","Info"
"1","0.000000000","192.168.1.34","13.74.191.167","TCP","66","35098  >  443 [ACK] Seq=1 Ack=1 Win=385 Len=0 TSval=4280400079 TSecr=26732810"
"2","0.060709770","13.79.241.202","192.168.1.34","TLSv1.2","1514","Ignored Unknown Record"
"3","0.060735672","192.168.1.34","13.79.241.202","TCP","66","57690  >  443 [ACK] Seq=1 Ack=1449 Win=296 Len=0 TSval=2358727739 TSecr=172554790"
"4","0.064267716","13.79.241.202","192.168.1.34","TLSv1.2","1341","Ignored Unknown Record"
"5","0.064289585","192.168.1.34","13.79.241.202","TCP","66","57690  >  443 [ACK] Seq=1 Ack=2724 Win=319 Len=0 TSval=2358727742 TSecr=172554790"
"6","0.066447922","192.168.1.34","13.79.241.202","TLSv1.2","216","Client Key Exchange, Change Cipher Spec, Encrypted Handshake Message"
"7","0.084896184","13.74.191.167","192.168.1.34","SSL","1514","Continuation Data"
"8","0.084919604","192.168.1.34","13.74.191.167","TCP","78","[TCP Window Update] 35098  >  443 [ACK] Seq=1 Ack=1 Win=407 Len=0 TSval=4280400205 TSecr=26732810 SLE=1449 SRE=2897"
"9","0.097500093","13.74.191.167","192.168.1.34","SSL","1514","Continuation Data"
"10","0.097522871","192.168.1.34","13.74.191.167","TCP","78","[TCP Window Update] 35098  >  443 [ACK] Seq=1 Ack=1 Win=430 Len=0 TSval=4280400218 TSecr=26732810 SLE=1449 SRE=4345"
"11","0.162949065","13.79.241.202","192.168.1.34","TLSv1.2","141","Change Cipher Spec, Encrypted Handshake Message"
"12","0.195459679","13.74.191.167","192.168.1.34","TCP","1514","[TCP Retransmission] 443  >  35098 [PSH, ACK] Seq=1 Ack=1 Win=512 Len=1448 TSval=26732847 TSecr=4280400205"
"13","0.195509667","192.168.1.34","13.74.191.167","TCP","66","35098  >  443 [ACK] Seq=1 Ack=4345 Win=452 Len=0 TSval=4280400316 TSecr=26732847"
"14","0.204032314","192.168.1.34","13.79.241.202","TCP","66","57690  >  443 [ACK] Seq=151 Ack=2799 Win=319 Len=0 TSval=2358727841 TSecr=172554801"
"15","0.448234272","13.74.191.167","192.168.1.34","SSL","1514","[TCP Previous segment not captured] , Continuation Data"
"16","0.448275082","192.168.1.34","13.74.191.167","TCP","78","[TCP Window Update] 35098  >  443 [ACK] Seq=1 Ack=4345 Win=475 Len=0 TSval=4280400569 TSecr=26732847 SLE=5793 SRE=7241"
"17","0.448325350","13.74.191.167","192.168.1.34","SSL","1040","Continuation Data"
"18","0.448335647","192.168.1.34","13.74.191.167","TCP","78","[TCP Window Update] 35098  >  443 [ACK] Seq=1 Ack=4345 Win=498 Len=0 TSval=4280400569 TSecr=26732847 SLE=5793 SRE=8215"
"19","2.108428892","13.74.191.167","192.168.1.34","TCP","1514","[TCP Retransmission] 443  >  35098 [PSH, ACK] Seq=4345 Ack=1 Win=512 Len=1448 TSval=26733029 TSecr=4280400569"
"20","2.108483802","192.168.1.34","13.74.191.167","TCP","66","35098  >  443 [ACK] Seq=1 Ack=8215 Win=520 Len=0 TSval=4280402229 TSecr=26733029"
"21","4.708030758","192.168.1.34","40.122.44.183","TCP","66","58296  >  443 [FIN, ACK] Seq=1 Ack=1 Win=229 Len=0 TSval=3278305746 TSecr=114074933"
"22","6.631397025","192.168.1.34","192.168.1.1","DNS","90","Standard query 0xbf1f A clients5.google.com OPT"
"23","6.632161589","192.168.1.34","192.168.1.1","DNS","86","Standard query 0x3d48 A apis.google.com OPT"
"24","6.634109037","192.168.1.34","192.168.1.1","DNS","96","Standard query 0x40f9 A lh3.googleusercontent.com OPT"
"25","6.656956782","192.168.1.1","192.168.1.34","DNS","210","Standard query response 0xbf1f A clients5.google.com CNAME clients.l.google.com A 173.194.221.100 A 173.194.221.113 A 173.194.221.102 A 173.194.221.139 A 173.194.221.101 A 173.194.221.138 OPT"
"26","6.659618442","192.168.1.34","192.168.1.1","DNS","85","Standard query 0x5314 A www.amazon.com OPT"
"27","6.666289668","192.168.1.1","192.168.1.34","DNS","147","Standard query response 0x3d48 A apis.google.com CNAME plus.l.google.com CNAME wide-plus.l.google.com A 173.194.221.196 OPT"
"28","6.667904356","192.168.1.34","192.168.1.1","DNS","94","Standard query 0x4aec A googleapis.l.google.com OPT"
"29","6.677240929","192.168.1.1","192.168.1.34","DNS","141","Standard query response 0x40f9 A lh3.googleusercontent.com CNAME googlehosted.l.googleusercontent.com A 173.194.221.132 OPT"
"30","6.678039010","192.168.1.34","192.168.1.1","DNS","86","Standard query 0x3882 A www.gstatic.com OPT"
"31","6.685134979","192.168.1.1","192.168.1.34","DNS","166","Standard query response 0x5314 A www.amazon.com CNAME www.cdn.amazon.com CNAME d3ag4hukkh62yn.cloudfront.net A 13.33.20.80 OPT"
"32","6.740570988","192.168.1.1","192.168.1.34","DNS","142","Standard query response 0x4aec A googleapis.l.google.com A 173.194.222.95 A 74.125.205.95 A 64.233.162.95 OPT"
"33","6.743311943","192.168.1.1","192.168.1.34","DNS","102","Standard query response 0x3882 A www.gstatic.com A 173.194.221.94 OPT"
"34","6.869776171","192.168.1.34","192.168.1.1","DNS","96","Standard query 0x3510 A mobile-gtalk.l.google.com OPT"
"35","6.895864016","192.168.1.1","192.168.1.34","DNS","112","Standard query response 0x3510 A mobile-gtalk.l.google.com A 64.233.162.188 OPT"
"36","6.896153911","192.168.1.34","64.233.162.188","TCP","74","45916  >  5228 [SYN] Seq=0 Win=29200 Len=0 MSS=1460 SACK_PERM=1 TSval=1643871372 TSecr=0 WS=128"
"37","6.918962318","64.233.162.188","192.168.1.34","TCP","74","5228  >  45916 [SYN, ACK] Seq=0 Ack=1 Win=42408 Len=0 MSS=1380 SACK_PERM=1 TSval=4237667749 TSecr=1643871372 WS=256"
"38","6.918993446","192.168.1.34","64.233.162.188","TCP","66","45916  >  5228 [ACK] Seq=1 Ack=1 Win=29312 Len=0 TSval=1643871395 TSecr=4237667749"
"39","6.919327914","192.168.1.34","64.233.162.188","TCP","583","45916  >  5228 [PSH, ACK] Seq=1 Ack=1 Win=29312 Len=517 TSval=1643871395 TSecr=4237667749"
"40","6.927490213","192.168.1.34","192.168.1.1","DNS","90","Standard query 0x8e2d A adservice.google.ru OPT"
"41","6.927919260","192.168.1.34","173.194.221.196","QUIC","1392","Client Hello, PKN: 1, CID: 3590720629355223137"
"42","6.928163151","192.168.1.34","173.194.221.138","QUIC","1392","Client Hello, PKN: 1, CID: 17224589155244876144"
"43","6.928381663","192.168.1.34","173.194.221.132","QUIC","1392","Client Hello, PKN: 1, CID: 9374137742742581356"
"44","6.928623240","192.168.1.34","173.194.221.94","QUIC","1392","Client Hello, PKN: 1, CID: 1844395865238430561"
"45","6.928658573","192.168.1.34","192.168.1.1","DNS","85","Standard query 0x75c4 A geo1.ggpht.com OPT"
"46","6.928775154","192.168.1.34","173.194.221.94","QUIC","1392","Client Hello, PKN: 1, CID: 11147747279864269353"
"47","6.928912884","192.168.1.34","173.194.221.94","QUIC","1392","Client Hello, PKN: 1, CID: 18072196388328118377"
"48","6.929537842","192.168.1.34","173.194.221.196","QUIC","1392","Client Hello, PKN: 1, CID: 13722843852663968178"
"49","6.929671294","192.168.1.34","192.168.1.1","DNS","85","Standard query 0xe647 A ogs.google.com OPT"
"50","6.938227234","192.168.1.34","192.168.1.1","DNS","100","Standard query 0x1e53 A clientservices.googleapis.com OPT"
"51","6.938526106","192.168.1.34","192.168.1.1","DNS","95","Standard query 0xba65 A translate.googleapis.com OPT"
"52","6.950453510","64.233.162.188","192.168.1.34","TCP","66","5228  >  45916 [ACK] Seq=1 Ack=518 Win=43520 Len=0 TSval=4237667776 TSecr=1643871395"
"53","6.968153005","192.168.1.34","173.194.221.132","QUIC","1392","Client Hello, PKN: 2, CID: 9374137742742581356"
"54","6.968388769","192.168.1.34","173.194.221.94","QUIC","1392","Client Hello, PKN: 2, CID: 18072196388328118377"
"55","6.971100344","192.168.1.34","173.194.221.196","QUIC","1392","Client Hello, PKN: 2, CID: 3590720629355223137"
"56","6.971233960","192.168.1.34","173.194.221.138","QUIC","1392","Client Hello, PKN: 2, CID: 17224589155244876144"
"57","7.033876886","192.168.1.34","173.194.222.95","TCP","74","37704  >  443 [SYN] Seq=0 Win=29200 Len=0 MSS=1460 SACK_PERM=1 TSval=1685010523 TSecr=0 WS=128"
"58","7.046242325","192.168.1.34","173.194.221.132","QUIC","1392","Client Hello, PKN: 3, CID: 9374137742742581356"
"59","7.046426533","192.168.1.34","173.194.221.94","QUIC","1392","Client Hello, PKN: 3, CID: 18072196388328118377"
"60","7.048010502","192.168.1.34","192.168.1.1","DNS","90","Standard query 0x2c9b A accounts.google.com OPT"
"61","7.055403482","192.168.1.34","173.194.221.196","QUIC","1392","Client Hello, PKN: 3, CID: 3590720629355223137"
"62","7.055438100","192.168.1.34","173.194.221.138","QUIC","1392","Client Hello, PKN: 3, CID: 17224589155244876144"
"63","7.079220704","192.168.1.34","173.194.221.94","QUIC","1392","Client Hello, PKN: 2, CID: 11147747279864269353"
"64","7.079660982","192.168.1.34","173.194.221.196","QUIC","1392","Client Hello, PKN: 2, CID: 13722843852663968178"
"65","7.220891781","192.168.1.34","173.194.221.132","QUIC","1392","Client Hello, PKN: 4, CID: 9374137742742581356"
"66","7.220956678","192.168.1.34","173.194.221.94","QUIC","1392","Client Hello, PKN: 4, CID: 18072196388328118377"
"67","7.223689876","192.168.1.34","173.194.221.196","QUIC","1392","Client Hello, PKN: 4, CID: 3590720629355223137"
"68","7.223823563","192.168.1.34","173.194.221.138","QUIC","1392","Client Hello, PKN: 4, CID: 17224589155244876144"
"69","7.267984126","192.168.1.1","192.168.1.34","DNS","194","Standard query response 0x8e2d A adservice.google.ru CNAME pagead46.l.doubleclick.net A 64.233.162.154 A 64.233.162.155 A 64.233.162.157 A 64.233.162.156 OPT"
"70","7.268764827","192.168.1.34","64.233.162.156","QUIC","1392","Client Hello, PKN: 1, CID: 15915747847831504427"
"71","7.288711995","192.168.1.34","173.194.222.95","TCP","74","37706  >  443 [SYN] Seq=0 Win=29200 Len=0 MSS=1460 SACK_PERM=1 TSval=1685010778 TSecr=0 WS=128"
"72","7.289171289","192.168.1.34","13.33.20.80","TCP","74","47832  >  443 [SYN] Seq=0 Win=29200 Len=0 MSS=1460 SACK_PERM=1 TSval=4096589746 TSecr=0 WS=128"
"73","7.304997404","192.168.1.34","64.233.162.156","QUIC","1392","Client Hello, PKN: 2, CID: 15915747847831504427"
"74","7.315977784","173.194.221.196","192.168.1.34","QUIC","77","Payload (Encrypted), PKN: 3, CID: 3590720629355223137"
"75","7.316000777","64.233.162.188","192.168.1.34","TCP","174","[TCP Previous segment not captured] 5228  >  45916 [PSH, ACK] Seq=4255 Ack=518 Win=43520 Len=108 TSval=4237667827 TSecr=1643871395"
"76","7.316018306","192.168.1.34","64.233.162.188","TCP","78","[TCP Window Update] 45916  >  5228 [ACK] Seq=518 Ack=1 Win=30336 Len=0 TSval=1643871792 TSecr=4237667776 SLE=4255 SRE=4363"
"77","7.316031593","173.194.221.138","192.168.1.34","QUIC","1392","Rejection, PKN: 1, CID: 17224589155244876144"
"78","7.334682432","192.168.1.34","173.194.222.95","TCP","74","37710  >  443 [SYN] Seq=0 Win=29200 Len=0 MSS=1460 SACK_PERM=1 TSval=1685010824 TSecr=0 WS=128"
"79","7.349502118","192.168.1.34","173.194.221.94","TCP","74","41136  >  443 [SYN] Seq=0 Win=29200 Len=0 MSS=1460 SACK_PERM=1 TSval=3638045982 TSecr=0 WS=128"
"80","7.352205623","192.168.1.34","173.194.221.138","QUIC","77","Payload (Encrypted), PKN: 5, CID: 17224589155244876144"
"81","7.359985602","173.194.221.138","192.168.1.34","QUIC","77","Payload (Encrypted), PKN: 3, CID: 17224589155244876144"
"82","7.378605550","192.168.1.34","64.233.162.156","QUIC","1392","Client Hello, PKN: 3, CID: 15915747847831504427"
"83","7.380177127","192.168.1.34","173.194.221.94","QUIC","1392","Client Hello, PKN: 3, CID: 11147747279864269353"
"84","7.380253823","192.168.1.34","173.194.221.196","QUIC","1392","Client Hello, PKN: 3, CID: 13722843852663968178"
"85","7.402002701","192.168.1.34","173.194.221.200","QUIC","1392","Client Hello, PKN: 1, CID: 5803283791748683659"
"86","7.402821014","192.168.1.34","239.255.255.250","SSDP","214","M-SEARCH * HTTP/1.1 "
"87","7.402904370","192.168.1.34","224.0.0.251","MDNS","82","Standard query 0x0000 PTR _googlecast._tcp.local, ""QM"" question"
"88","7.402935569","fe80::e947:4933:d8f3:d302","ff02::fb","MDNS","102","Standard query 0x0000 PTR _googlecast._tcp.local, ""QM"" question"
"89","7.447998532","173.194.221.132","192.168.1.34","QUIC","77","Payload (Encrypted), PKN: 3, CID: 9374137742742581356"
"90","7.448027660","192.168.1.1","192.168.1.34","DNS","101","Standard query response 0x75c4 A geo1.ggpht.com A 173.194.221.132 OPT"
"91","7.448693215","192.168.1.34","173.194.221.132","QUIC","1392","Client Hello, PKN: 1, CID: 5287725619453719693"
"92","7.480987587","192.168.1.34","192.168.1.1","DNS","90","Standard query 0x6f60 A clients2.google.com OPT"
"93","7.485782362","192.168.1.34","173.194.221.132","QUIC","1392","Client Hello, PKN: 2, CID: 5287725619453719693"
"94","7.522784311","192.168.1.34","64.233.162.156","QUIC","1392","Client Hello, PKN: 4, CID: 15915747847831504427"
"95","7.533390205","192.168.1.34","173.194.221.94","QUIC","1392","Client Hello, PKN: 5, CID: 18072196388328118377"
"96","7.539307237","192.168.1.34","13.33.20.80","TCP","74","47838  >  443 [SYN] Seq=0 Win=29200 Len=0 MSS=1460 SACK_PERM=1 TSval=4096589996 TSecr=0 WS=128"
"97","7.552587755","192.168.1.34","173.194.221.200","QUIC","1392","Client Hello, PKN: 2, CID: 5803283791748683659"
"98","7.561628320","192.168.1.34","173.194.221.132","QUIC","1392","Client Hello, PKN: 3, CID: 5287725619453719693"
"99","7.600033613","192.168.1.34","173.194.221.94","TCP","74","41140  >  443 [SYN] Seq=0 Win=29200 Len=0 MSS=1460 SACK_PERM=1 TSval=3638046232 TSecr=0 WS=128"
"100","7.702534183","192.168.1.34","173.194.221.200","TCP","74","51934  >  443 [SYN] Seq=0 Win=29200 Len=0 MSS=1460 SACK_PERM=1 TSval=3787810609 TSecr=0 WS=128"
"101","7.710666163","192.168.1.34","173.194.221.132","QUIC","1392","Client Hello, PKN: 4, CID: 5287725619453719693"
"102","7.711825238","192.168.1.34","192.168.1.1","DNS","85","Standard query 0xe647 A ogs.google.com OPT"
"103","7.711951777","192.168.1.34","192.168.1.1","DNS","95","Standard query 0xba65 A translate.googleapis.com OPT"
"104","7.712073014","192.168.1.34","192.168.1.1","DNS","100","Standard query 0x1e53 A clientservices.googleapis.com OPT"
"105","7.795372162","192.168.1.34","173.194.222.95","TCP","74","37720  >  443 [SYN] Seq=0 Win=29200 Len=0 MSS=1460 SACK_PERM=1 TSval=1685011285 TSecr=0 WS=128"
"106","7.811624919","192.168.1.34","64.233.162.156","QUIC","1392","Client Hello, PKN: 5, CID: 15915747847831504427"
"107","7.853078683","192.168.1.34","173.194.221.200","QUIC","1392","Client Hello, PKN: 3, CID: 5803283791748683659"
"108","7.891980701","173.194.221.94","192.168.1.34","QUIC","77","Payload (Encrypted), PKN: 3, CID: 1844395865238430561"
"109","7.953549028","192.168.1.34","173.194.221.200","TCP","74","51938  >  443 [SYN] Seq=0 Win=29200 Len=0 MSS=1460 SACK_PERM=1 TSval=3787810860 TSecr=0 WS=128"
"110","7.961832017","192.168.1.34","192.168.1.1","DNS","90","Standard query 0x2c9b A accounts.google.com OPT"
"111","7.980916288","192.168.1.34","173.194.221.94","QUIC","1392","Client Hello, PKN: 4, CID: 11147747279864269353"
"112","7.980967497","192.168.1.34","173.194.221.196","QUIC","1392","Client Hello, PKN: 4, CID: 13722843852663968178"
"113","8.007181515","192.168.1.34","173.194.221.132","QUIC","1392","Client Hello, PKN: 5, CID: 5287725619453719693"
"114","8.039985679","192.168.1.34","173.194.222.95","TCP","74","[TCP Retransmission] 37704  >  443 [SYN] Seq=0 Win=29200 Len=0 MSS=1460 SACK_PERM=1 TSval=1685011529 TSecr=0 WS=128"
"115","8.111074471","192.168.1.34","173.194.221.94","TCP","74","41148  >  443 [SYN] Seq=0 Win=29200 Len=0 MSS=1460 SACK_PERM=1 TSval=3638046744 TSecr=0 WS=128"
"116","8.113280926","192.168.1.34","173.194.221.94","TCP","74","41150  >  443 [SYN] Seq=0 Win=29200 Len=0 MSS=1460 SACK_PERM=1 TSval=3638046746 TSecr=0 WS=128"
"117","8.141495162","192.168.1.34","173.194.221.94","TCP","74","41152  >  443 [SYN] Seq=0 Win=29200 Len=0 MSS=1460 SACK_PERM=1 TSval=3638046774 TSecr=0 WS=128"
"118","8.157733385","192.168.1.34","173.194.221.94","QUIC","1392","Client Hello, PKN: 6, CID: 18072196388328118377"
"119","8.163980549","173.194.221.196","192.168.1.34","QUIC","1392","Rejection, PKN: 1, CID: 13722843852663968178"
"120","8.189340131","192.168.1.34","173.194.221.196","QUIC","77","Payload (Encrypted), PKN: 5, CID: 13722843852663968178"
"121","8.227974960","192.168.1.1","192.168.1.34","DNS","202","Standard query response 0xe647 A ogs.google.com CNAME www3.l.google.com A 173.194.221.139 A 173.194.221.102 A 173.194.221.101 A 173.194.221.138 A 173.194.221.113 A 173.194.221.100 OPT"
"122","8.227993510","173.194.221.94","192.168.1.34","QUIC","80","Payload (Encrypted), PKN: 3, CID: 18072196388328118377"
"123","8.228000023","192.168.1.1","192.168.1.34","DNS","116","Standard query response 0x1e53 A clientservices.googleapis.com A 173.194.221.94 OPT"
"124","8.228003528","192.168.1.1","192.168.1.34","DNS","111","Standard query response 0xba65 A translate.googleapis.com A 173.194.221.95 OPT"
"125","8.228005918","173.194.222.95","192.168.1.34","TCP","74","443  >  37704 [SYN, ACK] Seq=0 Ack=1 Win=42408 Len=0 MSS=1380 SACK_PERM=1 TSval=1527718278 TSecr=1685010523 WS=256"
"126","8.228055320","192.168.1.34","173.194.222.95","TCP","66","37704  >  443 [ACK] Seq=1 Ack=1 Win=29312 Len=0 TSval=1685011718 TSecr=1527718278"
"127","8.228068233","173.194.221.132","192.168.1.34","QUIC","80","Payload (Encrypted), PKN: 4, CID: 9374137742742581356"
"128","8.228071412","192.168.1.1","192.168.1.34","DNS","106","Standard query response 0x2c9b A accounts.google.com A 173.194.221.84 OPT"
"129","8.228486444","192.168.1.34","173.194.222.95","TLSv1.2","583","Client Hello"
"130","8.228756747","192.168.1.34","173.194.221.100","QUIC","1392","Client Hello, PKN: 1, CID: 12633944106072422182"
"131","8.228843842","192.168.1.34","173.194.221.84","QUIC","1392","Client Hello, PKN: 1, CID: 14934445637111636319"
"132","8.229002290","192.168.1.34","173.194.221.95","TCP","74","46068  >  443 [SYN] Seq=0 Win=29200 Len=0 MSS=1460 SACK_PERM=1 TSval=4126651714 TSecr=0 WS=128"
"133","8.229101355","192.168.1.34","173.194.221.94","TCP","74","41156  >  443 [SYN] Seq=0 Win=29200 Len=0 MSS=1460 SACK_PERM=1 TSval=3638046862 TSecr=0 WS=128"
"134","8.268923216","192.168.1.34","173.194.221.100","QUIC","1392","Client Hello, PKN: 2, CID: 12633944106072422182"
"135","8.268986563","192.168.1.34","173.194.221.84","QUIC","1392","Client Hello, PKN: 2, CID: 14934445637111636319"
"136","8.271179586","192.168.1.34","173.194.221.84","TCP","74","50678  >  443 [SYN] Seq=0 Win=29200 Len=0 MSS=1460 SACK_PERM=1 TSval=2032235461 TSecr=0 WS=128"
"137","8.291986133","192.168.1.34","13.33.20.80","TCP","74","[TCP Retransmission] 47832  >  443 [SYN] Seq=0 Win=29200 Len=0 MSS=1460 SACK_PERM=1 TSval=4096590749 TSecr=0 WS=128"
"138","8.292003051","192.168.1.34","173.194.222.95","TCP","74","[TCP Retransmission] 37706  >  443 [SYN] Seq=0 Win=29200 Len=0 MSS=1460 SACK_PERM=1 TSval=1685011782 TSecr=0 WS=128"
"139","8.317585370","192.168.1.34","173.194.221.94","QUIC","1392","Client Hello, PKN: 1, CID: 487402657683798057"
"140","8.318219150","192.168.1.34","192.168.1.1","DNS","90","Standard query 0x6f60 A clients2.google.com OPT"
"141","8.318608186","192.168.1.34","192.168.1.1","DNS","87","Standard query 0x6d23 A drive.google.com OPT"
"142","8.318987467","192.168.1.34","173.194.221.194","QUIC","1392","Client Hello, PKN: 1, CID: 16357981161946577666"
"143","8.349143471","192.168.1.34","173.194.221.100","QUIC","1392","Client Hello, PKN: 3, CID: 12633944106072422182"
"144","8.349191690","192.168.1.34","173.194.221.84","QUIC","1392","Client Hello, PKN: 3, CID: 14934445637111636319"
"145","8.356034620","192.168.1.34","173.194.221.94","TCP","74","[TCP Retransmission] 41136  >  443 [SYN] Seq=0 Win=29200 Len=0 MSS=1460 SACK_PERM=1 TSval=3638046989 TSecr=0 WS=128"
"146","8.356050034","192.168.1.34","173.194.222.95","TCP","74","[TCP Retransmission] 37710  >  443 [SYN] Seq=0 Win=29200 Len=0 MSS=1460 SACK_PERM=1 TSval=1685011846 TSecr=0 WS=128"
"147","8.387997575","192.168.1.34","64.233.162.156","QUIC","1392","Client Hello, PKN: 6, CID: 15915747847831504427"
"148","8.403359836","192.168.1.34","239.255.255.250","SSDP","214","M-SEARCH * HTTP/1.1 "
"149","8.403405780","192.168.1.34","224.0.0.251","MDNS","82","Standard query 0x0000 PTR _googlecast._tcp.local, ""QM"" question"
"150","8.403465616","fe80::e947:4933:d8f3:d302","ff02::fb","MDNS","102","Standard query 0x0000 PTR _googlecast._tcp.local, ""QM"" question"
"151","8.439971747","173.194.221.138","192.168.1.34","QUIC","77","Payload (Encrypted), PKN: 7, CID: 17224589155244876144"
"152","8.439988277","173.194.221.94","192.168.1.34","QUIC","77","Payload (Encrypted), PKN: 4, CID: 11147747279864269353"
"153","8.453473098","192.168.1.34","173.194.221.200","QUIC","1392","Client Hello, PKN: 4, CID: 5803283791748683659"
"154","8.474717405","192.168.1.34","173.194.221.94","TCP","74","41160  >  443 [SYN] Seq=0 Win=29200 Len=0 MSS=1460 SACK_PERM=1 TSval=3638047107 TSecr=0 WS=128"
"155","8.474764408","192.168.1.34","173.194.221.95","TCP","74","46076  >  443 [SYN] Seq=0 Win=29200 Len=0 MSS=1460 SACK_PERM=1 TSval=4126651960 TSecr=0 WS=128"
"156","8.509405281","192.168.1.34","173.194.221.100","QUIC","1392","Client Hello, PKN: 4, CID: 12633944106072422182"
"157","8.509438284","192.168.1.34","173.194.221.84","QUIC","1392","Client Hello, PKN: 4, CID: 14934445637111636319"
"158","8.521715731","192.168.1.34","173.194.221.84","TCP","74","50684  >  443 [SYN] Seq=0 Win=29200 Len=0 MSS=1460 SACK_PERM=1 TSval=2032235711 TSecr=0 WS=128"
"159","8.548030814","192.168.1.34","13.33.20.80","TCP","74","[TCP Retransmission] 47838  >  443 [SYN] Seq=0 Win=29200 Len=0 MSS=1460 SACK_PERM=1 TSval=4096591006 TSecr=0 WS=128"
"160","8.599766695","192.168.1.34","173.194.221.132","QUIC","1392","Client Hello, PKN: 6, CID: 5287725619453719693"
"161","8.612024934","192.168.1.34","173.194.221.94","TCP","74","[TCP Retransmission] 41140  >  443 [SYN] Seq=0 Win=29200 Len=0 MSS=1460 SACK_PERM=1 TSval=3638047245 TSecr=0 WS=128"
"162","8.691832348","192.168.1.34","173.194.222.95","TCP","74","37742  >  443 [SYN] Seq=0 Win=29200 Len=0 MSS=1460 SACK_PERM=1 TSval=1685012181 TSecr=0 WS=128"
"163","8.708473969","192.168.1.34","173.194.221.200","TCP","74","[TCP Retransmission] 51934  >  443 [SYN] Seq=0 Win=29200 Len=0 MSS=1460 SACK_PERM=1 TSval=3787811615 TSecr=0 WS=128"
"164","8.804023064","192.168.1.34","173.194.222.95","TCP","74","[TCP Retransmission] 37720  >  443 [SYN] Seq=0 Win=29200 Len=0 MSS=1460 SACK_PERM=1 TSval=1685012294 TSecr=0 WS=128"
"165","8.804052574","192.168.1.34","52.114.74.43","TLSv1.2","967","Application Data"
"166","8.819399257","192.168.1.34","173.194.221.94","TCP","74","41168  >  443 [SYN] Seq=0 Win=29200 Len=0 MSS=1460 SACK_PERM=1 TSval=3638047452 TSecr=0 WS=128"
"167","8.829619527","192.168.1.34","173.194.221.100","QUIC","1392","Client Hello, PKN: 5, CID: 12633944106072422182"
"168","8.829709977","192.168.1.34","173.194.221.84","QUIC","1392","Client Hello, PKN: 5, CID: 14934445637111636319"
"169","8.964015481","192.168.1.34","173.194.221.200","TCP","74","[TCP Retransmission] 51938  >  443 [SYN] Seq=0 Win=29200 Len=0 MSS=1460 SACK_PERM=1 TSval=3787811871 TSecr=0 WS=128"
"170","9.124280393","192.168.1.34","173.194.221.94","TCP","74","[TCP Retransmission] 41150  >  443 [SYN] Seq=0 Win=29200 Len=0 MSS=1460 SACK_PERM=1 TSval=3638047757 TSecr=0 WS=128"
"171","9.124316079","192.168.1.34","173.194.221.94","TCP","74","[TCP Retransmission] 41148  >  443 [SYN] Seq=0 Win=29200 Len=0 MSS=1460 SACK_PERM=1 TSval=3638047757 TSecr=0 WS=128"
"172","9.156182089","192.168.1.34","173.194.221.94","TCP","74","[TCP Retransmission] 41152  >  443 [SYN] Seq=0 Win=29200 Len=0 MSS=1460 SACK_PERM=1 TSval=3638047789 TSecr=0 WS=128"
"173","9.181947879","192.168.1.34","173.194.221.196","QUIC","1392","Client Hello, PKN: 6, CID: 13722843852663968178"
"174","9.252333331","192.168.1.34","173.194.221.95","TCP","74","[TCP Retransmission] 46068  >  443 [SYN] Seq=0 Win=29200 Len=0 MSS=1460 SACK_PERM=1 TSval=4126652738 TSecr=0 WS=128"
"175","9.252364005","192.168.1.34","173.194.221.94","TCP","74","[TCP Retransmission] 41156  >  443 [SYN] Seq=0 Win=29200 Len=0 MSS=1460 SACK_PERM=1 TSval=3638047885 TSecr=0 WS=128"
"176","9.284053203","192.168.1.34","173.194.221.84","TCP","74","[TCP Retransmission] 50678  >  443 [SYN] Seq=0 Win=29200 Len=0 MSS=1460 SACK_PERM=1 TSval=2032236474 TSecr=0 WS=128"
"177","9.403607450","192.168.1.34","239.255.255.250","SSDP","214","M-SEARCH * HTTP/1.1 "
"178","9.468448500","173.194.221.132","192.168.1.34","QUIC","77","Payload (Encrypted), PKN: 7, CID: 9374137742742581356"
"179","9.468479638","173.194.221.94","192.168.1.34","QUIC","77","Payload (Encrypted), PKN: 5, CID: 18072196388328118377"
"180","9.470249298","192.168.1.34","173.194.221.100","QUIC","1392","Client Hello, PKN: 6, CID: 12633944106072422182"
"181","9.470374642","192.168.1.34","173.194.221.84","QUIC","1392","Client Hello, PKN: 6, CID: 14934445637111636319"
"182","9.476036712","192.168.1.34","173.194.221.95","TCP","74","[TCP Retransmission] 46076  >  443 [SYN] Seq=0 Win=29200 Len=0 MSS=1460 SACK_PERM=1 TSval=4126652962 TSecr=0 WS=128"
"183","9.476072051","192.168.1.34","173.194.221.94","TCP","74","[TCP Retransmission] 41160  >  443 [SYN] Seq=0 Win=29200 Len=0 MSS=1460 SACK_PERM=1 TSval=3638048109 TSecr=0 WS=128"
"184","9.536437873","173.194.221.94","192.168.1.34","QUIC","1392","Payload (Encrypted), PKN: 7, CID: 18072196388328118377"
"185","9.536676418","192.168.1.34","173.194.221.94","QUIC","88","Payload (Encrypted), PKN: 7, CID: 18072196388328118377"
"186","9.540429021","192.168.1.34","173.194.221.84","TCP","74","[TCP Retransmission] 50684  >  443 [SYN] Seq=0 Win=29200 Len=0 MSS=1460 SACK_PERM=1 TSval=2032236730 TSecr=0 WS=128"
"187","9.540527074","192.168.1.34","64.233.162.156","QUIC","1392","Client Hello, PKN: 7, CID: 15915747847831504427"
"188","9.654293009","192.168.1.34","173.194.221.200","QUIC","1392","Client Hello, PKN: 5, CID: 5803283791748683659"
"189","9.699988082","192.168.1.34","173.194.222.95","TCP","74","[TCP Retransmission] 37742  >  443 [SYN] Seq=0 Win=29200 Len=0 MSS=1460 SACK_PERM=1 TSval=1685013190 TSecr=0 WS=128"
"190","9.785155417","192.168.1.34","173.194.221.132","QUIC","1392","Client Hello, PKN: 7, CID: 5287725619453719693"
"191","9.816237695","173.194.221.196","192.168.1.34","QUIC","77","Payload (Encrypted), PKN: 10, CID: 3590720629355223137"
"192","9.816269501","173.194.221.196","192.168.1.34","QUIC","1392","Rejection, PKN: 5, CID: 13722843852663968178"
"193","9.816279882","173.194.221.196","192.168.1.34","QUIC","1392","Payload (Encrypted), PKN: 6, CID: 13722843852663968178"
"194","9.816285788","173.194.221.138","192.168.1.34","QUIC","77","Payload (Encrypted), PKN: 10, CID: 17224589155244876144"
"195","9.816291531","64.233.162.156","192.168.1.34","QUIC","77","Payload (Encrypted), PKN: 3, CID: 15915747847831504427"
"196","9.816302072","173.194.222.95","192.168.1.34","TCP","74","443  >  37706 [SYN, ACK] Seq=0 Ack=1 Win=42408 Len=0 MSS=1380 SACK_PERM=1 TSval=791296678 TSecr=1685010778 WS=256"
"197","9.816345049","192.168.1.34","173.194.222.95","TCP","66","37706  >  443 [ACK] Seq=1 Ack=1 Win=29312 Len=0 TSval=1685013306 TSecr=791296678"
"198","9.816394673","13.33.20.80","192.168.1.34","TCP","74","443  >  47832 [SYN, ACK] Seq=0 Ack=1 Win=28960 Len=0 MSS=1460 SACK_PERM=1 TSval=1721382779 TSecr=4096589746 WS=256"
"199","9.816409986","192.168.1.34","13.33.20.80","TCP","66","47832  >  443 [ACK] Seq=1 Ack=1 Win=29312 Len=0 TSval=4096592275 TSecr=1721382779"
"200","9.816417784","64.233.162.188","192.168.1.34","TCP","1484","[TCP Retransmission] 5228  >  45916 [ACK] Seq=1419 Ack=518 Win=43520 Len=1418 TSval=4237668190 TSecr=1643871792"
"201","9.816431722","192.168.1.34","64.233.162.188","TCP","86","[TCP Window Update] 45916  >  5228 [ACK] Seq=518 Ack=1 Win=33152 Len=0 TSval=1643874294 TSecr=4237667776 SLE=1419 SRE=2837 SLE=4255 SRE=4363"
"202","9.816549005","192.168.1.34","173.194.221.196","QUIC","80","Payload (Encrypted), PKN: 7, CID: 13722843852663968178"
"203","9.820949986","192.168.1.34","173.194.221.196","QUIC","80","Payload (Encrypted), PKN: 8, CID: 13722843852663968178"
"204","9.821153499","173.194.222.95","192.168.1.34","TCP","74","443  >  37710 [SYN, ACK] Seq=0 Ack=1 Win=42408 Len=0 MSS=1380 SACK_PERM=1 TSval=3341271262 TSecr=1685010824 WS=256"
"205","9.821193483","192.168.1.34","173.194.222.95","TCP","66","37710  >  443 [ACK] Seq=1 Ack=1 Win=29312 Len=0 TSval=1685013311 TSecr=3341271262"
"206","9.821742058","192.168.1.34","173.194.222.95","TLSv1","583","Client Hello"
"207","9.822243396","192.168.1.34","13.33.20.80","TLSv1","583","Client Hello"
"208","9.822674205","192.168.1.34","173.194.222.95","TLSv1","583","Client Hello"
"209","9.826928013","192.168.1.34","173.194.221.196","QUIC","1392","Client Hello, PKN: 9, CID: 13722843852663968178"
"210","9.828011501","192.168.1.34","173.194.221.94","TCP","74","[TCP Retransmission] 41168  >  443 [SYN] Seq=0 Win=29200 Len=0 MSS=1460 SACK_PERM=1 TSval=3638048461 TSecr=0 WS=128"
"211","9.962007165","192.168.1.34","192.168.1.1","DNS","90","Standard query 0x6f60 A clients2.google.com OPT"
"212","9.962454228","192.168.1.34","192.168.1.1","DNS","87","Standard query 0x6d23 A drive.google.com OPT"
"213","10.016383412","64.233.162.156","192.168.1.34","QUIC","77","Payload (Encrypted), PKN: 4, CID: 15915747847831504427"
"214","10.049291102","192.168.1.34","173.194.221.194","QUIC","1392","Client Hello, PKN: 2, CID: 16357981161946577666"
"215","10.134520804","192.168.1.34","173.194.221.94","QUIC","1392","Client Hello, PKN: 2, CID: 487402657683798057"
"216","10.172444145","173.194.221.94","192.168.1.34","TCP","74","443  >  41136 [SYN, ACK] Seq=0 Ack=1 Win=42408 Len=0 MSS=1380 SACK_PERM=1 TSval=3088786796 TSecr=3638045982 WS=256"
"217","10.172510695","192.168.1.34","173.194.221.94","TCP","66","41136  >  443 [ACK] Seq=1 Ack=1 Win=29312 Len=0 TSval=3638048806 TSecr=3088786796"
"218","10.173150289","192.168.1.34","173.194.221.94","TLSv1","583","Client Hello"
"219","10.308452024","173.194.221.94","192.168.1.34","QUIC","1392","Rejection, PKN: 7, CID: 11147747279864269353"
"220","10.308688827","192.168.1.34","173.194.221.94","QUIC","83","Payload (Encrypted), PKN: 5, CID: 11147747279864269353"
"221","10.313250973","192.168.1.34","173.194.221.94","TCP","74","41170  >  443 [SYN] Seq=0 Win=29200 Len=0 MSS=1460 SACK_PERM=1 TSval=3638048947 TSecr=0 WS=128"
"222","10.399987110","64.233.162.156","192.168.1.34","QUIC","77","Payload (Encrypted), PKN: 5, CID: 15915747847831504427"
"223","10.404609607","192.168.1.34","224.0.0.251","MDNS","82","Standard query 0x0000 PTR _googlecast._tcp.local, ""QM"" question"
"224","10.404708434","fe80::e947:4933:d8f3:d302","ff02::fb","MDNS","102","Standard query 0x0000 PTR _googlecast._tcp.local, ""QM"" question"
"225","10.404830605","192.168.1.34","239.255.255.250","SSDP","214","M-SEARCH * HTTP/1.1 "
"226","10.563997507","192.168.1.34","13.33.20.80","TCP","74","[TCP Retransmission] 47838  >  443 [SYN] Seq=0 Win=29200 Len=0 MSS=1460 SACK_PERM=1 TSval=4096593022 TSecr=0 WS=128"
"227","10.564673140","192.168.1.34","173.194.221.94","TCP","74","41172  >  443 [SYN] Seq=0 Win=29200 Len=0 MSS=1460 SACK_PERM=1 TSval=3638049198 TSecr=0 WS=128"
"228","10.628174260","192.168.1.34","173.194.221.94","TCP","74","[TCP Retransmission] 41140  >  443 [SYN] Seq=0 Win=29200 Len=0 MSS=1460 SACK_PERM=1 TSval=3638049262 TSecr=0 WS=128"
"229","10.728546404","192.168.1.34","173.194.221.200","TCP","74","[TCP Retransmission] 51934  >  443 [SYN] Seq=0 Win=29200 Len=0 MSS=1460 SACK_PERM=1 TSval=3787813636 TSecr=0 WS=128"
"230","10.751565196","192.168.1.34","173.194.221.100","QUIC","1392","Client Hello, PKN: 7, CID: 12633944106072422182"
"231","10.751647884","192.168.1.34","173.194.221.84","QUIC","1392","Client Hello, PKN: 7, CID: 14934445637111636319"
"232","10.820435138","192.168.1.34","173.194.222.95","TCP","74","[TCP Retransmission] 37720  >  443 [SYN] Seq=0 Win=29200 Len=0 MSS=1460 SACK_PERM=1 TSval=1685014311 TSecr=0 WS=128"
"233","10.851997874","192.168.1.34","173.194.222.95","TCP","583","[TCP Retransmission] 37704  >  443 [PSH, ACK] Seq=1 Ack=1 Win=29312 Len=517 TSval=1685014343 TSecr=1527718278"
"234","10.920016314","173.194.221.94","192.168.1.34","QUIC","77","Payload (Encrypted), PKN: 9, CID: 11147747279864269353"
"235","10.920045711","173.194.222.95","192.168.1.34","TCP","74","[TCP Out-Of-Order] 443  >  37706 [SYN, ACK] Seq=0 Ack=1 Win=42408 Len=0 MSS=1380 SACK_PERM=1 TSval=791296978 TSecr=1685010778 WS=256"
"236","10.920069690","192.168.1.34","173.194.222.95","TCP","66","[TCP Dup ACK 197#1] 37706  >  443 [ACK] Seq=518 Ack=1 Win=29312 Len=0 TSval=1685014411 TSecr=791296678"
"237","10.980454589","192.168.1.34","173.194.221.200","TCP","74","[TCP Retransmission] 51938  >  443 [SYN] Seq=0 Win=29200 Len=0 MSS=1460 SACK_PERM=1 TSval=3787813888 TSecr=0 WS=128"
"238","11.140363912","192.168.1.34","173.194.221.94","TCP","74","[TCP Retransmission] 41148  >  443 [SYN] Seq=0 Win=29200 Len=0 MSS=1460 SACK_PERM=1 TSval=3638049774 TSecr=0 WS=128"
"239","11.140400272","192.168.1.34","173.194.221.94","TCP","74","[TCP Retransmission] 41150  >  443 [SYN] Seq=0 Win=29200 Len=0 MSS=1460 SACK_PERM=1 TSval=3638049774 TSecr=0 WS=128"
"240","11.144463490","173.194.221.200","192.168.1.34","QUIC","1392","Payload (Encrypted), PKN: 2, CID: 5803283791748683659"
"241","11.144727964","192.168.1.34","173.194.221.200","QUIC","77","Payload (Encrypted), PKN: 6, CID: 5803283791748683659"
"242","11.172487421","192.168.1.34","173.194.221.94","TCP","74","[TCP Retransmission] 41152  >  443 [SYN] Seq=0 Win=29200 Len=0 MSS=1460 SACK_PERM=1 TSval=3638049806 TSecr=0 WS=128"
"243","11.196456504","173.194.221.94","192.168.1.34","QUIC","1392","Payload (Encrypted), PKN: 9, CID: 1844395865238430561"
"244","11.196690822","192.168.1.34","173.194.221.94","QUIC","83","Payload (Encrypted), PKN: 2, CID: 1844395865238430561"
"245","11.268387786","192.168.1.34","173.194.221.95","TCP","74","[TCP Retransmission] 46068  >  443 [SYN] Seq=0 Win=29200 Len=0 MSS=1460 SACK_PERM=1 TSval=4126654755 TSecr=0 WS=128"
"246","11.268421684","192.168.1.34","173.194.221.94","TCP","74","[TCP Retransmission] 41156  >  443 [SYN] Seq=0 Win=29200 Len=0 MSS=1460 SACK_PERM=1 TSval=3638049902 TSecr=0 WS=128"
"247","11.300453661","192.168.1.34","173.194.221.84","TCP","74","[TCP Retransmission] 50678  >  443 [SYN] Seq=0 Win=29200 Len=0 MSS=1460 SACK_PERM=1 TSval=2032238491 TSecr=0 WS=128"
"248","11.332468803","192.168.1.34","173.194.221.94","TCP","74","[TCP Retransmission] 41170  >  443 [SYN] Seq=0 Win=29200 Len=0 MSS=1460 SACK_PERM=1 TSval=3638049966 TSecr=0 WS=128"
"249","11.392085092","173.194.221.196","192.168.1.34","QUIC","1392","Rejection, PKN: 10, CID: 13722843852663968178"
"250","11.392195128","192.168.1.34","173.194.221.196","QUIC","82","Payload (Encrypted), PKN: 10, CID: 13722843852663968178"
"251","11.449615700","192.168.1.34","173.194.221.132","QUIC","110","Payload (Encrypted), PKN: 8, CID: 5287725619453719693"
"252","11.452051238","192.168.1.1","192.168.1.34","DNS","210","Standard query response 0x6f60 A clients2.google.com CNAME clients.l.google.com A 173.194.221.139 A 173.194.221.101 A 173.194.221.138 A 173.194.221.100 A 173.194.221.102 A 173.194.221.113 OPT"
"253","11.452082076","173.194.221.132","192.168.1.34","QUIC","1392","Rejection, PKN: 1, CID: 5287725619453719693"
"254","11.452117790","192.168.1.34","173.194.221.132","ICMP","590","Destination unreachable (Port unreachable)"
"255","11.454023011","192.168.1.34","173.194.221.113","QUIC","1392","Client Hello, PKN: 1, CID: 6194125321457197329"
"256","11.492381233","192.168.1.34","173.194.221.94","TCP","74","[TCP Retransmission] 41160  >  443 [SYN] Seq=0 Win=29200 Len=0 MSS=1460 SACK_PERM=1 TSval=3638050126 TSecr=0 WS=128"
"257","11.492418687","192.168.1.34","173.194.221.95","TCP","74","[TCP Retransmission] 46076  >  443 [SYN] Seq=0 Win=29200 Len=0 MSS=1460 SACK_PERM=1 TSval=4126654979 TSecr=0 WS=128"
"258","11.516405344","173.194.221.132","192.168.1.34","QUIC","80","Payload (Encrypted), PKN: 3, CID: 5287725619453719693"
"259","11.516456248","192.168.1.34","173.194.221.132","ICMP","108","Destination unreachable (Port unreachable)"
"260","11.516484246","64.233.162.156","192.168.1.34","QUIC","77","Payload (Encrypted), PKN: 10, CID: 15915747847831504427"
"261","11.516502040","173.194.221.94","192.168.1.34","QUIC","77","Payload (Encrypted), PKN: 12, CID: 18072196388328118377"
"262","11.516508219","13.33.20.80","192.168.1.34","TCP","74","443  >  47838 [SYN, ACK] Seq=0 Ack=1 Win=28960 Len=0 MSS=1460 SACK_PERM=1 TSval=1721381463 TSecr=4096589996 WS=256"
"263","11.516537051","192.168.1.34","13.33.20.80","TCP","66","47838  >  443 [ACK] Seq=1 Ack=1 Win=29312 Len=0 TSval=4096593975 TSecr=1721381463"
"264","11.556047349","192.168.1.34","173.194.221.84","TCP","74","[TCP Retransmission] 50684  >  443 [SYN] Seq=0 Win=29200 Len=0 MSS=1460 SACK_PERM=1 TSval=2032238747 TSecr=0 WS=128"
"265","11.583132290","192.168.1.34","192.168.1.1","DNS","85","Standard query 0x8df3 A www.google.com OPT"
"266","11.587979303","192.168.1.34","173.194.221.94","TCP","74","[TCP Retransmission] 41172  >  443 [SYN] Seq=0 Win=29200 Len=0 MSS=1460 SACK_PERM=1 TSval=3638050222 TSecr=0 WS=128"
"267","11.596289861","192.168.1.34","173.194.221.113","QUIC","1392","Client Hello, PKN: 2, CID: 6194125321457197329"
"268","11.597440998","192.168.1.34","173.194.221.113","TCP","74","33502  >  443 [SYN] Seq=0 Win=29200 Len=0 MSS=1460 SACK_PERM=1 TSval=941980903 TSecr=0 WS=128"
"269","11.660089648","173.194.221.200","192.168.1.34","QUIC","77","Payload (Encrypted), PKN: 6, CID: 5803283791748683659"
"270","11.696054389","173.194.221.200","192.168.1.34","TCP","74","443  >  51934 [SYN, ACK] Seq=0 Ack=1 Win=42408 Len=0 MSS=1380 SACK_PERM=1 TSval=2054932956 TSecr=3787810609 WS=256"
"271","11.696110817","192.168.1.34","173.194.221.200","TCP","66","51934  >  443 [ACK] Seq=1 Ack=1 Win=29312 Len=0 TSval=3787814604 TSecr=2054932956"
"272","11.696775694","192.168.1.34","173.194.221.200","TLSv1","583","Client Hello"
"273","11.716460895","192.168.1.34","173.194.222.95","TCP","74","[TCP Retransmission] 37742  >  443 [SYN] Seq=0 Win=29200 Len=0 MSS=1460 SACK_PERM=1 TSval=1685015207 TSecr=0 WS=128"
"274","11.844459903","192.168.1.34","173.194.221.94","TCP","74","[TCP Retransmission] 41168  >  443 [SYN] Seq=0 Win=29200 Len=0 MSS=1460 SACK_PERM=1 TSval=3638050478 TSecr=0 WS=128"
"275","11.849130919","192.168.1.34","173.194.221.113","TCP","74","33504  >  443 [SYN] Seq=0 Win=29200 Len=0 MSS=1460 SACK_PERM=1 TSval=941981155 TSecr=0 WS=128"
"276","11.878903427","192.168.1.34","173.194.221.113","QUIC","1392","Client Hello, PKN: 3, CID: 6194125321457197329"
"277","12.024443904","173.194.221.132","192.168.1.34","QUIC","77","Payload (Encrypted), PKN: 7, CID: 5287725619453719693"
"278","12.024495272","192.168.1.34","173.194.221.132","ICMP","105","Destination unreachable (Port unreachable)"
"279","12.024523004","192.168.1.1","192.168.1.34","DNS","202","Standard query response 0xe647 A ogs.google.com CNAME www3.l.google.com A 173.194.221.139 A 173.194.221.102 A 173.194.221.101 A 173.194.221.138 A 173.194.221.113 A 173.194.221.100 OPT"
"280","12.024538117","192.168.1.34","192.168.1.1","ICMP","230","Destination unreachable (Port unreachable)"
"281","12.176456872","192.168.1.1","192.168.1.34","DNS","111","Standard query response 0xba65 A translate.googleapis.com A 173.194.221.95 OPT"
"282","12.176514863","192.168.1.34","192.168.1.1","ICMP","139","Destination unreachable (Port unreachable)"
"283","12.176545973","192.168.1.1","192.168.1.34","DNS","116","Standard query response 0x1e53 A clientservices.googleapis.com A 173.194.221.94 OPT"
"284","12.176558570","192.168.1.34","192.168.1.1","ICMP","144","Destination unreachable (Port unreachable)"
"285","12.176566726","192.168.1.1","192.168.1.34","DNS","106","Standard query response 0x2c9b A accounts.google.com A 173.194.221.84 OPT"
"286","12.176574866","192.168.1.34","192.168.1.1","ICMP","134","Destination unreachable (Port unreachable)"
"287","12.176581535","173.194.222.95","192.168.1.34","TCP","74","443  >  37720 [SYN, ACK] Seq=0 Ack=1 Win=42408 Len=0 MSS=1380 SACK_PERM=1 TSval=1388386687 TSecr=1685011285 WS=256"
"288","12.176619723","192.168.1.34","173.194.222.95","TCP","66","37720  >  443 [ACK] Seq=1 Ack=1 Win=29312 Len=0 TSval=1685015668 TSecr=1388386687"
"289","12.176629219","173.194.221.200","192.168.1.34","TCP","74","443  >  51938 [SYN, ACK] Seq=0 Ack=1 Win=42408 Len=0 MSS=1380 SACK_PERM=1 TSval=941026776 TSecr=3787810860 WS=256"
"290","12.176642946","192.168.1.34","173.194.221.200","TCP","66","51938  >  443 [ACK] Seq=1 Ack=1 Win=29312 Len=0 TSval=3787815085 TSecr=941026776"
"291","12.176649458","173.194.222.95","192.168.1.34","TCP","74","[TCP Retransmission] 443  >  37704 [SYN, ACK] Seq=0 Ack=1 Win=42408 Len=0 MSS=1380 SACK_PERM=1 TSval=1527719179 TSecr=1685010523 WS=256"
"292","12.176657104","192.168.1.34","173.194.222.95","TCP","66","[TCP Dup ACK 126#1] 37704  >  443 [ACK] Seq=518 Ack=1 Win=29312 Len=0 TSval=1685015668 TSecr=1527718278"
"293","12.177319601","192.168.1.34","173.194.222.95","TLSv1","583","Client Hello"
"294","12.227751732","192.168.1.34","173.194.221.196","QUIC","1392","Client Hello, PKN: 11, CID: 13722843852663968178"
"295","12.229022446","192.168.1.34","173.194.221.100","QUIC","110","Payload (Encrypted), PKN: 8, CID: 12633944106072422182"
"296","12.229227219","192.168.1.34","173.194.221.84","QUIC","110","Payload (Encrypted), PKN: 8, CID: 14934445637111636319"
"297","12.318602083","192.168.1.34","173.194.221.94","QUIC","110","Payload (Encrypted), PKN: 3, CID: 487402657683798057"
"298","12.320380909","192.168.1.34","173.194.221.194","QUIC","110","Payload (Encrypted), PKN: 3, CID: 16357981161946577666"
"299","12.428159649","64.233.162.156","192.168.1.34","QUIC","77","Payload (Encrypted), PKN: 13, CID: 15915747847831504427"
"300","12.428178371","173.194.221.200","192.168.1.34","QUIC","77","Payload (Encrypted), PKN: 9, CID: 5803283791748683659"
"301","12.443605017","192.168.1.34","173.194.221.113","QUIC","1392","Client Hello, PKN: 4, CID: 6194125321457197329"
"302","12.560452150","173.194.221.196","192.168.1.34","QUIC","77","Payload (Encrypted), PKN: 12, CID: 13722843852663968178"
"303","12.576777224","192.168.1.34","224.0.0.251","MDNS","78","Standard query 0x0000 PTR _privet._tcp.local, ""QM"" question"
"304","12.576862825","fe80::e947:4933:d8f3:d302","ff02::fb","MDNS","98","Standard query 0x0000 PTR _privet._tcp.local, ""QM"" question"
"305","12.612387611","192.168.1.34","173.194.221.113","TCP","74","[TCP Retransmission] 33502  >  443 [SYN] Seq=0 Win=29200 Len=0 MSS=1460 SACK_PERM=1 TSval=941981919 TSecr=0 WS=128"
"306","12.648321855","173.194.221.94","192.168.1.34","TCP","74","443  >  41148 [SYN, ACK] Seq=0 Ack=1 Win=42408 Len=0 MSS=1380 SACK_PERM=1 TSval=4145310185 TSecr=3638046744 WS=256"
"307","12.648387280","192.168.1.34","173.194.221.94","TCP","66","41148  >  443 [ACK] Seq=1 Ack=1 Win=29312 Len=0 TSval=3638051283 TSecr=4145310185"
"308","12.648412861","173.194.221.94","192.168.1.34","TCP","74","443  >  41150 [SYN, ACK] Seq=0 Ack=1 Win=42408 Len=0 MSS=1380 SACK_PERM=1 TSval=2187121041 TSecr=3638046746 WS=256"
"309","12.648426271","192.168.1.34","173.194.221.94","TCP","66","41150  >  443 [ACK] Seq=1 Ack=1 Win=29312 Len=0 TSval=3638051283 TSecr=2187121041"
"310","12.649090867","192.168.1.34","173.194.221.94","TLSv1","583","Client Hello"
"311","12.649626548","192.168.1.34","173.194.221.94","TLSv1","583","Client Hello"
"312","12.724144587","173.194.221.196","192.168.1.34","QUIC","1392","Payload (Encrypted), PKN: 14, CID: 3590720629355223137"
"313","12.724177133","173.194.221.94","192.168.1.34","TCP","74","443  >  41140 [SYN, ACK] Seq=0 Ack=1 Win=42408 Len=0 MSS=1380 SACK_PERM=1 TSval=2079449244 TSecr=3638046232 WS=256"
"314","12.724220185","192.168.1.34","173.194.221.94","TCP","66","41140  >  443 [ACK] Seq=1 Ack=1 Win=29312 Len=0 TSval=3638051359 TSecr=2079449244"
"315","12.724244860","173.194.221.200","192.168.1.34","TCP","74","[TCP Retransmission] 443  >  51934 [SYN, ACK] Seq=0 Ack=1 Win=42408 Len=0 MSS=1380 SACK_PERM=1 TSval=2054933257 TSecr=3787810609 WS=256"
"316","12.724253651","192.168.1.34","173.194.221.200","TCP","66","[TCP Dup ACK 271#1] 51934  >  443 [ACK] Seq=518 Ack=1 Win=29312 Len=0 TSval=3787815633 TSecr=2054932956"
"317","12.724261043","173.194.221.94","192.168.1.34","QUIC","77","Payload (Encrypted), PKN: 13, CID: 18072196388328118377"
"318","12.724484828","192.168.1.34","173.194.221.196","QUIC","88","Payload (Encrypted), PKN: 5, CID: 3590720629355223137"
"319","12.725136941","192.168.1.34","173.194.221.94","TLSv1","583","Client Hello"
"320","12.868453274","192.168.1.34","173.194.221.113","TCP","74","[TCP Retransmission] 33504  >  443 [SYN] Seq=0 Win=29200 Len=0 MSS=1460 SACK_PERM=1 TSval=941982175 TSecr=0 WS=128"
"321","13.111984984","173.194.221.94","192.168.1.34","QUIC","1392","Rejection, PKN: 10, CID: 1844395865238430561"
"322","13.115559240","192.168.1.34","173.194.221.94","QUIC","80","Payload (Encrypted), PKN: 3, CID: 1844395865238430561"
"323","13.122428071","192.168.1.34","173.194.221.94","QUIC","1392","Client Hello, PKN: 4, CID: 1844395865238430561"
"324","13.212228497","192.168.1.34","192.168.1.1","DNS","87","Standard query 0x6d23 A drive.google.com OPT"
"325","13.336042299","173.194.221.94","192.168.1.34","QUIC","1392","Payload (Encrypted), PKN: 14, CID: 11147747279864269353"
"326","13.336071588","173.194.222.95","192.168.1.34","TCP","66","443  >  37704 [ACK] Seq=1 Ack=518 Win=43520 Len=0 TSval=1527719423 TSecr=1685011718"
"327","13.339664386","192.168.1.34","173.194.221.94","QUIC","87","Payload (Encrypted), PKN: 6, CID: 11147747279864269353"
"328","13.346759610","173.194.222.95","192.168.1.34","TLSv1.2","1484","Server Hello"
"329","13.346795774","192.168.1.34","173.194.222.95","TCP","66","37704  >  443 [ACK] Seq=518 Ack=1419 Win=32128 Len=0 TSval=1685016838 TSecr=1527719424"
"330","13.348045544","192.168.1.34","173.194.221.94","TCP","74","[TCP Retransmission] 41170  >  443 [SYN] Seq=0 Win=29200 Len=0 MSS=1460 SACK_PERM=1 TSval=3638051983 TSecr=0 WS=128"
"331","13.351142756","192.168.1.34","173.194.221.94","QUIC","1392","Client Hello, PKN: 7, CID: 11147747279864269353"
"332","13.351674139","192.168.1.34","173.194.221.94","QUIC","775","Payload (Encrypted), PKN: 8, CID: 11147747279864269353"
"333","13.351982131","192.168.1.34","173.194.221.94","QUIC","187","Payload (Encrypted), PKN: 9, CID: 11147747279864269353"
"334","13.469892017","192.168.1.34","173.194.221.132","QUIC","120","Payload (Encrypted), PKN: 5, CID: 9374137742742581356"
"335","13.572386606","192.168.1.34","173.194.221.113","QUIC","1392","Client Hello, PKN: 5, CID: 6194125321457197329"
"336","13.578133419","192.168.1.34","224.0.0.251","MDNS","78","Standard query 0x0000 PTR _privet._tcp.local, ""QM"" question"
"337","13.578229505","fe80::e947:4933:d8f3:d302","ff02::fb","MDNS","98","Standard query 0x0000 PTR _privet._tcp.local, ""QM"" question"
"338","13.604048352","192.168.1.34","173.194.221.94","TCP","74","[TCP Retransmission] 41172  >  443 [SYN] Seq=0 Win=29200 Len=0 MSS=1460 SACK_PERM=1 TSval=3638052239 TSecr=0 WS=128"
"339","13.608024513","173.194.221.100","192.168.1.34","QUIC","1392","Rejection, PKN: 1, CID: 12633944106072422182"
"340","13.608077918","192.168.1.34","173.194.221.100","ICMP","590","Destination unreachable (Port unreachable)"
"341","13.608107399","173.194.221.100","192.168.1.34","QUIC","1392","Payload (Encrypted), PKN: 2, CID: 12633944106072422182"
"342","13.608119619","192.168.1.34","173.194.221.100","ICMP","590","Destination unreachable (Port unreachable)"
"343","13.608127660","13.33.20.80","192.168.1.34","TCP","74","[TCP Retransmission] 443  >  47832 [SYN, ACK] Seq=0 Ack=1 Win=28960 Len=0 MSS=1460 SACK_PERM=1 TSval=1721382879 TSecr=4096589746 WS=256"
"344","13.608142932","192.168.1.34","13.33.20.80","TCP","66","[TCP Dup ACK 199#1] 47832  >  443 [ACK] Seq=518 Ack=1 Win=29312 Len=0 TSval=4096596068 TSecr=1721382779"
"345","13.608150727","173.194.221.84","192.168.1.34","QUIC","1392","Rejection, PKN: 1, CID: 14934445637111636319"
"346","13.608163513","192.168.1.34","173.194.221.84","ICMP","590","Destination unreachable (Port unreachable)"
"347","13.608170896","173.194.221.84","192.168.1.34","QUIC","1392","Payload (Encrypted), PKN: 2, CID: 14934445637111636319"
"348","13.608180506","192.168.1.34","173.194.221.84","ICMP","590","Destination unreachable (Port unreachable)"
"349","13.608187175","173.194.221.95","192.168.1.34","TCP","74","443  >  46068 [SYN, ACK] Seq=0 Ack=1 Win=42408 Len=0 MSS=1380 SACK_PERM=1 TSval=3930756786 TSecr=4126651714 WS=256"
"350","13.608224575","192.168.1.34","173.194.221.95","TCP","66","46068  >  443 [ACK] Seq=1 Ack=1 Win=29312 Len=0 TSval=4126657096 TSecr=3930756786"
"351","13.608237449","173.194.221.94","192.168.1.34","TCP","74","443  >  41156 [SYN, ACK] Seq=0 Ack=1 Win=42408 Len=0 MSS=1380 SACK_PERM=1 TSval=1295662045 TSecr=3638046862 WS=256"
"352","13.608254731","192.168.1.34","173.194.221.94","TCP","66","41156  >  443 [ACK] Seq=1 Ack=1 Win=29312 Len=0 TSval=3638052243 TSecr=1295662045"
"353","13.608890252","192.168.1.34","173.194.221.95","TLSv1","583","Client Hello"
"354","13.609354799","192.168.1.34","173.194.221.94","TLSv1","583","Client Hello"
"355","13.744167229","173.194.221.94","192.168.1.34","QUIC","1392","Payload (Encrypted), PKN: 15, CID: 18072196388328118377"
"356","13.744179956","173.194.221.100","192.168.1.34","QUIC","77","Payload (Encrypted), PKN: 3, CID: 12633944106072422182"
"357","13.744196867","192.168.1.34","173.194.221.100","ICMP","105","Destination unreachable (Port unreachable)"
"358","13.744207165","173.194.222.95","192.168.1.34","TCP","74","[TCP Retransmission] 443  >  37720 [SYN, ACK] Seq=0 Ack=1 Win=42408 Len=0 MSS=1380 SACK_PERM=1 TSval=1388386987 TSecr=1685011285 WS=256"
"359","13.744213602","192.168.1.34","173.194.222.95","TCP","66","[TCP Dup ACK 288#1] 37720  >  443 [ACK] Seq=518 Ack=1 Win=29312 Len=0 TSval=1685017236 TSecr=1388386687"
"360","13.744216349","173.194.221.200","192.168.1.34","TCP","74","[TCP Retransmission] 443  >  51938 [SYN, ACK] Seq=0 Ack=1 Win=42408 Len=0 MSS=1380 SACK_PERM=1 TSval=941027075 TSecr=3787810860 WS=256"
"361","13.744219241","192.168.1.34","173.194.221.200","TCP","66","[TCP Dup ACK 290#1] 51938  >  443 [ACK] Seq=1 Ack=1 Win=29312 Len=0 TSval=3787816653 TSecr=941026776"
"362","13.744221307","173.194.221.84","192.168.1.34","QUIC","80","Payload (Encrypted), PKN: 3, CID: 14934445637111636319"
"363","13.744224722","192.168.1.34","173.194.221.84","ICMP","108","Destination unreachable (Port unreachable)"
"364","13.744227049","173.194.221.84","192.168.1.34","TCP","74","443  >  50678 [SYN, ACK] Seq=0 Ack=1 Win=42408 Len=0 MSS=1380 SACK_PERM=1 TSval=754625120 TSecr=2032235461 WS=256"
"365","13.744235903","192.168.1.34","173.194.221.84","TCP","66","50678  >  443 [ACK] Seq=1 Ack=1 Win=29312 Len=0 TSval=2032240936 TSecr=754625120"
"366","13.744238334","13.33.20.80","192.168.1.34","TCP","74","[TCP Retransmission] 443  >  47832 [SYN, ACK] Seq=0 Ack=1 Win=28960 Len=0 MSS=1460 SACK_PERM=1 TSval=1721382882 TSecr=4096589746 WS=256"
"367","13.744302881","192.168.1.34","173.194.221.94","QUIC","92","Payload (Encrypted), PKN: 8, CID: 18072196388328118377"
"368","13.744532089","192.168.1.34","173.194.221.84","TLSv1","583","Client Hello"
"369","13.822234793","192.168.1.34","173.194.221.138","QUIC","124","Payload (Encrypted), PKN: 6, CID: 17224589155244876144"
"370","13.948003930","173.194.222.95","192.168.1.34","TCP","74","[TCP Retransmission] 443  >  37706 [SYN, ACK] Seq=0 Ack=1 Win=42408 Len=0 MSS=1380 SACK_PERM=1 TSval=791297733 TSecr=1685010778 WS=256"
"371","13.948022297","192.168.1.34","173.194.222.95","TCP","66","[TCP Dup ACK 197#2] 37706  >  443 [ACK] Seq=518 Ack=1 Win=29312 Len=0 TSval=1685017440 TSecr=791296678"
"372","13.948035338","173.194.221.94","192.168.1.34","TCP","74","[TCP Out-Of-Order] 443  >  41148 [SYN, ACK] Seq=0 Ack=1 Win=42408 Len=0 MSS=1380 SACK_PERM=1 TSval=4145310484 TSecr=3638046744 WS=256"
"373","13.948038902","192.168.1.34","173.194.221.94","TCP","66","[TCP Dup ACK 307#1] 41148  >  443 [ACK] Seq=518 Ack=1 Win=29312 Len=0 TSval=3638052583 TSecr=4145310185"
"374","13.948041384","173.194.221.94","192.168.1.34","TCP","74","[TCP Out-Of-Order] 443  >  41150 [SYN, ACK] Seq=0 Ack=1 Win=42408 Len=0 MSS=1380 SACK_PERM=1 TSval=2187121340 TSecr=3638046746 WS=256"
"375","13.948043857","192.168.1.34","173.194.221.94","TCP","66","[TCP Dup ACK 309#1] 41150  >  443 [ACK] Seq=518 Ack=1 Win=29312 Len=0 TSval=3638052583 TSecr=2187121041"
"376","13.961840760","192.168.1.34","224.0.0.252","LLMNR","68","Standard query 0xd8d7 A ypbdlnrn"
"377","13.961998061","192.168.1.34","224.0.0.252","LLMNR","71","Standard query 0xe2a7 A tqghbbmgjla"
"378","13.962130409","192.168.1.34","224.0.0.252","LLMNR","73","Standard query 0x65f8 A lajvtlsxsvrar"
"379","14.212207589","192.168.1.1","192.168.1.34","DNS","210","Standard query response 0x6f60 A clients2.google.com CNAME clients.l.google.com A 173.194.221.139 A 173.194.221.101 A 173.194.221.138 A 173.194.221.100 A 173.194.221.102 A 173.194.221.113 OPT"
"380","14.212268685","192.168.1.34","192.168.1.1","ICMP","238","Destination unreachable (Port unreachable)"
"381","14.212295942","192.168.1.1","192.168.1.34","DNS","129","Standard query response 0x6d23 A drive.google.com CNAME wide-docs.l.google.com A 173.194.221.194 OPT"
"382","14.214354917","192.168.1.34","192.168.1.1","DNS","85","Standard query 0x8df3 A www.google.com OPT"
"383","14.214719962","192.168.1.34","224.0.0.252","LLMNR","73","Standard query 0x65f8 A lajvtlsxsvrar"
"384","14.215062473","192.168.1.34","224.0.0.252","LLMNR","71","Standard query 0xe2a7 A tqghbbmgjla"
"385","14.215382198","192.168.1.34","224.0.0.252","LLMNR","68","Standard query 0xd8d7 A ypbdlnrn"
"386","14.462074907","192.168.1.34","224.0.0.252","LLMNR","73","Standard query 0x65f8 A lajvtlsxsvrar"
"387","14.462196923","192.168.1.34","224.0.0.252","LLMNR","68","Standard query 0xd8d7 A ypbdlnrn"
"388","14.462292831","192.168.1.34","224.0.0.252","LLMNR","71","Standard query 0xe2a7 A tqghbbmgjla"
"389","14.519983238","64.233.162.156","192.168.1.34","QUIC","1392","Rejection, PKN: 14, CID: 15915747847831504427"
"390","14.520012330","64.233.162.156","192.168.1.34","QUIC","1392","Payload (Encrypted), PKN: 15, CID: 15915747847831504427"
"391","14.520019668","173.194.221.194","192.168.1.34","QUIC","1392","Rejection, PKN: 1, CID: 16357981161946577666"
"392","14.520059156","192.168.1.34","173.194.221.194","ICMP","590","Destination unreachable (Port unreachable)"
"393","14.520081652","173.194.221.194","192.168.1.34","QUIC","1392","Payload (Encrypted), PKN: 2, CID: 16357981161946577666"
"394","14.520094483","192.168.1.34","173.194.221.194","ICMP","590","Destination unreachable (Port unreachable)"
"395","14.520103547","173.194.221.194","192.168.1.34","QUIC","77","Payload (Encrypted), PKN: 3, CID: 16357981161946577666"
"396","14.520112448","192.168.1.34","173.194.221.194","ICMP","105","Destination unreachable (Port unreachable)"
"397","14.520266671","192.168.1.34","64.233.162.156","QUIC","97","Payload (Encrypted), PKN: 8, CID: 15915747847831504427"
"398","14.523846722","192.168.1.34","64.233.162.156","QUIC","82","Payload (Encrypted), PKN: 9, CID: 15915747847831504427"
"399","14.527060814","192.168.1.34","64.233.162.156","QUIC","1392","Client Hello, PKN: 10, CID: 15915747847831504427"
"400","14.528313464","192.168.1.34","173.194.221.94","QUIC","1392","Client Hello, PKN: 5, CID: 1844395865238430561"
"401","14.628451098","192.168.1.34","173.194.221.113","TCP","74","[TCP Retransmission] 33502  >  443 [SYN] Seq=0 Win=29200 Len=0 MSS=1460 SACK_PERM=1 TSval=941983936 TSecr=0 WS=128"
"402","14.692151906","192.168.1.34","13.79.241.202","TCP","66","55790  >  443 [FIN, ACK] Seq=1 Ack=1 Win=396 Len=0 TSval=2358742376 TSecr=70852930"
"403","14.866343410","192.168.1.34","224.0.0.252","LLMNR","71","Standard query 0xf102 A tqghbbmgjla"
"404","14.866495249","192.168.1.34","224.0.0.252","LLMNR","73","Standard query 0x2d6a A lajvtlsxsvrar"
"405","14.866621419","192.168.1.34","224.0.0.252","LLMNR","68","Standard query 0xa9a0 A ypbdlnrn"
"406","14.872004838","173.194.221.100","192.168.1.34","QUIC","1392","Payload (Encrypted), PKN: 8, CID: 12633944106072422182"
"407","14.872027593","192.168.1.34","173.194.221.100","ICMP","590","Destination unreachable (Port unreachable)"
"408","14.884490811","192.168.1.34","173.194.221.113","TCP","74","[TCP Retransmission] 33504  >  443 [SYN] Seq=0 Win=29200 Len=0 MSS=1460 SACK_PERM=1 TSval=941984192 TSecr=0 WS=128"
"409","14.947998398","192.168.1.34","173.194.222.95","TCP","583","[TCP Retransmission] 37710  >  443 [PSH, ACK] Seq=1 Ack=1 Win=29312 Len=517 TSval=1685018440 TSecr=3341271262"
"410","14.948038561","192.168.1.34","13.33.20.80","TCP","583","[TCP Retransmission] 47832  >  443 [PSH, ACK] Seq=1 Ack=1 Win=29312 Len=517 TSval=4096597408 TSecr=1721382779"
"411","14.948052648","192.168.1.34","173.194.222.95","TCP","583","[TCP Retransmission] 37706  >  443 [PSH, ACK] Seq=1 Ack=1 Win=29312 Len=517 TSval=1685018440 TSecr=791296678"
"412","15.108011545","173.194.221.94","192.168.1.34","TCP","74","[TCP Out-Of-Order] 443  >  41156 [SYN, ACK] Seq=0 Ack=1 Win=42408 Len=0 MSS=1380 SACK_PERM=1 TSval=1295662344 TSecr=3638046862 WS=256"
"413","15.108047305","192.168.1.34","173.194.221.94","TCP","66","[TCP Dup ACK 352#1] 41156  >  443 [ACK] Seq=518 Ack=1 Win=29312 Len=0 TSval=3638053743 TSecr=1295662045"
"414","15.204054600","192.168.1.34","173.194.221.94","TCP","74","[TCP Retransmission] 41152  >  443 [SYN] Seq=0 Win=29200 Len=0 MSS=1460 SACK_PERM=1 TSval=3638053839 TSecr=0 WS=128"
"415","15.211979609","192.168.1.34","224.0.0.252","LLMNR","71","Standard query 0xf102 A tqghbbmgjla"
"416","15.212375127","192.168.1.34","224.0.0.252","LLMNR","68","Standard query 0xa9a0 A ypbdlnrn"
"417","15.212703795","192.168.1.34","224.0.0.252","LLMNR","73","Standard query 0x2d6a A lajvtlsxsvrar"
"418","15.292129161","173.194.221.95","192.168.1.34","TCP","74","[TCP Out-Of-Order] 443  >  46068 [SYN, ACK] Seq=0 Ack=1 Win=42408 Len=0 MSS=1380 SACK_PERM=1 TSval=3930757086 TSecr=4126651714 WS=256"
"419","15.292166062","192.168.1.34","173.194.221.95","TCP","66","[TCP Dup ACK 350#1] 46068  >  443 [ACK] Seq=518 Ack=1 Win=29312 Len=0 TSval=4126658781 TSecr=3930756786"
"420","15.292189395","173.194.221.84","192.168.1.34","TCP","74","[TCP Out-Of-Order] 443  >  50678 [SYN, ACK] Seq=0 Ack=1 Win=42408 Len=0 MSS=1380 SACK_PERM=1 TSval=754625420 TSecr=2032235461 WS=256"
"421","15.292196261","192.168.1.34","173.194.221.84","TCP","66","[TCP Dup ACK 365#1] 50678  >  443 [ACK] Seq=518 Ack=1 Win=29312 Len=0 TSval=2032242485 TSecr=754625120"
"422","15.292203401","173.194.221.194","192.168.1.34","QUIC","1392","Rejection, PKN: 4, CID: 16357981161946577666"
"423","15.292236920","192.168.1.34","173.194.221.194","ICMP","590","Destination unreachable (Port unreachable)"
"424","15.292250407","173.194.221.194","192.168.1.34","QUIC","1392","Payload (Encrypted), PKN: 5, CID: 16357981161946577666"
"425","15.292261256","192.168.1.34","173.194.221.194","ICMP","590","Destination unreachable (Port unreachable)"
"426","15.292268842","173.194.221.100","192.168.1.34","QUIC","77","Payload (Encrypted), PKN: 9, CID: 12633944106072422182"
"427","15.292278624","192.168.1.34","173.194.221.100","ICMP","105","Destination unreachable (Port unreachable)"
"428","15.292284942","173.194.221.196","192.168.1.34","QUIC","1392","Payload (Encrypted), PKN: 13, CID: 13722843852663968178"
"429","15.292477665","192.168.1.34","173.194.221.196","QUIC","87","Payload (Encrypted), PKN: 12, CID: 13722843852663968178"
"430","15.454291542","192.168.1.34","173.194.221.113","QUIC","110","Payload (Encrypted), PKN: 6, CID: 6194125321457197329"
"431","15.461946735","192.168.1.34","224.0.0.252","LLMNR","71","Standard query 0xf102 A tqghbbmgjla"
"432","15.462044706","173.194.221.94","192.168.1.34","QUIC","1392","Rejection, PKN: 6, CID: 487402657683798057"
"433","15.462074694","192.168.1.34","173.194.221.94","ICMP","590","Destination unreachable (Port unreachable)"
"434","15.462423181","192.168.1.34","224.0.0.252","LLMNR","73","Standard query 0x2d6a A lajvtlsxsvrar"
"435","15.462755243","192.168.1.34","224.0.0.252","LLMNR","68","Standard query 0xa9a0 A ypbdlnrn"
"436","15.464189392","173.194.221.94","192.168.1.34","QUIC","1392","Payload (Encrypted), PKN: 7, CID: 487402657683798057"
"437","15.464219451","192.168.1.34","173.194.221.94","ICMP","590","Destination unreachable (Port unreachable)"
"438","15.464242236","13.33.20.80","192.168.1.34","TCP","74","[TCP Retransmission] 443  >  47838 [SYN, ACK] Seq=0 Ack=1 Win=28960 Len=0 MSS=1460 SACK_PERM=1 TSval=1721381563 TSecr=4096589996 WS=256"
"439","15.464257543","192.168.1.34","13.33.20.80","TCP","66","[TCP Dup ACK 263#1] 47838  >  443 [ACK] Seq=1 Ack=1 Win=29312 Len=0 TSval=4096597925 TSecr=1721381463"
"440","15.469071084","173.194.221.194","192.168.1.34","QUIC","1392","Rejection, PKN: 6, CID: 16357981161946577666"
"441","15.469080353","192.168.1.34","173.194.221.194","ICMP","590","Destination unreachable (Port unreachable)"
"442","15.469999217","173.194.221.194","192.168.1.34","QUIC","1392","Payload (Encrypted), PKN: 7, CID: 16357981161946577666"
"443","15.472655384","173.194.221.200","192.168.1.34","QUIC","1392","Rejection, PKN: 12, CID: 5803283791748683659"
"444","15.473912031","192.168.1.34","173.194.221.200","QUIC","90","Payload (Encrypted), PKN: 7, CID: 5803283791748683659"
"445","15.476257291","192.168.1.34","173.194.221.200","QUIC","1392","Client Hello, PKN: 8, CID: 5803283791748683659"
"446","15.479131744","173.194.221.200","192.168.1.34","QUIC","1392","Payload (Encrypted), PKN: 13, CID: 5803283791748683659"
"447","15.479241360","192.168.1.34","173.194.221.200","QUIC","84","Payload (Encrypted), PKN: 9, CID: 5803283791748683659"
"448","15.485738315","173.194.221.100","192.168.1.34","QUIC","1392","Rejection, PKN: 10, CID: 12633944106072422182"
"449","15.485760758","192.168.1.34","173.194.221.100","ICMP","590","Destination unreachable (Port unreachable)"
"450","15.504760660","173.194.221.100","192.168.1.34","QUIC","1392","Payload (Encrypted), PKN: 11, CID: 12633944106072422182"
"451","15.504794016","192.168.1.34","173.194.221.100","ICMP","590","Destination unreachable (Port unreachable)"
"452","15.504810420","173.194.221.84","192.168.1.34","QUIC","77","Payload (Encrypted), PKN: 8, CID: 14934445637111636319"
"453","15.504817212","192.168.1.34","173.194.221.84","ICMP","105","Destination unreachable (Port unreachable)"
"454","15.516114631","173.194.221.84","192.168.1.34","QUIC","1392","Rejection, PKN: 9, CID: 14934445637111636319"
"455","15.516144260","192.168.1.34","173.194.221.84","ICMP","590","Destination unreachable (Port unreachable)"
"456","15.524223103","173.194.221.84","192.168.1.34","QUIC","1392","Payload (Encrypted), PKN: 10, CID: 14934445637111636319"
"457","15.524257657","192.168.1.34","173.194.221.84","ICMP","590","Destination unreachable (Port unreachable)"
"458","15.555307894","173.194.221.132","192.168.1.34","QUIC","1392","Rejection, PKN: 13, CID: 5287725619453719693"
"459","15.555357878","192.168.1.34","173.194.221.132","ICMP","590","Destination unreachable (Port unreachable)"
"460","15.579211240","192.168.1.34","224.0.0.251","MDNS","78","Standard query 0x0000 PTR _privet._tcp.local, ""QM"" question"
"461","15.579309308","fe80::e947:4933:d8f3:d302","ff02::fb","MDNS","98","Standard query 0x0000 PTR _privet._tcp.local, ""QM"" question"
"462","15.637754601","173.194.221.132","192.168.1.34","QUIC","1392","Payload (Encrypted), PKN: 14, CID: 5287725619453719693"
"463","15.637805676","192.168.1.34","173.194.221.132","ICMP","590","Destination unreachable (Port unreachable)"
"464","15.642253779","173.194.221.94","192.168.1.34","QUIC","1392","Rejection, PKN: 8, CID: 487402657683798057"
"465","15.642301889","192.168.1.34","173.194.221.94","ICMP","590","Destination unreachable (Port unreachable)"
"466","15.672975988","173.194.221.94","192.168.1.34","QUIC","1392","Payload (Encrypted), PKN: 9, CID: 487402657683798057"
"467","15.673023568","192.168.1.34","173.194.221.94","ICMP","590","Destination unreachable (Port unreachable)"
"468","15.682044080","173.194.221.194","192.168.1.34","QUIC","1392","Rejection, PKN: 8, CID: 16357981161946577666"
"469","15.682093279","192.168.1.34","173.194.221.194","ICMP","590","Destination unreachable (Port unreachable)"
"470","15.698653410","173.194.221.194","192.168.1.34","QUIC","1392","Payload (Encrypted), PKN: 9, CID: 16357981161946577666"
"471","15.716029570","192.168.1.34","173.194.221.84","TCP","74","[TCP Retransmission] 50684  >  443 [SYN] Seq=0 Win=29200 Len=0 MSS=1460 SACK_PERM=1 TSval=2032242909 TSecr=0 WS=128"
"472","15.716066935","192.168.1.34","173.194.221.95","TCP","74","[TCP Retransmission] 46076  >  443 [SYN] Seq=0 Win=29200 Len=0 MSS=1460 SACK_PERM=1 TSval=4126659205 TSecr=0 WS=128"
"473","15.716076847","192.168.1.34","173.194.221.94","TCP","74","[TCP Retransmission] 41160  >  443 [SYN] Seq=0 Win=29200 Len=0 MSS=1460 SACK_PERM=1 TSval=3638054352 TSecr=0 WS=128"
"474","15.726087795","173.194.221.94","192.168.1.34","TCP","74","[TCP Retransmission] 443  >  41136 [SYN, ACK] Seq=0 Ack=1 Win=42408 Len=0 MSS=1380 SACK_PERM=1 TSval=3088788565 TSecr=3638045982 WS=256"
"475","15.726118295","192.168.1.34","173.194.221.94","TCP","66","[TCP Dup ACK 217#1] 41136  >  443 [ACK] Seq=518 Ack=1 Win=29312 Len=0 TSval=3638054362 TSecr=3088786796"
"476","15.730561105","173.194.222.95","192.168.1.34","TCP","74","[TCP Retransmission] 443  >  37710 [SYN, ACK] Seq=0 Ack=1 Win=42408 Len=0 MSS=1380 SACK_PERM=1 TSval=3341273045 TSecr=1685010824 WS=256"
"477","15.730594223","192.168.1.34","173.194.222.95","TCP","66","[TCP Dup ACK 205#1] 37710  >  443 [ACK] Seq=518 Ack=1 Win=29312 Len=0 TSval=1685019223 TSecr=3341271262"
"478","15.732206494","64.233.162.156","192.168.1.34","QUIC","77","Payload (Encrypted), PKN: 16, CID: 15915747847831504427"
"479","15.733553541","173.194.221.94","192.168.1.34","TCP","74","443  >  41160 [SYN, ACK] Seq=0 Ack=1 Win=42408 Len=0 MSS=1380 SACK_PERM=1 TSval=2719127879 TSecr=3638047107 WS=256"
"480","15.733611767","192.168.1.34","173.194.221.94","TCP","66","41160  >  443 [ACK] Seq=1 Ack=1 Win=29312 Len=0 TSval=3638054369 TSecr=2719127879"
"481","15.735137667","173.194.221.95","192.168.1.34","TCP","74","443  >  46076 [SYN, ACK] Seq=0 Ack=1 Win=42408 Len=0 MSS=1380 SACK_PERM=1 TSval=3195137034 TSecr=4126651960 WS=256"
"482","15.735180465","192.168.1.34","173.194.221.95","TCP","66","46076  >  443 [ACK] Seq=1 Ack=1 Win=29312 Len=0 TSval=4126659224 TSecr=3195137034"
"483","15.748255454","173.194.221.138","192.168.1.34","QUIC","1392","Payload (Encrypted), PKN: 13, CID: 17224589155244876144"
"484","15.748304037","192.168.1.34","173.194.221.138","ICMP","590","Destination unreachable (Port unreachable)"
"485","15.748331872","173.194.221.200","192.168.1.34","QUIC","77","Payload (Encrypted), PKN: 14, CID: 5803283791748683659"
"486","15.749431399","173.194.221.100","192.168.1.34","QUIC","77","Payload (Encrypted), PKN: 12, CID: 12633944106072422182"
"487","15.749478414","192.168.1.34","173.194.221.100","ICMP","105","Destination unreachable (Port unreachable)"
"488","15.750305742","173.194.221.84","192.168.1.34","QUIC","77","Payload (Encrypted), PKN: 11, CID: 14934445637111636319"
"489","15.750360280","192.168.1.34","173.194.221.84","ICMP","105","Destination unreachable (Port unreachable)"
"490","15.751265573","173.194.221.84","192.168.1.34","TCP","74","443  >  50684 [SYN, ACK] Seq=0 Ack=1 Win=42408 Len=0 MSS=1380 SACK_PERM=1 TSval=2724117092 TSecr=2032235711 WS=256"
"491","15.751319430","192.168.1.34","173.194.221.84","TCP","66","50684  >  443 [ACK] Seq=1 Ack=1 Win=29312 Len=0 TSval=2032242944 TSecr=2724117092"
"492","15.752316054","173.194.221.94","192.168.1.34","TCP","74","[TCP Retransmission] 443  >  41140 [SYN, ACK] Seq=0 Ack=1 Win=42408 Len=0 MSS=1380 SACK_PERM=1 TSval=2079450412 TSecr=3638046232 WS=256"
"493","15.752348843","192.168.1.34","173.194.221.94","TCP","66","[TCP Dup ACK 314#1] 41140  >  443 [ACK] Seq=518 Ack=1 Win=29312 Len=0 TSval=3638054388 TSecr=2079449244"
"494","15.753473363","13.33.20.80","192.168.1.34","TCP","74","[TCP Retransmission] 443  >  47838 [SYN, ACK] Seq=0 Ack=1 Win=28960 Len=0 MSS=1460 SACK_PERM=1 TSval=1721381617 TSecr=4096589996 WS=256"
"495","15.754782602","173.194.221.132","192.168.1.34","QUIC","77","Payload (Encrypted), PKN: 15, CID: 5287725619453719693"
"496","15.754828406","192.168.1.34","173.194.221.132","ICMP","105","Destination unreachable (Port unreachable)"
"497","15.761458673","173.194.221.196","192.168.1.34","QUIC","1392","Rejection, PKN: 15, CID: 3590720629355223137"
"498","15.765191113","192.168.1.34","173.194.221.196","QUIC","82","Payload (Encrypted), PKN: 6, CID: 3590720629355223137"
"499","15.765309562","192.168.1.34","173.194.221.94","QUIC","1392","Client Hello, PKN: 10, CID: 11147747279864269353"
"500","15.768553701","192.168.1.34","173.194.221.196","QUIC","1392","Client Hello, PKN: 7, CID: 3590720629355223137"
"501","15.768620615","192.168.1.34","173.194.221.196","QUIC","131","Payload (Encrypted), PKN: 8, CID: 3590720629355223137"
"502","15.804280321","173.194.221.196","192.168.1.34","QUIC","1392","Payload (Encrypted), PKN: 16, CID: 3590720629355223137"
"503","15.804327202","192.168.1.34","173.194.221.196","ICMP","590","Destination unreachable (Port unreachable)"
"504","15.821729849","173.194.222.95","192.168.1.34","TCP","74","443  >  37742 [SYN, ACK] Seq=0 Ack=1 Win=42408 Len=0 MSS=1380 SACK_PERM=1 TSval=2708603338 TSecr=1685012181 WS=256"
"505","15.821789789","192.168.1.34","173.194.222.95","TCP","66","37742  >  443 [ACK] Seq=1 Ack=1 Win=29312 Len=0 TSval=1685019314 TSecr=2708603338"
"506","15.822885347","173.194.221.200","192.168.1.34","TCP","74","[TCP Retransmission] 443  >  51934 [SYN, ACK] Seq=0 Ack=1 Win=42408 Len=0 MSS=1380 SACK_PERM=1 TSval=2054934455 TSecr=3787810609 WS=256"
"507","15.822918526","192.168.1.34","173.194.221.200","TCP","66","[TCP Dup ACK 271#2] 51934  >  443 [ACK] Seq=518 Ack=1 Win=29312 Len=0 TSval=3787818732 TSecr=2054932956"
"508","15.823881523","173.194.222.95","192.168.1.34","TCP","74","[TCP Retransmission] 443  >  37720 [SYN, ACK] Seq=0 Ack=1 Win=42408 Len=0 MSS=1380 SACK_PERM=1 TSval=1388388011 TSecr=1685011285 WS=256"
"509","15.823913682","192.168.1.34","173.194.222.95","TCP","66","[TCP Dup ACK 288#2] 37720  >  443 [ACK] Seq=518 Ack=1 Win=29312 Len=0 TSval=1685019316 TSecr=1388386687"
"510","15.824819238","173.194.221.94","192.168.1.34","TCP","74","443  >  41168 [SYN, ACK] Seq=0 Ack=1 Win=42408 Len=0 MSS=1380 SACK_PERM=1 TSval=1191651755 TSecr=3638047452 WS=256"
"511","15.824880990","192.168.1.34","173.194.221.94","TCP","66","41168  >  443 [ACK] Seq=1 Ack=1 Win=29312 Len=0 TSval=3638054460 TSecr=1191651755"
"512","15.825533592","192.168.1.34","173.194.221.94","TLSv1","583","Client Hello"
"513","15.825631001","173.194.221.100","192.168.1.34","QUIC","77","Payload (Encrypted), PKN: 13, CID: 12633944106072422182"
"514","15.826939710","173.194.221.200","192.168.1.34","TCP","74","[TCP Retransmission] 443  >  51938 [SYN, ACK] Seq=0 Ack=1 Win=42408 Len=0 MSS=1380 SACK_PERM=1 TSval=941028172 TSecr=3787810860 WS=256"
"515","15.826973579","192.168.1.34","173.194.221.200","TCP","66","[TCP Dup ACK 290#2] 51938  >  443 [ACK] Seq=1 Ack=1 Win=29312 Len=0 TSval=3787818737 TSecr=941026776"
"516","15.829095472","173.194.221.94","192.168.1.34","TCP","74","[TCP Retransmission] 443  >  41150 [SYN, ACK] Seq=0 Ack=1 Win=42408 Len=0 MSS=1380 SACK_PERM=1 TSval=2187122337 TSecr=3638046746 WS=256"
"517","15.829130148","192.168.1.34","173.194.221.94","TCP","66","[TCP Dup ACK 309#2] 41150  >  443 [ACK] Seq=518 Ack=1 Win=29312 Len=0 TSval=3638054465 TSecr=2187121041"
"518","15.831490889","173.194.221.94","192.168.1.34","TCP","74","[TCP Retransmission] 443  >  41148 [SYN, ACK] Seq=0 Ack=1 Win=42408 Len=0 MSS=1380 SACK_PERM=1 TSval=4145311499 TSecr=3638046744 WS=256"
"519","15.831515259","192.168.1.34","173.194.221.94","TCP","66","[TCP Dup ACK 307#2] 41148  >  443 [ACK] Seq=518 Ack=1 Win=29312 Len=0 TSval=3638054467 TSecr=4145310185"
"520","15.832991765","173.194.221.94","192.168.1.34","TCP","74","443  >  41152 [SYN, ACK] Seq=0 Ack=1 Win=42408 Len=0 MSS=1380 SACK_PERM=1 TSval=686276285 TSecr=3638046774 WS=256"
"521","15.833039246","192.168.1.34","173.194.221.94","TCP","66","41152  >  443 [ACK] Seq=1 Ack=1 Win=29312 Len=0 TSval=3638054469 TSecr=686276285"
"522","15.850819302","173.194.221.132","192.168.1.34","QUIC","1392","Rejection, PKN: 14, CID: 9374137742742581356"
"523","15.850867807","192.168.1.34","173.194.221.132","ICMP","590","Destination unreachable (Port unreachable)"
"524","15.874806691","173.194.221.132","192.168.1.34","QUIC","1392","Payload (Encrypted), PKN: 15, CID: 9374137742742581356"
"525","15.874854705","192.168.1.34","173.194.221.132","ICMP","590","Destination unreachable (Port unreachable)"
"526","15.887267731","173.194.221.84","192.168.1.34","QUIC","77","Payload (Encrypted), PKN: 12, CID: 14934445637111636319"
"527","15.887312796","192.168.1.34","173.194.221.84","ICMP","105","Destination unreachable (Port unreachable)"
"528","15.906422318","173.194.221.95","192.168.1.34","TCP","74","[TCP Out-Of-Order] 443  >  46068 [SYN, ACK] Seq=0 Ack=1 Win=42408 Len=0 MSS=1380 SACK_PERM=1 TSval=3930757933 TSecr=4126651714 WS=256"
"529","15.906455252","192.168.1.34","173.194.221.95","TCP","66","[TCP Dup ACK 350#2] 46068  >  443 [ACK] Seq=518 Ack=1 Win=29312 Len=0 TSval=4126659395 TSecr=3930756786"
"530","15.908065446","173.194.221.94","192.168.1.34","TCP","74","[TCP Out-Of-Order] 443  >  41156 [SYN, ACK] Seq=0 Ack=1 Win=42408 Len=0 MSS=1380 SACK_PERM=1 TSval=1295663192 TSecr=3638046862 WS=256"
"531","15.908099497","192.168.1.34","173.194.221.94","TCP","66","[TCP Dup ACK 352#2] 41156  >  443 [ACK] Seq=518 Ack=1 Win=29312 Len=0 TSval=3638054544 TSecr=1295662045"
"532","15.911283578","173.194.221.84","192.168.1.34","TCP","74","[TCP Out-Of-Order] 443  >  50678 [SYN, ACK] Seq=0 Ack=1 Win=42408 Len=0 MSS=1380 SACK_PERM=1 TSval=754626252 TSecr=2032235461 WS=256"
"533","15.911315778","192.168.1.34","173.194.221.84","TCP","66","[TCP Dup ACK 365#2] 50678  >  443 [ACK] Seq=518 Ack=1 Win=29312 Len=0 TSval=2032243104 TSecr=754625120"
"534","15.925534223","173.194.221.94","192.168.1.34","QUIC","1392","Rejection, PKN: 12, CID: 1844395865238430561"
"535","15.925768799","192.168.1.34","173.194.221.94","QUIC","82","Payload (Encrypted), PKN: 6, CID: 1844395865238430561"
"536","15.972025410","192.168.1.34","173.194.221.94","TCP","583","[TCP Retransmission] 41136  >  443 [PSH, ACK] Seq=1 Ack=1 Win=29312 Len=517 TSval=3638054608 TSecr=3088786796"
"537","16.060547013","173.194.221.94","192.168.1.34","QUIC","1392","Payload (Encrypted), PKN: 13, CID: 1844395865238430561"
"538","16.060699702","192.168.1.34","173.194.221.94","QUIC","82","Payload (Encrypted), PKN: 7, CID: 1844395865238430561"
"539","16.073789320","173.194.221.94","192.168.1.34","QUIC","1392","Rejection, PKN: 15, CID: 11147747279864269353"
"540","16.073920316","192.168.1.34","173.194.221.94","QUIC","84","Payload (Encrypted), PKN: 11, CID: 11147747279864269353"
"541","16.085791623","173.194.221.94","192.168.1.34","QUIC","1392","Payload (Encrypted), PKN: 16, CID: 11147747279864269353"
"542","16.086015686","192.168.1.34","173.194.221.94","QUIC","84","Payload (Encrypted), PKN: 12, CID: 11147747279864269353"
"543","16.124851439","173.194.221.196","192.168.1.34","QUIC","80","Payload (Encrypted), PKN: 14, CID: 13722843852663968178"
"544","16.140588723","173.194.221.100","192.168.1.34","QUIC","1392","Rejection, PKN: 14, CID: 12633944106072422182"
"545","16.190866472","173.194.221.100","192.168.1.34","QUIC","1392","Payload (Encrypted), PKN: 15, CID: 12633944106072422182"
"546","16.219698827","173.194.221.100","192.168.1.34","QUIC","77","Payload (Encrypted), PKN: 16, CID: 12633944106072422182"
"547","16.232049311","173.194.221.84","192.168.1.34","QUIC","1392","Rejection, PKN: 13, CID: 14934445637111636319"
"548","16.352460227","173.194.221.84","192.168.1.34","QUIC","1392","Payload (Encrypted), PKN: 14, CID: 14934445637111636319"
"549","16.418957309","173.194.221.94","192.168.1.34","QUIC","1392","Rejection, PKN: 16, CID: 18072196388328118377"
"550","16.422622997","192.168.1.34","173.194.221.94","QUIC","86","Payload (Encrypted), PKN: 9, CID: 18072196388328118377"
"551","16.427122784","192.168.1.34","173.194.221.94","QUIC","1392","Client Hello, PKN: 10, CID: 18072196388328118377"
"552","16.427350592","192.168.1.34","173.194.221.94","QUIC","135","Payload (Encrypted), PKN: 11, CID: 18072196388328118377"
"553","16.436785388","173.194.221.94","192.168.1.34","QUIC","1392","Payload (Encrypted), PKN: 17, CID: 18072196388328118377"
"554","16.436832043","192.168.1.34","173.194.221.94","ICMP","590","Destination unreachable (Port unreachable)"
"555","16.448040872","173.194.221.94","192.168.1.34","TCP","74","[TCP Retransmission] 443  >  41160 [SYN, ACK] Seq=0 Ack=1 Win=42408 Len=0 MSS=1380 SACK_PERM=1 TSval=2719128179 TSecr=3638047107 WS=256"
"556","16.448073351","192.168.1.34","173.194.221.94","TCP","66","[TCP Dup ACK 480#1] 41160  >  443 [ACK] Seq=1 Ack=1 Win=29312 Len=0 TSval=3638055084 TSecr=2719127879"
"557","16.452639513","173.194.221.95","192.168.1.34","TCP","74","[TCP Retransmission] 443  >  46076 [SYN, ACK] Seq=0 Ack=1 Win=42408 Len=0 MSS=1380 SACK_PERM=1 TSval=3195137334 TSecr=4126651960 WS=256"
"558","16.452672427","192.168.1.34","173.194.221.95","TCP","66","[TCP Dup ACK 482#1] 46076  >  443 [ACK] Seq=1 Ack=1 Win=29312 Len=0 TSval=4126659941 TSecr=3195137034"
"559","16.458407631","173.194.221.84","192.168.1.34","TCP","74","[TCP Retransmission] 443  >  50684 [SYN, ACK] Seq=0 Ack=1 Win=42408 Len=0 MSS=1380 SACK_PERM=1 TSval=2724117392 TSecr=2032235711 WS=256"
"560","16.458440126","192.168.1.34","173.194.221.84","TCP","66","[TCP Dup ACK 491#1] 50684  >  443 [ACK] Seq=1 Ack=1 Win=29312 Len=0 TSval=2032243651 TSecr=2724117092"
"561","16.472410090","173.194.221.94","192.168.1.34","QUIC","1392","Rejection, PKN: 10, CID: 487402657683798057"
"562","16.472456626","192.168.1.34","173.194.221.94","ICMP","590","Destination unreachable (Port unreachable)"
"563","16.525419882","173.194.221.94","192.168.1.34","QUIC","1392","Payload (Encrypted), PKN: 11, CID: 487402657683798057"
"564","16.525467870","192.168.1.34","173.194.221.94","ICMP","590","Destination unreachable (Port unreachable)"
"565","16.557536240","173.194.222.95","192.168.1.34","TCP","74","[TCP Out-Of-Order] 443  >  37742 [SYN, ACK] Seq=0 Ack=1 Win=42408 Len=0 MSS=1380 SACK_PERM=1 TSval=2708603637 TSecr=1685012181 WS=256"
"566","16.557560469","192.168.1.34","173.194.222.95","TCP","66","[TCP Dup ACK 505#1] 37742  >  443 [ACK] Seq=1 Ack=1 Win=29312 Len=0 TSval=1685020050 TSecr=2708603338"
"567","16.564292997","173.194.221.94","192.168.1.34","TCP","74","[TCP Out-Of-Order] 443  >  41168 [SYN, ACK] Seq=0 Ack=1 Win=42408 Len=0 MSS=1380 SACK_PERM=1 TSval=1191652056 TSecr=3638047452 WS=256"
"568","16.564316987","192.168.1.34","173.194.221.94","TCP","66","[TCP Dup ACK 511#1] 41168  >  443 [ACK] Seq=518 Ack=1 Win=29312 Len=0 TSval=3638055200 TSecr=1191651755"
"569","16.601357634","64.233.162.156","192.168.1.34","QUIC","1392","Rejection, PKN: 17, CID: 15915747847831504427"
"570","16.627289149","192.168.1.34","64.233.162.156","QUIC","85","Payload (Encrypted), PKN: 11, CID: 15915747847831504427"
"571","16.642931286","64.233.162.156","192.168.1.34","QUIC","1392","Payload (Encrypted), PKN: 18, CID: 15915747847831504427"
"572","16.668389034","192.168.1.34","64.233.162.156","QUIC","82","Payload (Encrypted), PKN: 12, CID: 15915747847831504427"
"573","16.719421558","173.194.221.194","192.168.1.34","QUIC","1392","Rejection, PKN: 10, CID: 16357981161946577666"
"574","16.719469721","192.168.1.34","173.194.221.194","ICMP","590","Destination unreachable (Port unreachable)"
"575","16.753698826","173.194.221.194","192.168.1.34","QUIC","1392","Payload (Encrypted), PKN: 11, CID: 16357981161946577666"
"576","16.755728027","173.194.221.95","192.168.1.34","TCP","74","[TCP Retransmission] 443  >  46076 [SYN, ACK] Seq=0 Ack=1 Win=42408 Len=0 MSS=1380 SACK_PERM=1 TSval=3195137496 TSecr=4126651960 WS=256"
"577","16.758424388","173.194.221.94","192.168.1.34","TCP","74","[TCP Retransmission] 443  >  41160 [SYN, ACK] Seq=0 Ack=1 Win=42408 Len=0 MSS=1380 SACK_PERM=1 TSval=2719128344 TSecr=3638047107 WS=256"
"578","16.761342083","173.194.221.84","192.168.1.34","TCP","74","[TCP Retransmission] 443  >  50684 [SYN, ACK] Seq=0 Ack=1 Win=42408 Len=0 MSS=1380 SACK_PERM=1 TSval=2724117473 TSecr=2032235711 WS=256"
"579","16.763006536","173.194.221.84","192.168.1.34","QUIC","77","Payload (Encrypted), PKN: 15, CID: 14934445637111636319"
"580","16.763043229","192.168.1.34","173.194.221.84","ICMP","105","Destination unreachable (Port unreachable)"
