"No.","Time","Source","Destination","Protocol","Length","Info"
"1","0.000000","192.168.43.240","192.168.43.1","DNS","75","Standard query 0x8244 A search-poysk.ru"
"2","0.001643","192.168.43.240","192.168.43.1","DNS","71","Standard query 0xb5f3 A browsec.com"
"3","0.002601","192.168.43.240","192.168.43.1","DNS","75","Standard query 0xf796 A ui.ff.avast.com"
"4","0.016352","192.168.43.240","192.168.43.255","NBNS","92","Name query NB WPAD<00>"
"5","0.017016","fe80::85f5:a9e0:4b59:b0f1","ff02::1:3","LLMNR","84","Standard query 0x42eb A wpad"
"6","0.017275","192.168.43.240","224.0.0.252","LLMNR","64","Standard query 0x42eb A wpad"
"7","0.066308","LiteonTe_f7:82:e7","Broadcast","ARP","42","Who has 192.168.43.1? Tell 192.168.43.240"
"8","0.071441","HuaweiTe_d8:6e:c7","LiteonTe_f7:82:e7","ARP","42","192.168.43.1 is at 50:04:b8:d8:6e:c7"
"9","0.131618","192.168.43.1","192.168.43.240","DNS","416","Standard query response 0x8244 A search-poysk.ru A 46.4.235.72 NS b.dns.ripn.net NS e.dns.ripn.net NS f.dns.ripn.net NS a.dns.ripn.net NS d.dns.ripn.net A 193.232.128.6 AAAA 2001:678:17:0:193:232:128:6 A 193.232.156.17 AAAA 2001:678:14:0:193:232:156:17 A 193.232.142.17 AAAA 2001:678:15:0:193:232:142:17 A 194.85.252.62 AAAA 2001:678:16:0:194:85:252:62 A 194.190.124.17 AAAA 2001:678:18:0:194:190:124:17"
"10","0.134100","192.168.43.240","192.168.43.1","DNS","88","Standard query 0xc8f0 A drah7iczdw1tu.cloudfront.net"
"11","0.159137","192.168.43.1","192.168.43.240","DNS","400","Standard query response 0xb5f3 A browsec.com A 138.201.57.222 NS ns-1465.awsdns-55.org NS ns-1850.awsdns-39.co.uk NS ns-635.awsdns-15.net NS ns-248.awsdns-31.com A 205.251.197.185 AAAA 2600:9000:5305:b900::1 A 205.251.199.58 AAAA 2600:9000:5307:3a00::1 A 205.251.192.248 AAAA 2600:9000:5300:f800::1 A 205.251.194.123 AAAA 2600:9000:5302:7b00::1"
"12","0.159139","192.168.43.1","192.168.43.240","DNS","454","Standard query response 0xf796 A ui.ff.avast.com CNAME urlinfo.ns1.ff.avast.com A 5.45.59.40 A 5.45.59.39 A 5.45.58.99 NS ns02.ns1dnsavast.com NS dns4.p02.nsone.net NS dns1.p02.nsone.net NS ns04.ns1dnsavast.com NS ns01.ns1dnsavast.com NS dns2.p02.nsone.net NS dns3.p02.nsone.net NS ns03.ns1dnsavast.com A 198.51.44.2 A 198.51.45.2 A 198.51.44.66 A 198.51.45.66 A 185.51.231.1 A 185.51.231.65 A 185.51.231.129 A 185.51.231.193"
"13","0.160867","192.168.43.240","192.168.43.1","DNS","76","Standard query 0x5819 A publicsuffix.org"
"14","0.161498","192.168.43.240","192.168.43.1","DNS","84","Standard query 0x7046 A ssl.google-analytics.com"
"15","0.182020","192.168.43.1","192.168.43.240","DNS","529","Standard query response 0xc8f0 A drah7iczdw1tu.cloudfront.net A 13.33.23.196 A 13.33.23.194 A 13.33.23.22 A 13.33.23.177 A 13.33.23.203 A 13.33.23.41 A 13.33.23.213 A 13.33.23.191 NS ns-1199.awsdns-21.org NS ns-317.awsdns-39.com NS ns-1563.awsdns-03.co.uk NS ns-634.awsdns-15.net A 205.251.196.175 AAAA 2600:9000:5304:af00::1 A 205.251.198.27 AAAA 2600:9000:5306:1b00::1 A 205.251.193.61 AAAA 2600:9000:5301:3d00::1 A 205.251.194.122 AAAA 2600:9000:5302:7a00::1"
"16","0.183171","192.168.43.240","192.168.43.1","DNS","76","Standard query 0xe067 A uib.ff.avast.com"
"17","0.315702","192.168.43.1","192.168.43.240","DNS","403","Standard query response 0x5819 A publicsuffix.org A 63.245.213.25 NS ns-1334.awsdns-38.org NS ns-2045.awsdns-63.co.uk NS ns-1.awsdns-00.com NS ns-787.awsdns-34.net A 205.251.192.1 AAAA 2600:9000:5300:100::1 A 205.251.197.54 AAAA 2600:9000:5305:3600::1 A 205.251.199.253 AAAA 2600:9000:5307:fd00::1 A 205.251.195.19 AAAA 2600:9000:5303:1300::1"
"18","0.315991","192.168.43.1","192.168.43.240","DNS","392","Standard query response 0x7046 A ssl.google-analytics.com CNAME ssl-google-analytics.l.google.com A 216.58.207.200 NS ns2.google.com NS ns1.google.com NS ns4.google.com NS ns3.google.com A 216.239.38.10 AAAA 2001:4860:4802:38::a A 216.239.36.10 AAAA 2001:4860:4802:36::a A 216.239.34.10 AAAA 2001:4860:4802:34::a A 216.239.32.10 AAAA 2001:4860:4802:32::a"
"19","0.316773","192.168.43.240","192.168.43.1","DNS","67","Standard query 0x1453 A mail.ru"
"20","0.320880","192.168.43.1","192.168.43.240","DNS","455","Standard query response 0xe067 A uib.ff.avast.com CNAME urlinfo.ns1.ff.avast.com A 5.45.59.39 A 5.45.59.40 A 5.45.58.99 NS dns1.p02.nsone.net NS ns02.ns1dnsavast.com NS ns04.ns1dnsavast.com NS ns03.ns1dnsavast.com NS ns01.ns1dnsavast.com NS dns4.p02.nsone.net NS dns3.p02.nsone.net NS dns2.p02.nsone.net A 198.51.44.2 A 198.51.45.2 A 198.51.44.66 A 198.51.45.66 A 185.51.231.1 A 185.51.231.65 A 185.51.231.129 A 185.51.231.193"
"21","0.428730","fe80::85f5:a9e0:4b59:b0f1","ff02::1:3","LLMNR","84","Standard query 0x42eb A wpad"
"22","0.428836","192.168.43.240","224.0.0.252","LLMNR","64","Standard query 0x42eb A wpad"
"23","0.500907","192.168.43.1","192.168.43.240","DNS","334","Standard query response 0x1453 A mail.ru A 94.100.180.201 A 217.69.139.201 A 217.69.139.200 A 94.100.180.200 NS ns1.mail.ru NS ns3.mail.ru NS ns2.mail.ru A 185.30.176.202 AAAA 2a00:1148:db00::2 A 94.100.180.138 AAAA 2a00:1148:db00::1 A 217.69.139.112 AAAA 2a00:1148:db00::2"
"24","0.766212","192.168.43.240","192.168.43.255","NBNS","92","Name query NB WPAD<00>"
"25","1.016629","192.168.43.240","192.168.43.1","DNS","76","Standard query 0x7ac0 A mtalk.google.com"
"26","1.017065","192.168.43.240","216.58.207.200","QUIC","1392","Client Hello, PKN: 1, CID: 8793268273576317718"
"27","1.017536","192.168.43.240","46.4.235.72","TCP","66","10638  >  80 [SYN] Seq=0 Win=8192 Len=0 MSS=1460 WS=256 SACK_PERM=1"
"28","1.017903","192.168.43.240","5.45.59.40","TCP","66","10639  >  80 [SYN] Seq=0 Win=8192 Len=0 MSS=1460 WS=256 SACK_PERM=1"
"29","1.018053","192.168.43.240","192.168.43.1","DNS","71","Standard query 0x9655 A traflabc.ru"
"30","1.111811","192.168.43.240","13.33.23.196","TCP","66","10640  >  443 [SYN] Seq=0 Win=8192 Len=0 MSS=1460 WS=256 SACK_PERM=1"
"31","1.119470","192.168.43.1","192.168.43.240","DNS","369","Standard query response 0x7ac0 A mtalk.google.com CNAME mobile-gtalk.l.google.com A 64.233.161.188 NS ns4.google.com NS ns2.google.com NS ns3.google.com NS ns1.google.com A 216.239.38.10 AAAA 2001:4860:4802:38::a A 216.239.36.10 AAAA 2001:4860:4802:36::a A 216.239.34.10 AAAA 2001:4860:4802:34::a A 216.239.32.10 AAAA 2001:4860:4802:32::a"
"32","1.119471","192.168.43.1","192.168.43.240","DNS","460","Standard query response 0x9655 A traflabc.ru A 46.4.235.70 NS ns2.reg.ru NS ns1.reg.ru A 176.99.13.11 A 176.99.13.13 A 176.99.13.15 A 176.99.13.17 A 194.58.117.11 A 194.58.117.13 A 194.58.117.15 A 194.58.117.17 AAAA 2a00:f940:4::47 A 176.99.13.12 A 176.99.13.14 A 176.99.13.16 A 176.99.13.18 A 194.58.117.12 A 194.58.117.14 A 194.58.117.16 A 194.58.117.18 AAAA 2a00:f940:5::190"
"33","1.119471","216.58.207.200","192.168.43.240","QUIC","1392","Payload (Encrypted), PKN: 1, CID: 8793268273576317718"
"34","1.120448","216.58.207.200","192.168.43.240","QUIC","1392","Payload (Encrypted), PKN: 2, CID: 8793268273576317718"
"35","1.120458","192.168.43.240","46.4.235.70","TCP","66","10641  >  80 [SYN] Seq=0 Win=8192 Len=0 MSS=1460 WS=256 SACK_PERM=1"
"36","1.120753","192.168.43.240","46.4.235.70","TCP","66","10642  >  80 [SYN] Seq=0 Win=8192 Len=0 MSS=1460 WS=256 SACK_PERM=1"
"37","1.121039","192.168.43.240","46.4.235.70","TCP","66","10643  >  80 [SYN] Seq=0 Win=8192 Len=0 MSS=1460 WS=256 SACK_PERM=1"
"38","1.124776","192.168.43.240","216.58.207.200","QUIC","80","Payload (Encrypted), PKN: 2, CID: 8793268273576317718"
"39","1.124894","46.4.235.72","192.168.43.240","TCP","66","80  >  10638 [SYN, ACK] Seq=0 Ack=1 Win=14600 Len=0 MSS=1400 SACK_PERM=1 WS=512"
"40","1.125121","192.168.43.240","46.4.235.72","TCP","54","10638  >  80 [ACK] Seq=1 Ack=1 Win=65792 Len=0"
"41","1.125692","192.168.43.240","46.4.235.72","HTTP","458","GET / HTTP/1.1 "
"42","1.140465","5.45.59.40","192.168.43.240","TCP","66","80  >  10639 [SYN, ACK] Seq=0 Ack=1 Win=2920 Len=0 MSS=1400 SACK_PERM=1 WS=8192"
"43","1.140701","192.168.43.240","5.45.59.40","TCP","54","10639  >  80 [ACK] Seq=1 Ack=1 Win=65792 Len=0"
"44","1.140958","192.168.43.240","5.45.59.40","HTTP","481","GET /v5/ruleUpdate HTTP/1.1 "
"45","1.193969","192.168.43.240","216.58.207.200","TCP","66","10644  >  443 [SYN] Seq=0 Win=8192 Len=0 MSS=1460 WS=256 SACK_PERM=1"
"46","1.202600","192.168.43.240","64.233.161.188","TCP","66","10645  >  5228 [SYN] Seq=0 Win=8192 Len=0 MSS=1460 WS=256 SACK_PERM=1"
"47","1.229994","192.168.43.240","13.33.23.196","TCP","66","10646  >  443 [SYN] Seq=0 Win=8192 Len=0 MSS=1460 WS=256 SACK_PERM=1"
"48","1.238115","192.168.43.240","138.201.57.222","TCP","66","10647  >  443 [SYN] Seq=0 Win=8192 Len=0 MSS=1460 WS=256 SACK_PERM=1"
"49","1.267179","192.168.43.240","64.233.161.188","TCP","66","10648  >  5228 [SYN] Seq=0 Win=8192 Len=0 MSS=1460 WS=256 SACK_PERM=1"
"50","1.287650","13.33.23.196","192.168.43.240","TCP","66","443  >  10640 [SYN, ACK] Seq=0 Ack=1 Win=29200 Len=0 MSS=1400 SACK_PERM=1 WS=256"
"51","1.287651","46.4.235.70","192.168.43.240","TCP","66","80  >  10641 [SYN, ACK] Seq=0 Ack=1 Win=14600 Len=0 MSS=1400 SACK_PERM=1 WS=512"
"52","1.287652","46.4.235.70","192.168.43.240","TCP","66","80  >  10643 [SYN, ACK] Seq=0 Ack=1 Win=14600 Len=0 MSS=1400 SACK_PERM=1 WS=512"
"53","1.287652","46.4.235.70","192.168.43.240","TCP","66","80  >  10642 [SYN, ACK] Seq=0 Ack=1 Win=14600 Len=0 MSS=1400 SACK_PERM=1 WS=512"
"54","1.287966","192.168.43.240","192.168.43.1","DNS","79","Standard query 0x8c03 A accounts.google.com"
"55","1.288238","192.168.43.240","13.33.23.196","TCP","54","10640  >  443 [ACK] Seq=1 Ack=1 Win=65792 Len=0"
"56","1.288273","192.168.43.240","46.4.235.70","TCP","54","10641  >  80 [ACK] Seq=1 Ack=1 Win=65792 Len=0"
"57","1.288298","192.168.43.240","46.4.235.70","TCP","54","10643  >  80 [ACK] Seq=1 Ack=1 Win=65792 Len=0"
"58","1.288320","192.168.43.240","46.4.235.70","TCP","54","10642  >  80 [ACK] Seq=1 Ack=1 Win=65792 Len=0"
"59","1.291477","192.168.43.240","13.33.23.196","TLSv1.2","270","Client Hello"
"60","1.291944","192.168.43.240","192.168.43.1","DNS","81","Standard query 0xed3e A shepherd.ff.avast.com"
"61","1.297385","46.4.235.72","192.168.43.240","TCP","54","80  >  10638 [ACK] Seq=1 Ack=405 Win=15872 Len=0"
"62","1.297386","46.4.235.72","192.168.43.240","HTTP","391","HTTP/1.1 302 Found  (text/html)"
"63","1.297386","5.45.59.40","192.168.43.240","TCP","54","80  >  10639 [ACK] Seq=1 Ack=428 Win=8192 Len=0"
"64","1.297387","5.45.59.40","192.168.43.240","TCP","1454","80  >  10639 [ACK] Seq=1 Ack=428 Win=8192 Len=1400 [TCP segment of a reassembled PDU]"
"65","1.297387","5.45.59.40","192.168.43.240","TCP","1454","80  >  10639 [ACK] Seq=1401 Ack=428 Win=8192 Len=1400 [TCP segment of a reassembled PDU]"
"66","1.297388","5.45.59.40","192.168.43.240","TCP","1454","80  >  10639 [ACK] Seq=2801 Ack=428 Win=8192 Len=1400 [TCP segment of a reassembled PDU]"
"67","1.297390","5.45.59.40","192.168.43.240","TCP","1454","80  >  10639 [ACK] Seq=4201 Ack=428 Win=8192 Len=1400 [TCP segment of a reassembled PDU]"
"68","1.297391","5.45.59.40","192.168.43.240","TCP","1454","80  >  10639 [ACK] Seq=5601 Ack=428 Win=8192 Len=1400 [TCP segment of a reassembled PDU]"
"69","1.297391","5.45.59.40","192.168.43.240","TCP","1454","80  >  10639 [ACK] Seq=7001 Ack=428 Win=8192 Len=1400 [TCP segment of a reassembled PDU]"
"70","1.297392","5.45.59.40","192.168.43.240","TCP","1454","80  >  10639 [ACK] Seq=8401 Ack=428 Win=8192 Len=1400 [TCP segment of a reassembled PDU]"
"71","1.297393","5.45.59.40","192.168.43.240","TCP","1454","80  >  10639 [ACK] Seq=9801 Ack=428 Win=8192 Len=1400 [TCP segment of a reassembled PDU]"
"72","1.297394","5.45.59.40","192.168.43.240","TCP","1454","80  >  10639 [ACK] Seq=11201 Ack=428 Win=8192 Len=1400 [TCP segment of a reassembled PDU]"
"73","1.297540","192.168.43.240","5.45.59.40","TCP","54","10639  >  80 [ACK] Seq=428 Ack=12601 Win=65792 Len=0"
"74","1.304953","192.168.43.240","192.168.43.1","DNS","67","Standard query 0xfd46 A msrv.su"
"75","1.321269","192.168.43.240","5.45.59.39","TCP","66","10652  >  443 [SYN] Seq=0 Win=8192 Len=0 MSS=1460 WS=256 SACK_PERM=1"
"76","1.341988","192.168.43.240","239.255.255.250","SSDP","216","M-SEARCH * HTTP/1.1 "
"77","1.347602","192.168.43.240","46.4.235.72","TCP","54","10638  >  80 [ACK] Seq=405 Ack=338 Win=65280 Len=0"
"78","1.363345","192.168.43.240","13.33.23.196","TCP","66","10653  >  443 [SYN] Seq=0 Win=8192 Len=0 MSS=1460 WS=256 SACK_PERM=1"
"79","1.394510","192.168.43.240","216.58.207.200","QUIC","1392","Client Hello, PKN: 3, CID: 8793268273576317718"
"80","1.394951","192.168.43.240","216.58.207.200","QUIC","277","Payload (Encrypted), PKN: 4, CID: 8793268273576317718"
"81","1.398366","192.168.43.240","46.4.235.70","HTTP","1105","GET /?token=ziqh0 HTTP/1.1 "
"82","1.426753","fe80::85f5:a9e0:4b59:b0f1","ff02::1:2","DHCPv6","146","Solicit XID: 0x923422 CID: 000100011b8f3bf654a050ec5337 "
"83","1.439128","5.45.59.40","192.168.43.240","TCP","1454","80  >  10639 [ACK] Seq=12601 Ack=428 Win=8192 Len=1400 [TCP segment of a reassembled PDU]"
"84","1.439130","64.233.161.188","192.168.43.240","TCP","66","5228  >  10645 [SYN, ACK] Seq=0 Ack=1 Win=42780 Len=0 MSS=1380 SACK_PERM=1 WS=256"
"85","1.439130","216.58.207.200","192.168.43.240","TCP","66","443  >  10644 [SYN, ACK] Seq=0 Ack=1 Win=42780 Len=0 MSS=1380 SACK_PERM=1 WS=256"
"86","1.439131","13.33.23.196","192.168.43.240","TCP","66","443  >  10646 [SYN, ACK] Seq=0 Ack=1 Win=29200 Len=0 MSS=1400 SACK_PERM=1 WS=256"
"87","1.439603","192.168.43.240","64.233.161.188","TCP","240","10645  >  5228 [PSH, ACK] Seq=1 Ack=1 Win=66048 Len=186"
"88","1.439675","192.168.43.240","216.58.207.200","TCP","54","10644  >  443 [ACK] Seq=1 Ack=1 Win=66048 Len=0"
"89","1.439711","192.168.43.240","13.33.23.196","TCP","54","10646  >  443 [ACK] Seq=1 Ack=1 Win=65792 Len=0"
"90","1.439813","192.168.43.240","216.58.207.200","TLSv1.2","266","Client Hello"
"91","1.439940","192.168.43.240","13.33.23.196","TLSv1.2","270","Client Hello"
"92","1.442245","192.168.43.240","192.168.43.1","DNS","89","Standard query 0x301b A clientservices.googleapis.com"
"93","1.442323","192.168.43.240","192.168.43.1","DNS","84","Standard query 0xa96d A translate.googleapis.com"
"94","1.452433","64.233.161.188","192.168.43.240","TCP","66","5228  >  10648 [SYN, ACK] Seq=0 Ack=1 Win=42780 Len=0 MSS=1380 SACK_PERM=1 WS=256"
"95","1.452625","192.168.43.240","64.233.161.188","TCP","54","10648  >  5228 [ACK] Seq=1 Ack=1 Win=66048 Len=0"
"96","1.459674","138.201.57.222","192.168.43.240","TCP","66","443  >  10647 [SYN, ACK] Seq=0 Ack=1 Win=29200 Len=0 MSS=1400 SACK_PERM=1 WS=128"
"97","1.459922","192.168.43.240","138.201.57.222","TCP","54","10647  >  443 [ACK] Seq=1 Ack=1 Win=65792 Len=0"
"98","1.460111","192.168.43.240","138.201.57.222","TLSv1.2","253","Client Hello"
"99","1.461580","192.168.43.1","192.168.43.240","DNS","343","Standard query response 0x8c03 A accounts.google.com A 216.58.207.205 NS ns1.google.com NS ns3.google.com NS ns4.google.com NS ns2.google.com A 216.239.38.10 AAAA 2001:4860:4802:38::a A 216.239.36.10 AAAA 2001:4860:4802:36::a A 216.239.34.10 AAAA 2001:4860:4802:34::a A 216.239.32.10 AAAA 2001:4860:4802:32::a"
"100","1.462683","192.168.43.240","216.58.207.205","QUIC","1392","Client Hello, PKN: 1, CID: 9556696882999421587"
"101","1.488683","192.168.43.240","5.45.59.40","TCP","54","10639  >  80 [ACK] Seq=428 Ack=14001 Win=65792 Len=0"
"102","1.491808","192.168.43.240","192.168.43.1","DNS","67","Standard query 0xfd46 A msrv.su"
"103","1.491808","192.168.43.240","192.168.43.1","DNS","81","Standard query 0xed3e A shepherd.ff.avast.com"
"104","1.516740","192.168.43.240","192.168.43.255","NBNS","92","Name query NB WPAD<00>"
"105","1.533753","192.168.43.240","216.58.207.200","QUIC","1392","Client Hello, PKN: 5, CID: 8793268273576317718"
"106","1.572044","192.168.43.240","5.45.59.39","TCP","66","10656  >  443 [SYN] Seq=0 Win=8192 Len=0 MSS=1460 WS=256 SACK_PERM=1"
"107","1.599944","192.168.43.1","192.168.43.240","DNS","445","Standard query response 0xed3e A shepherd.ff.avast.com CNAME shepherd.ns1.ff.avast.com A 5.62.40.21 A 77.234.46.22 NS dns1.p02.nsone.net NS ns03.ns1dnsavast.com NS dns4.p02.nsone.net NS ns04.ns1dnsavast.com NS ns02.ns1dnsavast.com NS dns2.p02.nsone.net NS ns01.ns1dnsavast.com NS dns3.p02.nsone.net A 198.51.44.2 A 198.51.45.2 A 198.51.44.66 A 198.51.45.66 A 185.51.231.1 A 185.51.231.65 A 185.51.231.129 A 185.51.231.193"
"108","1.600672","192.168.43.240","5.62.40.21","TCP","66","10659  >  443 [SYN] Seq=0 Win=8192 Len=0 MSS=1460 WS=256 SACK_PERM=1"
"109","1.600942","192.168.43.1","192.168.43.240","DNS","318","Standard query response 0xfd46 A msrv.su A 176.9.18.162 NS robotns2.second-ns.de NS ns1.first-ns.de NS robotns3.second-ns.com A 193.47.99.3 AAAA 2001:67c:192c::add:a3 A 213.133.105.6 AAAA 2a01:4f8:d0a:2004::2 A 213.239.242.238 AAAA 2a01:4f8:0:a101::a:1"
"110","1.600943","13.33.23.196","192.168.43.240","TCP","54","443  >  10640 [ACK] Seq=1 Ack=217 Win=30464 Len=0"
"111","1.600943","13.33.23.196","192.168.43.240","TLSv1.2","1454","Server Hello"
"112","1.600945","13.33.23.196","192.168.43.240","TCP","1454","443  >  10640 [ACK] Seq=1401 Ack=217 Win=30464 Len=1400 [TCP segment of a reassembled PDU]"
"113","1.600946","13.33.23.196","192.168.43.240","TLSv1.2","1454","Certificate [TCP segment of a reassembled PDU]"
"114","1.600946","13.33.23.196","192.168.43.240","TLSv1.2","797","Certificate Status, Server Key Exchange, Server Hello Done"
"115","1.600947","5.45.59.40","192.168.43.240","TCP","1454","80  >  10639 [ACK] Seq=14001 Ack=428 Win=8192 Len=1400 [TCP segment of a reassembled PDU]"
"116","1.600947","5.45.59.40","192.168.43.240","TCP","1454","80  >  10639 [PSH, ACK] Seq=15401 Ack=428 Win=8192 Len=1400 [TCP segment of a reassembled PDU]"
"117","1.600948","5.45.59.40","192.168.43.240","TCP","1454","80  >  10639 [ACK] Seq=16801 Ack=428 Win=8192 Len=1400 [TCP segment of a reassembled PDU]"
"118","1.601083","192.168.43.240","13.33.23.196","TCP","54","10640  >  443 [ACK] Seq=217 Ack=4944 Win=65792 Len=0"
"119","1.601120","192.168.43.240","5.45.59.40","TCP","54","10639  >  80 [ACK] Seq=428 Ack=18201 Win=65792 Len=0"
"120","1.601475","5.45.59.40","192.168.43.240","TCP","1454","80  >  10639 [ACK] Seq=18201 Ack=428 Win=8192 Len=1400 [TCP segment of a reassembled PDU]"
"121","1.601518","192.168.43.240","5.45.59.40","TCP","54","10639  >  80 [ACK] Seq=428 Ack=19601 Win=65792 Len=0"
"122","1.603337","192.168.43.240","13.33.23.196","TLSv1.2","180","Client Key Exchange, Change Cipher Spec, Encrypted Handshake Message"
"123","1.603869","192.168.43.240","176.9.18.162","TCP","66","10660  >  443 [SYN] Seq=0 Win=8192 Len=0 MSS=1460 WS=256 SACK_PERM=1"
"124","1.604127","192.168.43.240","176.9.18.162","TCP","66","10661  >  443 [SYN] Seq=0 Win=8192 Len=0 MSS=1460 WS=256 SACK_PERM=1"
"125","1.604357","192.168.43.240","176.9.18.162","TCP","66","10662  >  443 [SYN] Seq=0 Win=8192 Len=0 MSS=1460 WS=256 SACK_PERM=1"
"126","1.609368","192.168.43.240","13.33.23.196","TLSv1.2","402","Application Data"
"127","1.617943","5.45.59.40","192.168.43.240","TCP","1454","80  >  10639 [ACK] Seq=19601 Ack=428 Win=8192 Len=1400 [TCP segment of a reassembled PDU]"
"128","1.618534","5.45.59.40","192.168.43.240","TCP","1454","80  >  10639 [ACK] Seq=21001 Ack=428 Win=8192 Len=1400 [TCP segment of a reassembled PDU]"
"129","1.618575","192.168.43.240","5.45.59.40","TCP","54","10639  >  80 [ACK] Seq=428 Ack=22401 Win=65792 Len=0"
"130","1.618663","5.45.59.40","192.168.43.240","HTTP","169","HTTP/1.1 200 OK  (application/octet-stream)"
"131","1.618664","5.45.59.39","192.168.43.240","TCP","66","443  >  10652 [SYN, ACK] Seq=0 Ack=1 Win=2920 Len=0 MSS=1400 SACK_PERM=1 WS=8192"
"132","1.618871","192.168.43.240","5.45.59.39","TCP","54","10652  >  443 [ACK] Seq=1 Ack=1 Win=65792 Len=0"
"133","1.619304","192.168.43.240","5.45.59.39","TLSv1.2","258","Client Hello"
"134","1.628846","192.168.43.240","192.168.43.1","DNS","89","Standard query 0x301b A clientservices.googleapis.com"
"135","1.628938","192.168.43.240","192.168.43.1","DNS","84","Standard query 0xa96d A translate.googleapis.com"
"136","1.670828","192.168.43.240","5.45.59.40","TCP","54","10639  >  80 [ACK] Seq=428 Ack=22516 Win=65536 Len=0"
"137","1.679136","192.168.43.240","216.58.207.205","TCP","66","10663  >  443 [SYN] Seq=0 Win=8192 Len=0 MSS=1460 WS=256 SACK_PERM=1"
"138","1.768117","46.4.235.72","192.168.43.240","HTTP","391","[TCP Spurious Retransmission] HTTP/1.1 302 Found  (text/html)"
"139","1.768118","192.168.43.1","192.168.43.240","DNS","152","Standard query response 0xed3e A shepherd.ff.avast.com CNAME shepherd.ns1.ff.avast.com A 77.234.46.22 A 5.62.40.21"
"140","1.768118","192.168.43.1","192.168.43.240","DNS","83","Standard query response 0xfd46 A msrv.su A 176.9.18.162"
"141","1.768119","64.233.161.188","192.168.43.240","TCP","66","[TCP Retransmission] 5228  >  10645 [SYN, ACK] Seq=0 Ack=1 Win=42780 Len=0 MSS=1380 SACK_PERM=1 WS=256"
"142","1.768119","216.58.207.200","192.168.43.240","TCP","66","[TCP Retransmission] 443  >  10644 [SYN, ACK] Seq=0 Ack=1 Win=42780 Len=0 MSS=1380 SACK_PERM=1 WS=256"
"143","1.768154","192.168.43.240","46.4.235.72","TCP","66","[TCP Dup ACK 77#1] 10638  >  80 [ACK] Seq=405 Ack=338 Win=65280 Len=0 SLE=1 SRE=338"
"144","1.768224","192.168.43.240","64.233.161.188","TCP","66","[TCP Dup ACK 87#1] 10645  >  5228 [ACK] Seq=187 Ack=1 Win=66048 Len=0 SLE=0 SRE=1"
"145","1.768241","192.168.43.240","216.58.207.200","TCP","66","[TCP Dup ACK 88#1] 10644  >  443 [ACK] Seq=213 Ack=1 Win=66048 Len=0 SLE=0 SRE=1"
"146","1.768381","192.168.43.1","192.168.43.240","DNS","360","Standard query response 0x301b A clientservices.googleapis.com A 216.58.207.195 NS ns2.google.com NS ns3.google.com NS ns1.google.com NS ns4.google.com A 216.239.34.10 AAAA 2001:4860:4802:34::a A 216.239.32.10 AAAA 2001:4860:4802:32::a A 216.239.36.10 AAAA 2001:4860:4802:36::a A 216.239.38.10 AAAA 2001:4860:4802:38::a"
"147","1.768493","192.168.43.1","192.168.43.240","DNS","355","Standard query response 0xa96d A translate.googleapis.com A 216.58.207.202 NS ns1.google.com NS ns2.google.com NS ns4.google.com NS ns3.google.com A 216.239.34.10 AAAA 2001:4860:4802:34::a A 216.239.32.10 AAAA 2001:4860:4802:32::a A 216.239.36.10 AAAA 2001:4860:4802:36::a A 216.239.38.10 AAAA 2001:4860:4802:38::a"
"148","1.768494","64.233.161.188","192.168.43.240","TCP","54","5228  >  10645 [ACK] Seq=1 Ack=187 Win=44032 Len=0"
"149","1.769033","192.168.43.240","216.58.207.195","TCP","66","10664  >  443 [SYN] Seq=0 Win=8192 Len=0 MSS=1460 WS=256 SACK_PERM=1"
"150","1.769101","64.233.161.188","192.168.43.240","TCP","1454","5228  >  10645 [ACK] Seq=1 Ack=187 Win=44032 Len=1400"
"151","1.769233","192.168.43.240","216.58.207.202","TCP","66","10665  >  443 [SYN] Seq=0 Win=8192 Len=0 MSS=1460 WS=256 SACK_PERM=1"
"152","1.769819","64.233.161.188","192.168.43.240","TCP","1454","5228  >  10645 [ACK] Seq=1401 Ack=187 Win=44032 Len=1400"
"153","1.769884","192.168.43.240","64.233.161.188","TCP","54","10645  >  5228 [ACK] Seq=187 Ack=2801 Win=66048 Len=0"
"154","1.770439","64.233.161.188","192.168.43.240","TCP","1454","5228  >  10645 [ACK] Seq=2801 Ack=187 Win=44032 Len=1400"
"155","1.770440","64.233.161.188","192.168.43.240","TCP","214","5228  >  10645 [PSH, ACK] Seq=4201 Ack=187 Win=44032 Len=160"
"156","1.770501","192.168.43.240","64.233.161.188","TCP","54","10645  >  5228 [ACK] Seq=187 Ack=4361 Win=66048 Len=0"
"157","1.770904","13.33.23.196","192.168.43.240","TCP","66","443  >  10653 [SYN, ACK] Seq=0 Ack=1 Win=29200 Len=0 MSS=1400 SACK_PERM=1 WS=256"
"158","1.770904","216.58.207.200","192.168.43.240","QUIC","86","Payload (Encrypted), PKN: 3, CID: 8793268273576317718"
"159","1.770904","13.33.23.196","192.168.43.240","TCP","54","443  >  10646 [ACK] Seq=1 Ack=217 Win=30464 Len=0"
"160","1.770905","216.58.207.200","192.168.43.240","TCP","54","443  >  10644 [ACK] Seq=1 Ack=213 Win=44032 Len=0"
"161","1.771039","192.168.43.240","13.33.23.196","TCP","54","10653  >  443 [ACK] Seq=1 Ack=1 Win=65792 Len=0"
"162","1.771887","13.33.23.196","192.168.43.240","TLSv1.2","1454","Server Hello"
"163","1.771992","192.168.43.240","64.233.161.188","TCP","312","10645  >  5228 [PSH, ACK] Seq=187 Ack=4361 Win=66048 Len=258"
"164","1.772152","192.168.43.240","216.58.207.200","QUIC","277","Payload (Encrypted), PKN: 6, CID: 8793268273576317718"
"165","1.775553","13.33.23.196","192.168.43.240","TCP","1454","443  >  10646 [ACK] Seq=1401 Ack=217 Win=30464 Len=1400 [TCP segment of a reassembled PDU]"
"166","1.775612","192.168.43.240","13.33.23.196","TCP","54","10646  >  443 [ACK] Seq=217 Ack=2801 Win=65792 Len=0"
"167","1.775974","13.33.23.196","192.168.43.240","TLSv1.2","1454","Certificate [TCP segment of a reassembled PDU]"
"168","1.776222","13.33.23.196","192.168.43.240","TLSv1.2","797","Certificate Status, Server Key Exchange, Server Hello Done"
"169","1.776259","192.168.43.240","13.33.23.196","TCP","54","10646  >  443 [ACK] Seq=217 Ack=4944 Win=65792 Len=0"
"170","1.776721","216.58.207.200","192.168.43.240","QUIC","1392","Payload (Encrypted), PKN: 4"
"171","1.776722","216.58.207.200","192.168.43.240","QUIC","73","Payload (Encrypted), PKN: 5"
"172","1.777148","216.58.207.205","192.168.43.240","QUIC","1392","Payload (Encrypted), PKN: 1, CID: 9556696882999421587"
"173","1.777595","216.58.207.205","192.168.43.240","QUIC","1392","Payload (Encrypted), PKN: 2, CID: 9556696882999421587"
"174","1.777922","192.168.43.240","13.33.23.196","TLSv1.2","180","Client Key Exchange, Change Cipher Spec, Encrypted Handshake Message"
"175","1.778046","216.58.207.200","192.168.43.240","TLSv1.2","1454","Server Hello"
"176","1.778514","216.58.207.200","192.168.43.240","TCP","1454","443  >  10644 [ACK] Seq=1401 Ack=213 Win=44032 Len=1400 [TCP segment of a reassembled PDU]"
"177","1.778543","192.168.43.240","216.58.207.200","TCP","54","10644  >  443 [ACK] Seq=213 Ack=2801 Win=66048 Len=0"
"178","1.778654","216.58.207.200","192.168.43.240","TLSv1.2","384","Certificate, Server Key Exchange, Server Hello Done"
"179","1.778655","46.4.235.70","192.168.43.240","TCP","54","80  >  10641 [ACK] Seq=1 Ack=1052 Win=16896 Len=0"
"180","1.778714","138.201.57.222","192.168.43.240","TCP","54","443  >  10647 [ACK] Seq=1 Ack=200 Win=30336 Len=0"
"181","1.779017","46.4.235.70","192.168.43.240","HTTP","965","HTTP/1.1 200 OK  (text/html)"
"182","1.779606","192.168.43.240","216.58.207.200","QUIC","83","Payload (Encrypted), PKN: 7, CID: 8793268273576317718"
"183","1.779701","192.168.43.240","216.58.207.200","QUIC","83","Payload (Encrypted), PKN: 8, CID: 8793268273576317718"
"184","1.779792","138.201.57.222","192.168.43.240","TLSv1.2","1454","Server Hello"
"185","1.780267","138.201.57.222","192.168.43.240","TCP","1454","443  >  10647 [ACK] Seq=1401 Ack=200 Win=30336 Len=1400 [TCP segment of a reassembled PDU]"
"186","1.780294","192.168.43.240","138.201.57.222","TCP","54","10647  >  443 [ACK] Seq=200 Ack=2801 Win=65792 Len=0"
"187","1.780727","138.201.57.222","192.168.43.240","TLSv1.2","1454","Certificate [TCP segment of a reassembled PDU]"
"188","1.781114","138.201.57.222","192.168.43.240","TLSv1.2","1197","Certificate Status, Server Key Exchange, Server Hello Done"
"189","1.781115","5.45.59.39","192.168.43.240","TCP","66","443  >  10656 [SYN, ACK] Seq=0 Ack=1 Win=2920 Len=0 MSS=1400 SACK_PERM=1 WS=8192"
"190","1.781289","192.168.43.240","138.201.57.222","TCP","54","10647  >  443 [ACK] Seq=200 Ack=5344 Win=65792 Len=0"
"191","1.781316","192.168.43.240","5.45.59.39","TCP","54","10656  >  443 [ACK] Seq=1 Ack=1 Win=65792 Len=0"
"192","1.781589","216.58.207.200","192.168.43.240","QUIC","1392","Payload (Encrypted), PKN: 6"
"193","1.781589","192.168.43.1","192.168.43.240","DNS","105","Standard query response 0x301b A clientservices.googleapis.com A 216.58.207.195"
"194","1.781654","192.168.43.1","192.168.43.240","DNS","100","Standard query response 0xa96d A translate.googleapis.com A 216.58.207.202"
"195","1.781766","192.168.43.240","216.58.207.205","QUIC","80","Payload (Encrypted), PKN: 2, CID: 9556696882999421587"
"196","1.782103","216.58.207.205","192.168.43.240","QUIC","1379","Rejection, PKN: 3, CID: 9556696882999421587"
"197","1.782542","216.58.207.205","192.168.43.240","QUIC","1392","Payload (Encrypted), PKN: 4, CID: 9556696882999421587"
"198","1.782788","13.33.23.196","192.168.43.240","TCP","797","[TCP Spurious Retransmission] 443  >  10640 [PSH, ACK] Seq=4201 Ack=217 Win=30464 Len=743[Reassembly error, protocol TCP: New fragment overlaps old data (retransmission?)]"
"199","1.782815","192.168.43.240","13.33.23.196","TCP","66","[TCP Dup ACK 118#1] 10640  >  443 [ACK] Seq=691 Ack=4944 Win=65792 Len=0 SLE=4201 SRE=4944"
"200","1.782922","13.33.23.196","192.168.43.240","TCP","54","443  >  10640 [ACK] Seq=4944 Ack=691 Win=31488 Len=0"
"201","1.782923","216.58.207.205","192.168.43.240","TCP","66","443  >  10663 [SYN, ACK] Seq=0 Ack=1 Win=42780 Len=0 MSS=1380 SACK_PERM=1 WS=256"
"202","1.783057","192.168.43.240","216.58.207.205","TCP","54","10663  >  443 [ACK] Seq=1 Ack=1 Win=66048 Len=0"
"203","1.783115","192.168.43.240","216.58.207.200","TLSv1.2","312","Client Key Exchange, Change Cipher Spec, Encrypted Handshake Message, Encrypted Handshake Message"
"204","1.783128","13.33.23.196","192.168.43.240","TLSv1.2","312","New Session Ticket, Change Cipher Spec, Encrypted Handshake Message"
"205","1.784588","13.33.23.196","192.168.43.240","TCP","1454","443  >  10640 [ACK] Seq=5202 Ack=691 Win=31488 Len=1400 [TCP segment of a reassembled PDU]"
"206","1.784619","192.168.43.240","13.33.23.196","TCP","54","10640  >  443 [ACK] Seq=691 Ack=6602 Win=65792 Len=0"
"207","1.784868","13.33.23.196","192.168.43.240","TLSv1.2","948","Application Data"
"208","1.784970","13.33.23.196","192.168.43.240","TLSv1.2","88","Application Data"
"209","1.784971","5.62.40.21","192.168.43.240","TCP","66","443  >  10659 [SYN, ACK] Seq=0 Ack=1 Win=29200 Len=0 MSS=1400 SACK_PERM=1 WS=128"
"210","1.785152","192.168.43.240","13.33.23.196","TCP","54","10640  >  443 [ACK] Seq=691 Ack=7530 Win=64768 Len=0"
"211","1.785189","192.168.43.240","5.62.40.21","TCP","54","10659  >  443 [ACK] Seq=1 Ack=1 Win=65792 Len=0"
"212","1.786159","192.168.43.240","138.201.57.222","TLSv1.2","180","Client Key Exchange, Change Cipher Spec, Encrypted Handshake Message"
"213","1.786296","192.168.43.240","216.58.207.205","QUIC","80","Payload (Encrypted), PKN: 3, CID: 9556696882999421587"
"214","1.787262","192.168.43.240","216.58.207.205","QUIC","1392","Client Hello, PKN: 4, CID: 9556696882999421587"
"215","1.787587","192.168.43.240","13.33.23.196","TLSv1.2","489","Application Data"
"216","1.789154","192.168.43.240","216.58.207.205","TLSv1.2","261","Client Hello"
"217","1.789288","192.168.43.240","5.62.40.21","TLSv1.2","263","Client Hello"
"218","1.806228","192.168.43.240","176.9.18.162","TCP","66","10666  >  443 [SYN] Seq=0 Win=8192 Len=0 MSS=1460 WS=256 SACK_PERM=1"
"219","1.808946","192.168.43.240","216.58.207.200","QUIC","77","Payload (Encrypted), PKN: 9, CID: 8793268273576317718"
"220","1.828959","192.168.43.240","46.4.235.70","TCP","54","10641  >  80 [ACK] Seq=1052 Ack=912 Win=64768 Len=0"
"221","1.889450","192.168.43.240","5.45.59.39","TLSv1.2","258","Client Hello"
"222","1.917407","176.9.18.162","192.168.43.240","TCP","66","443  >  10661 [SYN, ACK] Seq=0 Ack=1 Win=29200 Len=0 MSS=1400 SACK_PERM=1 WS=512"
"223","1.917593","192.168.43.240","176.9.18.162","TCP","54","10661  >  443 [ACK] Seq=1 Ack=1 Win=65792 Len=0"
"224","1.917747","192.168.43.240","176.9.18.162","TLSv1.2","249","Client Hello"
"225","1.917831","176.9.18.162","192.168.43.240","TCP","66","443  >  10662 [SYN, ACK] Seq=0 Ack=1 Win=29200 Len=0 MSS=1400 SACK_PERM=1 WS=512"
"226","1.917832","176.9.18.162","192.168.43.240","TCP","66","443  >  10660 [SYN, ACK] Seq=0 Ack=1 Win=29200 Len=0 MSS=1400 SACK_PERM=1 WS=512"
"227","1.918059","192.168.43.240","176.9.18.162","TCP","54","10662  >  443 [ACK] Seq=1 Ack=1 Win=65792 Len=0"
"228","1.918085","192.168.43.240","176.9.18.162","TLSv1.2","249","Client Hello"
"229","1.918089","192.168.43.240","176.9.18.162","TCP","54","10660  >  443 [ACK] Seq=1 Ack=1 Win=65792 Len=0"
"230","1.918220","192.168.43.240","176.9.18.162","TLSv1.2","249","Client Hello"
"231","1.918286","216.58.207.200","192.168.43.240","QUIC","1392","Payload (Encrypted), PKN: 7"
"232","1.918286","5.45.59.39","192.168.43.240","TCP","54","443  >  10652 [ACK] Seq=1 Ack=205 Win=8192 Len=0"
"233","1.918380","5.45.59.39","192.168.43.240","TLSv1.2","1454","Server Hello"
"234","1.918843","5.45.59.39","192.168.43.240","TCP","1454","443  >  10652 [ACK] Seq=1401 Ack=205 Win=8192 Len=1400 [TCP segment of a reassembled PDU]"
"235","1.918872","192.168.43.240","5.45.59.39","TCP","54","10652  >  443 [ACK] Seq=205 Ack=2801 Win=65792 Len=0"
"236","1.919434","5.45.59.39","192.168.43.240","TCP","1454","443  >  10652 [ACK] Seq=2801 Ack=205 Win=8192 Len=1400 [TCP segment of a reassembled PDU]"
"237","1.919572","5.45.59.39","192.168.43.240","TLSv1.2","784","Certificate, Certificate Status, Server Key Exchange, Server Hello Done"
"238","1.919613","192.168.43.240","5.45.59.39","TCP","54","10652  >  443 [ACK] Seq=205 Ack=4931 Win=65792 Len=0"
"239","1.920028","216.58.207.195","192.168.43.240","TCP","66","443  >  10664 [SYN, ACK] Seq=0 Ack=1 Win=42780 Len=0 MSS=1380 SACK_PERM=1 WS=256"
"240","1.920028","64.233.161.188","192.168.43.240","TCP","375","5228  >  10645 [PSH, ACK] Seq=4361 Ack=445 Win=45056 Len=321"
"241","1.920029","216.58.207.202","192.168.43.240","TCP","66","443  >  10665 [SYN, ACK] Seq=0 Ack=1 Win=42780 Len=0 MSS=1380 SACK_PERM=1 WS=256"
"242","1.920029","216.58.207.200","192.168.43.240","QUIC","230","Payload (Encrypted), PKN: 8"
"243","1.920030","216.58.207.200","192.168.43.240","QUIC","72","Payload (Encrypted), PKN: 9"
"244","1.920030","13.33.23.196","192.168.43.240","TLSv1.2","312","New Session Ticket, Change Cipher Spec, Encrypted Handshake Message"
"245","1.920357","192.168.43.240","216.58.207.195","TCP","54","10664  >  443 [ACK] Seq=1 Ack=1 Win=66048 Len=0"
"246","1.920397","192.168.43.240","216.58.207.202","TCP","54","10665  >  443 [ACK] Seq=1 Ack=1 Win=66048 Len=0"
"247","1.920531","216.58.207.200","192.168.43.240","TLSv1.2","332","New Session Ticket, Change Cipher Spec, Encrypted Handshake Message"
"248","1.920531","216.58.207.200","192.168.43.240","TLSv1.2","123","Application Data"
"249","1.920532","216.58.207.205","192.168.43.240","TCP","54","443  >  10663 [ACK] Seq=1 Ack=208 Win=44032 Len=0"
"250","1.920580","192.168.43.240","216.58.207.200","TCP","54","10644  >  443 [ACK] Seq=471 Ack=3478 Win=65536 Len=0"
"251","1.920650","216.58.207.205","192.168.43.240","QUIC","1392","Payload (Encrypted), PKN: 5"
"252","1.920650","216.58.207.205","192.168.43.240","QUIC","73","Payload (Encrypted), PKN: 6"
"253","1.921132","216.58.207.205","192.168.43.240","TLSv1.2","1454","Server Hello"
"254","1.922140","192.168.43.240","5.45.59.39","TLSv1.2","180","Client Key Exchange, Change Cipher Spec, Encrypted Handshake Message"
"255","1.922467","192.168.43.240","216.58.207.200","QUIC","80","Payload (Encrypted), PKN: 10, CID: 8793268273576317718"
"256","1.923022","192.168.43.240","216.58.207.205","QUIC","81","Payload (Encrypted), PKN: 5, CID: 9556696882999421587"
"257","1.923125","192.168.43.240","216.58.207.205","QUIC","80","Payload (Encrypted), PKN: 6, CID: 9556696882999421587"
"258","1.923344","192.168.43.240","216.58.207.195","TLSv1.2","267","Client Hello"
"259","1.923461","192.168.43.240","216.58.207.202","TLSv1.2","262","Client Hello"
"260","1.923908","192.168.43.240","216.58.207.205","QUIC","1295","Payload (Encrypted), PKN: 7, CID: 9556696882999421587"
"261","1.923984","192.168.43.240","216.58.207.205","QUIC","67","Payload (Encrypted), PKN: 8, CID: 9556696882999421587"
"262","1.927317","192.168.43.240","64.233.161.188","TCP","238","10645  >  5228 [PSH, ACK] Seq=445 Ack=4682 Win=65792 Len=184"
"263","1.927926","216.58.207.205","192.168.43.240","TCP","1454","443  >  10663 [ACK] Seq=1401 Ack=208 Win=44032 Len=1400 [TCP segment of a reassembled PDU]"
"264","1.927927","216.58.207.205","192.168.43.240","TLSv1.2","1077","Certificate, Server Key Exchange, Server Hello Done"
"265","1.927929","5.62.40.21","192.168.43.240","TCP","54","443  >  10659 [ACK] Seq=1 Ack=210 Win=30336 Len=0"
"266","1.927929","5.62.40.21","192.168.43.240","TLSv1.2","1454","Server Hello"
"267","1.927930","5.62.40.21","192.168.43.240","TCP","1454","443  >  10659 [ACK] Seq=1401 Ack=210 Win=30336 Len=1400 [TCP segment of a reassembled PDU]"
"268","1.927931","5.62.40.21","192.168.43.240","TLSv1.2","1066","Certificate, Certificate Status, Server Key Exchange, Server Hello Done"
"269","1.927931","176.9.18.162","192.168.43.240","TCP","66","443  >  10666 [SYN, ACK] Seq=0 Ack=1 Win=29200 Len=0 MSS=1400 SACK_PERM=1 WS=512"
"270","1.927932","216.58.207.200","192.168.43.240","QUIC","75","Payload (Encrypted), PKN: 10"
"271","1.927932","138.201.57.222","192.168.43.240","TLSv1.2","312","New Session Ticket, Change Cipher Spec, Encrypted Handshake Message"
"272","1.927933","13.33.23.196","192.168.43.240","TCP","54","443  >  10646 [ACK] Seq=5202 Ack=778 Win=31488 Len=0"
"273","1.928222","192.168.43.240","216.58.207.205","TCP","54","10663  >  443 [ACK] Seq=208 Ack=3824 Win=66048 Len=0"
"274","1.928268","192.168.43.240","5.62.40.21","TCP","54","10659  >  443 [ACK] Seq=210 Ack=3813 Win=65792 Len=0"
"275","1.928293","192.168.43.240","176.9.18.162","TCP","54","10666  >  443 [ACK] Seq=1 Ack=1 Win=65792 Len=0"
"276","1.929619","13.33.23.196","192.168.43.240","TLSv1.2","1304","Application Data"
"277","1.929620","13.33.23.196","192.168.43.240","TLSv1.2","88","Application Data"
"278","1.929679","192.168.43.240","13.33.23.196","TCP","54","10646  >  443 [ACK] Seq=778 Ack=6486 Win=65792 Len=0"
"279","1.929957","192.168.43.240","216.58.207.205","TLSv1.2","312","Client Key Exchange, Change Cipher Spec, Encrypted Handshake Message, Encrypted Handshake Message"
"280","1.931863","192.168.43.240","5.62.40.21","TLSv1.2","180","Client Key Exchange, Change Cipher Spec, Encrypted Handshake Message"
"281","1.944507","192.168.43.240","5.62.40.21","TLSv1.2","520","Application Data"
"282","1.944726","192.168.43.240","138.201.57.222","TLSv1.2","489","Application Data"
"283","2.082850","5.45.59.39","192.168.43.240","TCP","54","443  >  10656 [ACK] Seq=1 Ack=205 Win=8192 Len=0"
"284","2.216338","5.45.59.39","192.168.43.240","TLSv1.2","1454","Server Hello"
"285","2.216338","5.45.59.39","192.168.43.240","TCP","1454","443  >  10656 [ACK] Seq=1401 Ack=205 Win=8192 Len=1400 [TCP segment of a reassembled PDU]"
"286","2.216402","192.168.43.240","5.45.59.39","TCP","54","10656  >  443 [ACK] Seq=205 Ack=2801 Win=65792 Len=0"
"287","2.230070","5.45.59.39","192.168.43.240","TCP","1454","443  >  10656 [ACK] Seq=2801 Ack=205 Win=8192 Len=1400 [TCP segment of a reassembled PDU]"
"288","2.230071","5.45.59.39","192.168.43.240","TLSv1.2","784","Certificate, Certificate Status, Server Key Exchange, Server Hello Done"
"289","2.230071","64.233.161.188","192.168.43.240","TCP","84","5228  >  10645 [PSH, ACK] Seq=4682 Ack=629 Win=46080 Len=30"
"290","2.230071","64.233.161.188","192.168.43.240","TCP","173","5228  >  10645 [PSH, ACK] Seq=4712 Ack=629 Win=46080 Len=119"
"291","2.230072","64.233.161.188","192.168.43.240","TCP","188","5228  >  10645 [PSH, ACK] Seq=4831 Ack=629 Win=46080 Len=134"
"292","2.230072","216.58.207.195","192.168.43.240","TCP","54","443  >  10664 [ACK] Seq=1 Ack=214 Win=44032 Len=0"
"293","2.230072","216.58.207.202","192.168.43.240","TCP","54","443  >  10665 [ACK] Seq=1 Ack=209 Win=44032 Len=0"
"294","2.230072","216.58.207.205","192.168.43.240","TLSv1.2","332","New Session Ticket, Change Cipher Spec, Encrypted Handshake Message"
"295","2.230073","216.58.207.205","192.168.43.240","TLSv1.2","123","Application Data"
"296","2.230073","216.58.207.205","192.168.43.240","QUIC","78","Payload (Encrypted), PKN: 7"
"297","2.230159","192.168.43.240","5.45.59.39","TCP","54","10656  >  443 [ACK] Seq=205 Ack=4931 Win=65792 Len=0"
"298","2.230191","192.168.43.240","64.233.161.188","TCP","54","10645  >  5228 [ACK] Seq=629 Ack=4965 Win=65536 Len=0"
"299","2.230207","192.168.43.240","216.58.207.205","TCP","54","10663  >  443 [ACK] Seq=466 Ack=4171 Win=65792 Len=0"
"300","2.231805","192.168.43.240","5.45.59.39","TLSv1.2","180","Client Key Exchange, Change Cipher Spec, Encrypted Handshake Message"
"301","2.231843","216.58.207.195","192.168.43.240","TLSv1.2","1454","Server Hello"
"302","2.231845","216.58.207.195","192.168.43.240","TLSv1.2","1309","Certificate, Server Key Exchange, Server Hello Done"
"303","2.231845","216.58.207.202","192.168.43.240","TLSv1.2","1454","Server Hello"
"304","2.231897","192.168.43.240","216.58.207.195","TCP","54","10664  >  443 [ACK] Seq=214 Ack=2656 Win=66048 Len=0"
"305","2.232923","192.168.43.240","216.58.207.195","TLSv1.2","147","Client Key Exchange, Change Cipher Spec, Encrypted Handshake Message"
"306","2.234088","216.58.207.202","192.168.43.240","TLSv1.2","1308","Certificate, Server Key Exchange, Server Hello Done"
"307","2.234089","5.62.40.21","192.168.43.240","TLSv1.2","328","New Session Ticket, Change Cipher Spec, Encrypted Handshake Message"
"308","2.234090","176.9.18.162","192.168.43.240","TCP","54","443  >  10662 [ACK] Seq=1 Ack=196 Win=30720 Len=0"
"309","2.234090","176.9.18.162","192.168.43.240","TCP","54","443  >  10661 [ACK] Seq=1 Ack=196 Win=30720 Len=0"
"310","2.234090","176.9.18.162","192.168.43.240","TCP","54","443  >  10660 [ACK] Seq=1 Ack=196 Win=30720 Len=0"
"311","2.234142","192.168.43.240","216.58.207.202","TCP","54","10665  >  443 [ACK] Seq=209 Ack=2655 Win=66048 Len=0"
"312","2.235065","192.168.43.240","216.58.207.202","TLSv1.2","147","Client Key Exchange, Change Cipher Spec, Encrypted Handshake Message"
"313","2.235554","216.58.207.205","192.168.43.240","QUIC","1174","Payload (Encrypted), PKN: 8"
"314","2.235555","216.58.207.205","192.168.43.240","QUIC","70","Payload (Encrypted), PKN: 9"
"315","2.235555","216.58.207.205","192.168.43.240","QUIC","192","Payload (Encrypted), PKN: 10"
"316","2.235556","176.9.18.162","192.168.43.240","TLSv1.2","1454","Server Hello"
"317","2.237392","192.168.43.240","216.58.207.205","QUIC","83","Payload (Encrypted), PKN: 9, CID: 9556696882999421587"
"318","2.239422","192.168.43.240","216.58.207.195","TLSv1.2","147","Application Data"
"319","2.239589","192.168.43.240","216.58.207.202","TLSv1.2","147","Application Data"
"320","2.239742","192.168.43.240","216.58.207.195","TLSv1.2","322","Application Data"
"321","2.239814","192.168.43.240","216.58.207.202","TLSv1.2","291","Application Data"
"322","2.239832","176.9.18.162","192.168.43.240","TCP","1454","443  >  10661 [ACK] Seq=1401 Ack=196 Win=30720 Len=1400 [TCP segment of a reassembled PDU]"
"323","2.239865","192.168.43.240","176.9.18.162","TCP","54","10661  >  443 [ACK] Seq=196 Ack=2801 Win=65792 Len=0"
"324","2.241096","176.9.18.162","192.168.43.240","TLSv1.2","1454","Certificate [TCP segment of a reassembled PDU]"
"325","2.241097","176.9.18.162","192.168.43.240","TLSv1.2","142","Server Key Exchange, Server Hello Done"
"326","2.241157","192.168.43.240","176.9.18.162","TCP","54","10661  >  443 [ACK] Seq=196 Ack=4289 Win=65792 Len=0"
"327","2.242203","176.9.18.162","192.168.43.240","TLSv1.2","1454","Server Hello"
"328","2.242682","192.168.43.240","176.9.18.162","TLSv1.2","180","Client Key Exchange, Change Cipher Spec, Encrypted Handshake Message"
"329","2.242688","176.9.18.162","192.168.43.240","TCP","1454","443  >  10662 [ACK] Seq=1401 Ack=196 Win=30720 Len=1400 [TCP segment of a reassembled PDU]"
"330","2.242725","192.168.43.240","176.9.18.162","TCP","54","10662  >  443 [ACK] Seq=196 Ack=2801 Win=65792 Len=0"
"331","2.243138","176.9.18.162","192.168.43.240","TLSv1.2","1454","Certificate [TCP segment of a reassembled PDU]"
"332","2.243248","176.9.18.162","192.168.43.240","TLSv1.2","142","Server Key Exchange, Server Hello Done"
"333","2.243281","192.168.43.240","176.9.18.162","TCP","54","10662  >  443 [ACK] Seq=196 Ack=4289 Win=65792 Len=0"
"334","2.243529","138.201.57.222","192.168.43.240","TLSv1.2","1128","Application Data"
"335","2.243994","176.9.18.162","192.168.43.240","TLSv1.2","1454","Server Hello"
"336","2.244454","176.9.18.162","192.168.43.240","TCP","1454","443  >  10660 [ACK] Seq=1401 Ack=196 Win=30720 Len=1400 [TCP segment of a reassembled PDU]"
"337","2.244480","192.168.43.240","176.9.18.162","TCP","54","10660  >  443 [ACK] Seq=196 Ack=2801 Win=65792 Len=0"
"338","2.244592","192.168.43.240","176.9.18.162","TLSv1.2","180","Client Key Exchange, Change Cipher Spec, Encrypted Handshake Message"
"339","2.244934","176.9.18.162","192.168.43.240","TLSv1.2","1454","Certificate [TCP segment of a reassembled PDU]"
"340","2.244935","176.9.18.162","192.168.43.240","TLSv1.2","142","Server Key Exchange, Server Hello Done"
"341","2.244975","192.168.43.240","176.9.18.162","TCP","54","10660  >  443 [ACK] Seq=196 Ack=4289 Win=65792 Len=0"
"342","2.245043","5.45.59.39","192.168.43.240","TLSv1.2","312","New Session Ticket, Change Cipher Spec, Encrypted Handshake Message"
"343","2.245544","5.62.40.21","192.168.43.240","TCP","1454","443  >  10659 [ACK] Seq=4087 Ack=802 Win=31360 Len=1400 [TCP segment of a reassembled PDU]"
"344","2.245606","192.168.43.240","5.62.40.21","TCP","54","10659  >  443 [ACK] Seq=802 Ack=5487 Win=65792 Len=0"
"345","2.245700","5.62.40.21","192.168.43.240","TLSv1.2","498","Application Data"
"346","2.245775","216.58.207.205","192.168.43.240","TLSv1.2","123","[TCP Spurious Retransmission] , Application Data"
"347","2.245799","192.168.43.240","216.58.207.205","TCP","66","[TCP Dup ACK 299#1] 10663  >  443 [ACK] Seq=466 Ack=4171 Win=65792 Len=0 SLE=4102 SRE=4171"
"348","2.246676","192.168.43.240","176.9.18.162","TLSv1.2","180","Client Key Exchange, Change Cipher Spec, Encrypted Handshake Message"
"349","2.246819","5.62.40.21","192.168.43.240","TCP","498","[TCP Retransmission] 443  >  10659 [PSH, ACK] Seq=5487 Ack=802 Win=31360 Len=444"
"350","2.246837","192.168.43.240","5.62.40.21","TCP","66","10659  >  443 [ACK] Seq=802 Ack=5931 Win=65280 Len=0 SLE=5487 SRE=5931"
"351","2.252307","192.168.43.240","5.45.59.39","TLSv1.2","1084","Application Data"
"352","2.263342","192.168.43.240","216.58.207.205","QUIC","77","Payload (Encrypted), PKN: 10, CID: 9556696882999421587"
"353","2.282760","192.168.43.240","46.4.235.70","HTTP","1147","GET /gj0/rtk/mni5 HTTP/1.1 "
"354","2.289324","192.168.43.240","138.201.57.222","TCP","54","10647  >  443 [ACK] Seq=761 Ack=6676 Win=64256 Len=0"
"355","2.342410","192.168.43.240","239.255.255.250","SSDP","216","M-SEARCH * HTTP/1.1 "
"356","2.403009","216.58.207.195","192.168.43.240","TLSv1.2","92","[TCP Previous segment not captured] , Application Data"
"357","2.403049","192.168.43.240","216.58.207.195","TCP","66","[TCP Dup ACK 304#1] 10664  >  443 [ACK] Seq=668 Ack=2656 Win=66048 Len=0 SLE=2955 SRE=2993"
"358","2.403174","216.58.207.195","192.168.43.240","TCP","284","[TCP Out-Of-Order] 443  >  10664 [PSH, ACK] Seq=2656 Ack=668 Win=45056 Len=230"
"359","2.403175","216.58.207.195","192.168.43.240","TCP","123","[TCP Out-Of-Order] 443  >  10664 [PSH, ACK] Seq=2886 Ack=668 Win=45056 Len=69"
"360","2.403175","216.58.207.202","192.168.43.240","TLSv1.2","284","New Session Ticket, Change Cipher Spec, Encrypted Handshake Message"
"361","2.403210","192.168.43.240","216.58.207.195","TCP","66","10664  >  443 [ACK] Seq=668 Ack=2886 Win=65792 Len=0 SLE=2955 SRE=2993"
"362","2.403244","192.168.43.240","216.58.207.195","TCP","54","10664  >  443 [ACK] Seq=668 Ack=2993 Win=65792 Len=0"
"363","2.403432","192.168.43.240","216.58.207.195","TLSv1.2","92","Application Data"
"364","2.403540","216.58.207.202","192.168.43.240","TLSv1.2","123","Application Data"
"365","2.403540","216.58.207.202","192.168.43.240","TLSv1.2","92","Application Data"
"366","2.403540","216.58.207.195","192.168.43.240","TLSv1.2","299","Application Data"
"367","2.403541","216.58.207.195","192.168.43.240","TLSv1.2","92","Application Data"
"368","2.403541","216.58.207.195","192.168.43.240","TLSv1.2","100","Application Data"
"369","2.403588","192.168.43.240","216.58.207.202","TCP","54","10665  >  443 [ACK] Seq=632 Ack=2992 Win=65792 Len=0"
"370","2.403613","192.168.43.240","216.58.207.195","TCP","54","10664  >  443 [ACK] Seq=706 Ack=3322 Win=65536 Len=0"
"371","2.403688","216.58.207.202","192.168.43.240","TLSv1.2","400","Application Data"
"372","2.403717","192.168.43.240","216.58.207.202","TCP","54","10665  >  443 [ACK] Seq=632 Ack=3338 Win=65536 Len=0"
"373","2.403989","216.58.207.202","192.168.43.240","TLSv1.2","1188","Application Data"
"374","2.404089","216.58.207.202","192.168.43.240","TLSv1.2","328","Application Data"
"375","2.404121","192.168.43.240","216.58.207.202","TCP","54","10665  >  443 [ACK] Seq=632 Ack=4746 Win=66048 Len=0"
"376","2.404184","216.58.207.202","192.168.43.240","TLSv1.2","100","Application Data"
"377","2.404242","176.9.18.162","192.168.43.240","TLSv1.2","312","New Session Ticket, Change Cipher Spec, Encrypted Handshake Message"
"378","2.404334","192.168.43.240","216.58.207.195","TLSv1.2","100","Application Data"
"379","2.404351","176.9.18.162","192.168.43.240","TLSv1.2","312","New Session Ticket, Change Cipher Spec, Encrypted Handshake Message"
"380","2.404390","192.168.43.240","216.58.207.202","TLSv1.2","92","Application Data"
"381","2.404439","192.168.43.240","216.58.207.202","TLSv1.2","100","Application Data"
"382","2.404458","176.9.18.162","192.168.43.240","TLSv1.2","312","New Session Ticket, Change Cipher Spec, Encrypted Handshake Message"
"383","2.404554","5.45.59.39","192.168.43.240","TLSv1.2","265","Application Data"
"384","2.405771","192.168.43.240","5.45.59.39","TLSv1.2","1091","Application Data"
"385","2.405959","5.45.59.39","192.168.43.240","TLSv1.2","312","New Session Ticket, Change Cipher Spec, Encrypted Handshake Message"
"386","2.405959","46.4.235.70","192.168.43.240","TCP","54","80  >  10641 [ACK] Seq=912 Ack=2145 Win=19968 Len=0"
"387","2.418833","192.168.43.240","176.9.18.162","TLSv1.2","847","Application Data"
"388","2.427399","fe80::85f5:a9e0:4b59:b0f1","ff02::1:2","DHCPv6","146","Solicit XID: 0x923422 CID: 000100011b8f3bf654a050ec5337 "
"389","2.449416","192.168.43.240","176.9.18.162","TCP","54","10662  >  443 [ACK] Seq=322 Ack=4547 Win=65536 Len=0"
"390","2.449462","192.168.43.240","176.9.18.162","TCP","54","10660  >  443 [ACK] Seq=322 Ack=4547 Win=65536 Len=0"
"391","2.464456","192.168.43.240","5.45.59.39","TCP","54","10656  >  443 [ACK] Seq=331 Ack=5189 Win=65536 Len=0"
"392","2.566865","46.4.235.70","192.168.43.240","HTTP","1269","HTTP/1.1 302 Found  (text/html) (text/html)"
"393","2.566865","216.58.207.195","192.168.43.240","TCP","54","443  >  10664 [ACK] Seq=3322 Ack=752 Win=45056 Len=0"
"394","2.566865","216.58.207.202","192.168.43.240","TCP","54","443  >  10665 [ACK] Seq=4792 Ack=716 Win=45056 Len=0"
"395","2.566865","176.9.18.162","192.168.43.240","TLSv1.2","520","Application Data"
"396","2.566866","5.45.59.39","192.168.43.240","TLSv1.2","275","Application Data"
"397","2.570087","192.168.43.240","192.168.43.1","DNS","78","Standard query 0xced5 A gkcimd.cbbgdep.biz"
"398","2.572588","192.168.43.240","192.168.43.1","DNS","87","Standard query 0x071a A safebrowsing.googleapis.com"
"399","2.585310","13.33.23.196","192.168.43.240","TCP","66","[TCP Retransmission] 443  >  10653 [SYN, ACK] Seq=0 Ack=1 Win=29200 Len=0 MSS=1400 SACK_PERM=1 WS=256"
"400","2.585351","192.168.43.240","13.33.23.196","TCP","66","[TCP Dup ACK 161#1] 10653  >  443 [ACK] Seq=1 Ack=1 Win=65792 Len=0 SLE=0 SRE=1"
"401","2.617501","192.168.43.240","176.9.18.162","TCP","54","10661  >  443 [ACK] Seq=1115 Ack=5013 Win=65024 Len=0"
"402","2.620345","192.168.43.240","5.45.59.39","TLSv1.2","1135","Application Data"
"403","2.624567","192.168.43.240","46.4.235.70","TCP","54","10641  >  80 [ACK] Seq=2145 Ack=2127 Win=65792 Len=0"
"404","2.728060","192.168.43.1","192.168.43.240","DNS","358","Standard query response 0x071a A safebrowsing.googleapis.com A 216.58.207.202 NS ns1.google.com NS ns3.google.com NS ns2.google.com NS ns4.google.com A 216.239.34.10 AAAA 2001:4860:4802:34::a A 216.239.32.10 AAAA 2001:4860:4802:32::a A 216.239.36.10 AAAA 2001:4860:4802:36::a A 216.239.38.10 AAAA 2001:4860:4802:38::a"
"405","2.728198","192.168.43.1","192.168.43.240","DNS","398","Standard query response 0xced5 A gkcimd.cbbgdep.biz CNAME c.visitweb.com A 185.71.67.6 NS ns7.visitweb.com NS ns5.visitweb.com NS ns16.visitweb.com NS ns9.visitweb.com NS ns8.visitweb.com NS ns15.visitweb.com NS ns17.visitweb.com NS ns10.visitweb.com A 46.165.222.110 A 85.17.30.84 A 83.149.126.87 A 178.162.203.184 A 83.149.126.90 A 95.211.156.224 A 95.211.222.152 A 95.211.222.167"
"406","2.728740","192.168.43.240","216.58.207.202","TCP","66","10675  >  443 [SYN] Seq=0 Win=8192 Len=0 MSS=1460 WS=256 SACK_PERM=1"
"407","2.728910","192.168.43.240","216.58.207.202","TCP","66","10676  >  443 [SYN] Seq=0 Win=8192 Len=0 MSS=1460 WS=256 SACK_PERM=1"
"408","2.729099","192.168.43.240","185.71.67.6","TCP","66","10677  >  80 [SYN] Seq=0 Win=8192 Len=0 MSS=1460 WS=256 SACK_PERM=1"
"409","2.729256","192.168.43.240","185.71.67.6","TCP","66","10678  >  80 [SYN] Seq=0 Win=8192 Len=0 MSS=1460 WS=256 SACK_PERM=1"
"410","2.819932","192.168.43.240","185.71.67.6","TCP","66","10679  >  80 [SYN] Seq=0 Win=8192 Len=0 MSS=1460 WS=256 SACK_PERM=1"
"411","2.823248","192.168.43.240","216.58.207.202","TCP","66","10680  >  443 [SYN] Seq=0 Win=8192 Len=0 MSS=1460 WS=256 SACK_PERM=1"
"412","2.880386","5.45.59.39","192.168.43.240","TLSv1.2","275","Application Data"
"413","2.880386","216.58.207.202","192.168.43.240","TCP","66","443  >  10675 [SYN, ACK] Seq=0 Ack=1 Win=42780 Len=0 MSS=1380 SACK_PERM=1 WS=256"
"414","2.880387","216.58.207.202","192.168.43.240","TCP","66","443  >  10676 [SYN, ACK] Seq=0 Ack=1 Win=42780 Len=0 MSS=1380 SACK_PERM=1 WS=256"
"415","2.880387","185.71.67.6","192.168.43.240","TCP","66","80  >  10678 [SYN, ACK] Seq=0 Ack=1 Win=28960 Len=0 MSS=1400 SACK_PERM=1 WS=512"
"416","2.880731","192.168.43.240","216.58.207.202","TCP","54","10675  >  443 [ACK] Seq=1 Ack=1 Win=66048 Len=0"
"417","2.880764","192.168.43.240","216.58.207.202","TCP","54","10676  >  443 [ACK] Seq=1 Ack=1 Win=66048 Len=0"
"418","2.880785","192.168.43.240","185.71.67.6","TCP","54","10678  >  80 [ACK] Seq=1 Ack=1 Win=65792 Len=0"
"419","2.880976","185.71.67.6","192.168.43.240","TCP","66","80  >  10677 [SYN, ACK] Seq=0 Ack=1 Win=28960 Len=0 MSS=1400 SACK_PERM=1 WS=512"
"420","2.881161","192.168.43.240","185.71.67.6","TCP","54","10677  >  80 [ACK] Seq=1 Ack=1 Win=65792 Len=0"
"421","2.881572","192.168.43.240","216.58.207.202","TLSv1.2","269","Client Hello"
"422","2.881736","192.168.43.240","216.58.207.202","TLSv1.2","269","Client Hello"
"423","2.881901","192.168.43.240","185.71.67.6","HTTP","618","GET /c?b=yoyJJghdZsz_fC4nbIdZ2EeJT3weT6IVSbi66ON0DDkwthE2Ut6Cqb9AkGw HTTP/1.1 "
"424","2.884563","216.58.207.202","192.168.43.240","TCP","66","443  >  10680 [SYN, ACK] Seq=0 Ack=1 Win=42780 Len=0 MSS=1380 SACK_PERM=1 WS=256"
"425","2.884742","192.168.43.240","216.58.207.202","TCP","54","10680  >  443 [ACK] Seq=1 Ack=1 Win=66048 Len=0"
"426","2.929792","192.168.43.240","5.45.59.39","TCP","54","10652  >  443 [ACK] Seq=3479 Ack=5842 Win=64768 Len=0"
"427","3.043773","185.71.67.6","192.168.43.240","TCP","66","80  >  10679 [SYN, ACK] Seq=0 Ack=1 Win=28960 Len=0 MSS=1400 SACK_PERM=1 WS=512"
"428","3.043774","216.58.207.202","192.168.43.240","TCP","54","443  >  10676 [ACK] Seq=1 Ack=216 Win=44032 Len=0"
"429","3.043774","216.58.207.202","192.168.43.240","TCP","54","443  >  10675 [ACK] Seq=1 Ack=216 Win=44032 Len=0"
"430","3.043954","192.168.43.240","185.71.67.6","TCP","54","10679  >  80 [ACK] Seq=1 Ack=1 Win=65792 Len=0"
"431","3.052431","216.58.207.202","192.168.43.240","TLSv1.2","1454","Server Hello"
"432","3.052799","216.58.207.202","192.168.43.240","TLSv1.2","1312","Certificate, Server Key Exchange, Server Hello Done"
"433","3.052843","192.168.43.240","216.58.207.202","TCP","54","10676  >  443 [ACK] Seq=216 Ack=2659 Win=66048 Len=0"
"434","3.053199","216.58.207.202","192.168.43.240","TLSv1.2","1454","Server Hello"
"435","3.053625","216.58.207.202","192.168.43.240","TLSv1.2","1312","Certificate, Server Key Exchange, Server Hello Done"
"436","3.053627","185.71.67.6","192.168.43.240","TCP","54","80  >  10678 [ACK] Seq=1 Ack=565 Win=30720 Len=0"
"437","3.053663","192.168.43.240","216.58.207.202","TCP","54","10675  >  443 [ACK] Seq=216 Ack=2659 Win=66048 Len=0"
"438","3.056684","192.168.43.240","216.58.207.202","TLSv1.2","312","Client Key Exchange, Change Cipher Spec, Encrypted Handshake Message, Encrypted Handshake Message"
"439","3.057328","192.168.43.240","216.58.207.202","TLSv1.2","312","Client Key Exchange, Change Cipher Spec, Encrypted Handshake Message, Encrypted Handshake Message"
"440","3.060873","192.168.43.240","216.58.207.202","TCP","54","10675  >  443 [FIN, ACK] Seq=474 Ack=2659 Win=66048 Len=0"
"441","3.060998","192.168.43.240","216.58.207.202","TLSv1.2","147","Application Data"
"442","3.061201","192.168.43.240","216.58.207.202","TLSv1.2","748","Application Data"
"443","3.061282","192.168.43.240","216.58.207.202","TLSv1.2","603","Application Data"
"444","3.202674","185.71.67.6","192.168.43.240","HTTP","844","HTTP/1.1 200 OK  (text/html)"
"445","3.208563","216.58.207.202","192.168.43.240","TCP","66","[TCP Dup ACK 429#1] 443  >  10675 [ACK] Seq=2659 Ack=216 Win=44032 Len=0 SLE=474 SRE=475"
"446","3.216599","216.58.207.202","192.168.43.240","TLSv1.2","92","[TCP Previous segment not captured] , Application Data"
"447","3.216639","192.168.43.240","216.58.207.202","TCP","66","[TCP Dup ACK 433#1] 10676  >  443 [ACK] Seq=1810 Ack=2659 Win=66048 Len=0 SLE=3006 SRE=3044"
"448","3.219667","216.58.207.202","192.168.43.240","TCP","54","443  >  10675 [ACK] Seq=2659 Ack=475 Win=45056 Len=0"
"449","3.219923","216.58.207.202","192.168.43.240","TCP","54","443  >  10676 [ACK] Seq=2659 Ack=1261 Win=46336 Len=0"
"450","3.220056","216.58.207.202","192.168.43.240","TCP","332","[TCP Out-Of-Order] 443  >  10676 [PSH, ACK] Seq=2659 Ack=1810 Win=47872 Len=278"
"451","3.220092","192.168.43.240","216.58.207.202","TCP","66","10676  >  443 [ACK] Seq=1810 Ack=2937 Win=65792 Len=0 SLE=3006 SRE=3044"
"452","3.220166","216.58.207.202","192.168.43.240","TLSv1.2","332","New Session Ticket, Change Cipher Spec, Encrypted Handshake Message"
"453","3.220211","192.168.43.240","216.58.207.202","TCP","54","10675  >  443 [RST, ACK] Seq=475 Ack=2937 Win=0 Len=0"
"454","3.224947","216.58.207.202","192.168.43.240","TCP","123","[TCP Out-Of-Order] 443  >  10676 [PSH, ACK] Seq=2937 Ack=1810 Win=47872 Len=69"
"455","3.224948","216.58.207.202","192.168.43.240","TLSv1.2","123","Application Data"
"456","3.224949","216.58.207.202","192.168.43.240","TCP","54","443  >  10675 [FIN, ACK] Seq=3006 Ack=475 Win=45056 Len=0"
"457","3.225003","192.168.43.240","216.58.207.202","TCP","54","10676  >  443 [ACK] Seq=1810 Ack=3044 Win=65792 Len=0"
"458","3.225114","192.168.43.240","216.58.207.202","TLSv1.2","92","Application Data"
"459","3.251993","192.168.43.240","185.71.67.6","TCP","54","10678  >  80 [ACK] Seq=565 Ack=791 Win=64768 Len=0"
"460","3.344142","192.168.43.240","239.255.255.250","SSDP","216","M-SEARCH * HTTP/1.1 "
"461","3.365396","216.58.207.202","192.168.43.240","TLSv1.2","347","Application Data"
"462","3.365497","216.58.207.202","192.168.43.240","TLSv1.2","490","Application Data, Application Data"
"463","3.365498","216.58.207.202","192.168.43.240","TLSv1.2","100","Application Data"
"464","3.365536","192.168.43.240","216.58.207.202","TCP","54","10676  >  443 [ACK] Seq=1848 Ack=3819 Win=65024 Len=0"
"465","3.365617","216.58.207.202","192.168.43.240","TLSv1.2","131","Application Data"
"466","3.365636","192.168.43.240","216.58.207.202","TCP","54","10676  >  443 [ACK] Seq=1848 Ack=3896 Win=64768 Len=0"
"467","3.365688","216.58.207.202","192.168.43.240","TLSv1.2","385","Application Data"
"468","3.365786","216.58.207.202","192.168.43.240","TLSv1.2","279","Application Data"
"469","3.365811","192.168.43.240","216.58.207.202","TCP","54","10676  >  443 [ACK] Seq=1848 Ack=4452 Win=66048 Len=0"
"470","3.366083","185.71.67.6","192.168.43.240","HTTP","844","[TCP Spurious Retransmission] HTTP/1.1 200 OK  (text/html)"
"471","3.366084","216.58.207.202","192.168.43.240","TCP","54","443  >  10676 [ACK] Seq=4452 Ack=1848 Win=47872 Len=0"
"472","3.366106","192.168.43.240","185.71.67.6","TCP","66","[TCP Dup ACK 459#1] 10678  >  80 [ACK] Seq=565 Ack=791 Win=64768 Len=0 SLE=1 SRE=791"
"473","3.366149","192.168.43.240","216.58.207.202","TLSv1.2","100","Application Data"
"474","3.428107","fe80::85f5:a9e0:4b59:b0f1","ff02::1:2","DHCPv6","146","Solicit XID: 0x923422 CID: 000100011b8f3bf654a050ec5337 "
"475","3.728350","192.168.43.240","216.58.207.202","TCP","100","[TCP Retransmission] 10676  >  443 [PSH, ACK] Seq=1848 Ack=4452 Win=66048 Len=46"
"476","3.847223","216.58.207.202","192.168.43.240","TCP","66","443  >  10676 [ACK] Seq=4452 Ack=1894 Win=47872 Len=0 SLE=1848 SRE=1894"
"477","4.345851","192.168.43.240","239.255.255.250","SSDP","216","M-SEARCH * HTTP/1.1 "
"478","5.428553","fe80::85f5:a9e0:4b59:b0f1","ff02::1:2","DHCPv6","146","Solicit XID: 0x923422 CID: 000100011b8f3bf654a050ec5337 "
"479","7.055470","192.168.43.240","192.168.43.255","NBNS","92","Name query NB GBMNSOPTPDT<00>"
"480","7.055540","192.168.43.240","192.168.43.255","NBNS","92","Name query NB USQBSTOVON<00>"
"481","7.055573","192.168.43.240","192.168.43.255","NBNS","92","Name query NB RHJPRCLT<00>"
"482","7.055915","fe80::85f5:a9e0:4b59:b0f1","ff02::1:3","LLMNR","88","Standard query 0x9194 A rhjprclt"
"483","7.055986","fe80::85f5:a9e0:4b59:b0f1","ff02::1:3","LLMNR","91","Standard query 0xbc01 A gbmnsoptpdt"
"484","7.056108","fe80::85f5:a9e0:4b59:b0f1","ff02::1:3","LLMNR","90","Standard query 0x1b84 A usqbstovon"
"485","7.056190","192.168.43.240","224.0.0.252","LLMNR","68","Standard query 0x9194 A rhjprclt"
"486","7.056314","192.168.43.240","224.0.0.252","LLMNR","71","Standard query 0xbc01 A gbmnsoptpdt"
"487","7.056406","192.168.43.240","224.0.0.252","LLMNR","70","Standard query 0x1b84 A usqbstovon"
"488","7.467000","fe80::85f5:a9e0:4b59:b0f1","ff02::1:3","LLMNR","88","Standard query 0x9194 A rhjprclt"
"489","7.467000","fe80::85f5:a9e0:4b59:b0f1","ff02::1:3","LLMNR","90","Standard query 0x1b84 A usqbstovon"
"490","7.467013","fe80::85f5:a9e0:4b59:b0f1","ff02::1:3","LLMNR","91","Standard query 0xbc01 A gbmnsoptpdt"
"491","7.467081","192.168.43.240","224.0.0.252","LLMNR","70","Standard query 0x1b84 A usqbstovon"
"492","7.467087","192.168.43.240","224.0.0.252","LLMNR","71","Standard query 0xbc01 A gbmnsoptpdt"
"493","7.467115","192.168.43.240","224.0.0.252","LLMNR","68","Standard query 0x9194 A rhjprclt"
"494","7.805262","192.168.43.240","192.168.43.255","NBNS","92","Name query NB GBMNSOPTPDT<00>"
"495","7.805317","192.168.43.240","192.168.43.255","NBNS","92","Name query NB RHJPRCLT<00>"
"496","7.805341","192.168.43.240","192.168.43.255","NBNS","92","Name query NB USQBSTOVON<00>"
"497","8.555804","192.168.43.240","192.168.43.255","NBNS","92","Name query NB USQBSTOVON<00>"
"498","8.555857","192.168.43.240","192.168.43.255","NBNS","92","Name query NB RHJPRCLT<00>"
"499","8.555881","192.168.43.240","192.168.43.255","NBNS","92","Name query NB GBMNSOPTPDT<00>"
"500","9.017735","192.168.43.240","192.168.43.255","NBNS","92","Name query NB WPAD<00>"
