"No.","Time","Source","Destination","Protocol","Length","Info"
"1","02:54:43,303578","ZyxelCom_9f:c2:bc","Broadcast","ARP","42","Who has 192.168.1.34? Tell 192.168.1.1"
"2","02:54:46,539389","192.168.1.37","192.168.1.1","DNS","67","Standard query 0x3a69 A dnzl.ru"
"3","02:54:46,544422","192.168.1.37","192.168.1.1","DNS","80","Standard query 0x978b A adservice.google.com"
"4","02:54:46,547250","192.168.1.37","192.168.1.1","DNS","79","Standard query 0x81fc A adservice.google.ru"
"5","02:54:46,548343","192.168.1.1","192.168.1.37","DNS","296","Standard query response 0x3a69 A dnzl.ru A 77.222.61.12 NS ns3.spaceweb.pro NS ns1.spaceweb.ru NS ns4.spaceweb.pro NS ns2.spaceweb.ru A 77.222.50.250 A 89.111.160.68 A 77.222.51.250 AAAA 2a02:408:7722:51::250 A 89.111.167.100 AAAA 2a01:d8:9:2::100"
"6","02:54:46,548344","192.168.1.1","192.168.1.37","DNS","432","Standard query response 0x978b A adservice.google.com CNAME pagead46.l.doubleclick.net A 64.233.162.154 A 64.233.162.156 A 64.233.162.157 A 64.233.162.155 NS ns2.google.com NS ns3.google.com NS ns1.google.com NS ns4.google.com A 216.239.32.10 AAAA 2001:4860:4802:32::a A 216.239.34.10 AAAA 2001:4860:4802:34::a A 216.239.36.10 AAAA 2001:4860:4802:36::a A 216.239.38.10 AAAA 2001:4860:4802:38::a"
"7","02:54:46,549268","192.168.1.37","192.168.1.255","NBNS","92","Name query NB WPAD<00>"
"8","02:54:46,549390","192.168.1.37","192.168.1.1","DNS","76","Standard query 0x5aa7 A brozen.yandex.ru"
"9","02:54:46,549652","fe80::d5d4:e1d6:8319:3e4","ff02::1:3","LLMNR","84","Standard query 0x38af A wpad"
"10","02:54:46,549824","192.168.1.37","192.168.1.1","DNS","85","Standard query 0x6668 A sovetnik.market.yandex.ru"
"11","02:54:46,549839","192.168.1.37","224.0.0.252","LLMNR","64","Standard query 0x38af A wpad"
"12","02:54:46,553870","192.168.1.1","192.168.1.37","DNS","441","Standard query response 0x81fc A adservice.google.ru CNAME pagead46.l.doubleclick.net A 64.233.162.155 A 64.233.162.156 A 64.233.162.154 A 64.233.162.157 NS ns2.google.com NS ns1.google.com NS ns3.google.com NS ns4.google.com A 216.239.32.10 AAAA 2001:4860:4802:32::a A 216.239.34.10 AAAA 2001:4860:4802:34::a A 216.239.36.10 AAAA 2001:4860:4802:36::a A 216.239.38.10 AAAA 2001:4860:4802:38::a"
"13","02:54:46,556959","192.168.1.37","192.168.1.1","DNS","71","Standard query 0x571e A timeweb.com"
"14","02:54:46,559265","192.168.1.1","192.168.1.37","DNS","262","Standard query response 0x5aa7 A brozen.yandex.ru CNAME webzen.stable.qloud-b.yandex.net A 77.88.21.237 NS ns3.yandex.ru NS ns4.yandex.ru A 87.250.250.1 AAAA 2a02:6b8::1001 A 77.88.21.1 AAAA 2a02:6b8:0:1::1:1"
"15","02:54:46,559624","192.168.1.1","192.168.1.37","DNS","336","Standard query response 0x6668 A sovetnik.market.yandex.ru CNAME sovetnik.market.http.yandex.ru A 87.250.250.41 NS ns9.z5h64q92x9.net NS ns2.yandex.ru NS ns1.yandex.ru A 213.180.193.1 AAAA 2a02:6b8::1 A 93.158.134.1 AAAA 2a02:6b8:0:1::1 A 195.156.199.201 AAAA 2a05:d014:484:fd80:ffff:ffff:0:1"
"16","02:54:46,561672","192.168.1.37","192.168.1.1","DNS","72","Standard query 0x8cff A yastatic.net"
"17","02:54:46,562396","192.168.1.37","192.168.1.1","DNS","69","Standard query 0x6d83 A yandex.ru"
"18","02:54:46,562974","192.168.1.1","192.168.1.37","DNS","356","Standard query response 0x571e A timeweb.com A 92.53.96.141 NS ns2.timeweb.ru NS ns3.timeweb.org NS ns1.timeweb.ru NS ns4.timeweb.org A 92.53.116.200 AAAA 2a03:6f00:1::10 A 92.53.98.100 AAAA 2a03:6f00:1::20 A 92.53.116.26 AAAA 2a03:6f00:1::30 A 92.53.98.42 AAAA 2a03:6f00:1::40"
"19","02:54:46,564179","192.168.1.1","192.168.1.37","DNS","324","Standard query response 0x8cff A yastatic.net A 178.154.131.215 A 178.154.131.216 A 178.154.131.217 NS ns1.yandex.net NS ns2.yandex.net NS ns9.z5h64q92x9.net A 213.180.193.1 AAAA 2a02:6b8::1 A 93.158.134.1 AAAA 2a02:6b8:0:1::1 A 195.156.199.201 AAAA 2a05:d014:484:fd80:ffff:ffff:0:1"
"20","02:54:46,566904","192.168.1.1","192.168.1.37","DNS","333","Standard query response 0x6d83 A yandex.ru A 77.88.55.50 A 77.88.55.55 A 5.255.255.55 A 5.255.255.50 NS ns1.yandex.ru NS ns2.yandex.ru NS ns9.z5h64q92x9.net A 213.180.193.1 AAAA 2a02:6b8::1 A 93.158.134.1 AAAA 2a02:6b8:0:1::1 A 195.156.199.201 AAAA 2a05:d014:484:fd80:ffff:ffff:0:1"
"21","02:54:46,971057","fe80::d5d4:e1d6:8319:3e4","ff02::1:3","LLMNR","84","Standard query 0x38af A wpad"
"22","02:54:46,971296","192.168.1.37","224.0.0.252","LLMNR","64","Standard query 0x38af A wpad"
"23","02:54:47,298549","192.168.1.37","192.168.1.255","NBNS","92","Name query NB WPAD<00>"
"24","02:54:47,566058","192.168.1.37","192.168.1.1","DNS","77","Standard query 0xdd63 A hackuniversity.ru"
"25","02:54:47,566660","192.168.1.37","192.168.1.1","DNS","79","Standard query 0x34bf A static.tildacdn.com"
"26","02:54:47,567127","192.168.1.37","192.168.1.1","DNS","68","Standard query 0xb0cc A tilda.ws"
"27","02:54:47,567609","192.168.1.37","192.168.1.1","DNS","78","Standard query 0x2a93 A api-maps.yandex.ru"
"28","02:54:47,568326","192.168.1.37","192.168.1.1","DNS","77","Standard query 0x050d A stat.tildacdn.com"
"29","02:54:47,568811","192.168.1.37","192.168.1.1","DNS","81","Standard query 0xde2e A vec01.maps.yandex.net"
"30","02:54:47,569144","192.168.1.37","173.194.221.95","TCP","66","2182  >  443 [SYN] Seq=0 Win=8192 Len=0 MSS=1460 WS=256 SACK_PERM=1"
"31","02:54:47,570192","192.168.1.1","192.168.1.37","DNS","445","Standard query response 0xdd63 A hackuniversity.ru A 178.248.234.146 NS ns2.reg.ru NS ns1.reg.ru A 194.58.117.15 A 194.58.117.17 A 176.99.13.11 A 176.99.13.13 A 176.99.13.15 A 176.99.13.17 A 194.58.117.11 A 194.58.117.13 AAAA 2a00:f940:4::47 A 176.99.13.14 A 176.99.13.16 A 176.99.13.18 A 194.58.117.12 A 194.58.117.14 A 194.58.117.16 A 194.58.117.18 A 176.99.13.12 AAAA 2a00:f940:5::190"
"32","02:54:47,579916","173.194.221.95","192.168.1.37","TCP","66","443  >  2182 [SYN, ACK] Seq=0 Ack=1 Win=42780 Len=0 MSS=1380 SACK_PERM=1 WS=256"
"33","02:54:47,580169","192.168.1.37","173.194.221.95","TCP","54","2182  >  443 [ACK] Seq=1 Ack=1 Win=66048 Len=0"
"34","02:54:47,580908","192.168.1.37","178.248.234.146","TCP","66","2183  >  80 [SYN] Seq=0 Win=8192 Len=0 MSS=1460 WS=256 SACK_PERM=1"
"35","02:54:47,581026","192.168.1.37","192.168.1.1","DNS","81","Standard query 0x3111 A vec02.maps.yandex.net"
"36","02:54:47,581712","192.168.1.37","173.194.221.95","TLSv1.2","262","Client Hello"
"37","02:54:47,589909","192.168.1.1","192.168.1.37","DNS","342","Standard query response 0x2a93 A api-maps.yandex.ru A 77.88.21.106 A 213.180.193.106 A 213.180.204.106 A 87.250.250.106 NS ns2.yandex.ru NS ns1.yandex.ru NS ns9.z5h64q92x9.net A 213.180.193.1 AAAA 2a02:6b8::1 A 93.158.134.1 AAAA 2a02:6b8:0:1::1 A 195.156.199.201 AAAA 2a05:d014:484:fd80:ffff:ffff:0:1"
"38","02:54:47,591015","192.168.1.37","77.88.21.106","TCP","66","2184  >  443 [SYN] Seq=0 Win=8192 Len=0 MSS=1460 WS=256 SACK_PERM=1"
"39","02:54:47,591333","192.168.1.37","192.168.1.1","DNS","81","Standard query 0xe144 A vec03.maps.yandex.net"
"40","02:54:47,591477","192.168.1.37","77.88.21.106","TCP","66","2185  >  443 [SYN] Seq=0 Win=8192 Len=0 MSS=1460 WS=256 SACK_PERM=1"
"41","02:54:47,591485","192.168.1.1","192.168.1.37","DNS","382","Standard query response 0xde2e A vec01.maps.yandex.net CNAME vec.maps.yandex.net CNAME vec.map.yandex.net A 5.45.196.91 A 5.45.196.93 A 5.45.196.94 A 5.45.196.92 NS ns9.z5h64q92x9.net NS ns1.yandex.net NS ns2.yandex.net A 213.180.193.1 AAAA 2a02:6b8::1 A 93.158.134.1 AAAA 2a02:6b8:0:1::1 A 195.156.199.201 AAAA 2a05:d014:484:fd80:ffff:ffff:0:1"
"42","02:54:47,591486","192.168.1.1","192.168.1.37","DNS","306","Standard query response 0x34bf A static.tildacdn.com CNAME tilda.cdnvideo.ru A 151.236.71.164 NS ns009.cdnvideo.ru NS ns008.cdnvideo.ru NS ns006.cdnvideo.ru NS ns007.cdnvideo.ru NS ns060.cdnvideo.ru A 151.236.64.32 A 91.238.110.24 A 91.231.236.45 A 130.193.68.251 A 185.129.102.222"
"43","02:54:47,592611","192.168.1.37","5.45.196.91","TCP","66","2186  >  443 [SYN] Seq=0 Win=8192 Len=0 MSS=1460 WS=256 SACK_PERM=1"
"44","02:54:47,593213","192.168.1.1","192.168.1.37","DNS","400","Standard query response 0xb0cc A tilda.ws A 178.248.234.191 NS ns-1912.awsdns-47.co.uk NS ns-1258.awsdns-29.org NS ns-985.awsdns-59.net NS ns-118.awsdns-14.com A 205.251.192.118 AAAA 2600:9000:5300:7600::1 A 205.251.195.217 AAAA 2600:9000:5303:d900::1 A 205.251.196.234 AAAA 2600:9000:5304:ea00::1 A 205.251.199.120 AAAA 2600:9000:5307:7800::1"
"45","02:54:47,596652","192.168.1.1","192.168.1.37","DNS","406","Standard query response 0x050d A stat.tildacdn.com A 95.213.201.189 NS ns-330.awsdns-41.com NS ns-1243.awsdns-27.org NS ns-663.awsdns-18.net NS ns-1649.awsdns-14.co.uk A 205.251.193.74 AAAA 2600:9000:5301:4a00::1 A 205.251.194.151 AAAA 2600:9000:5302:9700::1 A 205.251.196.219 AAAA 2600:9000:5304:db00::1 A 205.251.198.113 AAAA 2600:9000:5306:7100::1"
"46","02:54:47,600374","192.168.1.1","192.168.1.37","DNS","382","Standard query response 0x3111 A vec02.maps.yandex.net CNAME vec.maps.yandex.net CNAME vec.map.yandex.net A 5.45.196.93 A 5.45.196.94 A 5.45.196.91 A 5.45.196.92 NS ns1.yandex.net NS ns2.yandex.net NS ns9.z5h64q92x9.net A 213.180.193.1 AAAA 2a02:6b8::1 A 93.158.134.1 AAAA 2a02:6b8:0:1::1 A 195.156.199.201 AAAA 2a05:d014:484:fd80:ffff:ffff:0:1"
"47","02:54:47,601383","173.194.221.95","192.168.1.37","TCP","54","443  >  2182 [ACK] Seq=1 Ack=209 Win=44032 Len=0"
"48","02:54:47,601385","173.194.221.95","192.168.1.37","TLSv1.2","1484","Server Hello"
"49","02:54:47,602934","192.168.1.37","5.45.196.93","TCP","66","2187  >  443 [SYN] Seq=0 Win=8192 Len=0 MSS=1460 WS=256 SACK_PERM=1"
"50","02:54:47,603200","192.168.1.37","5.45.196.93","TCP","66","2188  >  443 [SYN] Seq=0 Win=8192 Len=0 MSS=1460 WS=256 SACK_PERM=1"
"51","02:54:47,604928","192.168.1.37","178.248.234.191","TCP","66","2189  >  80 [SYN] Seq=0 Win=8192 Len=0 MSS=1460 WS=256 SACK_PERM=1"
"52","02:54:47,605170","192.168.1.37","178.248.234.191","TCP","66","2190  >  80 [SYN] Seq=0 Win=8192 Len=0 MSS=1460 WS=256 SACK_PERM=1"
"53","02:54:47,605353","192.168.1.37","178.248.234.191","TCP","66","2191  >  80 [SYN] Seq=0 Win=8192 Len=0 MSS=1460 WS=256 SACK_PERM=1"
"54","02:54:47,605539","192.168.1.37","178.248.234.191","TCP","66","2192  >  80 [SYN] Seq=0 Win=8192 Len=0 MSS=1460 WS=256 SACK_PERM=1"
"55","02:54:47,605779","192.168.1.37","151.236.71.164","TCP","66","2193  >  80 [SYN] Seq=0 Win=8192 Len=0 MSS=1460 WS=256 SACK_PERM=1"
"56","02:54:47,605980","192.168.1.37","151.236.71.164","TCP","66","2194  >  80 [SYN] Seq=0 Win=8192 Len=0 MSS=1460 WS=256 SACK_PERM=1"
"57","02:54:47,606167","192.168.1.37","151.236.71.164","TCP","66","2195  >  80 [SYN] Seq=0 Win=8192 Len=0 MSS=1460 WS=256 SACK_PERM=1"
"58","02:54:47,606354","173.194.221.95","192.168.1.37","TLSv1.2","1283","Certificate, Server Key Exchange, Server Hello Done"
"59","02:54:47,606356","5.45.196.91","192.168.1.37","TCP","66","443  >  2186 [SYN, ACK] Seq=0 Ack=1 Win=42300 Len=0 MSS=1410 SACK_PERM=1 WS=4096"
"60","02:54:47,606356","192.168.1.1","192.168.1.37","DNS","382","Standard query response 0xe144 A vec03.maps.yandex.net CNAME vec.maps.yandex.net CNAME vec.map.yandex.net A 5.45.196.93 A 5.45.196.92 A 5.45.196.94 A 5.45.196.91 NS ns9.z5h64q92x9.net NS ns1.yandex.net NS ns2.yandex.net A 213.180.193.1 AAAA 2a02:6b8::1 A 93.158.134.1 AAAA 2a02:6b8:0:1::1 A 195.156.199.201 AAAA 2a05:d014:484:fd80:ffff:ffff:0:1"
"61","02:54:47,606377","192.168.1.37","151.236.71.164","TCP","66","2196  >  80 [SYN] Seq=0 Win=8192 Len=0 MSS=1460 WS=256 SACK_PERM=1"
"62","02:54:47,606447","192.168.1.37","173.194.221.95","TCP","54","2182  >  443 [ACK] Seq=209 Ack=2660 Win=66048 Len=0"
"63","02:54:47,606497","192.168.1.37","5.45.196.91","TCP","54","2186  >  443 [ACK] Seq=1 Ack=1 Win=66048 Len=0"
"64","02:54:47,606582","192.168.1.37","151.236.71.164","TCP","66","2197  >  80 [SYN] Seq=0 Win=8192 Len=0 MSS=1460 WS=256 SACK_PERM=1"
"65","02:54:47,606788","192.168.1.37","151.236.71.164","TCP","66","2198  >  80 [SYN] Seq=0 Win=8192 Len=0 MSS=1460 WS=256 SACK_PERM=1"
"66","02:54:47,606995","192.168.1.37","151.236.71.164","TCP","66","2199  >  443 [SYN] Seq=0 Win=8192 Len=0 MSS=1460 WS=256 SACK_PERM=1"
"67","02:54:47,607196","192.168.1.37","151.236.71.164","TCP","66","2200  >  443 [SYN] Seq=0 Win=8192 Len=0 MSS=1460 WS=256 SACK_PERM=1"
"68","02:54:47,607394","192.168.1.37","151.236.71.164","TCP","66","2201  >  443 [SYN] Seq=0 Win=8192 Len=0 MSS=1460 WS=256 SACK_PERM=1"
"69","02:54:47,607589","192.168.1.37","151.236.71.164","TCP","66","2202  >  443 [SYN] Seq=0 Win=8192 Len=0 MSS=1460 WS=256 SACK_PERM=1"
"70","02:54:47,607782","192.168.1.37","151.236.71.164","TCP","66","2203  >  443 [SYN] Seq=0 Win=8192 Len=0 MSS=1460 WS=256 SACK_PERM=1"
"71","02:54:47,607976","192.168.1.37","151.236.71.164","TCP","66","2204  >  443 [SYN] Seq=0 Win=8192 Len=0 MSS=1460 WS=256 SACK_PERM=1"
"72","02:54:47,609883","178.248.234.146","192.168.1.37","TCP","58","80  >  2183 [SYN, ACK] Seq=0 Ack=1 Win=5792 Len=0 MSS=1460"
"73","02:54:47,609973","192.168.1.37","178.248.234.146","TCP","54","2183  >  80 [ACK] Seq=1 Ack=1 Win=64240 Len=0"
"74","02:54:47,610709","5.45.196.93","192.168.1.37","TCP","66","443  >  2187 [SYN, ACK] Seq=0 Ack=1 Win=42300 Len=0 MSS=1410 SACK_PERM=1 WS=4096"
"75","02:54:47,610768","192.168.1.37","5.45.196.93","TCP","54","2187  >  443 [ACK] Seq=1 Ack=1 Win=66048 Len=0"
"76","02:54:47,611370","77.88.21.106","192.168.1.37","TCP","66","443  >  2184 [SYN, ACK] Seq=0 Ack=1 Win=28200 Len=0 MSS=1410 SACK_PERM=1 WS=128"
"77","02:54:47,611371","77.88.21.106","192.168.1.37","TCP","66","443  >  2185 [SYN, ACK] Seq=0 Ack=1 Win=28200 Len=0 MSS=1410 SACK_PERM=1 WS=128"
"78","02:54:47,611461","192.168.1.37","77.88.21.106","TCP","54","2184  >  443 [ACK] Seq=1 Ack=1 Win=66048 Len=0"
"79","02:54:47,611524","192.168.1.37","77.88.21.106","TCP","54","2185  >  443 [ACK] Seq=1 Ack=1 Win=66048 Len=0"
"80","02:54:47,614406","192.168.1.37","5.45.196.91","TLSv1.2","263","Client Hello"
"81","02:54:47,614851","192.168.1.37","5.45.196.93","TLSv1.2","263","Client Hello"
"82","02:54:47,615678","192.168.1.37","77.88.21.106","TLSv1.2","260","Client Hello"
"83","02:54:47,615886","192.168.1.37","77.88.21.106","TLSv1.2","260","Client Hello"
"84","02:54:47,618122","192.168.1.37","192.168.1.1","DNS","81","Standard query 0xe144 A vec03.maps.yandex.net"
"85","02:54:47,618336","5.45.196.93","192.168.1.37","TCP","66","443  >  2188 [SYN, ACK] Seq=0 Ack=1 Win=42300 Len=0 MSS=1410 SACK_PERM=1 WS=4096"
"86","02:54:47,618408","192.168.1.37","5.45.196.93","TCP","54","2188  >  443 [ACK] Seq=1 Ack=1 Win=66048 Len=0"
"87","02:54:47,618851","192.168.1.37","5.45.196.93","TLSv1.2","263","Client Hello"
"88","02:54:47,621521","5.45.196.91","192.168.1.37","TCP","54","443  >  2186 [ACK] Seq=1 Ack=210 Win=45056 Len=0"
"89","02:54:47,623391","5.45.196.93","192.168.1.37","TCP","54","443  >  2187 [ACK] Seq=1 Ack=210 Win=45056 Len=0"
"90","02:54:47,624341","192.168.1.37","192.168.1.1","DNS","81","Standard query 0xd6cf A vec04.maps.yandex.net"
"91","02:54:47,625596","5.45.196.91","192.168.1.37","TLSv1.2","1464","Server Hello"
"92","02:54:47,625598","5.45.196.91","192.168.1.37","TCP","1464","443  >  2186 [ACK] Seq=1411 Ack=210 Win=45056 Len=1410 [TCP segment of a reassembled PDU]"
"93","02:54:47,625599","5.45.196.93","192.168.1.37","TLSv1.2","1464","Server Hello"
"94","02:54:47,625602","5.45.196.93","192.168.1.37","TCP","1464","443  >  2187 [ACK] Seq=1411 Ack=210 Win=45056 Len=1410 [TCP segment of a reassembled PDU]"
"95","02:54:47,625603","5.45.196.93","192.168.1.37","TCP","1330","443  >  2187 [PSH, ACK] Seq=2821 Ack=210 Win=45056 Len=1276 [TCP segment of a reassembled PDU]"
"96","02:54:47,625605","5.45.196.91","192.168.1.37","TCP","1330","443  >  2186 [PSH, ACK] Seq=2821 Ack=210 Win=45056 Len=1276 [TCP segment of a reassembled PDU]"
"97","02:54:47,625606","178.248.234.191","192.168.1.37","TCP","58","80  >  2190 [SYN, ACK] Seq=0 Ack=1 Win=5792 Len=0 MSS=1460"
"98","02:54:47,625606","5.45.196.93","192.168.1.37","TCP","54","443  >  2188 [ACK] Seq=1 Ack=210 Win=45056 Len=0"
"99","02:54:47,625606","178.248.234.191","192.168.1.37","TCP","58","80  >  2192 [SYN, ACK] Seq=0 Ack=1 Win=5792 Len=0 MSS=1460"
"100","02:54:47,625607","5.45.196.93","192.168.1.37","TLSv1.2","1464","Server Hello"
"101","02:54:47,625608","5.45.196.93","192.168.1.37","TCP","1464","443  >  2188 [ACK] Seq=1411 Ack=210 Win=45056 Len=1410 [TCP segment of a reassembled PDU]"
"102","02:54:47,625609","5.45.196.93","192.168.1.37","TCP","1330","443  >  2188 [PSH, ACK] Seq=2821 Ack=210 Win=45056 Len=1276 [TCP segment of a reassembled PDU]"
"103","02:54:47,625610","151.236.71.164","192.168.1.37","TCP","66","80  >  2193 [SYN, ACK] Seq=0 Ack=1 Win=11680 Len=0 MSS=1460 SACK_PERM=1 WS=4096"
"104","02:54:47,625611","178.248.234.191","192.168.1.37","TCP","58","80  >  2189 [SYN, ACK] Seq=0 Ack=1 Win=5792 Len=0 MSS=1460"
"105","02:54:47,625611","178.248.234.191","192.168.1.37","TCP","58","80  >  2191 [SYN, ACK] Seq=0 Ack=1 Win=5792 Len=0 MSS=1460"
"106","02:54:47,625928","192.168.1.37","5.45.196.91","TCP","54","2186  >  443 [ACK] Seq=210 Ack=4097 Win=66048 Len=0"
"107","02:54:47,626067","192.168.1.37","5.45.196.93","TCP","54","2187  >  443 [ACK] Seq=210 Ack=4097 Win=66048 Len=0"
"108","02:54:47,626108","192.168.1.37","178.248.234.191","TCP","54","2190  >  80 [ACK] Seq=1 Ack=1 Win=64240 Len=0"
"109","02:54:47,626165","192.168.1.37","178.248.234.191","TCP","54","2192  >  80 [ACK] Seq=1 Ack=1 Win=64240 Len=0"
"110","02:54:47,626220","192.168.1.37","5.45.196.93","TCP","54","2188  >  443 [ACK] Seq=210 Ack=4097 Win=66048 Len=0"
"111","02:54:47,626254","192.168.1.37","151.236.71.164","TCP","54","2193  >  80 [ACK] Seq=1 Ack=1 Win=65536 Len=0"
"112","02:54:47,626287","192.168.1.37","178.248.234.191","TCP","54","2189  >  80 [ACK] Seq=1 Ack=1 Win=64240 Len=0"
"113","02:54:47,626318","192.168.1.37","178.248.234.191","TCP","54","2191  >  80 [ACK] Seq=1 Ack=1 Win=64240 Len=0"
"114","02:54:47,627685","151.236.71.164","192.168.1.37","TCP","66","80  >  2194 [SYN, ACK] Seq=0 Ack=1 Win=11680 Len=0 MSS=1460 SACK_PERM=1 WS=4096"
"115","02:54:47,627690","151.236.71.164","192.168.1.37","TCP","66","80  >  2195 [SYN, ACK] Seq=0 Ack=1 Win=11680 Len=0 MSS=1460 SACK_PERM=1 WS=4096"
"116","02:54:47,627691","151.236.71.164","192.168.1.37","TCP","66","80  >  2196 [SYN, ACK] Seq=0 Ack=1 Win=11680 Len=0 MSS=1460 SACK_PERM=1 WS=4096"
"117","02:54:47,627692","151.236.71.164","192.168.1.37","TCP","66","80  >  2197 [SYN, ACK] Seq=0 Ack=1 Win=11680 Len=0 MSS=1460 SACK_PERM=1 WS=4096"
"118","02:54:47,627692","151.236.71.164","192.168.1.37","TCP","66","80  >  2198 [SYN, ACK] Seq=0 Ack=1 Win=11680 Len=0 MSS=1460 SACK_PERM=1 WS=4096"
"119","02:54:47,627693","151.236.71.164","192.168.1.37","TCP","66","443  >  2199 [SYN, ACK] Seq=0 Ack=1 Win=11680 Len=0 MSS=1460 SACK_PERM=1 WS=4096"
"120","02:54:47,627693","151.236.71.164","192.168.1.37","TCP","66","443  >  2200 [SYN, ACK] Seq=0 Ack=1 Win=11680 Len=0 MSS=1460 SACK_PERM=1 WS=4096"
"121","02:54:47,627694","151.236.71.164","192.168.1.37","TCP","66","443  >  2201 [SYN, ACK] Seq=0 Ack=1 Win=11680 Len=0 MSS=1460 SACK_PERM=1 WS=4096"
"122","02:54:47,627694","151.236.71.164","192.168.1.37","TCP","66","443  >  2202 [SYN, ACK] Seq=0 Ack=1 Win=11680 Len=0 MSS=1460 SACK_PERM=1 WS=4096"
"123","02:54:47,627695","151.236.71.164","192.168.1.37","TCP","66","443  >  2203 [SYN, ACK] Seq=0 Ack=1 Win=11680 Len=0 MSS=1460 SACK_PERM=1 WS=4096"
"124","02:54:47,628113","192.168.1.37","151.236.71.164","TCP","54","2194  >  80 [ACK] Seq=1 Ack=1 Win=65536 Len=0"
"125","02:54:47,628203","192.168.1.37","151.236.71.164","TCP","54","2195  >  80 [ACK] Seq=1 Ack=1 Win=65536 Len=0"
"126","02:54:47,628239","192.168.1.37","151.236.71.164","TCP","54","2196  >  80 [ACK] Seq=1 Ack=1 Win=65536 Len=0"
"127","02:54:47,628276","192.168.1.37","151.236.71.164","TCP","54","2197  >  80 [ACK] Seq=1 Ack=1 Win=65536 Len=0"
"128","02:54:47,628322","192.168.1.37","151.236.71.164","TCP","54","2198  >  80 [ACK] Seq=1 Ack=1 Win=65536 Len=0"
"129","02:54:47,628369","192.168.1.37","151.236.71.164","TCP","54","2199  >  443 [ACK] Seq=1 Ack=1 Win=65536 Len=0"
"130","02:54:47,628408","192.168.1.37","151.236.71.164","TCP","54","2200  >  443 [ACK] Seq=1 Ack=1 Win=65536 Len=0"
"131","02:54:47,628457","192.168.1.37","151.236.71.164","TCP","54","2201  >  443 [ACK] Seq=1 Ack=1 Win=65536 Len=0"
"132","02:54:47,628512","192.168.1.37","151.236.71.164","TCP","54","2202  >  443 [ACK] Seq=1 Ack=1 Win=65536 Len=0"
"133","02:54:47,628546","192.168.1.37","151.236.71.164","TCP","54","2203  >  443 [ACK] Seq=1 Ack=1 Win=65536 Len=0"
"134","02:54:47,628722","192.168.1.37","151.236.71.164","TLSv1.2","261","Client Hello"
"135","02:54:47,628996","192.168.1.37","151.236.71.164","TLSv1.2","261","Client Hello"
"136","02:54:47,629243","192.168.1.37","151.236.71.164","TLSv1.2","261","Client Hello"
"137","02:54:47,629623","192.168.1.37","151.236.71.164","TLSv1.2","261","Client Hello"
"138","02:54:47,629828","192.168.1.37","151.236.71.164","TLSv1.2","261","Client Hello"
"139","02:54:47,633595","151.236.71.164","192.168.1.37","TCP","66","443  >  2204 [SYN, ACK] Seq=0 Ack=1 Win=11680 Len=0 MSS=1460 SACK_PERM=1 WS=4096"
"140","02:54:47,633596","192.168.1.1","192.168.1.37","DNS","382","Standard query response 0xe144 A vec03.maps.yandex.net CNAME vec.maps.yandex.net CNAME vec.map.yandex.net A 5.45.196.93 A 5.45.196.92 A 5.45.196.94 A 5.45.196.91 NS ns9.z5h64q92x9.net NS ns1.yandex.net NS ns2.yandex.net A 213.180.193.1 AAAA 2a02:6b8::1 A 93.158.134.1 AAAA 2a02:6b8:0:1::1 A 195.156.199.201 AAAA 2a05:d014:484:fd80:ffff:ffff:0:1"
"141","02:54:47,633597","192.168.1.1","192.168.1.37","DNS","382","Standard query response 0xd6cf A vec04.maps.yandex.net CNAME vec.maps.yandex.net CNAME vec.map.yandex.net A 5.45.196.92 A 5.45.196.93 A 5.45.196.91 A 5.45.196.94 NS ns2.yandex.net NS ns9.z5h64q92x9.net NS ns1.yandex.net A 213.180.193.1 AAAA 2a02:6b8::1 A 93.158.134.1 AAAA 2a02:6b8:0:1::1 A 195.156.199.201 AAAA 2a05:d014:484:fd80:ffff:ffff:0:1"
"142","02:54:47,633749","192.168.1.37","151.236.71.164","TCP","54","2204  >  443 [ACK] Seq=1 Ack=1 Win=65536 Len=0"
"143","02:54:47,634601","192.168.1.37","151.236.71.164","TLSv1.2","261","Client Hello"
"144","02:54:47,634987","77.88.21.106","192.168.1.37","TCP","54","443  >  2184 [ACK] Seq=1 Ack=207 Win=29312 Len=0"
"145","02:54:47,635371","77.88.21.106","192.168.1.37","TCP","54","443  >  2185 [ACK] Seq=1 Ack=207 Win=29312 Len=0"
"146","02:54:47,640601","77.88.21.106","192.168.1.37","TLSv1.2","1464","Server Hello"
"147","02:54:47,641480","77.88.21.106","192.168.1.37","TCP","1464","443  >  2184 [ACK] Seq=1411 Ack=207 Win=29312 Len=1410 [TCP segment of a reassembled PDU]"
"148","02:54:47,641482","77.88.21.106","192.168.1.37","TCP","1464","443  >  2184 [ACK] Seq=2821 Ack=207 Win=29312 Len=1410 [TCP segment of a reassembled PDU]"
"149","02:54:47,641483","77.88.21.106","192.168.1.37","TLSv1.2","1464","Certificate [TCP segment of a reassembled PDU]"
"150","02:54:47,641484","77.88.21.106","192.168.1.37","TLSv1.2","974","Certificate Status, Server Key Exchange, Server Hello Done"
"151","02:54:47,641550","192.168.1.37","77.88.21.106","TCP","54","2184  >  443 [ACK] Seq=207 Ack=6561 Win=66048 Len=0"
"152","02:54:47,642679","77.88.21.106","192.168.1.37","TLSv1.2","1464","Server Hello"
"153","02:54:47,642681","77.88.21.106","192.168.1.37","TCP","1464","443  >  2185 [ACK] Seq=1411 Ack=207 Win=29312 Len=1410 [TCP segment of a reassembled PDU]"
"154","02:54:47,642682","77.88.21.106","192.168.1.37","TCP","1464","443  >  2185 [ACK] Seq=2821 Ack=207 Win=29312 Len=1410 [TCP segment of a reassembled PDU]"
"155","02:54:47,642744","192.168.1.37","77.88.21.106","TCP","54","2185  >  443 [ACK] Seq=207 Ack=4231 Win=66048 Len=0"
"156","02:54:47,643033","77.88.21.106","192.168.1.37","TLSv1.2","1464","Certificate [TCP segment of a reassembled PDU]"
"157","02:54:47,643034","77.88.21.106","192.168.1.37","TLSv1.2","974","Certificate Status, Server Key Exchange, Server Hello Done"
"158","02:54:47,643035","5.45.196.93","192.168.1.37","TLSv1.2","694","Certificate, Server Key Exchange, Server Hello Done"
"159","02:54:47,643070","192.168.1.37","77.88.21.106","TCP","54","2185  >  443 [ACK] Seq=207 Ack=6561 Win=66048 Len=0"
"160","02:54:47,643112","192.168.1.37","5.45.196.93","TCP","54","2188  >  443 [ACK] Seq=210 Ack=4737 Win=65536 Len=0"
"161","02:54:47,647437","5.45.196.91","192.168.1.37","TLSv1.2","694","Certificate, Server Key Exchange, Server Hello Done"
"162","02:54:47,647515","192.168.1.37","5.45.196.91","TCP","54","2186  >  443 [ACK] Seq=210 Ack=4737 Win=65536 Len=0"
"163","02:54:47,647729","192.168.1.37","77.88.21.106","TLSv1.2","180","Client Key Exchange, Change Cipher Spec, Encrypted Handshake Message"
"164","02:54:47,650823","5.45.196.93","192.168.1.37","TLSv1.2","694","Certificate, Server Key Exchange, Server Hello Done"
"165","02:54:47,650881","192.168.1.37","5.45.196.93","TCP","54","2187  >  443 [ACK] Seq=210 Ack=4737 Win=65536 Len=0"
"166","02:54:47,654199","192.168.1.37","77.88.21.106","TLSv1.2","180","Client Key Exchange, Change Cipher Spec, Encrypted Handshake Message"
"167","02:54:47,657989","192.168.1.37","5.45.196.93","TLSv1.2","139","Client Key Exchange, Change Cipher Spec, Encrypted Handshake Message"
"168","02:54:47,658516","192.168.1.37","5.45.196.92","TCP","66","2205  >  443 [SYN] Seq=0 Win=8192 Len=0 MSS=1460 WS=256 SACK_PERM=1"
"169","02:54:47,659551","151.236.71.164","192.168.1.37","TCP","54","443  >  2199 [ACK] Seq=1 Ack=208 Win=16384 Len=0"
"170","02:54:47,659552","151.236.71.164","192.168.1.37","TCP","54","443  >  2200 [ACK] Seq=1 Ack=208 Win=16384 Len=0"
"171","02:54:47,659552","151.236.71.164","192.168.1.37","TCP","54","443  >  2201 [ACK] Seq=1 Ack=208 Win=16384 Len=0"
"172","02:54:47,659553","151.236.71.164","192.168.1.37","TCP","54","443  >  2202 [ACK] Seq=1 Ack=208 Win=16384 Len=0"
"173","02:54:47,659553","151.236.71.164","192.168.1.37","TCP","54","443  >  2203 [ACK] Seq=1 Ack=208 Win=16384 Len=0"
"174","02:54:47,659554","151.236.71.164","192.168.1.37","TCP","54","443  >  2204 [ACK] Seq=1 Ack=208 Win=16384 Len=0"
"175","02:54:47,659554","151.236.71.164","192.168.1.37","TLSv1.2","1514","Server Hello"
"176","02:54:47,659555","151.236.71.164","192.168.1.37","TCP","1514","443  >  2199 [ACK] Seq=1461 Ack=208 Win=16384 Len=1460 [TCP segment of a reassembled PDU]"
"177","02:54:47,659558","151.236.71.164","192.168.1.37","TCP","1514","443  >  2199 [ACK] Seq=2921 Ack=208 Win=16384 Len=1460 [TCP segment of a reassembled PDU]"
"178","02:54:47,659559","151.236.71.164","192.168.1.37","TLSv1.2","441","Certificate, Server Key Exchange, Server Hello Done"
"179","02:54:47,659559","151.236.71.164","192.168.1.37","TLSv1.2","1514","Server Hello"
"180","02:54:47,659560","151.236.71.164","192.168.1.37","TCP","1514","443  >  2204 [ACK] Seq=1461 Ack=208 Win=16384 Len=1460 [TCP segment of a reassembled PDU]"
"181","02:54:47,659561","151.236.71.164","192.168.1.37","TCP","1514","443  >  2204 [ACK] Seq=2921 Ack=208 Win=16384 Len=1460 [TCP segment of a reassembled PDU]"
"182","02:54:47,659562","151.236.71.164","192.168.1.37","TLSv1.2","441","Certificate, Server Key Exchange, Server Hello Done"
"183","02:54:47,659563","151.236.71.164","192.168.1.37","TLSv1.2","1514","Server Hello"
"184","02:54:47,659689","192.168.1.37","151.236.71.164","TCP","54","2199  >  443 [ACK] Seq=208 Ack=4768 Win=65536 Len=0"
"185","02:54:47,659746","192.168.1.37","151.236.71.164","TCP","54","2204  >  443 [ACK] Seq=208 Ack=4768 Win=65536 Len=0"
"186","02:54:47,660885","151.236.71.164","192.168.1.37","TCP","1514","443  >  2200 [ACK] Seq=1461 Ack=208 Win=16384 Len=1460 [TCP segment of a reassembled PDU]"
"187","02:54:47,660887","151.236.71.164","192.168.1.37","TCP","1514","443  >  2200 [ACK] Seq=2921 Ack=208 Win=16384 Len=1460 [TCP segment of a reassembled PDU]"
"188","02:54:47,660888","151.236.71.164","192.168.1.37","TLSv1.2","441","Certificate, Server Key Exchange, Server Hello Done"
"189","02:54:47,660940","192.168.1.37","151.236.71.164","TCP","54","2200  >  443 [ACK] Seq=208 Ack=4768 Win=65536 Len=0"
"190","02:54:47,663176","192.168.1.37","5.45.196.91","TLSv1.2","139","Client Key Exchange, Change Cipher Spec, Encrypted Handshake Message"
"191","02:54:47,667603","192.168.1.37","5.45.196.93","TLSv1.2","139","Client Key Exchange, Change Cipher Spec, Encrypted Handshake Message"
"192","02:54:47,668374","151.236.71.164","192.168.1.37","TLSv1.2","1514","Server Hello"
"193","02:54:47,671562","151.236.71.164","192.168.1.37","TCP","1514","443  >  2201 [ACK] Seq=1461 Ack=208 Win=16384 Len=1460 [TCP segment of a reassembled PDU]"
"194","02:54:47,671564","151.236.71.164","192.168.1.37","TCP","1514","443  >  2201 [ACK] Seq=2921 Ack=208 Win=16384 Len=1460 [TCP segment of a reassembled PDU]"
"195","02:54:47,671565","151.236.71.164","192.168.1.37","TLSv1.2","441","Certificate, Server Key Exchange, Server Hello Done"
"196","02:54:47,671565","151.236.71.164","192.168.1.37","TLSv1.2","1514","Server Hello"
"197","02:54:47,671566","151.236.71.164","192.168.1.37","TCP","1514","443  >  2202 [ACK] Seq=1461 Ack=208 Win=16384 Len=1460 [TCP segment of a reassembled PDU]"
"198","02:54:47,671568","151.236.71.164","192.168.1.37","TCP","1514","443  >  2202 [ACK] Seq=2921 Ack=208 Win=16384 Len=1460 [TCP segment of a reassembled PDU]"
"199","02:54:47,671569","151.236.71.164","192.168.1.37","TLSv1.2","441","Certificate, Server Key Exchange, Server Hello Done"
"200","02:54:47,671570","151.236.71.164","192.168.1.37","TLSv1.2","1514","Server Hello"
"201","02:54:47,671571","151.236.71.164","192.168.1.37","TCP","1514","443  >  2203 [ACK] Seq=1461 Ack=208 Win=16384 Len=1460 [TCP segment of a reassembled PDU]"
"202","02:54:47,671572","151.236.71.164","192.168.1.37","TCP","1514","443  >  2203 [ACK] Seq=2921 Ack=208 Win=16384 Len=1460 [TCP segment of a reassembled PDU]"
"203","02:54:47,671573","151.236.71.164","192.168.1.37","TLSv1.2","441","Certificate, Server Key Exchange, Server Hello Done"
"204","02:54:47,671670","192.168.1.37","151.236.71.164","TCP","54","2201  >  443 [ACK] Seq=208 Ack=4768 Win=65536 Len=0"
"205","02:54:47,671740","192.168.1.37","151.236.71.164","TCP","54","2202  >  443 [ACK] Seq=208 Ack=4768 Win=65536 Len=0"
"206","02:54:47,671777","192.168.1.37","151.236.71.164","TCP","54","2203  >  443 [ACK] Seq=208 Ack=4768 Win=65536 Len=0"
"207","02:54:47,674936","192.168.1.37","151.236.71.164","TLSv1.2","180","Client Key Exchange, Change Cipher Spec, Encrypted Handshake Message"
"208","02:54:47,676658","5.45.196.92","192.168.1.37","TCP","66","443  >  2205 [SYN, ACK] Seq=0 Ack=1 Win=42300 Len=0 MSS=1410 SACK_PERM=1 WS=4096"
"209","02:54:47,676659","5.45.196.93","192.168.1.37","TLSv1.2","320","New Session Ticket, Change Cipher Spec, Encrypted Handshake Message"
"210","02:54:47,676659","77.88.21.106","192.168.1.37","TLSv1.2","312","New Session Ticket, Change Cipher Spec, Encrypted Handshake Message"
"211","02:54:47,676757","192.168.1.37","5.45.196.92","TCP","54","2205  >  443 [ACK] Seq=1 Ack=1 Win=66048 Len=0"
"212","02:54:47,677381","5.45.196.93","192.168.1.37","TLSv1.2","320","New Session Ticket, Change Cipher Spec, Encrypted Handshake Message"
"213","02:54:47,677382","5.45.196.91","192.168.1.37","TLSv1.2","320","New Session Ticket, Change Cipher Spec, Encrypted Handshake Message"
"214","02:54:47,681498","192.168.1.37","151.236.71.164","TLSv1.2","180","Client Key Exchange, Change Cipher Spec, Encrypted Handshake Message"
"215","02:54:47,688085","192.168.1.37","151.236.71.164","TLSv1.2","180","Client Key Exchange, Change Cipher Spec, Encrypted Handshake Message"
"216","02:54:47,690402","77.88.21.106","192.168.1.37","TLSv1.2","312","New Session Ticket, Change Cipher Spec, Encrypted Handshake Message"
"217","02:54:47,692002","151.236.71.164","192.168.1.37","TLSv1.2","312","New Session Ticket, Change Cipher Spec, Encrypted Handshake Message"
"218","02:54:47,697668","192.168.1.37","151.236.71.164","TLSv1.2","180","Client Key Exchange, Change Cipher Spec, Encrypted Handshake Message"
"219","02:54:47,699399","151.236.71.164","192.168.1.37","TLSv1.2","312","New Session Ticket, Change Cipher Spec, Encrypted Handshake Message"
"220","02:54:47,704438","151.236.71.164","192.168.1.37","TLSv1.2","312","New Session Ticket, Change Cipher Spec, Encrypted Handshake Message"
"221","02:54:47,705554","192.168.1.37","151.236.71.164","TLSv1.2","180","Client Key Exchange, Change Cipher Spec, Encrypted Handshake Message"
"222","02:54:47,710509","151.236.71.164","192.168.1.37","TLSv1.2","312","New Session Ticket, Change Cipher Spec, Encrypted Handshake Message"
"223","02:54:47,713380","192.168.1.37","151.236.71.164","TLSv1.2","180","Client Key Exchange, Change Cipher Spec, Encrypted Handshake Message"
"224","02:54:47,718462","192.168.1.37","5.45.196.92","TLSv1.2","263","Client Hello"
"225","02:54:47,719499","151.236.71.164","192.168.1.37","TLSv1.2","312","New Session Ticket, Change Cipher Spec, Encrypted Handshake Message"
"226","02:54:47,722439","5.45.196.92","192.168.1.37","TCP","54","443  >  2205 [ACK] Seq=1 Ack=210 Win=45056 Len=0"
"227","02:54:47,724559","5.45.196.92","192.168.1.37","TLSv1.2","1464","Server Hello"
"228","02:54:47,724561","5.45.196.92","192.168.1.37","TCP","1464","443  >  2205 [ACK] Seq=1411 Ack=210 Win=45056 Len=1410 [TCP segment of a reassembled PDU]"
"229","02:54:47,724566","5.45.196.92","192.168.1.37","TCP","1330","443  >  2205 [PSH, ACK] Seq=2821 Ack=210 Win=45056 Len=1276 [TCP segment of a reassembled PDU]"
"230","02:54:47,724694","192.168.1.37","5.45.196.92","TCP","54","2205  >  443 [ACK] Seq=210 Ack=4097 Win=66048 Len=0"
"231","02:54:47,725501","151.236.71.164","192.168.1.37","TLSv1.2","312","New Session Ticket, Change Cipher Spec, Encrypted Handshake Message"
"232","02:54:47,730470","192.168.1.37","77.88.21.106","TCP","54","2184  >  443 [ACK] Seq=333 Ack=6819 Win=65792 Len=0"
"233","02:54:47,731452","5.45.196.92","192.168.1.37","TLSv1.2","694","Certificate, Server Key Exchange, Server Hello Done"
"234","02:54:47,731568","192.168.1.37","5.45.196.92","TCP","54","2205  >  443 [ACK] Seq=210 Ack=4737 Win=65536 Len=0"
"235","02:54:47,732413","192.168.1.37","5.45.196.93","TCP","54","2188  >  443 [ACK] Seq=295 Ack=5003 Win=65280 Len=0"
"236","02:54:47,734420","192.168.1.37","5.45.196.93","TCP","54","2187  >  443 [ACK] Seq=295 Ack=5003 Win=65280 Len=0"
"237","02:54:47,734506","192.168.1.37","5.45.196.91","TCP","54","2186  >  443 [ACK] Seq=295 Ack=5003 Win=65280 Len=0"
"238","02:54:47,735945","192.168.1.37","5.45.196.92","TLSv1.2","139","Client Key Exchange, Change Cipher Spec, Encrypted Handshake Message"
"239","02:54:47,738510","192.168.1.37","151.236.71.164","TCP","54","2199  >  443 [ACK] Seq=334 Ack=5026 Win=65280 Len=0"
"240","02:54:47,741431","5.45.196.92","192.168.1.37","TLSv1.2","320","New Session Ticket, Change Cipher Spec, Encrypted Handshake Message"
"241","02:54:47,745854","192.168.1.37","77.88.21.106","TCP","54","2185  >  443 [ACK] Seq=333 Ack=6819 Win=65792 Len=0"
"242","02:54:47,746400","192.168.1.37","151.236.71.164","TCP","54","2204  >  443 [ACK] Seq=334 Ack=5026 Win=65280 Len=0"
"243","02:54:47,746469","192.168.1.37","151.236.71.164","TCP","54","2200  >  443 [ACK] Seq=334 Ack=5026 Win=65280 Len=0"
"244","02:54:47,762431","192.168.1.37","151.236.71.164","TCP","54","2201  >  443 [ACK] Seq=334 Ack=5026 Win=65280 Len=0"
"245","02:54:47,765855","192.168.1.37","151.236.71.164","TCP","54","2202  >  443 [ACK] Seq=334 Ack=5026 Win=65280 Len=0"
"246","02:54:47,780443","192.168.1.37","151.236.71.164","TCP","54","2203  >  443 [ACK] Seq=334 Ack=5026 Win=65280 Len=0"
"247","02:54:47,792453","192.168.1.37","5.45.196.92","TCP","54","2205  >  443 [ACK] Seq=295 Ack=5003 Win=65280 Len=0"
"248","02:54:48,049146","192.168.1.37","192.168.1.255","NBNS","92","Name query NB WPAD<00>"
"249","02:54:48,270279","192.168.1.37","213.180.204.179","TCP","66","2206  >  443 [SYN] Seq=0 Win=8192 Len=0 MSS=1460 WS=256 SACK_PERM=1"
"250","02:54:48,286973","213.180.204.179","192.168.1.37","TCP","66","443  >  2206 [SYN, ACK] Seq=0 Ack=1 Win=28200 Len=0 MSS=1410 SACK_PERM=1 WS=256"
"251","02:54:48,287072","192.168.1.37","213.180.204.179","TCP","54","2206  >  443 [ACK] Seq=1 Ack=1 Win=66048 Len=0"
"252","02:54:48,287461","192.168.1.37","213.180.204.179","TLSv1.2","238","Client Hello"
"253","02:54:48,304267","213.180.204.179","192.168.1.37","TCP","54","443  >  2206 [ACK] Seq=1 Ack=185 Win=29440 Len=0"
"254","02:54:48,309278","213.180.204.179","192.168.1.37","TLSv1.2","1464","Server Hello"
"255","02:54:48,310290","213.180.204.179","192.168.1.37","TCP","1464","443  >  2206 [ACK] Seq=1411 Ack=185 Win=29440 Len=1410 [TCP segment of a reassembled PDU]"
"256","02:54:48,310292","213.180.204.179","192.168.1.37","TCP","1464","443  >  2206 [ACK] Seq=2821 Ack=185 Win=29440 Len=1410 [TCP segment of a reassembled PDU]"
"257","02:54:48,310294","213.180.204.179","192.168.1.37","TLSv1.2","1464","Certificate [TCP segment of a reassembled PDU]"
"258","02:54:48,310295","213.180.204.179","192.168.1.37","TLSv1.2","764","Certificate Status, Server Key Exchange, Server Hello Done"
"259","02:54:48,310357","192.168.1.37","213.180.204.179","TCP","54","2206  >  443 [ACK] Seq=185 Ack=6351 Win=66048 Len=0"
"260","02:54:48,317576","192.168.1.37","213.180.204.179","TLSv1.2","180","Client Key Exchange, Change Cipher Spec, Encrypted Handshake Message"
"261","02:54:48,334385","213.180.204.179","192.168.1.37","TLSv1.2","312","New Session Ticket, Change Cipher Spec, Encrypted Handshake Message"
"262","02:54:48,342571","192.168.1.37","213.180.204.179","TCP","1464","2206  >  443 [ACK] Seq=311 Ack=6609 Win=65792 Len=1410 [TCP segment of a reassembled PDU]"
"263","02:54:48,342583","192.168.1.37","213.180.204.179","TLSv1.2","564","Application Data"
"264","02:54:48,364882","213.180.204.179","192.168.1.37","TCP","60","443  >  2206 [ACK] Seq=6609 Ack=2231 Win=35072 Len=0"
"265","02:54:48,365269","213.180.204.179","192.168.1.37","TLSv1.2","343","Application Data"
"266","02:54:48,372323","ZyxelCom_9f:c2:bc","Broadcast","ARP","42","Who has 192.168.1.34? Tell 192.168.1.1"
"267","02:54:48,380111","213.180.204.179","192.168.1.37","TLSv1.2","135","Application Data"
"268","02:54:48,380172","192.168.1.37","213.180.204.179","TCP","54","2206  >  443 [ACK] Seq=2231 Ack=6979 Win=65536 Len=0"
"269","02:54:48,419083","192.168.1.37","192.168.1.255","NBNS","92","Name query NB WPAD<00>"
"270","02:54:48,419452","fe80::d5d4:e1d6:8319:3e4","ff02::1:3","LLMNR","84","Standard query 0xba69 A wpad"
"271","02:54:48,419554","192.168.1.37","224.0.0.252","LLMNR","64","Standard query 0xba69 A wpad"
"272","02:54:48,421261","192.168.1.37","192.168.1.1","DNS","81","Standard query 0x08ea A api.browser.yandex.ru"
"273","02:54:48,423217","192.168.1.1","192.168.1.37","DNS","361","Standard query response 0x08ea A api.browser.yandex.ru A 93.158.134.82 A 213.180.204.82 A 87.250.251.82 A 213.180.193.82 A 87.250.250.82 NS ns1.yandex.ru NS ns9.z5h64q92x9.net NS ns2.yandex.ru A 213.180.193.1 AAAA 2a02:6b8::1 A 93.158.134.1 AAAA 2a02:6b8:0:1::1 A 195.156.199.201 AAAA 2a05:d014:484:fd80:ffff:ffff:0:1"
"274","02:54:48,423771","192.168.1.37","93.158.134.82","TCP","66","2207  >  443 [SYN] Seq=0 Win=8192 Len=0 MSS=1460 WS=256 SACK_PERM=1"
"275","02:54:48,431445","192.168.1.37","93.158.134.82","TCP","66","2208  >  443 [SYN] Seq=0 Win=8192 Len=0 MSS=1460 WS=256 SACK_PERM=1"
"276","02:54:48,434271","192.168.1.37","213.180.193.125","TCP","66","2209  >  443 [SYN] Seq=0 Win=8192 Len=0 MSS=1460 WS=256 SACK_PERM=1"
"277","02:54:48,446363","93.158.134.82","192.168.1.37","TCP","66","443  >  2207 [SYN, ACK] Seq=0 Ack=1 Win=42300 Len=0 MSS=1410 SACK_PERM=1 WS=4096"
"278","02:54:48,446446","192.168.1.37","93.158.134.82","TCP","54","2207  >  443 [ACK] Seq=1 Ack=1 Win=66048 Len=0"
"279","02:54:48,446689","192.168.1.37","93.158.134.82","TLSv1.2","263","Client Hello"
"280","02:54:48,449083","213.180.193.125","192.168.1.37","TCP","66","443  >  2209 [SYN, ACK] Seq=0 Ack=1 Win=28200 Len=0 MSS=1410 SACK_PERM=1 WS=256"
"281","02:54:48,449157","192.168.1.37","213.180.193.125","TCP","54","2209  >  443 [ACK] Seq=1 Ack=1 Win=66048 Len=0"
