"No.","Time","Source","Destination","Protocol","Length","Info"
"1","0.000000","LiteonTe_f7:82:e7","Broadcast","ARP","42","Who has 192.168.43.1? Tell 192.168.43.240"
"2","0.019586","HuaweiTe_d8:6e:c7","LiteonTe_f7:82:e7","ARP","42","192.168.43.1 is at 50:04:b8:d8:6e:c7"
"3","4.057691","192.168.43.240","192.168.43.1","DNS","75","Standard query 0x62ce A search-poysk.ru"
"4","4.058496","192.168.43.240","192.168.43.1","DNS","75","Standard query 0xaf8f A ui.ff.avast.com"
"5","4.062094","192.168.43.240","192.168.43.1","DNS","71","Standard query 0x7e3c A browsec.com"
"6","4.082987","192.168.43.240","192.168.43.255","NBNS","92","Name query NB WPAD<00>"
"7","4.083656","fe80::85f5:a9e0:4b59:b0f1","ff02::1:3","LLMNR","84","Standard query 0x882c A wpad"
"8","4.083886","192.168.43.240","224.0.0.252","LLMNR","64","Standard query 0x882c A wpad"
"9","4.248886","192.168.43.240","192.168.43.1","DNS","75","Standard query 0xaf8f A ui.ff.avast.com"
"10","4.248886","192.168.43.240","192.168.43.1","DNS","75","Standard query 0x62ce A search-poysk.ru"
"11","4.248961","192.168.43.240","192.168.43.1","DNS","71","Standard query 0x7e3c A browsec.com"
"12","4.346816","192.168.43.1","192.168.43.240","DNS","468","Standard query response 0x62ce A search-poysk.ru A 46.4.235.72 NS ns1.reg.ru NS ns2.reg.ru A 194.58.117.13 A 194.58.117.15 A 194.58.117.17 A 176.99.13.11 A 176.99.13.13 A 176.99.13.15 A 176.99.13.17 A 194.58.117.11 AAAA 2a00:f940:4::47 A 194.58.117.16 A 194.58.117.18 A 176.99.13.12 A 176.99.13.14 A 176.99.13.16 A 176.99.13.18 A 194.58.117.12 A 194.58.117.14 AAAA 2a00:f940:5::190"
"13","4.346817","192.168.43.1","192.168.43.240","DNS","91","Standard query response 0x62ce A search-poysk.ru A 46.4.235.72"
"14","4.347890","192.168.43.1","192.168.43.240","DNS","400","Standard query response 0x7e3c A browsec.com A 138.201.57.222 NS ns-248.awsdns-31.com NS ns-635.awsdns-15.net NS ns-1465.awsdns-55.org NS ns-1850.awsdns-39.co.uk A 205.251.197.185 AAAA 2600:9000:5305:b900::1 A 205.251.199.58 AAAA 2600:9000:5307:3a00::1 A 205.251.192.248 AAAA 2600:9000:5300:f800::1 A 205.251.194.123 AAAA 2600:9000:5302:7b00::1"
"15","4.347891","192.168.43.1","192.168.43.240","DNS","454","Standard query response 0xaf8f A ui.ff.avast.com CNAME urlinfo.ns1.ff.avast.com A 5.45.58.99 A 5.45.59.39 A 77.234.40.41 NS ns04.ns1dnsavast.com NS ns03.ns1dnsavast.com NS dns3.p02.nsone.net NS dns2.p02.nsone.net NS dns4.p02.nsone.net NS ns01.ns1dnsavast.com NS dns1.p02.nsone.net NS ns02.ns1dnsavast.com A 198.51.44.2 A 198.51.45.2 A 198.51.44.66 A 198.51.45.66 A 185.51.231.1 A 185.51.231.65 A 185.51.231.129 A 185.51.231.193"
"16","4.349138","192.168.43.240","192.168.43.1","DNS","84","Standard query 0x40de A ssl.google-analytics.com"
"17","4.349209","192.168.43.240","192.168.43.1","DNS","88","Standard query 0xfd59 A drah7iczdw1tu.cloudfront.net"
"18","4.349327","192.168.43.240","192.168.43.1","DNS","76","Standard query 0xf08e A publicsuffix.org"
"19","4.494803","fe80::85f5:a9e0:4b59:b0f1","ff02::1:3","LLMNR","84","Standard query 0x882c A wpad"
"20","4.494911","192.168.43.240","224.0.0.252","LLMNR","64","Standard query 0x882c A wpad"
"21","4.510740","192.168.43.1","192.168.43.240","DNS","392","Standard query response 0x40de A ssl.google-analytics.com CNAME ssl-google-analytics.l.google.com A 216.58.207.200 NS ns4.google.com NS ns3.google.com NS ns2.google.com NS ns1.google.com A 216.239.38.10 AAAA 2001:4860:4802:38::a A 216.239.36.10 AAAA 2001:4860:4802:36::a A 216.239.34.10 AAAA 2001:4860:4802:34::a A 216.239.32.10 AAAA 2001:4860:4802:32::a"
"22","4.510741","192.168.43.1","192.168.43.240","DNS","403","Standard query response 0xf08e A publicsuffix.org A 63.245.213.25 NS ns-2045.awsdns-63.co.uk NS ns-1334.awsdns-38.org NS ns-1.awsdns-00.com NS ns-787.awsdns-34.net A 205.251.192.1 AAAA 2600:9000:5300:100::1 A 205.251.197.54 AAAA 2600:9000:5305:3600::1 A 205.251.199.253 AAAA 2600:9000:5307:fd00::1 A 205.251.195.19 AAAA 2600:9000:5303:1300::1"
"23","4.510741","192.168.43.1","192.168.43.240","DNS","529","Standard query response 0xfd59 A drah7iczdw1tu.cloudfront.net A 13.33.23.41 A 13.33.23.22 A 13.33.23.203 A 13.33.23.213 A 13.33.23.196 A 13.33.23.177 A 13.33.23.194 A 13.33.23.191 NS ns-317.awsdns-39.com NS ns-1199.awsdns-21.org NS ns-634.awsdns-15.net NS ns-1563.awsdns-03.co.uk A 205.251.196.175 AAAA 2600:9000:5304:af00::1 A 205.251.198.27 AAAA 2600:9000:5306:1b00::1 A 205.251.193.61 AAAA 2600:9000:5301:3d00::1 A 205.251.194.122 AAAA 2600:9000:5302:7a00::1"
"24","4.520514","192.168.43.240","192.168.43.1","DNS","76","Standard query 0xc593 A uib.ff.avast.com"
"25","4.520526","192.168.43.240","192.168.43.1","DNS","67","Standard query 0xb536 A mail.ru"
"26","4.670218","192.168.43.1","192.168.43.240","DNS","334","Standard query response 0xb536 A mail.ru A 94.100.180.201 A 217.69.139.200 A 217.69.139.201 A 94.100.180.200 NS ns3.mail.ru NS ns2.mail.ru NS ns1.mail.ru A 185.30.176.202 AAAA 2a00:1148:db00::2 A 217.69.139.112 AAAA 2a00:1148:db00::2 A 94.100.180.138 AAAA 2a00:1148:db00::1"
"27","4.670219","192.168.43.1","192.168.43.240","DNS","455","Standard query response 0xc593 A uib.ff.avast.com CNAME urlinfo.ns1.ff.avast.com A 77.234.40.41 A 5.45.58.99 A 5.45.59.39 NS dns1.p02.nsone.net NS ns03.ns1dnsavast.com NS dns2.p02.nsone.net NS ns01.ns1dnsavast.com NS dns3.p02.nsone.net NS ns04.ns1dnsavast.com NS ns02.ns1dnsavast.com NS dns4.p02.nsone.net A 198.51.44.2 A 198.51.45.2 A 198.51.44.66 A 198.51.45.66 A 185.51.231.1 A 185.51.231.65 A 185.51.231.129 A 185.51.231.193"
"28","4.832370","192.168.43.240","192.168.43.255","NBNS","92","Name query NB WPAD<00>"
"29","5.083108","192.168.43.240","46.4.235.72","TCP","66","9694  >  80 [SYN] Seq=0 Win=8192 Len=0 MSS=1460 WS=256 SACK_PERM=1"
"30","5.083288","192.168.43.240","46.4.235.72","TCP","66","9695  >  80 [SYN] Seq=0 Win=8192 Len=0 MSS=1460 WS=256 SACK_PERM=1"
"31","5.083791","192.168.43.240","192.168.43.1","DNS","76","Standard query 0xb6ec A mtalk.google.com"
"32","5.148072","192.168.43.1","192.168.43.240","DNS","369","Standard query response 0xb6ec A mtalk.google.com CNAME mobile-gtalk.l.google.com A 64.233.162.188 NS ns3.google.com NS ns1.google.com NS ns4.google.com NS ns2.google.com A 216.239.38.10 AAAA 2001:4860:4802:38::a A 216.239.36.10 AAAA 2001:4860:4802:36::a A 216.239.34.10 AAAA 2001:4860:4802:34::a A 216.239.32.10 AAAA 2001:4860:4802:32::a"
"33","5.148705","192.168.43.240","64.233.162.188","TCP","66","9696  >  5228 [SYN] Seq=0 Win=8192 Len=0 MSS=1460 WS=256 SACK_PERM=1"
"34","5.160653","46.4.235.72","192.168.43.240","TCP","66","80  >  9694 [SYN, ACK] Seq=0 Ack=1 Win=14600 Len=0 MSS=1400 SACK_PERM=1 WS=512"
"35","5.160892","192.168.43.240","46.4.235.72","TCP","54","9694  >  80 [ACK] Seq=1 Ack=1 Win=65792 Len=0"
"36","5.171565","46.4.235.72","192.168.43.240","TCP","66","80  >  9695 [SYN, ACK] Seq=0 Ack=1 Win=14600 Len=0 MSS=1400 SACK_PERM=1 WS=512"
"37","5.171798","192.168.43.240","46.4.235.72","TCP","54","9695  >  80 [ACK] Seq=1 Ack=1 Win=65792 Len=0"
"38","5.308640","64.233.162.188","192.168.43.240","TCP","66","5228  >  9696 [SYN, ACK] Seq=0 Ack=1 Win=42780 Len=0 MSS=1380 SACK_PERM=1 WS=256"
"39","5.308809","192.168.43.240","64.233.162.188","TCP","54","9696  >  5228 [ACK] Seq=1 Ack=1 Win=66048 Len=0"
"40","5.308998","192.168.43.240","64.233.162.188","TCP","240","9696  >  5228 [PSH, ACK] Seq=1 Ack=1 Win=66048 Len=186"
"41","5.469574","192.168.43.240","239.255.255.250","SSDP","216","M-SEARCH * HTTP/1.1 "
"42","5.478744","64.233.162.188","192.168.43.240","TCP","54","5228  >  9696 [ACK] Seq=1 Ack=187 Win=44032 Len=0"
"43","5.481764","64.233.162.188","192.168.43.240","TCP","1454","5228  >  9696 [ACK] Seq=1 Ack=187 Win=44032 Len=1400"
"44","5.481765","64.233.162.188","192.168.43.240","TCP","1454","5228  >  9696 [ACK] Seq=1401 Ack=187 Win=44032 Len=1400"
"45","5.481766","64.233.162.188","192.168.43.240","TCP","1454","5228  >  9696 [ACK] Seq=2801 Ack=187 Win=44032 Len=1400"
"46","5.481768","64.233.162.188","192.168.43.240","TCP","215","5228  >  9696 [PSH, ACK] Seq=4201 Ack=187 Win=44032 Len=161"
"47","5.481870","192.168.43.240","64.233.162.188","TCP","54","9696  >  5228 [ACK] Seq=187 Ack=4362 Win=66048 Len=0"
"48","5.582854","192.168.43.240","192.168.43.255","NBNS","92","Name query NB WPAD<00>"
"49","5.679654","192.168.43.240","216.58.207.200","QUIC","1392","Client Hello, PKN: 1, CID: 1971129022153680497"
"50","5.680040","192.168.43.240","5.45.58.99","TCP","66","9697  >  80 [SYN] Seq=0 Win=8192 Len=0 MSS=1460 WS=256 SACK_PERM=1"
"51","5.680206","192.168.43.240","46.4.235.72","HTTP","458","GET / HTTP/1.1 "
"52","5.739007","192.168.43.240","64.233.162.188","TCP","312","9696  >  5228 [PSH, ACK] Seq=187 Ack=4362 Win=66048 Len=258"
"53","5.741602","192.168.43.240","13.33.23.41","TCP","66","9701  >  443 [SYN] Seq=0 Win=8192 Len=0 MSS=1460 WS=256 SACK_PERM=1"
"54","5.745410","192.168.43.240","138.201.57.222","TCP","66","9702  >  443 [SYN] Seq=0 Win=8192 Len=0 MSS=1460 WS=256 SACK_PERM=1"
"55","5.789551","216.58.207.200","192.168.43.240","QUIC","1392","Payload (Encrypted), PKN: 1, CID: 1971129022153680497"
"56","5.789810","216.58.207.200","192.168.43.240","QUIC","1392","Payload (Encrypted), PKN: 2, CID: 1971129022153680497"
"57","5.789812","5.45.58.99","192.168.43.240","TCP","66","80  >  9697 [SYN, ACK] Seq=0 Ack=1 Win=2920 Len=0 MSS=1400 SACK_PERM=1 WS=8192"
"58","5.790002","192.168.43.240","5.45.58.99","TCP","54","9697  >  80 [ACK] Seq=1 Ack=1 Win=65792 Len=0"
"59","5.793555","192.168.43.240","216.58.207.200","QUIC","80","Payload (Encrypted), PKN: 2, CID: 1971129022153680497"
"60","5.793793","192.168.43.240","5.45.58.99","HTTP","481","GET /v5/ruleUpdate HTTP/1.1 "
"61","5.793930","64.233.162.188","192.168.43.240","TCP","375","5228  >  9696 [PSH, ACK] Seq=4362 Ack=445 Win=45056 Len=321"
"62","5.793931","13.33.23.41","192.168.43.240","TCP","66","443  >  9701 [SYN, ACK] Seq=0 Ack=1 Win=29200 Len=0 MSS=1400 SACK_PERM=1 WS=256"
"63","5.793932","46.4.235.72","192.168.43.240","TCP","54","80  >  9694 [ACK] Seq=1 Ack=405 Win=15872 Len=0"
"64","5.793932","46.4.235.72","192.168.43.240","HTTP","391","HTTP/1.1 302 Found  (text/html)"
"65","5.794127","192.168.43.240","13.33.23.41","TCP","54","9701  >  443 [ACK] Seq=1 Ack=1 Win=65792 Len=0"
"66","5.794446","192.168.43.240","13.33.23.41","TLSv1.2","270","Client Hello"
"67","5.797609","192.168.43.240","192.168.43.1","DNS","71","Standard query 0x74dc A traflabc.ru"
"68","5.802270","192.168.43.240","216.58.207.200","TCP","66","9703  >  443 [SYN] Seq=0 Win=8192 Len=0 MSS=1460 WS=256 SACK_PERM=1"
"69","5.809995","138.201.57.222","192.168.43.240","TCP","66","443  >  9702 [SYN, ACK] Seq=0 Ack=1 Win=29200 Len=0 MSS=1400 SACK_PERM=1 WS=128"
"70","5.810159","192.168.43.240","138.201.57.222","TCP","54","9702  >  443 [ACK] Seq=1 Ack=1 Win=65792 Len=0"
"71","5.810289","192.168.43.240","138.201.57.222","TLSv1.2","253","Client Hello"
"72","5.819633","192.168.43.240","77.234.40.41","TCP","66","9704  >  443 [SYN] Seq=0 Win=8192 Len=0 MSS=1460 WS=256 SACK_PERM=1"
"73","5.827738","192.168.43.240","216.58.207.200","QUIC","1392","Client Hello, PKN: 3, CID: 1971129022153680497"
"74","5.829481","192.168.43.240","216.58.207.200","QUIC","277","Payload (Encrypted), PKN: 4, CID: 1971129022153680497"
"75","5.829637","192.168.43.240","64.233.162.188","TCP","238","9696  >  5228 [PSH, ACK] Seq=445 Ack=4683 Win=65792 Len=184"
"76","5.833981","192.168.43.240","46.4.235.72","TCP","54","9694  >  80 [ACK] Seq=405 Ack=338 Win=65280 Len=0"
"77","5.870390","192.168.43.240","52.230.80.159","TLSv1.2","155","Application Data"
"78","5.934748","192.168.43.240","192.168.43.255","NBNS","92","Name query NB WPAD<00>"
"79","5.935235","fe80::85f5:a9e0:4b59:b0f1","ff02::1:3","LLMNR","84","Standard query 0x011c A wpad"
"80","5.935423","192.168.43.240","224.0.0.252","LLMNR","64","Standard query 0x011c A wpad"
"81","5.950701","216.58.207.200","192.168.43.240","TCP","66","443  >  9703 [SYN, ACK] Seq=0 Ack=1 Win=42780 Len=0 MSS=1380 SACK_PERM=1 WS=256"
"82","5.950851","192.168.43.240","216.58.207.200","TCP","54","9703  >  443 [ACK] Seq=1 Ack=1 Win=66048 Len=0"
"83","5.950946","192.168.43.1","192.168.43.240","DNS","460","Standard query response 0x74dc A traflabc.ru A 46.4.235.70 NS ns2.reg.ru NS ns1.reg.ru A 176.99.13.11 A 176.99.13.13 A 176.99.13.15 A 176.99.13.17 A 194.58.117.11 A 194.58.117.13 A 194.58.117.15 A 194.58.117.17 AAAA 2a00:f940:4::47 A 176.99.13.16 A 176.99.13.18 A 194.58.117.12 A 194.58.117.14 A 194.58.117.16 A 194.58.117.18 A 176.99.13.12 A 176.99.13.14 AAAA 2a00:f940:5::190"
"84","5.950947","13.33.23.41","192.168.43.240","TCP","54","443  >  9701 [ACK] Seq=1 Ack=217 Win=30464 Len=0"
"85","5.950991","192.168.43.240","216.58.207.200","TLSv1.2","266","Client Hello"
"86","5.951271","13.33.23.41","192.168.43.240","TLSv1.2","1454","Server Hello"
"87","5.951271","13.33.23.41","192.168.43.240","TCP","1454","443  >  9701 [ACK] Seq=1401 Ack=217 Win=30464 Len=1400 [TCP segment of a reassembled PDU]"
"88","5.951323","192.168.43.240","13.33.23.41","TCP","54","9701  >  443 [ACK] Seq=217 Ack=2801 Win=65792 Len=0"
"89","5.951570","192.168.43.240","46.4.235.70","TCP","66","9705  >  80 [SYN] Seq=0 Win=8192 Len=0 MSS=1460 WS=256 SACK_PERM=1"
"90","5.951719","192.168.43.240","46.4.235.70","TCP","66","9706  >  80 [SYN] Seq=0 Win=8192 Len=0 MSS=1460 WS=256 SACK_PERM=1"
"91","5.957938","13.33.23.41","192.168.43.240","TLSv1.2","1454","Certificate [TCP segment of a reassembled PDU]"
"92","5.957939","13.33.23.41","192.168.43.240","TLSv1.2","797","Certificate Status, Server Key Exchange, Server Hello Done"
"93","5.957939","64.233.162.188","192.168.43.240","TCP","84","5228  >  9696 [PSH, ACK] Seq=4683 Ack=629 Win=46080 Len=30"
"94","5.957940","64.233.162.188","192.168.43.240","TCP","173","5228  >  9696 [PSH, ACK] Seq=4713 Ack=629 Win=46080 Len=119"
"95","5.957940","64.233.162.188","192.168.43.240","TCP","188","5228  >  9696 [PSH, ACK] Seq=4832 Ack=629 Win=46080 Len=134"
"96","5.957940","138.201.57.222","192.168.43.240","TCP","54","443  >  9702 [ACK] Seq=1 Ack=200 Win=30336 Len=0"
"97","5.957940","216.58.207.200","192.168.43.240","QUIC","1392","Payload (Encrypted), PKN: 3"
"98","5.957942","216.58.207.200","192.168.43.240","QUIC","73","Payload (Encrypted), PKN: 4"
"99","5.957942","5.45.58.99","192.168.43.240","TCP","54","80  >  9697 [ACK] Seq=1 Ack=428 Win=8192 Len=0"
"100","5.957943","5.45.58.99","192.168.43.240","TCP","1454","80  >  9697 [ACK] Seq=1 Ack=428 Win=8192 Len=1400 [TCP segment of a reassembled PDU]"
"101","5.957944","5.45.58.99","192.168.43.240","TCP","1454","80  >  9697 [ACK] Seq=1401 Ack=428 Win=8192 Len=1400 [TCP segment of a reassembled PDU]"
"102","5.957944","5.45.58.99","192.168.43.240","TCP","1454","80  >  9697 [ACK] Seq=2801 Ack=428 Win=8192 Len=1400 [TCP segment of a reassembled PDU]"
"103","5.957945","5.45.58.99","192.168.43.240","TCP","1454","80  >  9697 [ACK] Seq=4201 Ack=428 Win=8192 Len=1400 [TCP segment of a reassembled PDU]"
"104","5.957946","5.45.58.99","192.168.43.240","TCP","1454","80  >  9697 [ACK] Seq=5601 Ack=428 Win=8192 Len=1400 [TCP segment of a reassembled PDU]"
"105","5.957946","5.45.58.99","192.168.43.240","TCP","1454","80  >  9697 [ACK] Seq=7001 Ack=428 Win=8192 Len=1400 [TCP segment of a reassembled PDU]"
"106","5.957947","5.45.58.99","192.168.43.240","TCP","1454","80  >  9697 [ACK] Seq=8401 Ack=428 Win=8192 Len=1400 [TCP segment of a reassembled PDU]"
"107","5.957948","5.45.58.99","192.168.43.240","TCP","1454","80  >  9697 [ACK] Seq=9801 Ack=428 Win=8192 Len=1400 [TCP segment of a reassembled PDU]"
"108","5.957949","5.45.58.99","192.168.43.240","TCP","1454","80  >  9697 [ACK] Seq=11201 Ack=428 Win=8192 Len=1400 [TCP segment of a reassembled PDU]"
"109","5.957950","5.45.58.99","192.168.43.240","TCP","1454","80  >  9697 [ACK] Seq=12601 Ack=428 Win=8192 Len=1400 [TCP segment of a reassembled PDU]"
"110","5.957951","138.201.57.222","192.168.43.240","TLSv1.2","1454","Server Hello"
"111","5.957951","138.201.57.222","192.168.43.240","TCP","1454","443  >  9702 [ACK] Seq=1401 Ack=200 Win=30336 Len=1400 [TCP segment of a reassembled PDU]"
"112","5.957952","138.201.57.222","192.168.43.240","TLSv1.2","1454","Certificate [TCP segment of a reassembled PDU]"
"113","5.957953","138.201.57.222","192.168.43.240","TLSv1.2","1197","Certificate Status, Server Key Exchange, Server Hello Done"
"114","5.957953","77.234.40.41","192.168.43.240","TCP","66","443  >  9704 [SYN, ACK] Seq=0 Ack=1 Win=2920 Len=0 MSS=1400 SACK_PERM=1 WS=8192"
"115","5.958090","192.168.43.240","13.33.23.41","TCP","54","9701  >  443 [ACK] Seq=217 Ack=4944 Win=65792 Len=0"
"116","5.958142","192.168.43.240","64.233.162.188","TCP","54","9696  >  5228 [ACK] Seq=629 Ack=4966 Win=65536 Len=0"
"117","5.958411","192.168.43.240","5.45.58.99","TCP","54","9697  >  80 [ACK] Seq=428 Ack=14001 Win=65792 Len=0"
"118","5.958451","192.168.43.240","138.201.57.222","TCP","54","9702  >  443 [ACK] Seq=200 Ack=5344 Win=65792 Len=0"
"119","5.958479","192.168.43.240","77.234.40.41","TCP","54","9704  >  443 [ACK] Seq=1 Ack=1 Win=65792 Len=0"
"120","5.960361","192.168.43.240","13.33.23.41","TLSv1.2","180","Client Key Exchange, Change Cipher Spec, Encrypted Handshake Message"
"121","5.961202","192.168.43.240","216.58.207.200","QUIC","83","Payload (Encrypted), PKN: 5, CID: 1971129022153680497"
"122","5.961335","192.168.43.240","216.58.207.200","QUIC","80","Payload (Encrypted), PKN: 6, CID: 1971129022153680497"
"123","5.965145","192.168.43.240","138.201.57.222","TLSv1.2","180","Client Key Exchange, Change Cipher Spec, Encrypted Handshake Message"
"124","5.965502","192.168.43.240","77.234.40.41","TLSv1.2","258","Client Hello"
"125","5.969196","192.168.43.240","13.33.23.41","TLSv1.2","489","Application Data"
"126","6.016802","192.168.43.240","192.168.43.1","DNS","79","Standard query 0xdfa2 A accounts.google.com"
"127","6.048298","192.168.43.240","46.4.235.70","TCP","66","9711  >  80 [SYN] Seq=0 Win=8192 Len=0 MSS=1460 WS=256 SACK_PERM=1"
"128","6.107298","13.33.23.41","192.168.43.240","TCP","797","[TCP Spurious Retransmission] 443  >  9701 [PSH, ACK] Seq=4201 Ack=217 Win=30464 Len=743[Reassembly error, protocol TCP: New fragment overlaps old data (retransmission?)]"
"129","6.107298","216.58.207.200","192.168.43.240","QUIC","1392","Payload (Encrypted), PKN: 5"
"130","6.107299","216.58.207.200","192.168.43.240","TCP","54","443  >  9703 [ACK] Seq=1 Ack=213 Win=44032 Len=0"
"131","6.107299","13.33.23.41","192.168.43.240","TLSv1.2","312","New Session Ticket, Change Cipher Spec, Encrypted Handshake Message"
"132","6.107300","216.58.207.200","192.168.43.240","QUIC","246","Payload (Encrypted), PKN: 6"
"133","6.107301","216.58.207.200","192.168.43.240","TLSv1.2","1454","Server Hello"
"134","6.107302","216.58.207.200","192.168.43.240","TCP","1454","443  >  9703 [ACK] Seq=1401 Ack=213 Win=44032 Len=1400 [TCP segment of a reassembled PDU]"
"135","6.107302","216.58.207.200","192.168.43.240","TLSv1.2","384","Certificate, Server Key Exchange, Server Hello Done"
"136","6.107360","192.168.43.240","13.33.23.41","TCP","66","[TCP Dup ACK 115#1] 9701  >  443 [ACK] Seq=778 Ack=4944 Win=65792 Len=0 SLE=4201 SRE=4944"
"137","6.107522","192.168.43.240","216.58.207.200","TCP","54","9703  >  443 [ACK] Seq=213 Ack=3131 Win=66048 Len=0"
"138","6.107669","192.168.43.240","216.58.207.200","QUIC","80","Payload (Encrypted), PKN: 7, CID: 1971129022153680497"
"139","6.109131","192.168.43.240","216.58.207.200","TLSv1.2","312","Client Key Exchange, Change Cipher Spec, Encrypted Handshake Message, Encrypted Handshake Message"
"140","6.109614","138.201.57.222","192.168.43.240","TCP","1197","[TCP Spurious Retransmission] 443  >  9702 [PSH, ACK] Seq=4201 Ack=200 Win=30336 Len=1143[Reassembly error, protocol TCP: New fragment overlaps old data (retransmission?)]"
"141","6.109614","46.4.235.70","192.168.43.240","TCP","66","80  >  9706 [SYN, ACK] Seq=0 Ack=1 Win=14600 Len=0 MSS=1400 SACK_PERM=1 WS=512"
"142","6.109615","46.4.235.70","192.168.43.240","TCP","66","80  >  9705 [SYN, ACK] Seq=0 Ack=1 Win=14600 Len=0 MSS=1400 SACK_PERM=1 WS=512"
"143","6.109615","138.201.57.222","192.168.43.240","TLSv1.2","312","New Session Ticket, Change Cipher Spec, Encrypted Handshake Message"
"144","6.109616","192.168.43.1","192.168.43.240","DNS","343","Standard query response 0xdfa2 A accounts.google.com A 216.58.207.205 NS ns3.google.com NS ns1.google.com NS ns4.google.com NS ns2.google.com A 216.239.38.10 AAAA 2001:4860:4802:38::a A 216.239.36.10 AAAA 2001:4860:4802:36::a A 216.239.34.10 AAAA 2001:4860:4802:34::a A 216.239.32.10 AAAA 2001:4860:4802:32::a"
"145","6.109616","5.45.58.99","192.168.43.240","TCP","1454","80  >  9697 [ACK] Seq=14001 Ack=428 Win=8192 Len=1400 [TCP segment of a reassembled PDU]"
"146","6.109618","5.45.58.99","192.168.43.240","TCP","1454","80  >  9697 [PSH, ACK] Seq=15401 Ack=428 Win=8192 Len=1400 [TCP segment of a reassembled PDU]"
"147","6.109619","5.45.58.99","192.168.43.240","TCP","1454","80  >  9697 [ACK] Seq=16801 Ack=428 Win=8192 Len=1400 [TCP segment of a reassembled PDU]"
"148","6.109620","5.45.58.99","192.168.43.240","TCP","1454","80  >  9697 [ACK] Seq=18201 Ack=428 Win=8192 Len=1400 [TCP segment of a reassembled PDU]"
"149","6.109620","5.45.58.99","192.168.43.240","TCP","1454","80  >  9697 [ACK] Seq=19601 Ack=428 Win=8192 Len=1400 [TCP segment of a reassembled PDU]"
"150","6.109621","5.45.58.99","192.168.43.240","TCP","1454","80  >  9697 [ACK] Seq=21001 Ack=428 Win=8192 Len=1400 [TCP segment of a reassembled PDU]"
"151","6.109622","5.45.58.99","192.168.43.240","HTTP","169","HTTP/1.1 200 OK  (application/octet-stream)"
"152","6.109622","13.33.23.41","192.168.43.240","TCP","54","443  >  9701 [ACK] Seq=5202 Ack=778 Win=31488 Len=0"
"153","6.109623","77.234.40.41","192.168.43.240","TCP","54","443  >  9704 [ACK] Seq=1 Ack=205 Win=8192 Len=0"
"154","6.109623","77.234.40.41","192.168.43.240","TLSv1.2","1454","Server Hello"
"155","6.109624","77.234.40.41","192.168.43.240","TCP","1454","443  >  9704 [ACK] Seq=1401 Ack=205 Win=8192 Len=1400 [TCP segment of a reassembled PDU]"
"156","6.109672","192.168.43.240","138.201.57.222","TCP","66","[TCP Dup ACK 118#1] 9702  >  443 [ACK] Seq=326 Ack=5344 Win=65792 Len=0 SLE=4201 SRE=5344"
"157","6.109935","192.168.43.240","46.4.235.70","TCP","54","9706  >  80 [ACK] Seq=1 Ack=1 Win=65792 Len=0"
"158","6.109977","192.168.43.240","46.4.235.70","TCP","54","9705  >  80 [ACK] Seq=1 Ack=1 Win=65792 Len=0"
"159","6.110120","192.168.43.240","5.45.58.99","TCP","54","9697  >  80 [ACK] Seq=428 Ack=22516 Win=65792 Len=0"
"160","6.110155","192.168.43.240","77.234.40.41","TCP","54","9704  >  443 [ACK] Seq=205 Ack=2801 Win=65792 Len=0"
"161","6.110461","192.168.43.240","46.4.235.70","HTTP","1105","GET /?token=ziqh0 HTTP/1.1 "
"162","6.112051","192.168.43.240","216.58.207.205","QUIC","1392","Client Hello, PKN: 1, CID: 433568322872277013"
"163","6.112647","77.234.40.41","192.168.43.240","TCP","1454","443  >  9704 [ACK] Seq=2801 Ack=205 Win=8192 Len=1400 [TCP segment of a reassembled PDU]"
"164","6.112648","77.234.40.41","192.168.43.240","TLSv1.2","784","Certificate, Certificate Status, Server Key Exchange, Server Hello Done"
"165","6.112648","13.33.23.41","192.168.43.240","TLSv1.2","1304","Application Data"
"166","6.112649","13.33.23.41","192.168.43.240","TLSv1.2","88","Application Data"
"167","6.112726","192.168.43.240","77.234.40.41","TCP","54","9704  >  443 [ACK] Seq=205 Ack=4931 Win=65792 Len=0"
"168","6.112764","192.168.43.240","13.33.23.41","TCP","54","9701  >  443 [ACK] Seq=778 Ack=6486 Win=65792 Len=0"
"169","6.115704","192.168.43.240","77.234.40.41","TLSv1.2","180","Client Key Exchange, Change Cipher Spec, Encrypted Handshake Message"
"170","6.122211","46.4.235.70","192.168.43.240","TCP","66","80  >  9711 [SYN, ACK] Seq=0 Ack=1 Win=14600 Len=0 MSS=1400 SACK_PERM=1 WS=512"
"171","6.122383","192.168.43.240","46.4.235.70","TCP","54","9711  >  80 [ACK] Seq=1 Ack=1 Win=65792 Len=0"
"172","6.123812","192.168.43.240","138.201.57.222","TLSv1.2","489","Application Data"
"173","6.241654","192.168.43.240","216.58.207.205","TCP","66","9712  >  443 [SYN] Seq=0 Win=8192 Len=0 MSS=1460 WS=256 SACK_PERM=1"
"174","6.270171","52.230.80.159","192.168.43.240","TLSv1.2","219","Application Data"
"175","6.270398","216.58.207.200","192.168.43.240","TLSv1.2","332","New Session Ticket, Change Cipher Spec, Encrypted Handshake Message"
"176","6.270399","216.58.207.200","192.168.43.240","TLSv1.2","123","Application Data"
"177","6.270460","192.168.43.240","216.58.207.200","TCP","54","9703  >  443 [ACK] Seq=471 Ack=3478 Win=65792 Len=0"
"178","6.276589","216.58.207.205","192.168.43.240","QUIC","1392","Payload (Encrypted), PKN: 1, CID: 433568322872277013"
"179","6.276591","216.58.207.205","192.168.43.240","QUIC","1392","Payload (Encrypted), PKN: 2, CID: 433568322872277013"
"180","6.276591","46.4.235.70","192.168.43.240","TCP","54","80  >  9706 [ACK] Seq=1 Ack=1052 Win=16896 Len=0"
"181","6.276592","46.4.235.70","192.168.43.240","HTTP","966","HTTP/1.1 200 OK  (text/html)"
"182","6.276593","77.234.40.41","192.168.43.240","TLSv1.2","312","New Session Ticket, Change Cipher Spec, Encrypted Handshake Message"
"183","6.276595","138.201.57.222","192.168.43.240","TLSv1.2","1128","Application Data"
"184","6.279468","192.168.43.240","216.58.207.205","QUIC","80","Payload (Encrypted), PKN: 2, CID: 433568322872277013"
"185","6.283793","192.168.43.240","216.58.207.205","QUIC","1392","Client Hello, PKN: 3, CID: 433568322872277013"
"186","6.286332","216.58.207.205","192.168.43.240","TCP","66","443  >  9712 [SYN, ACK] Seq=0 Ack=1 Win=42780 Len=0 MSS=1380 SACK_PERM=1 WS=256"
"187","6.286484","192.168.43.240","216.58.207.205","TCP","54","9712  >  443 [ACK] Seq=1 Ack=1 Win=66048 Len=0"
"188","6.289853","192.168.43.240","216.58.207.205","TLSv1.2","261","Client Hello"
"189","6.290198","192.168.43.240","77.234.40.41","TLSv1.2","1084","Application Data"
"190","6.320349","192.168.43.240","138.201.57.222","TCP","54","9702  >  443 [ACK] Seq=761 Ack=6676 Win=64256 Len=0"
"191","6.321374","192.168.43.240","52.230.80.159","TCP","54","8923  >  443 [ACK] Seq=102 Ack=166 Win=255 Len=0"
"192","6.334351","192.168.43.240","46.4.235.70","TCP","54","9706  >  80 [ACK] Seq=1052 Ack=913 Win=64768 Len=0"
"193","6.345444","fe80::85f5:a9e0:4b59:b0f1","ff02::1:3","LLMNR","84","Standard query 0x011c A wpad"
"194","6.345549","192.168.43.240","224.0.0.252","LLMNR","64","Standard query 0x011c A wpad"
"195","6.398550","192.168.43.240","77.234.40.41","TCP","66","9715  >  443 [SYN] Seq=0 Win=8192 Len=0 MSS=1460 WS=256 SACK_PERM=1"
"196","6.424297","192.168.43.240","192.168.43.1","DNS","67","Standard query 0xfe6d A msrv.su"
"197","6.439132","216.58.207.205","192.168.43.240","QUIC","1379","Rejection, PKN: 3, CID: 433568322872277013"
"198","6.439137","216.58.207.205","192.168.43.240","QUIC","1392","Payload (Encrypted), PKN: 4, CID: 433568322872277013"
"199","6.439141","216.58.207.205","192.168.43.240","TCP","54","443  >  9712 [ACK] Seq=1 Ack=208 Win=44032 Len=0"
"200","6.439345","216.58.207.205","192.168.43.240","QUIC","1392","Payload (Encrypted), PKN: 5"
"201","6.439347","216.58.207.205","192.168.43.240","QUIC","73","Payload (Encrypted), PKN: 6"
"202","6.439357","192.168.43.240","216.58.207.205","QUIC","80","Payload (Encrypted), PKN: 4, CID: 433568322872277013"
"203","6.439607","216.58.207.205","192.168.43.240","TLSv1.2","1454","Server Hello"
"204","6.439821","192.168.43.240","216.58.207.205","QUIC","81","Payload (Encrypted), PKN: 5, CID: 433568322872277013"
"205","6.439940","192.168.43.240","216.58.207.205","QUIC","80","Payload (Encrypted), PKN: 6, CID: 433568322872277013"
"206","6.440325","192.168.43.240","216.58.207.205","QUIC","1272","Payload (Encrypted), PKN: 7, CID: 433568322872277013"
"207","6.440400","192.168.43.240","216.58.207.205","QUIC","67","Payload (Encrypted), PKN: 8, CID: 433568322872277013"
"208","6.440492","216.58.207.205","192.168.43.240","TCP","1454","443  >  9712 [ACK] Seq=1401 Ack=208 Win=44032 Len=1400 [TCP segment of a reassembled PDU]"
"209","6.440572","192.168.43.240","216.58.207.205","TCP","54","9712  >  443 [ACK] Seq=208 Ack=2801 Win=66048 Len=0"
"210","6.441741","216.58.207.205","192.168.43.240","TLSv1.2","1077","Certificate, Server Key Exchange, Server Hello Done"
"211","6.441742","77.234.40.41","192.168.43.240","TLSv1.2","265","Application Data"
"212","6.441742","216.58.207.205","192.168.43.240","TCP","1077","[TCP Retransmission] 443  >  9712 [PSH, ACK] Seq=2801 Ack=208 Win=44032 Len=1023"
"213","6.441810","192.168.43.240","216.58.207.205","TCP","66","9712  >  443 [ACK] Seq=208 Ack=3824 Win=65024 Len=0 SLE=2801 SRE=3824"
"214","6.443815","192.168.43.240","216.58.207.205","TLSv1.2","312","Client Key Exchange, Change Cipher Spec, Encrypted Handshake Message, Encrypted Handshake Message"
"215","6.445038","192.168.43.240","77.234.40.41","TLSv1.2","1091","Application Data"
"216","6.470155","192.168.43.240","239.255.255.250","SSDP","216","M-SEARCH * HTTP/1.1 "
"217","6.593196","77.234.40.41","192.168.43.240","TCP","66","443  >  9715 [SYN, ACK] Seq=0 Ack=1 Win=2920 Len=0 MSS=1400 SACK_PERM=1 WS=8192"
"218","6.593329","192.168.43.240","77.234.40.41","TCP","54","9715  >  443 [ACK] Seq=1 Ack=1 Win=65792 Len=0"
"219","6.593431","192.168.43.1","192.168.43.240","DNS","318","Standard query response 0xfe6d A msrv.su A 176.9.18.162 NS ns1.first-ns.de NS robotns3.second-ns.com NS robotns2.second-ns.de A 193.47.99.3 AAAA 2001:67c:192c::add:a3 A 213.133.105.6 AAAA 2a01:4f8:d0a:2004::2 A 213.239.242.238 AAAA 2a01:4f8:0:a101::a:1"
"220","6.593432","216.58.207.205","192.168.43.240","TLSv1.2","332","New Session Ticket, Change Cipher Spec, Encrypted Handshake Message"
"221","6.593432","216.58.207.205","192.168.43.240","TLSv1.2","123","Application Data"
"222","6.593432","216.58.207.205","192.168.43.240","QUIC","81","Payload (Encrypted), PKN: 7"
"223","6.593502","192.168.43.240","77.234.40.41","TLSv1.2","571","Client Hello"
"224","6.593508","192.168.43.240","216.58.207.205","TCP","54","9712  >  443 [ACK] Seq=466 Ack=4171 Win=64768 Len=0"
"225","6.593781","216.58.207.205","192.168.43.240","QUIC","1172","Payload (Encrypted), PKN: 8"
"226","6.593781","216.58.207.205","192.168.43.240","QUIC","70","Payload (Encrypted), PKN: 9"
"227","6.593782","216.58.207.205","192.168.43.240","QUIC","164","Payload (Encrypted), PKN: 10"
"228","6.593782","77.234.40.41","192.168.43.240","TLSv1.2","275","Application Data"
"229","6.594032","192.168.43.240","216.58.207.205","QUIC","83","Payload (Encrypted), PKN: 9, CID: 433568322872277013"
"230","6.595078","192.168.43.240","176.9.18.162","TCP","66","9716  >  443 [SYN] Seq=0 Win=8192 Len=0 MSS=1460 WS=256 SACK_PERM=1"
"231","6.617417","216.58.207.205","192.168.43.240","TLSv1.2","123","[TCP Spurious Retransmission] , Application Data"
"232","6.617456","192.168.43.240","216.58.207.205","TCP","66","[TCP Dup ACK 224#1] 9712  >  443 [ACK] Seq=466 Ack=4171 Win=64768 Len=0 SLE=4102 SRE=4171"
"233","6.619555","192.168.43.240","216.58.207.205","QUIC","77","Payload (Encrypted), PKN: 10, CID: 433568322872277013"
"234","6.643582","192.168.43.240","77.234.40.41","TCP","54","9704  >  443 [ACK] Seq=2398 Ack=5621 Win=65024 Len=0"
"235","6.674826","192.168.43.240","176.9.18.162","TCP","66","9717  >  443 [SYN] Seq=0 Win=8192 Len=0 MSS=1460 WS=256 SACK_PERM=1"
"236","6.684706","192.168.43.240","192.168.43.255","NBNS","92","Name query NB WPAD<00>"
"237","6.752747","176.9.18.162","192.168.43.240","TCP","66","443  >  9716 [SYN, ACK] Seq=0 Ack=1 Win=29200 Len=0 MSS=1400 SACK_PERM=1 WS=512"
"238","6.752747","77.234.40.41","192.168.43.240","TCP","54","443  >  9715 [ACK] Seq=1 Ack=518 Win=8192 Len=0"
"239","6.752748","77.234.40.41","192.168.43.240","TLSv1.2","195","Server Hello, Change Cipher Spec, Encrypted Handshake Message"
"240","6.752894","192.168.43.240","176.9.18.162","TCP","54","9716  >  443 [ACK] Seq=1 Ack=1 Win=65792 Len=0"
"241","6.753066","192.168.43.240","77.234.40.41","TLSv1.2","105","Change Cipher Spec, Encrypted Handshake Message"
"242","6.753643","176.9.18.162","192.168.43.240","TCP","66","443  >  9717 [SYN, ACK] Seq=0 Ack=1 Win=29200 Len=0 MSS=1400 SACK_PERM=1 WS=512"
"243","6.753713","192.168.43.240","176.9.18.162","TCP","54","9717  >  443 [ACK] Seq=1 Ack=1 Win=65792 Len=0"
"244","6.755781","192.168.43.240","176.9.18.162","TLSv1.2","249","Client Hello"
"245","6.794721","192.168.43.240","46.4.235.70","HTTP","1147","GET /iyj/rtk/x873 HTTP/1.1 "
"246","6.914724","176.9.18.162","192.168.43.240","TCP","54","443  >  9716 [ACK] Seq=1 Ack=196 Win=30720 Len=0"
"247","6.914866","176.9.18.162","192.168.43.240","TLSv1.2","1454","Server Hello"
"248","6.915019","176.9.18.162","192.168.43.240","TCP","1454","443  >  9716 [ACK] Seq=1401 Ack=196 Win=30720 Len=1400 [TCP segment of a reassembled PDU]"
"249","6.915072","192.168.43.240","176.9.18.162","TCP","54","9716  >  443 [ACK] Seq=196 Ack=2801 Win=65792 Len=0"
"250","6.915285","176.9.18.162","192.168.43.240","TLSv1.2","1454","Certificate [TCP segment of a reassembled PDU]"
"251","6.915286","176.9.18.162","192.168.43.240","TLSv1.2","142","Server Key Exchange, Server Hello Done"
"252","6.915286","77.234.40.41","192.168.43.240","TCP","54","443  >  9715 [ACK] Seq=142 Ack=569 Win=8192 Len=0"
"253","6.915335","192.168.43.240","176.9.18.162","TCP","54","9716  >  443 [ACK] Seq=196 Ack=4289 Win=65792 Len=0"
"254","6.916712","192.168.43.240","176.9.18.162","TLSv1.2","180","Client Key Exchange, Change Cipher Spec, Encrypted Handshake Message"
"255","6.923014","46.4.235.70","192.168.43.240","TCP","54","80  >  9706 [ACK] Seq=913 Ack=2145 Win=19968 Len=0"
"256","6.935254","192.168.43.240","192.168.43.1","DNS","84","Standard query 0x2027 A translate.googleapis.com"
"257","6.935273","192.168.43.240","192.168.43.1","DNS","89","Standard query 0xe7f4 A clientservices.googleapis.com"
"258","7.071976","192.168.43.1","192.168.43.240","DNS","360","Standard query response 0xe7f4 A clientservices.googleapis.com A 216.58.207.195 NS ns2.google.com NS ns1.google.com NS ns3.google.com NS ns4.google.com A 216.239.34.10 AAAA 2001:4860:4802:34::a A 216.239.32.10 AAAA 2001:4860:4802:32::a A 216.239.36.10 AAAA 2001:4860:4802:36::a A 216.239.38.10 AAAA 2001:4860:4802:38::a"
"259","7.071977","192.168.43.1","192.168.43.240","DNS","355","Standard query response 0x2027 A translate.googleapis.com A 216.58.207.202 NS ns2.google.com NS ns3.google.com NS ns1.google.com NS ns4.google.com A 216.239.34.10 AAAA 2001:4860:4802:34::a A 216.239.32.10 AAAA 2001:4860:4802:32::a A 216.239.36.10 AAAA 2001:4860:4802:36::a A 216.239.38.10 AAAA 2001:4860:4802:38::a"
"260","7.072089","176.9.18.162","192.168.43.240","TLSv1.2","312","New Session Ticket, Change Cipher Spec, Encrypted Handshake Message"
"261","7.072191","46.4.235.70","192.168.43.240","HTTP","1221","HTTP/1.1 302 Found  (text/html) (text/html)"
"262","7.072646","192.168.43.240","216.58.207.195","TCP","66","9724  >  443 [SYN] Seq=0 Win=8192 Len=0 MSS=1460 WS=256 SACK_PERM=1"
"263","7.072814","192.168.43.240","216.58.207.202","TCP","66","9725  >  443 [SYN] Seq=0 Win=8192 Len=0 MSS=1460 WS=256 SACK_PERM=1"
"264","7.074451","192.168.43.240","192.168.43.1","DNS","70","Standard query 0x41d7 A prftja.com"
"265","7.079634","192.168.43.240","176.9.18.162","TLSv1.2","847","Application Data"
"266","7.081014","192.168.43.240","77.234.40.41","TLSv1.2","1135","Application Data"
"267","7.126004","192.168.43.240","46.4.235.70","TCP","54","9706  >  80 [ACK] Seq=2145 Ack=2080 Win=65792 Len=0"
"268","7.185317","192.168.43.240","216.58.207.202","TCP","66","9726  >  443 [SYN] Seq=0 Win=8192 Len=0 MSS=1460 WS=256 SACK_PERM=1"
"269","7.185471","192.168.43.240","216.58.207.195","TCP","66","9727  >  443 [SYN] Seq=0 Win=8192 Len=0 MSS=1460 WS=256 SACK_PERM=1"
"270","7.232326","192.168.43.1","192.168.43.240","DNS","452","Standard query response 0x41d7 A prftja.com A 88.198.0.60 NS ns2.reg.ru NS ns1.reg.ru A 176.99.13.17 A 194.58.117.11 A 194.58.117.13 A 194.58.117.15 A 194.58.117.17 A 176.99.13.11 A 176.99.13.13 A 176.99.13.15 AAAA 2a00:f940:4::47 A 194.58.117.14 A 194.58.117.16 A 194.58.117.18 A 176.99.13.12 A 176.99.13.14 A 176.99.13.16 A 176.99.13.18 A 194.58.117.12 AAAA 2a00:f940:5::190"
"271","7.232326","216.58.207.202","192.168.43.240","TCP","66","443  >  9725 [SYN, ACK] Seq=0 Ack=1 Win=42780 Len=0 MSS=1380 SACK_PERM=1 WS=256"
"272","7.232326","216.58.207.195","192.168.43.240","TCP","66","443  >  9724 [SYN, ACK] Seq=0 Ack=1 Win=42780 Len=0 MSS=1380 SACK_PERM=1 WS=256"
"273","7.232624","192.168.43.240","216.58.207.202","TCP","54","9725  >  443 [ACK] Seq=1 Ack=1 Win=66048 Len=0"
"274","7.232669","192.168.43.240","216.58.207.195","TCP","54","9724  >  443 [ACK] Seq=1 Ack=1 Win=66048 Len=0"
"275","7.232727","192.168.43.240","216.58.207.202","TLSv1.2","262","Client Hello"
"276","7.232930","192.168.43.240","216.58.207.195","TLSv1.2","267","Client Hello"
"277","7.233056","176.9.18.162","192.168.43.240","TLSv1.2","520","Application Data"
"278","7.233056","77.234.40.41","192.168.43.240","TLSv1.2","275","Application Data"
"279","7.233056","216.58.207.195","192.168.43.240","TCP","66","443  >  9727 [SYN, ACK] Seq=0 Ack=1 Win=42780 Len=0 MSS=1380 SACK_PERM=1 WS=256"
"280","7.233056","216.58.207.202","192.168.43.240","TCP","66","443  >  9726 [SYN, ACK] Seq=0 Ack=1 Win=42780 Len=0 MSS=1380 SACK_PERM=1 WS=256"
"281","7.233238","192.168.43.240","216.58.207.195","TCP","54","9727  >  443 [ACK] Seq=1 Ack=1 Win=66048 Len=0"
"282","7.233239","192.168.43.240","88.198.0.60","TCP","66","9728  >  443 [SYN] Seq=0 Win=8192 Len=0 MSS=1460 WS=256 SACK_PERM=1"
"283","7.233267","192.168.43.240","216.58.207.202","TCP","54","9726  >  443 [ACK] Seq=1 Ack=1 Win=66048 Len=0"
"284","7.233502","192.168.43.240","88.198.0.60","TCP","66","9729  >  443 [SYN] Seq=0 Win=8192 Len=0 MSS=1460 WS=256 SACK_PERM=1"
"285","7.282108","192.168.43.240","77.234.40.41","TCP","54","9704  >  443 [ACK] Seq=3479 Ack=5842 Win=64768 Len=0"
"286","7.286095","192.168.43.240","176.9.18.162","TCP","54","9716  >  443 [ACK] Seq=1115 Ack=5013 Win=65024 Len=0"
"287","7.324291","192.168.43.240","88.198.0.60","TCP","66","9732  >  443 [SYN] Seq=0 Win=8192 Len=0 MSS=1460 WS=256 SACK_PERM=1"
"288","7.375085","216.58.207.202","192.168.43.240","TCP","54","443  >  9725 [ACK] Seq=1 Ack=209 Win=44032 Len=0"
"289","7.375086","216.58.207.195","192.168.43.240","TCP","54","443  >  9724 [ACK] Seq=1 Ack=214 Win=44032 Len=0"
"290","7.405776","216.58.207.202","192.168.43.240","TLSv1.2","1454","Server Hello"
"291","7.405777","216.58.207.202","192.168.43.240","TLSv1.2","1309","Certificate, Server Key Exchange, Server Hello Done"
"292","7.405777","216.58.207.195","192.168.43.240","TLSv1.2","1454","Server Hello"
"293","7.405779","216.58.207.195","192.168.43.240","TLSv1.2","1309","Certificate, Server Key Exchange, Server Hello Done"
"294","7.405779","88.198.0.60","192.168.43.240","TCP","66","443  >  9728 [SYN, ACK] Seq=0 Ack=1 Win=29200 Len=0 MSS=1400 SACK_PERM=1 WS=512"
"295","7.405779","88.198.0.60","192.168.43.240","TCP","66","443  >  9729 [SYN, ACK] Seq=0 Ack=1 Win=29200 Len=0 MSS=1400 SACK_PERM=1 WS=512"
"296","7.405780","88.198.0.60","192.168.43.240","TCP","66","443  >  9732 [SYN, ACK] Seq=0 Ack=1 Win=29200 Len=0 MSS=1400 SACK_PERM=1 WS=512"
"297","7.406060","192.168.43.240","216.58.207.202","TCP","54","9725  >  443 [ACK] Seq=209 Ack=2656 Win=66048 Len=0"
"298","7.406097","192.168.43.240","216.58.207.195","TCP","54","9724  >  443 [ACK] Seq=214 Ack=2656 Win=66048 Len=0"
"299","7.406118","192.168.43.240","88.198.0.60","TCP","54","9728  >  443 [ACK] Seq=1 Ack=1 Win=65792 Len=0"
"300","7.406137","192.168.43.240","88.198.0.60","TCP","54","9729  >  443 [ACK] Seq=1 Ack=1 Win=65792 Len=0"
"301","7.406155","192.168.43.240","88.198.0.60","TCP","54","9732  >  443 [ACK] Seq=1 Ack=1 Win=65792 Len=0"
"302","7.406986","192.168.43.240","216.58.207.202","TLSv1.2","147","Client Key Exchange, Change Cipher Spec, Encrypted Handshake Message"
"303","7.408668","192.168.43.240","216.58.207.195","TLSv1.2","147","Client Key Exchange, Change Cipher Spec, Encrypted Handshake Message"
"304","7.408926","192.168.43.240","88.198.0.60","TLSv1.2","252","Client Hello"
