"No.","Time","Source","Destination","Protocol","Length","Info"
"1","09:50:19,440683","213.180.204.179","192.168.43.171","TLSv1","139","Application Data"
"2","09:50:19,476727","192.168.43.171","213.180.204.179","TCP","54","58346  >  443 [ACK] Seq=1 Ack=86 Win=256 Len=0"
"3","09:50:20,518934","193.200.241.195","192.168.43.171","TCP","597","9001  >  58529 [PSH, ACK] Seq=1 Ack=1 Win=533 Len=543"
"4","09:50:20,568946","192.168.43.171","193.200.241.195","TCP","54","58529  >  9001 [ACK] Seq=1 Ack=544 Win=252 Len=0"
"5","09:50:20,630038","192.168.43.171","193.200.241.195","TCP","597","58529  >  9001 [PSH, ACK] Seq=1 Ack=544 Win=252 Len=543"
"6","09:50:20,739087","193.200.241.195","192.168.43.171","TCP","54","9001  >  58529 [ACK] Seq=544 Ack=544 Win=542 Len=0"
"7","09:50:20,739088","193.200.241.195","192.168.43.171","TCP","597","9001  >  58529 [PSH, ACK] Seq=544 Ack=544 Win=542 Len=543"
"8","09:50:20,747826","192.168.43.171","193.200.241.195","TCP","597","58529  >  9001 [PSH, ACK] Seq=544 Ack=1087 Win=257 Len=543"
"9","09:50:20,895309","193.200.241.195","192.168.43.171","TCP","54","9001  >  58529 [ACK] Seq=1087 Ack=1087 Win=550 Len=0"
"10","09:50:20,922683","193.200.241.195","192.168.43.171","TCP","597","9001  >  58529 [PSH, ACK] Seq=1087 Ack=1087 Win=550 Len=543"
"11","09:50:20,931383","192.168.43.171","193.200.241.195","TCP","597","58529  >  9001 [PSH, ACK] Seq=1087 Ack=1630 Win=254 Len=543"
"12","09:50:21,019771","193.200.241.195","192.168.43.171","TCP","54","9001  >  58529 [ACK] Seq=1630 Ack=1630 Win=558 Len=0"
"13","09:50:21,129854","193.200.241.195","192.168.43.171","TCP","597","9001  >  58529 [PSH, ACK] Seq=1630 Ack=1630 Win=558 Len=543"
"14","09:50:21,179864","192.168.43.171","193.200.241.195","TCP","54","58529  >  9001 [ACK] Seq=1630 Ack=2173 Win=252 Len=0"
"15","09:50:22,690134","192.168.43.171","94.130.187.3","TCP","66","58690  >  443 [SYN] Seq=0 Win=8192 Len=0 MSS=1460 WS=256 SACK_PERM=1"
"16","09:50:22,783452","94.130.187.3","192.168.43.171","TCP","66","443  >  58690 [SYN, ACK] Seq=0 Ack=1 Win=29200 Len=0 MSS=1400 SACK_PERM=1 WS=128"
"17","09:50:22,783552","192.168.43.171","94.130.187.3","TCP","54","58690  >  443 [ACK] Seq=1 Ack=1 Win=65792 Len=0"
"18","09:50:22,791866","192.168.43.171","94.130.187.3","TLSv1.2","243","Client Hello"
"19","09:50:22,861083","94.130.187.3","192.168.43.171","TCP","54","443  >  58690 [ACK] Seq=1 Ack=190 Win=30336 Len=0"
"20","09:50:22,861084","94.130.187.3","192.168.43.171","TLSv1.2","1068","Server Hello, Certificate, Server Key Exchange, Server Hello Done"
"21","09:50:22,864619","192.168.43.171","94.130.187.3","TLSv1.2","180","Client Key Exchange, Change Cipher Spec, Encrypted Handshake Message"
"22","09:50:22,955313","94.130.187.3","192.168.43.171","TLSv1.2","105","Change Cipher Spec, Encrypted Handshake Message"
"23","09:50:22,955723","192.168.43.171","94.130.187.3","TLSv1.2","94","Application Data"
"24","09:50:23,062057","94.130.187.3","192.168.43.171","TCP","1454","443  >  58690 [ACK] Seq=1066 Ack=356 Win=30336 Len=1400 [TCP segment of a reassembled PDU]"
"25","09:50:23,062059","94.130.187.3","192.168.43.171","TLSv1.2","731","Application Data"
"26","09:50:23,062137","192.168.43.171","94.130.187.3","TCP","54","58690  >  443 [ACK] Seq=356 Ack=3143 Win=65792 Len=0"
"27","09:50:23,067591","192.168.43.171","94.130.187.3","TLSv1.2","1111","Application Data"
"28","09:50:23,150094","94.130.187.3","192.168.43.171","TLSv1.2","597","Application Data"
"29","09:50:23,157493","192.168.43.171","94.130.187.3","TLSv1.2","597","Application Data"
"30","09:50:23,272553","94.130.187.3","192.168.43.171","TLSv1.2","597","Application Data"
"31","09:50:23,280569","192.168.43.171","94.130.187.3","TLSv1.2","597","Application Data"
"32","09:50:23,411674","94.130.187.3","192.168.43.171","TCP","54","443  >  58690 [ACK] Seq=4229 Ack=2499 Win=35712 Len=0"
"33","09:50:23,513007","94.130.187.3","192.168.43.171","TLSv1.2","597","Application Data"
"34","09:50:23,564723","192.168.43.171","94.130.187.3","TCP","54","58690  >  443 [ACK] Seq=2499 Ack=4772 Win=65792 Len=0"
"35","09:50:23,658623","192.168.43.171","94.130.187.3","TLSv1.2","597","Application Data"
"36","09:50:23,736613","94.130.187.3","192.168.43.171","TCP","54","443  >  58690 [ACK] Seq=4772 Ack=3042 Win=36736 Len=0"
"37","09:50:23,755996","94.130.187.3","192.168.43.171","TLSv1.2","597","Application Data"
"38","09:50:23,761733","192.168.43.171","94.130.187.3","TLSv1.2","597","Application Data"
"39","09:50:23,875982","94.130.187.3","192.168.43.171","TLSv1.2","597","Application Data"
"40","09:50:23,883566","192.168.43.171","94.130.187.3","TLSv1.2","597","Application Data"
"41","09:50:23,996752","94.130.187.3","192.168.43.171","TCP","54","443  >  58690 [ACK] Seq=5858 Ack=4128 Win=38912 Len=0"
"42","09:50:24,239321","94.130.187.3","192.168.43.171","TLSv1.2","597","Application Data"
"43","09:50:24,283529","192.168.43.171","94.130.187.3","TCP","54","58690  >  443 [ACK] Seq=4128 Ack=6401 Win=65792 Len=0"
"44","09:50:24,456336","192.168.43.171","149.154.163.64","SSL","143","Continuation Data"
"45","09:50:24,549151","149.154.163.64","192.168.43.171","SSL","143","Continuation Data"
"46","09:50:24,596060","192.168.43.171","149.154.163.64","TCP","54","58358  >  443 [ACK] Seq=90 Ack=90 Win=64311 Len=0"
"47","09:50:24,659202","192.168.43.171","94.130.187.3","TLSv1.2","597","Application Data"
"48","09:50:24,736667","94.130.187.3","192.168.43.171","TCP","54","443  >  58690 [ACK] Seq=6401 Ack=4671 Win=39936 Len=0"
"49","09:50:24,750204","94.130.187.3","192.168.43.171","TLSv1.2","597","Application Data"
"50","09:50:24,757827","192.168.43.171","94.130.187.3","TLSv1.2","597","Application Data"
"51","09:50:24,872251","94.130.187.3","192.168.43.171","TLSv1.2","597","Application Data"
"52","09:50:24,880526","192.168.43.171","94.130.187.3","TLSv1.2","597","Application Data"
"53","09:50:25,013874","94.130.187.3","192.168.43.171","TCP","54","443  >  58690 [ACK] Seq=7487 Ack=5757 Win=42112 Len=0"
"54","09:50:25,014050","94.130.187.3","192.168.43.171","TLSv1.2","597","Application Data"
"55","09:50:25,065856","192.168.43.171","94.130.187.3","TCP","54","58690  >  443 [ACK] Seq=5757 Ack=8030 Win=65792 Len=0"
"56","09:50:25,655123","192.168.43.171","94.130.187.3","TLSv1.2","597","Application Data"
"57","09:50:25,736937","94.130.187.3","192.168.43.171","TCP","54","443  >  58690 [ACK] Seq=8030 Ack=6300 Win=43264 Len=0"
"58","09:50:25,749664","94.130.187.3","192.168.43.171","TLSv1.2","597","Application Data"
"59","09:50:25,756438","192.168.43.171","94.130.187.3","TLSv1.2","597","Application Data"
"60","09:50:25,877355","94.130.187.3","192.168.43.171","TCP","54","443  >  58690 [ACK] Seq=8573 Ack=6843 Win=44288 Len=0"
"61","09:50:25,971098","94.130.187.3","192.168.43.171","TLSv1.2","597","Application Data"
"62","09:50:25,979083","192.168.43.171","94.130.187.3","TLSv1.2","597","Application Data"
"63","09:50:26,064860","94.130.187.3","192.168.43.171","TCP","54","443  >  58690 [ACK] Seq=9116 Ack=7386 Win=45440 Len=0"
"64","09:50:26,398336","94.130.187.3","192.168.43.171","TLSv1.2","597","Application Data"
"65","09:50:26,439870","192.168.43.171","94.130.187.3","TCP","54","58690  >  443 [ACK] Seq=7386 Ack=9659 Win=65792 Len=0"
"66","09:50:26,660126","192.168.43.171","94.130.187.3","TLSv1.2","597","Application Data"
"67","09:50:26,738967","94.130.187.3","192.168.43.171","TCP","54","443  >  58690 [ACK] Seq=9659 Ack=7929 Win=46464 Len=0"
"68","09:50:26,758928","94.130.187.3","192.168.43.171","TLSv1.2","597","Application Data"
"69","09:50:26,766931","192.168.43.171","94.130.187.3","TLSv1.2","597","Application Data"
"70","09:50:26,908902","94.130.187.3","192.168.43.171","TCP","54","443  >  58690 [ACK] Seq=10202 Ack=8472 Win=47616 Len=0"
"71","09:50:26,908905","94.130.187.3","192.168.43.171","TLSv1.2","597","Application Data"
"72","09:50:26,917161","192.168.43.171","94.130.187.3","TLSv1.2","597","Application Data"
"73","09:50:27,002397","94.130.187.3","192.168.43.171","TCP","54","443  >  58690 [ACK] Seq=10745 Ack=9015 Win=48640 Len=0"
"74","09:50:27,204218","94.130.187.3","192.168.43.171","TLSv1.2","597","Application Data"
"75","09:50:27,252391","192.168.43.171","94.130.187.3","TCP","54","58690  >  443 [ACK] Seq=9015 Ack=11288 Win=65792 Len=0"
"76","09:50:27,691183","192.168.43.171","94.130.187.3","TLSv1.2","597","Application Data"
"77","09:50:27,783710","94.130.187.3","192.168.43.171","TCP","54","443  >  58690 [ACK] Seq=11288 Ack=9558 Win=49792 Len=0"
"78","09:50:27,783787","192.168.43.171","94.130.187.3","TLSv1.2","597","Application Data"
"79","09:50:27,908708","94.130.187.3","192.168.43.171","TCP","54","443  >  58690 [ACK] Seq=11288 Ack=10101 Win=50816 Len=0"
"80","09:50:28,088156","94.130.187.3","192.168.43.171","TLSv1.2","597","Application Data"
"81","09:50:28,143279","192.168.43.171","94.130.187.3","TCP","54","58690  >  443 [ACK] Seq=10101 Ack=11831 Win=65024 Len=0"
"82","09:50:28,252252","94.130.187.3","192.168.43.171","TCP","1454","443  >  58690 [ACK] Seq=11831 Ack=10101 Win=50816 Len=1400 [TCP segment of a reassembled PDU]"
"83","09:50:28,252714","94.130.187.3","192.168.43.171","TCP","1454","443  >  58690 [ACK] Seq=13231 Ack=10101 Win=50816 Len=1400 [TCP segment of a reassembled PDU]"
"84","09:50:28,252716","94.130.187.3","192.168.43.171","TLSv1.2","367","Application Data"
"85","09:50:28,252759","192.168.43.171","94.130.187.3","TCP","54","58690  >  443 [ACK] Seq=10101 Ack=14944 Win=65792 Len=0"
"86","09:50:28,369897","94.130.187.3","192.168.43.171","TCP","1454","443  >  58690 [ACK] Seq=14944 Ack=10101 Win=50816 Len=1400 [TCP segment of a reassembled PDU]"
"87","09:50:28,370077","94.130.187.3","192.168.43.171","TLSv1.2","225","Application Data"
"88","09:50:28,370120","192.168.43.171","94.130.187.3","TCP","54","58690  >  443 [ACK] Seq=10101 Ack=16515 Win=65792 Len=0"
"89","09:50:28,379778","193.200.241.195","192.168.43.171","TCP","597","9001  >  58529 [PSH, ACK] Seq=2173 Ack=1630 Win=558 Len=543"
"90","09:50:28,382097","192.168.43.171","94.130.187.3","TLSv1.2","597","Application Data"
"91","09:50:28,424357","192.168.43.171","193.200.241.195","TCP","54","58529  >  9001 [ACK] Seq=1630 Ack=2716 Win=257 Len=0"
"92","09:50:28,455612","94.130.187.3","192.168.43.171","TCP","54","443  >  58690 [ACK] Seq=16515 Ack=10644 Win=51968 Len=0"
"93","09:50:28,455674","192.168.43.171","94.130.187.3","TLSv1.2","597","Application Data"
"94","09:50:28,527683","94.130.187.3","192.168.43.171","TCP","54","443  >  58690 [ACK] Seq=16515 Ack=11187 Win=52992 Len=0"
"95","09:50:28,658542","192.168.43.171","94.130.187.3","TLSv1.2","597","Application Data"
"96","09:50:28,756514","94.130.187.3","192.168.43.171","TLSv1.2","597","Application Data"
"97","09:50:28,773715","94.130.187.3","192.168.43.171","TCP","54","443  >  58690 [ACK] Seq=17058 Ack=11730 Win=54144 Len=0"
"98","09:50:28,814986","192.168.43.171","94.130.187.3","TCP","54","58690  >  443 [ACK] Seq=11730 Ack=17058 Win=65024 Len=0"
"99","09:50:28,890193","94.130.187.3","192.168.43.171","TLSv1.2","1140","Application Data, Application Data"
"100","09:50:28,898484","192.168.43.171","94.130.187.3","TLSv1.2","597","Application Data"
"101","09:50:28,964967","94.130.187.3","192.168.43.171","TCP","54","443  >  58690 [ACK] Seq=18144 Ack=12273 Win=55168 Len=0"
"102","09:50:29,018299","94.130.187.3","192.168.43.171","TLSv1.2","1111","Application Data"
"103","09:50:29,023845","192.168.43.171","94.130.187.3","TLSv1.2","597","Application Data"
"104","09:50:29,096249","94.130.187.3","192.168.43.171","TCP","54","443  >  58690 [ACK] Seq=19201 Ack=12816 Win=56320 Len=0"
"105","09:50:29,183132","94.130.187.3","192.168.43.171","TLSv1.2","597","Application Data"
"106","09:50:29,242430","HuaweiTe_d8:6e:c7","LiteonTe_6b:2c:4b","ARP","42","Who has 192.168.43.171? Tell 192.168.43.1"
"107","09:50:29,242457","LiteonTe_6b:2c:4b","HuaweiTe_d8:6e:c7","ARP","42","192.168.43.171 is at 20:68:9d:6b:2c:4b"
"108","09:50:29,252500","192.168.43.171","94.130.187.3","TCP","54","58690  >  443 [ACK] Seq=12816 Ack=19744 Win=65792 Len=0"
"109","09:50:31,644370","192.168.43.171","193.200.241.195","TCP","597","58529  >  9001 [PSH, ACK] Seq=1630 Ack=2716 Win=257 Len=543"
"110","09:50:31,749872","193.200.241.195","192.168.43.171","TCP","54","9001  >  58529 [ACK] Seq=2716 Ack=2173 Win=567 Len=0"
"111","09:50:31,764620","193.200.241.195","192.168.43.171","TCP","597","9001  >  58529 [PSH, ACK] Seq=2716 Ack=2173 Win=567 Len=543"
"112","09:50:31,770290","192.168.43.171","193.200.241.195","TCP","597","58529  >  9001 [PSH, ACK] Seq=2173 Ack=3259 Win=254 Len=543"
"113","09:50:31,905703","193.200.241.195","192.168.43.171","TCP","54","9001  >  58529 [ACK] Seq=3259 Ack=2716 Win=575 Len=0"
"114","09:50:31,911813","193.200.241.195","192.168.43.171","TCP","597","9001  >  58529 [PSH, ACK] Seq=3259 Ack=2716 Win=575 Len=543"
"115","09:50:31,920243","192.168.43.171","193.200.241.195","TCP","597","58529  >  9001 [PSH, ACK] Seq=2716 Ack=3802 Win=252 Len=543"
"116","09:50:32,034463","193.200.241.195","192.168.43.171","TCP","54","9001  >  58529 [ACK] Seq=3802 Ack=3259 Win=584 Len=0"
"117","09:50:32,100011","193.200.241.195","192.168.43.171","TCP","597","9001  >  58529 [PSH, ACK] Seq=3802 Ack=3259 Win=584 Len=543"
"118","09:50:32,162482","192.168.43.171","193.200.241.195","TCP","54","58529  >  9001 [ACK] Seq=3259 Ack=4345 Win=257 Len=0"
