"No.","Time","Source","Destination","Protocol","Length","Info"
"1","0.000000000","HuaweiTe_20:5d:96","LiteonTe_6b:2c:4b","ARP","56","Who has 10.0.0.201? Tell 10.0.1.165"
"2","0.120213365","10.0.1.67","224.0.0.252","LLMNR","75","Standard query 0x30d2 A BRW9453304E9B4B"
"3","0.326092448","10.0.1.168","239.255.255.250","SSDP","179","M-SEARCH * HTTP/1.1 "
"4","0.327719582","10.0.1.226","10.0.15.255","NBNS","92","Name query NB WPAD<00>"
"5","0.530253527","10.0.1.168","224.0.0.251","MDNS","75","Standard query 0x0000 PTR _ssh._tcp.local, ""QM"" question"
"6","0.532983048","10.0.2.139","230.0.0.1","UDP","92","6666  >  6666 Len=50"
"7","0.536769885","10.0.1.100","224.0.0.251","MDNS","395","Standard query response 0x0000 TXT PTR MacBook Pro\\302\\240\\342\\200\\224 \\320\\220\\320\\275\\320\\264\\321\\200\\320\\265\\320\\271 (2)._ssh._tcp.local TXT, cache flush SRV, cache flush 0 0 22 MacBook-Pro-Andrej-2.local AAAA, cache flush fe80::466:a953:7aeb:68ce A, cache flush 10.0.1.100 NSEC, cache flush MacBook Pro\\302\\240\\342\\200\\224 \\320\\220\\320\\275\\320\\264\\321\\200\\320\\265\\320\\271 (2)._ssh._tcp.local NSEC, cache flush MacBook-Pro-Andrej-2.local OPT"
"8","1.144102417","10.0.1.226","10.0.15.255","NBNS","92","Name query NB WPAD<00>"
"9","1.145656267","10.0.1.67","10.0.15.255","NBNS","92","Name query NB BRW9453304E9B4B<00>"
"10","1.349655280","10.0.2.144","239.255.255.250","SSDP","179","M-SEARCH * HTTP/1.1 "
"11","1.556448952","10.0.2.139","230.0.0.1","UDP","92","6666  >  6666 Len=50"
"12","1.759172256","10.0.2.118","239.255.255.250","SSDP","167","M-SEARCH * HTTP/1.1 "
"13","1.761344037","10.0.2.118","239.255.255.250","SSDP","167","M-SEARCH * HTTP/1.1 "
"14","1.964495527","10.0.2.118","239.255.255.250","SSDP","167","M-SEARCH * HTTP/1.1 "
"15","1.966552487","10.0.2.1","255.255.255.255","DB-LSP-DISC","175","Dropbox LAN sync Discovery Protocol"
"16","1.968730879","10.0.2.1","10.0.15.255","DB-LSP-DISC","175","Dropbox LAN sync Discovery Protocol"
"17","1.970800548","10.0.2.153","239.255.255.250","SSDP","175","M-SEARCH * HTTP/1.1 "
"18","2.168255976","10.0.1.67","10.0.15.255","NBNS","92","Name query NB BRW9453304E9B4B<00>"
"19","2.169670792","10.0.1.67","224.0.0.252","LLMNR","75","Standard query 0x46cb A BRW9453304E9B4B"
"20","2.171278893","10.0.1.47","224.0.0.251","MDNS","91","Standard query 0x0000 PTR _raop._tcp.local, ""QM"" question PTR _airplay._tcp.local, ""QM"" question"
"21","2.376706089","10.0.1.100","224.0.0.251","MDNS","558","Standard query response 0x0000 TXT TXT, cache flush PTR _ssh._tcp.local PTR MacBook Pro\\302\\240\\342\\200\\224 \\320\\220\\320\\275\\320\\264\\321\\200\\320\\265\\320\\271 (2)._ssh._tcp.local TXT, cache flush PTR _sftp-ssh._tcp.local PTR MacBook Pro\\302\\240\\342\\200\\224 \\320\\220\\320\\275\\320\\264\\321\\200\\320\\265\\320\\271 (2)._sftp-ssh._tcp.local SRV, cache flush 0 0 22 MacBook-Pro-Andrej-2.local SRV, cache flush 0 0 22 MacBook-Pro-Andrej-2.local AAAA, cache flush fe80::466:a953:7aeb:68ce A, cache flush 10.0.1.100 NSEC, cache flush MacBook Pro\\302\\240\\342\\200\\224 \\320\\220\\320\\275\\320\\264\\321\\200\\320\\265\\320\\271 (2)._ssh._tcp.local NSEC, cache flush MacBook Pro\\302\\240\\342\\200\\224 \\320\\220\\320\\275\\320\\264\\321\\200\\320\\265\\320\\271 (2)._sftp-ssh._tcp.local NSEC, cache flush MacBook-Pro-Andrej-2.local OPT"
"22","2.448333167","10.0.2.155","8.8.8.8","DNS","79","Standard query 0x0dc0 A ajax.googleapis.com"
"23","2.448378848","10.0.2.155","8.8.8.8","DNS","79","Standard query 0x1833 A adservice.google.ru"
"24","2.448403057","10.0.2.155","8.8.8.8","DNS","75","Standard query 0xae3d A apis.google.com"
"25","2.467483862","8.8.8.8","10.0.2.155","DNS","136","Standard query response 0xae3d A apis.google.com CNAME plus.l.google.com CNAME wide-plus.l.google.com A 64.233.162.196"
"26","2.468018515","8.8.8.8","10.0.2.155","DNS","183","Standard query response 0x1833 A adservice.google.ru CNAME pagead46.l.doubleclick.net A 64.233.164.155 A 64.233.164.157 A 64.233.164.154 A 64.233.164.156"
"27","2.469005441","8.8.8.8","10.0.2.155","DNS","193","Standard query response 0x0dc0 A ajax.googleapis.com CNAME googleapis.l.google.com A 173.194.222.95 A 209.85.233.95 A 64.233.162.95 A 64.233.164.95 A 173.194.221.95"
"28","2.469642018","10.0.2.155","8.8.8.8","DNS","80","Standard query 0xb49c A fonts.googleapis.com"
"29","2.469854269","10.0.2.155","8.8.8.8","DNS","72","Standard query 0x7007 A id.google.ru"
"30","2.481448562","10.0.2.155","8.8.8.8","DNS","83","Standard query 0xd01f A maxcdn.bootstrapcdn.com"
"31","2.488724073","8.8.8.8","10.0.2.155","DNS","132","Standard query response 0xb49c A fonts.googleapis.com CNAME googleadapis.l.google.com A 209.85.233.95"
"32","2.489251428","10.0.2.155","8.8.8.8","DNS","75","Standard query 0x2108 A ssl.gstatic.com"
"33","2.496048692","8.8.8.8","10.0.2.155","DNS","117","Standard query response 0x7007 A id.google.ru CNAME id.l.google.com A 173.194.222.94"
"34","2.497555106","10.0.2.155","8.8.8.8","DNS","73","Standard query 0x5562 A www.google.ru"
"35","2.498681519","8.8.8.8","10.0.2.155","DNS","151","Standard query response 0xd01f A maxcdn.bootstrapcdn.com CNAME cds.j3z9t3p6.hwcdn.net A 205.185.216.10 A 205.185.216.42"
"36","2.499210547","10.0.2.155","8.8.8.8","DNS","75","Standard query 0x433f A www.gstatic.com"
"37","2.507673138","8.8.8.8","10.0.2.155","DNS","91","Standard query response 0x2108 A ssl.gstatic.com A 64.233.162.94"
"38","2.508267357","10.0.2.155","8.8.8.8","DNS","77","Standard query 0xa822 A www.wireshark.org"
"39","2.517057226","8.8.8.8","10.0.2.155","DNS","89","Standard query response 0x5562 A www.google.ru A 64.233.162.94"
"40","2.518248787","8.8.8.8","10.0.2.155","DNS","91","Standard query response 0x433f A www.gstatic.com A 64.233.162.94"
"41","2.519400875","10.0.2.155","224.0.0.251","MDNS","136","Standard query 0x0000 A MacBook-Pro-Andrej-2.local, ""QM"" question AAAA MacBook-Pro-Andrej-2.local, ""QM"" question AAAA fe80::466:a953:7aeb:68ce A 10.0.1.100"
"42","2.529403838","10.0.2.155","8.8.8.8","DNS","85","Standard query 0x820f A chromium-i18n.appspot.com"
"43","2.543873481","10.0.2.155","64.233.162.94","TCP","74","52606  >  443 [SYN] Seq=0 Win=29200 Len=0 MSS=1460 SACK_PERM=1 TSval=130785 TSecr=0 WS=128"
"44","2.545375101","10.0.2.155","64.233.162.196","TCP","74","55214  >  443 [SYN] Seq=0 Win=29200 Len=0 MSS=1460 SACK_PERM=1 TSval=130786 TSecr=0 WS=128"
"45","2.545564729","10.0.2.155","64.233.162.196","TCP","74","55216  >  443 [SYN] Seq=0 Win=29200 Len=0 MSS=1460 SACK_PERM=1 TSval=130786 TSecr=0 WS=128"
"46","2.545787060","10.0.2.155","64.233.162.94","TCP","74","52612  >  443 [SYN] Seq=0 Win=29200 Len=0 MSS=1460 SACK_PERM=1 TSval=130786 TSecr=0 WS=128"
"47","2.545839494","10.0.2.155","64.233.162.94","TCP","74","52614  >  443 [SYN] Seq=0 Win=29200 Len=0 MSS=1460 SACK_PERM=1 TSval=130786 TSecr=0 WS=128"
"48","2.545964234","10.0.2.155","64.233.162.94","TCP","74","52616  >  443 [SYN] Seq=0 Win=29200 Len=0 MSS=1460 SACK_PERM=1 TSval=130786 TSecr=0 WS=128"
"49","2.546011256","10.0.2.155","64.233.162.94","TCP","74","52618  >  443 [SYN] Seq=0 Win=29200 Len=0 MSS=1460 SACK_PERM=1 TSval=130786 TSecr=0 WS=128"
"50","2.546053623","10.0.2.155","64.233.162.94","TCP","74","52620  >  443 [SYN] Seq=0 Win=29200 Len=0 MSS=1460 SACK_PERM=1 TSval=130786 TSecr=0 WS=128"
"51","2.546096153","10.0.2.155","64.233.162.94","TCP","74","52622  >  443 [SYN] Seq=0 Win=29200 Len=0 MSS=1460 SACK_PERM=1 TSval=130786 TSecr=0 WS=128"
"52","2.546141708","10.0.2.155","64.233.162.94","TCP","74","52624  >  443 [SYN] Seq=0 Win=29200 Len=0 MSS=1460 SACK_PERM=1 TSval=130786 TSecr=0 WS=128"
"53","2.546265916","10.0.2.155","64.233.162.94","TCP","74","52626  >  443 [SYN] Seq=0 Win=29200 Len=0 MSS=1460 SACK_PERM=1 TSval=130786 TSecr=0 WS=128"
"54","2.546307431","10.0.2.155","64.233.162.94","TCP","74","52628  >  443 [SYN] Seq=0 Win=29200 Len=0 MSS=1460 SACK_PERM=1 TSval=130786 TSecr=0 WS=128"
"55","2.548231197","8.8.8.8","10.0.2.155","DNS","140","Standard query response 0x820f A chromium-i18n.appspot.com CNAME appspot-preview.l.google.com A 64.233.162.153"
"56","2.548606949","10.0.2.155","64.233.162.153","TCP","74","50572  >  443 [SYN] Seq=0 Win=29200 Len=0 MSS=1460 SACK_PERM=1 TSval=130787 TSecr=0 WS=128"
"57","2.560381082","8.8.8.8","10.0.2.155","DNS","109","Standard query response 0xa822 A www.wireshark.org A 104.25.218.21 A 104.25.219.21"
"58","2.563607805","64.233.162.196","10.0.2.155","TCP","74","443  >  55214 [SYN, ACK] Seq=0 Ack=1 Win=42408 Len=0 MSS=1380 SACK_PERM=1 TSval=3914934284 TSecr=130786 WS=256"
"59","2.563682840","10.0.2.155","64.233.162.196","TCP","66","55214  >  443 [ACK] Seq=1 Ack=1 Win=29312 Len=0 TSval=130790 TSecr=3914934284"
"60","2.564561613","10.0.2.155","64.233.162.196","TLSv1.2","283","Client Hello"
"61","2.568692739","64.233.162.196","10.0.2.155","TCP","74","443  >  55216 [SYN, ACK] Seq=0 Ack=1 Win=42408 Len=0 MSS=1380 SACK_PERM=1 TSval=1650553136 TSecr=130786 WS=256"
"62","2.568735763","10.0.2.155","64.233.162.196","TCP","66","55216  >  443 [ACK] Seq=1 Ack=1 Win=29312 Len=0 TSval=130792 TSecr=1650553136"
"63","2.569333305","64.233.162.153","10.0.2.155","TCP","74","443  >  50572 [SYN, ACK] Seq=0 Ack=1 Win=42408 Len=0 MSS=1380 SACK_PERM=1 TSval=4252270044 TSecr=130787 WS=256"
"64","2.569354214","10.0.2.155","64.233.162.153","TCP","66","50572  >  443 [ACK] Seq=1 Ack=1 Win=29312 Len=0 TSval=130792 TSecr=4252270044"
"65","2.570660295","10.0.2.155","64.233.162.196","TLSv1.2","283","Client Hello"
"66","2.571942629","64.233.162.94","10.0.2.155","TCP","74","443  >  52606 [SYN, ACK] Seq=0 Ack=1 Win=42408 Len=0 MSS=1380 SACK_PERM=1 TSval=35120090 TSecr=130785 WS=256"
"67","2.571974089","10.0.2.155","64.233.162.94","TCP","66","52606  >  443 [ACK] Seq=1 Ack=1 Win=29312 Len=0 TSval=130793 TSecr=35120090"
"68","2.574233368","10.0.2.155","64.233.162.153","TLSv1.2","281","Client Hello"
"69","2.578102143","10.0.1.67","224.0.0.252","LLMNR","75","Standard query 0x46cb A BRW9453304E9B4B"
"70","2.579771235","10.0.2.139","230.0.0.1","UDP","92","6666  >  6666 Len=50"
"71","2.580294464","10.0.2.155","64.233.162.94","TLSv1.2","281","Client Hello"
"72","2.582037926","10.0.1.48","224.0.0.251","MDNS","136","Standard query 0x0000 A MacBook-Pro-Andrej-2.local, ""QM"" question AAAA MacBook-Pro-Andrej-2.local, ""QM"" question AAAA fe80::466:a953:7aeb:68ce A 10.0.1.100"
"73","2.582067921","10.0.2.155","8.8.8.8","DNS","84","Standard query 0xc2aa A translate.googleapis.com"
"74","2.585575114","10.0.1.139","224.0.0.251","MDNS","91","Standard query response 0x0000 A, cache flush 10.0.1.139"
"75","2.588701024","10.0.1.139","224.0.0.251","MDNS","91","Standard query response 0x0000 A, cache flush 10.0.1.139"
"76","2.590092862","64.233.162.94","10.0.2.155","TCP","74","443  >  52612 [SYN, ACK] Seq=0 Ack=1 Win=42408 Len=0 MSS=1380 SACK_PERM=1 TSval=660389037 TSecr=130786 WS=256"
"77","2.590153820","10.0.2.155","64.233.162.94","TCP","66","52612  >  443 [ACK] Seq=1 Ack=1 Win=29312 Len=0 TSval=130797 TSecr=660389037"
"78","2.590536525","10.0.2.155","64.233.162.94","TLSv1.2","283","Client Hello"
"79","2.591746673","64.233.162.94","10.0.2.155","TCP","74","443  >  52614 [SYN, ACK] Seq=0 Ack=1 Win=42408 Len=0 MSS=1380 SACK_PERM=1 TSval=4143796536 TSecr=130786 WS=256"
"80","2.591785464","10.0.2.155","64.233.162.94","TCP","66","52614  >  443 [ACK] Seq=1 Ack=1 Win=29312 Len=0 TSval=130797 TSecr=4143796536"
"81","2.591805542","64.233.162.94","10.0.2.155","TCP","74","443  >  52616 [SYN, ACK] Seq=0 Ack=1 Win=42408 Len=0 MSS=1380 SACK_PERM=1 TSval=4273431948 TSecr=130786 WS=256"
"82","2.591815076","10.0.2.155","64.233.162.94","TCP","66","52616  >  443 [ACK] Seq=1 Ack=1 Win=29312 Len=0 TSval=130797 TSecr=4273431948"
"83","2.591823150","64.233.162.94","10.0.2.155","TCP","74","443  >  52624 [SYN, ACK] Seq=0 Ack=1 Win=42408 Len=0 MSS=1380 SACK_PERM=1 TSval=346878124 TSecr=130786 WS=256"
"84","2.591831986","10.0.2.155","64.233.162.94","TCP","66","52624  >  443 [ACK] Seq=1 Ack=1 Win=29312 Len=0 TSval=130797 TSecr=346878124"
"85","2.591838955","64.233.162.94","10.0.2.155","TCP","74","443  >  52622 [SYN, ACK] Seq=0 Ack=1 Win=42408 Len=0 MSS=1380 SACK_PERM=1 TSval=2592921794 TSecr=130786 WS=256"
"86","2.591847848","10.0.2.155","64.233.162.94","TCP","66","52622  >  443 [ACK] Seq=1 Ack=1 Win=29312 Len=0 TSval=130797 TSecr=2592921794"
"87","2.591854406","64.233.162.94","10.0.2.155","TCP","74","443  >  52618 [SYN, ACK] Seq=0 Ack=1 Win=42408 Len=0 MSS=1380 SACK_PERM=1 TSval=1096402668 TSecr=130786 WS=256"
"88","2.591862846","10.0.2.155","64.233.162.94","TCP","66","52618  >  443 [ACK] Seq=1 Ack=1 Win=29312 Len=0 TSval=130797 TSecr=1096402668"
"89","2.591869105","64.233.162.94","10.0.2.155","TCP","74","443  >  52628 [SYN, ACK] Seq=0 Ack=1 Win=42408 Len=0 MSS=1380 SACK_PERM=1 TSval=3331859497 TSecr=130786 WS=256"
"90","2.591876875","10.0.2.155","64.233.162.94","TCP","66","52628  >  443 [ACK] Seq=1 Ack=1 Win=29312 Len=0 TSval=130797 TSecr=3331859497"
"91","2.591886282","64.233.162.94","10.0.2.155","TCP","74","443  >  52626 [SYN, ACK] Seq=0 Ack=1 Win=42408 Len=0 MSS=1380 SACK_PERM=1 TSval=4225123584 TSecr=130786 WS=256"
"92","2.591894642","10.0.2.155","64.233.162.94","TCP","66","52626  >  443 [ACK] Seq=1 Ack=1 Win=29312 Len=0 TSval=130797 TSecr=4225123584"
"93","2.591913204","64.233.162.94","10.0.2.155","TCP","74","443  >  52620 [SYN, ACK] Seq=0 Ack=1 Win=42408 Len=0 MSS=1380 SACK_PERM=1 TSval=3858483489 TSecr=130786 WS=256"
"94","2.591922992","10.0.2.155","64.233.162.94","TCP","66","52620  >  443 [ACK] Seq=1 Ack=1 Win=29312 Len=0 TSval=130798 TSecr=3858483489"
"95","2.591930358","64.233.162.196","10.0.2.155","TCP","66","443  >  55214 [ACK] Seq=1 Ack=218 Win=43520 Len=0 TSval=3914934307 TSecr=130791"
"96","2.592349056","10.0.2.155","64.233.162.94","TLSv1.2","283","Client Hello"
"97","2.592880604","10.0.2.155","64.233.162.94","TLSv1.2","281","Client Hello"
"98","2.593409764","10.0.2.155","64.233.162.94","TLSv1.2","281","Client Hello"
"99","2.593693983","10.0.2.155","64.233.162.94","TLSv1.2","281","Client Hello"
"100","2.594180172","10.0.2.155","64.233.162.94","TLSv1.2","281","Client Hello"
"101","2.594391197","10.0.2.155","64.233.162.94","TLSv1.2","283","Client Hello"
"102","2.594867315","10.0.2.155","64.233.162.94","TLSv1.2","283","Client Hello"
"103","2.595058054","10.0.2.155","64.233.162.94","TLSv1.2","281","Client Hello"
"104","2.597937233","64.233.162.196","10.0.2.155","TLSv1.2","1484","Server Hello"
"105","2.597969185","10.0.2.155","64.233.162.196","TCP","66","55214  >  443 [ACK] Seq=218 Ack=1419 Win=32128 Len=0 TSval=130799 TSecr=3914934308"
"106","2.597987653","64.233.162.196","10.0.2.155","TLSv1.2","1484","Certificate [TCP segment of a reassembled PDU]"
"107","2.597999442","10.0.2.155","64.233.162.196","TCP","66","55214  >  443 [ACK] Seq=218 Ack=2837 Win=35072 Len=0 TSval=130799 TSecr=3914934308"
"108","2.598004324","64.233.162.196","10.0.2.155","TLSv1.2","190","Server Key Exchange, Server Hello Done"
"109","2.598009416","10.0.2.155","64.233.162.196","TCP","66","55214  >  443 [ACK] Seq=218 Ack=2961 Win=35072 Len=0 TSval=130799 TSecr=3914934308"
"110","2.598013853","64.233.162.196","10.0.2.155","TCP","66","443  >  55216 [ACK] Seq=1 Ack=218 Win=43520 Len=0 TSval=1650553162 TSecr=130792"
"111","2.600615707","64.233.162.196","10.0.2.155","TLSv1.2","1484","Server Hello"
"112","2.600711051","10.0.2.155","64.233.162.196","TCP","66","55216  >  443 [ACK] Seq=218 Ack=1419 Win=32128 Len=0 TSval=130800 TSecr=1650553164"
"113","2.600797152","64.233.162.196","10.0.2.155","TLSv1.2","1484","Certificate [TCP segment of a reassembled PDU]"
"114","2.600843491","10.0.2.155","64.233.162.196","TCP","66","55216  >  443 [ACK] Seq=218 Ack=2837 Win=35072 Len=0 TSval=130800 TSecr=1650553164"
"115","2.600869009","64.233.162.196","10.0.2.155","TLSv1.2","190","Server Key Exchange, Server Hello Done"
"116","2.600879991","10.0.2.155","64.233.162.196","TCP","66","55216  >  443 [ACK] Seq=218 Ack=2961 Win=35072 Len=0 TSval=130800 TSecr=1650553164"
"117","2.600895742","64.233.162.153","10.0.2.155","TCP","66","443  >  50572 [ACK] Seq=1 Ack=216 Win=43520 Len=0 TSval=4252270075 TSecr=130793"
"118","2.602838774","64.233.162.153","10.0.2.155","TLSv1.2","1484","Server Hello"
"119","2.602867185","10.0.2.155","64.233.162.153","TCP","66","50572  >  443 [ACK] Seq=216 Ack=1419 Win=32128 Len=0 TSval=130800 TSecr=4252270076"
"120","2.602880404","64.233.162.153","10.0.2.155","TLSv1.2","1484","Certificate [TCP segment of a reassembled PDU]"
"121","2.602890972","10.0.2.155","64.233.162.153","TCP","66","50572  >  443 [ACK] Seq=216 Ack=2837 Win=35072 Len=0 TSval=130800 TSecr=4252270076"
"122","2.603434256","64.233.162.153","10.0.2.155","TLSv1.2","290","Server Key Exchange, Server Hello Done"
"123","2.603449520","10.0.2.155","64.233.162.153","TCP","66","50572  >  443 [ACK] Seq=216 Ack=3061 Win=37888 Len=0 TSval=130800 TSecr=4252270076"
"124","2.609002555","8.8.8.8","10.0.2.155","DNS","100","Standard query response 0xc2aa A translate.googleapis.com A 209.85.233.95"
"125","2.613099318","64.233.162.94","10.0.2.155","TCP","66","443  >  52606 [ACK] Seq=1 Ack=216 Win=43520 Len=0 TSval=35120132 TSecr=130795"
"126","2.616064946","10.0.2.155","209.85.233.95","TCP","74","60026  >  443 [SYN] Seq=0 Win=29200 Len=0 MSS=1460 SACK_PERM=1 TSval=130804 TSecr=0 WS=128"
"127","2.616387198","64.233.162.94","10.0.2.155","TLSv1.2","1484","Server Hello"
"128","2.616406624","10.0.2.155","64.233.162.94","TCP","66","52606  >  443 [ACK] Seq=216 Ack=1419 Win=32128 Len=0 TSval=130804 TSecr=35120134"
"129","2.618144094","10.0.2.155","64.233.162.153","TLSv1.2","151","Client Key Exchange, Change Cipher Spec, Encrypted Handshake Message"
"130","2.619415332","64.233.162.94","10.0.2.155","TLSv1.2","1484","Certificate [TCP segment of a reassembled PDU]"
"131","2.619452325","10.0.2.155","64.233.162.94","TCP","66","52606  >  443 [ACK] Seq=216 Ack=2837 Win=35072 Len=0 TSval=130804 TSecr=35120134"
"132","2.623740956","64.233.162.94","10.0.2.155","TLSv1.2","207","Server Key Exchange, Server Hello Done"
"133","2.623772207","10.0.2.155","64.233.162.94","TCP","66","52606  >  443 [ACK] Seq=216 Ack=2978 Win=37888 Len=0 TSval=130805 TSecr=35120134"
"134","2.623792815","64.233.162.94","10.0.2.155","TCP","66","443  >  52612 [ACK] Seq=1 Ack=218 Win=43520 Len=0 TSval=660389081 TSecr=130797"
"135","2.623809214","64.233.162.94","10.0.2.155","TLSv1.2","1484","Server Hello"
"136","2.623816501","10.0.2.155","64.233.162.94","TCP","66","52612  >  443 [ACK] Seq=218 Ack=1419 Win=32128 Len=0 TSval=130805 TSecr=660389081"
"137","2.623827229","64.233.162.94","10.0.2.155","TCP","1484","443  >  52612 [ACK] Seq=1419 Ack=218 Win=43520 Len=1418 TSval=660389081 TSecr=130797 [TCP segment of a reassembled PDU]"
"138","2.623835725","10.0.2.155","64.233.162.94","TCP","66","52612  >  443 [ACK] Seq=218 Ack=2837 Win=35072 Len=0 TSval=130805 TSecr=660389081"
"139","2.626367805","64.233.162.94","10.0.2.155","TLSv1.2","1484","Certificate [TCP segment of a reassembled PDU]"
"140","2.626394589","10.0.2.155","64.233.162.94","TCP","66","52612  >  443 [ACK] Seq=218 Ack=4255 Win=37888 Len=0 TSval=130806 TSecr=660389081"
"141","2.626415549","64.233.162.94","10.0.2.155","TLSv1.2","182","Server Key Exchange, Server Hello Done"
"142","2.626425287","10.0.2.155","64.233.162.94","TCP","66","52612  >  443 [ACK] Seq=218 Ack=4371 Win=37888 Len=0 TSval=130806 TSecr=660389081"
"143","2.630784830","64.233.162.94","10.0.2.155","TCP","66","443  >  52616 [ACK] Seq=1 Ack=216 Win=43520 Len=0 TSval=4273431999 TSecr=130798"
"144","2.630815089","64.233.162.94","10.0.2.155","TCP","66","443  >  52624 [ACK] Seq=1 Ack=216 Win=43520 Len=0 TSval=346878174 TSecr=130798"
"145","2.630825849","64.233.162.94","10.0.2.155","TCP","66","443  >  52622 [ACK] Seq=1 Ack=216 Win=43520 Len=0 TSval=2592921844 TSecr=130798"
"146","2.630833992","64.233.162.94","10.0.2.155","TCP","66","443  >  52614 [ACK] Seq=1 Ack=218 Win=43520 Len=0 TSval=4143796587 TSecr=130798"
"147","2.630841793","64.233.162.94","10.0.2.155","TCP","66","443  >  52618 [ACK] Seq=1 Ack=216 Win=43520 Len=0 TSval=1096402718 TSecr=130798"
"148","2.630849222","64.233.162.94","10.0.2.155","TCP","66","443  >  52628 [ACK] Seq=1 Ack=218 Win=43520 Len=0 TSval=3331859547 TSecr=130798"
"149","2.630856824","64.233.162.94","10.0.2.155","TLSv1.2","1484","Server Hello"
"150","2.630871689","10.0.2.155","64.233.162.94","TCP","66","52614  >  443 [ACK] Seq=218 Ack=1419 Win=32128 Len=0 TSval=130807 TSecr=4143796587"
"151","2.630894462","64.233.162.94","10.0.2.155","TCP","66","443  >  52626 [ACK] Seq=1 Ack=218 Win=43520 Len=0 TSval=4225123634 TSecr=130798"
"152","2.630903025","64.233.162.94","10.0.2.155","TCP","1484","443  >  52614 [ACK] Seq=1419 Ack=218 Win=43520 Len=1418 TSval=4143796587 TSecr=130798 [TCP segment of a reassembled PDU]"
"153","2.630912775","10.0.2.155","64.233.162.94","TCP","66","52614  >  443 [ACK] Seq=218 Ack=2837 Win=35072 Len=0 TSval=130807 TSecr=4143796587"
"154","2.631269042","10.0.2.155","64.233.162.196","TLSv1.2","308","Client Key Exchange, Change Cipher Spec, Encrypted Handshake Message, Encrypted Handshake Message"
"155","2.632774279","64.233.162.94","10.0.2.155","TLSv1.2","1484","Server Hello"
"156","2.632807247","10.0.2.155","64.233.162.94","TCP","66","52628  >  443 [ACK] Seq=218 Ack=1419 Win=32128 Len=0 TSval=130808 TSecr=3331859547"
"157","2.632819714","64.233.162.94","10.0.2.155","TCP","1484","443  >  52628 [ACK] Seq=1419 Ack=218 Win=43520 Len=1418 TSval=3331859547 TSecr=130798 [TCP segment of a reassembled PDU]"
"158","2.632831503","10.0.2.155","64.233.162.94","TCP","66","52628  >  443 [ACK] Seq=218 Ack=2837 Win=35072 Len=0 TSval=130808 TSecr=3331859547"
"159","2.632835425","64.233.162.94","10.0.2.155","TLSv1.2","1484","Server Hello"
"160","2.632842117","10.0.2.155","64.233.162.94","TCP","66","52626  >  443 [ACK] Seq=218 Ack=1419 Win=32128 Len=0 TSval=130808 TSecr=4225123635"
"161","2.632846223","64.233.162.94","10.0.2.155","TCP","1484","443  >  52626 [ACK] Seq=1419 Ack=218 Win=43520 Len=1418 TSval=4225123635 TSecr=130798 [TCP segment of a reassembled PDU]"
"162","2.632852971","10.0.2.155","64.233.162.94","TCP","66","52626  >  443 [ACK] Seq=218 Ack=2837 Win=35072 Len=0 TSval=130808 TSecr=4225123635"
"163","2.632856218","64.233.162.94","10.0.2.155","TCP","66","443  >  52620 [ACK] Seq=1 Ack=216 Win=43520 Len=0 TSval=3858483539 TSecr=130798"
"164","2.632865581","64.233.162.94","10.0.2.155","TLSv1.2","1484","Server Hello"
"165","2.632871807","10.0.2.155","64.233.162.94","TCP","66","52624  >  443 [ACK] Seq=216 Ack=1419 Win=32128 Len=0 TSval=130808 TSecr=346878176"
"166","2.632876448","64.233.162.94","10.0.2.155","TLSv1.2","1484","Certificate [TCP segment of a reassembled PDU]"
"167","2.632882695","10.0.2.155","64.233.162.94","TCP","66","52624  >  443 [ACK] Seq=216 Ack=2837 Win=35072 Len=0 TSval=130808 TSecr=346878176"
"168","2.632886309","64.233.162.94","10.0.2.155","TLSv1.2","1484","Server Hello"
"169","2.632893016","10.0.2.155","64.233.162.94","TCP","66","52622  >  443 [ACK] Seq=216 Ack=1419 Win=32128 Len=0 TSval=130808 TSecr=2592921846"
"170","2.635979912","64.233.162.94","10.0.2.155","TLSv1.2","1484","Certificate [TCP segment of a reassembled PDU]"
"171","2.636020362","10.0.2.155","64.233.162.94","TCP","66","52622  >  443 [ACK] Seq=216 Ack=2837 Win=35072 Len=0 TSval=130809 TSecr=2592921846"
"172","2.636046316","64.233.162.94","10.0.2.155","TLSv1.2","1484","Server Hello"
"173","2.636054614","10.0.2.155","64.233.162.94","TCP","66","52618  >  443 [ACK] Seq=216 Ack=1419 Win=32128 Len=0 TSval=130809 TSecr=1096402720"
"174","2.636063098","64.233.162.94","10.0.2.155","TLSv1.2","1484","Certificate [TCP segment of a reassembled PDU]"
"175","2.636070506","10.0.2.155","64.233.162.94","TCP","66","52618  >  443 [ACK] Seq=216 Ack=2837 Win=35072 Len=0 TSval=130809 TSecr=1096402720"
"176","2.636078761","64.233.162.94","10.0.2.155","TLSv1.2","1484","Server Hello"
"177","2.636085997","10.0.2.155","64.233.162.94","TCP","66","52620  >  443 [ACK] Seq=216 Ack=1419 Win=32128 Len=0 TSval=130809 TSecr=3858483541"
"178","2.636094739","64.233.162.94","10.0.2.155","TLSv1.2","1484","Certificate [TCP segment of a reassembled PDU]"
"179","2.636101935","10.0.2.155","64.233.162.94","TCP","66","52620  >  443 [ACK] Seq=216 Ack=2837 Win=35072 Len=0 TSval=130809 TSecr=3858483541"
"180","2.636109106","64.233.162.94","10.0.2.155","TLSv1.2","1484","Certificate [TCP segment of a reassembled PDU]"
"181","2.636116537","10.0.2.155","64.233.162.94","TCP","66","52614  >  443 [ACK] Seq=218 Ack=4255 Win=37888 Len=0 TSval=130809 TSecr=4143796587"
"182","2.636123923","64.233.162.94","10.0.2.155","TLSv1.2","183","Server Key Exchange, Server Hello Done"
"183","2.636128947","10.0.2.155","64.233.162.94","TCP","66","52614  >  443 [ACK] Seq=218 Ack=4372 Win=37888 Len=0 TSval=130809 TSecr=4143796587"
"184","2.636135476","64.233.162.94","10.0.2.155","TLSv1.2","1484","Server Hello"
"185","2.636141668","10.0.2.155","64.233.162.94","TCP","66","52616  >  443 [ACK] Seq=216 Ack=1419 Win=32128 Len=0 TSval=130809 TSecr=4273432002"
"186","2.636148537","64.233.162.94","10.0.2.155","TLSv1.2","1484","Certificate [TCP segment of a reassembled PDU]"
"187","2.636153875","10.0.2.155","64.233.162.94","TCP","66","52616  >  443 [ACK] Seq=216 Ack=2837 Win=35072 Len=0 TSval=130809 TSecr=4273432002"
"188","2.636160412","64.233.162.94","10.0.2.155","TLSv1.2","1484","Certificate [TCP segment of a reassembled PDU]"
"189","2.636165580","10.0.2.155","64.233.162.94","TCP","66","52628  >  443 [ACK] Seq=218 Ack=4255 Win=37888 Len=0 TSval=130809 TSecr=3331859547"
"190","2.636173110","64.233.162.94","10.0.2.155","TLSv1.2","182","Server Key Exchange, Server Hello Done"
"191","2.636179124","10.0.2.155","64.233.162.94","TCP","66","52628  >  443 [ACK] Seq=218 Ack=4371 Win=37888 Len=0 TSval=130809 TSecr=3331859547"
"192","2.636187508","64.233.162.94","10.0.2.155","TLSv1.2","1484","Certificate [TCP segment of a reassembled PDU]"
"193","2.636193088","10.0.2.155","64.233.162.94","TCP","66","52626  >  443 [ACK] Seq=218 Ack=4255 Win=37888 Len=0 TSval=130809 TSecr=4225123635"
"194","2.636199853","64.233.162.94","10.0.2.155","TLSv1.2","181","Server Key Exchange, Server Hello Done"
"195","2.636205311","10.0.2.155","64.233.162.94","TCP","66","52626  >  443 [ACK] Seq=218 Ack=4370 Win=37888 Len=0 TSval=130809 TSecr=4225123635"
"196","2.636211218","64.233.162.94","10.0.2.155","TLSv1.2","207","Server Key Exchange, Server Hello Done"
"197","2.636215924","10.0.2.155","64.233.162.94","TCP","66","52624  >  443 [ACK] Seq=216 Ack=2978 Win=37888 Len=0 TSval=130809 TSecr=346878176"
"198","2.636223777","64.233.162.94","10.0.2.155","TLSv1.2","207","Server Key Exchange, Server Hello Done"
"199","2.636228512","10.0.2.155","64.233.162.94","TCP","66","52622  >  443 [ACK] Seq=216 Ack=2978 Win=37888 Len=0 TSval=130809 TSecr=2592921846"
"200","2.636235851","64.233.162.94","10.0.2.155","TLSv1.2","207","Server Key Exchange, Server Hello Done"
"201","2.636240288","10.0.2.155","64.233.162.94","TCP","66","52618  >  443 [ACK] Seq=216 Ack=2978 Win=37888 Len=0 TSval=130809 TSecr=1096402720"
"202","2.636247012","64.233.162.94","10.0.2.155","TLSv1.2","207","Server Key Exchange, Server Hello Done"
"203","2.636250985","10.0.2.155","64.233.162.94","TCP","66","52620  >  443 [ACK] Seq=216 Ack=2978 Win=37888 Len=0 TSval=130809 TSecr=3858483541"
"204","2.636257117","64.233.162.94","10.0.2.155","TLSv1.2","207","Server Key Exchange, Server Hello Done"
"205","2.636261468","10.0.2.155","64.233.162.94","TCP","66","52616  >  443 [ACK] Seq=216 Ack=2978 Win=37888 Len=0 TSval=130809 TSecr=4273432002"
"206","2.636517852","10.0.2.155","64.233.162.196","TLSv1.2","308","Client Key Exchange, Change Cipher Spec, Encrypted Handshake Message, Encrypted Handshake Message"
"207","2.637073706","209.85.233.95","10.0.2.155","TCP","74","443  >  60026 [SYN, ACK] Seq=0 Ack=1 Win=42408 Len=0 MSS=1380 SACK_PERM=1 TSval=105834013 TSecr=130804 WS=256"
"208","2.637164027","10.0.2.155","209.85.233.95","TCP","66","60026  >  443 [ACK] Seq=1 Ack=1 Win=29312 Len=0 TSval=130809 TSecr=105834013"
"209","2.637521063","10.0.2.155","64.233.162.94","TLSv1.2","308","Client Key Exchange, Change Cipher Spec, Encrypted Handshake Message, Encrypted Handshake Message"
"210","2.637940555","64.233.162.153","10.0.2.155","TLSv1.2","342","New Session Ticket, Change Cipher Spec, Encrypted Handshake Message"
"211","2.637961461","64.233.162.153","10.0.2.155","TLSv1.2","127","Application Data"
"212","2.641852840","10.0.2.155","64.233.162.94","TLSv1.2","308","Client Key Exchange, Change Cipher Spec, Encrypted Handshake Message, Encrypted Handshake Message"
"213","2.652047275","64.233.162.196","10.0.2.155","TLSv1.2","379","New Session Ticket, Change Cipher Spec, Encrypted Handshake Message"
"214","2.652479747","64.233.162.196","10.0.2.155","TLSv1.2","127","Application Data"
"215","2.657694089","64.233.162.196","10.0.2.155","TLSv1.2","379","New Session Ticket, Change Cipher Spec, Encrypted Handshake Message"
"216","2.658251735","64.233.162.196","10.0.2.155","TLSv1.2","127","Application Data"
"217","2.663804281","10.0.2.155","64.233.162.94","TLSv1.2","308","Client Key Exchange, Change Cipher Spec, Encrypted Handshake Message, Encrypted Handshake Message"
"218","2.666757449","10.0.2.155","64.233.162.94","TLSv1.2","308","Client Key Exchange, Change Cipher Spec, Encrypted Handshake Message, Encrypted Handshake Message"
"219","2.670209146","64.233.162.94","10.0.2.155","TLSv1.2","379","New Session Ticket, Change Cipher Spec, Encrypted Handshake Message"
"220","2.670823804","64.233.162.94","10.0.2.155","TLSv1.2","379","New Session Ticket, Change Cipher Spec, Encrypted Handshake Message"
"221","2.670844538","64.233.162.94","10.0.2.155","TLSv1.2","127","Application Data"
"222","2.675927348","10.0.2.155","64.233.162.153","TCP","66","50572  >  443 [ACK] Seq=301 Ack=3398 Win=40704 Len=0 TSval=130819 TSecr=4252270115"
"223","2.677239744","10.0.2.155","64.233.162.94","TLSv1.2","308","Client Key Exchange, Change Cipher Spec, Encrypted Handshake Message, Encrypted Handshake Message"
"224","2.681864424","10.0.2.155","64.233.162.94","TLSv1.2","308","Client Key Exchange, Change Cipher Spec, Encrypted Handshake Message, Encrypted Handshake Message"
"225","2.682715524","64.233.162.153","10.0.2.155","TLSv1.2","127","[TCP Spurious Retransmission] , Application Data"
"226","2.682739492","10.0.2.155","64.233.162.153","TCP","78","[TCP Dup ACK 222#1] 50572  >  443 [ACK] Seq=301 Ack=3398 Win=40704 Len=0 TSval=130820 TSecr=4252270160 SLE=3337 SRE=3398"
"227","2.684124800","10.0.2.155","64.233.162.94","TLSv1.2","308","Client Key Exchange, Change Cipher Spec, Encrypted Handshake Message, Encrypted Handshake Message"
"228","2.688063402","10.0.2.155","64.233.162.94","TLSv1.2","308","Client Key Exchange, Change Cipher Spec, Encrypted Handshake Message, Encrypted Handshake Message"
"229","2.689306347","10.0.2.155","64.233.162.94","TLSv1.2","308","Client Key Exchange, Change Cipher Spec, Encrypted Handshake Message, Encrypted Handshake Message"
"230","2.690486893","10.0.2.155","64.233.162.94","TLSv1.2","308","Client Key Exchange, Change Cipher Spec, Encrypted Handshake Message, Encrypted Handshake Message"
"231","2.691692448","10.0.2.155","224.0.0.251","MDNS","168","Standard query 0x0000 SRV Admin-\\320\\237\\320\\232._smb._tcp.local, ""QM"" question AAAA Admin.local, ""QM"" question A Admin.local, ""QM"" question A 10.0.1.66 AAAA fe80::bcd3:77a7:a992:3f4a SRV 0 0 445 Admin.local"
"232","2.691933161","10.0.2.155","64.233.162.196","TCP","66","55214  >  443 [ACK] Seq=460 Ack=3335 Win=37888 Len=0 TSval=130823 TSecr=3914934374"
"233","2.693723204","64.233.162.94","10.0.2.155","TLSv1.2","379","New Session Ticket, Change Cipher Spec, Encrypted Handshake Message"
"234","2.694608064","64.233.162.94","10.0.2.155","TLSv1.2","127","Application Data"
"235","2.694626299","64.233.162.94","10.0.2.155","TLSv1.2","379","New Session Ticket, Change Cipher Spec, Encrypted Handshake Message"
"236","2.695281275","64.233.162.94","10.0.2.155","TLSv1.2","127","Application Data"
"237","2.695922024","10.0.2.155","64.233.162.196","TCP","66","55216  >  443 [ACK] Seq=460 Ack=3335 Win=37888 Len=0 TSval=130824 TSecr=1650553231"
"238","2.700070899","64.233.162.196","10.0.2.155","TLSv1.2","127","[TCP Spurious Retransmission] , Application Data"
"239","2.700170612","10.0.2.155","64.233.162.196","TCP","78","[TCP Dup ACK 232#1] 55214  >  443 [ACK] Seq=460 Ack=3335 Win=37888 Len=0 TSval=130825 TSecr=3914934422 SLE=3274 SRE=3335"
"240","2.707921512","10.0.2.155","64.233.162.94","TCP","66","52612  >  443 [ACK] Seq=460 Ack=4745 Win=40832 Len=0 TSval=130827 TSecr=660389132"
"241","2.707947197","10.0.2.155","64.233.162.94","TCP","66","52606  >  443 [ACK] Seq=458 Ack=3291 Win=40704 Len=0 TSval=130827 TSecr=35120187"
"242","2.715867046","10.0.2.155","209.85.233.95","TLSv1.2","280","Client Hello"
"243","2.716045445","10.0.2.155","64.233.162.153","TLSv1.2","111","Application Data"
"244","2.721852329","10.0.2.155","8.8.8.8","DNS","83","Standard query 0x4343 A safebrowsing.google.com"
"245","2.723443316","10.0.2.155","64.233.162.153","TLSv1.2","380","Application Data, Application Data, Application Data, Application Data"
"246","2.727366222","64.233.162.94","10.0.2.155","TLSv1.2","379","New Session Ticket, Change Cipher Spec, Encrypted Handshake Message"
"247","2.727390276","10.0.2.155","64.233.162.94","TCP","66","52626  >  443 [ACK] Seq=460 Ack=4683 Win=40832 Len=0 TSval=130831 TSecr=4225123718"
"248","2.730142040","64.233.162.94","10.0.2.155","TLSv1.2","127","Application Data"
"249","2.730158894","10.0.2.155","64.233.162.94","TCP","66","52626  >  443 [ACK] Seq=460 Ack=4744 Win=40832 Len=0 TSval=130832 TSecr=4225123718"
"250","2.730170896","64.233.162.196","10.0.2.155","TLSv1.2","127","[TCP Spurious Retransmission] , Application Data"
"251","2.730176812","10.0.2.155","64.233.162.196","TCP","78","[TCP Dup ACK 237#1] 55216  >  443 [ACK] Seq=460 Ack=3335 Win=37888 Len=0 TSval=130832 TSecr=1650553282 SLE=3274 SRE=3335"
"252","2.730180344","64.233.162.94","10.0.2.155","TLSv1.2","379","New Session Ticket, Change Cipher Spec, Encrypted Handshake Message"
"253","2.730187175","10.0.2.155","64.233.162.94","TCP","66","52624  >  443 [ACK] Seq=458 Ack=3291 Win=40704 Len=0 TSval=130832 TSecr=346878259"
"254","2.730189697","64.233.162.94","10.0.2.155","TLSv1.2","379","New Session Ticket, Change Cipher Spec, Encrypted Handshake Message"
"255","2.730194440","10.0.2.155","64.233.162.94","TCP","66","52622  >  443 [ACK] Seq=458 Ack=3291 Win=40704 Len=0 TSval=130832 TSecr=2592921930"
"256","2.730199373","64.233.162.94","10.0.2.155","TLSv1.2","379","New Session Ticket, Change Cipher Spec, Encrypted Handshake Message"
"257","2.730204522","10.0.2.155","64.233.162.94","TCP","66","52618  >  443 [ACK] Seq=458 Ack=3291 Win=40704 Len=0 TSval=130832 TSecr=1096402808"
"258","2.730206768","64.233.162.94","10.0.2.155","TLSv1.2","379","New Session Ticket, Change Cipher Spec, Encrypted Handshake Message"
"259","2.730210762","10.0.2.155","64.233.162.94","TCP","66","52616  >  443 [ACK] Seq=458 Ack=3291 Win=40704 Len=0 TSval=130832 TSecr=4273432095"
"260","2.730212864","64.233.162.94","10.0.2.155","TLSv1.2","379","New Session Ticket, Change Cipher Spec, Encrypted Handshake Message"
"261","2.730216663","10.0.2.155","64.233.162.94","TCP","66","52620  >  443 [ACK] Seq=458 Ack=3291 Win=40704 Len=0 TSval=130832 TSecr=3858483635"
"262","2.731915998","10.0.2.155","64.233.162.94","TCP","66","52628  >  443 [ACK] Seq=460 Ack=4745 Win=40832 Len=0 TSval=130833 TSecr=3331859615"
"263","2.731933767","10.0.2.155","64.233.162.94","TCP","66","52614  >  443 [ACK] Seq=460 Ack=4746 Win=40832 Len=0 TSval=130833 TSecr=4143796653"
"264","2.737560017","209.85.233.95","10.0.2.155","TCP","66","443  >  60026 [ACK] Seq=1 Ack=215 Win=43520 Len=0 TSval=105834116 TSecr=130828"
"265","2.738437302","209.85.233.95","10.0.2.155","TLSv1.2","1484","Server Hello"
"266","2.738454278","10.0.2.155","209.85.233.95","TCP","66","60026  >  443 [ACK] Seq=215 Ack=1419 Win=32128 Len=0 TSval=130834 TSecr=105834117"
"267","2.739113899","209.85.233.95","10.0.2.155","TLSv1.2","1303","Certificate, Server Key Exchange, Server Hello Done"
"268","2.739130351","10.0.2.155","209.85.233.95","TCP","66","60026  >  443 [ACK] Seq=215 Ack=2656 Win=34944 Len=0 TSval=130834 TSecr=105834117"
"269","2.741562151","10.0.2.155","209.85.233.95","TLSv1.2","151","Client Key Exchange, Change Cipher Spec, Encrypted Handshake Message"
"270","2.743663548","64.233.162.153","10.0.2.155","TCP","66","443  >  50572 [ACK] Seq=3398 Ack=660 Win=44800 Len=0 TSval=4252270222 TSecr=130829"
"271","2.744576397","64.233.162.153","10.0.2.155","TLSv1.2","96","Application Data"
"272","2.744595355","10.0.2.155","64.233.162.153","TCP","66","50572  >  443 [ACK] Seq=660 Ack=3428 Win=40704 Len=0 TSval=130836 TSecr=4252270222"
"273","2.745059743","8.8.8.8","10.0.2.155","DNS","166","Standard query response 0x4343 A safebrowsing.google.com CNAME sb.l.google.com A 209.85.233.91 A 209.85.233.93 A 209.85.233.136 A 209.85.233.190"
"274","2.747394202","10.0.2.155","209.85.233.91","TCP","74","45918  >  443 [SYN] Seq=0 Win=29200 Len=0 MSS=1460 SACK_PERM=1 TSval=130836 TSecr=0 WS=128"
"275","2.748139663","10.0.2.155","209.85.233.95","TLSv1.2","111","Application Data"
"276","2.750706706","10.0.2.155","209.85.233.95","TLSv1.2","395","Application Data, Application Data, Application Data"
"277","2.759844143","209.85.233.95","10.0.2.155","TLSv1.2","342","New Session Ticket, Change Cipher Spec, Encrypted Handshake Message"
"278","2.760398078","209.85.233.95","10.0.2.155","TLSv1.2","127","Application Data"
"279","2.760429752","10.0.2.155","209.85.233.95","TCP","66","60026  >  443 [ACK] Seq=674 Ack=2993 Win=37888 Len=0 TSval=130840 TSecr=105834139"
"280","2.760578738","10.0.2.155","209.85.233.95","TLSv1.2","96","Application Data"
"281","2.767851202","209.85.233.95","10.0.2.155","TCP","66","443  >  60026 [ACK] Seq=2993 Ack=674 Win=44800 Len=0 TSval=105834147 TSecr=130837"
"282","2.768439768","209.85.233.95","10.0.2.155","TLSv1.2","96","Application Data"
"283","2.773592989","209.85.233.95","10.0.2.155","TLSv1.2","404","Application Data"
"284","2.773652472","10.0.2.155","209.85.233.95","TCP","66","60026  >  443 [ACK] Seq=704 Ack=3361 Win=40704 Len=0 TSval=130843 TSecr=105834147"
"285","2.782979117","10.0.1.207","224.0.0.251","MDNS","136","Standard query 0x0000 A MacBook-Pro-Andrej-2.local, ""QM"" question AAAA MacBook-Pro-Andrej-2.local, ""QM"" question AAAA fe80::466:a953:7aeb:68ce A 10.0.1.100"
"286","2.784700727","10.0.1.139","224.0.0.251","MDNS","91","Standard query response 0x0000 A, cache flush 10.0.1.139"
"287","2.786191361","10.0.1.139","224.0.0.251","MDNS","91","Standard query response 0x0000 A, cache flush 10.0.1.139"
"288","2.787725122","10.0.1.133","224.0.0.251","MDNS","91","Standard query response 0x0000 A, cache flush 10.0.1.133"
"289","2.789271938","10.0.1.133","224.0.0.251","MDNS","91","Standard query response 0x0000 A, cache flush 10.0.1.133"
"290","2.792574331","10.0.1.100","224.0.0.251","MDNS","325","Standard query 0x0000 PTR _airport._tcp.local, ""QM"" question PTR _uscan._tcp.local, ""QM"" question PTR _uscans._tcp.local, ""QM"" question PTR _ippusb._tcp.local, ""QM"" question PTR _printer._tcp.local, ""QM"" question PTR _pdl-datastream._tcp.local, ""QM"" question PTR _ptp._tcp.local, ""QM"" question PTR _apple-mobdev._tcp.local, ""QM"" question PTR 93fe07f5._sub._apple-mobdev2._tcp.local, ""QM"" question PTR _apple-pairable._tcp.local, ""QM"" question PTR _raop._tcp.local, ""QM"" question PTR _airplay._tcp.local, ""QM"" question PTR _sleep-proxy._udp.local, ""QM"" question OPT"
"291","2.796425441","209.85.233.95","10.0.2.155","TLSv1.2","1305","Application Data"
"292","2.796439748","209.85.233.95","10.0.2.155","TLSv1.2","106","Application Data"
"293","2.796443968","209.85.233.95","10.0.2.155","TLSv1.2","104","Application Data"
"294","2.796465435","10.0.2.155","209.85.233.95","TCP","66","60026  >  443 [ACK] Seq=704 Ack=4678 Win=43520 Len=0 TSval=130849 TSecr=105834152"
"295","2.797577087","10.0.2.155","209.85.233.95","TLSv1.2","104","Application Data"
"296","2.799551052","209.85.233.91","10.0.2.155","TCP","74","443  >  45918 [SYN, ACK] Seq=0 Ack=1 Win=42408 Len=0 MSS=1380 SACK_PERM=1 TSval=950753143 TSecr=130836 WS=256"
"297","2.799595548","10.0.2.155","209.85.233.91","TCP","66","45918  >  443 [ACK] Seq=1 Ack=1 Win=29312 Len=0 TSval=130849 TSecr=950753143"
"298","2.799865516","10.0.2.155","209.85.233.91","TLSv1.2","291","Client Hello"
"299","2.817101050","209.85.233.95","10.0.2.155","TCP","66","443  >  60026 [ACK] Seq=4678 Ack=704 Win=44800 Len=0 TSval=105834196 TSecr=130840"
"300","2.833595847","209.85.233.91","10.0.2.155","TCP","66","443  >  45918 [ACK] Seq=1 Ack=226 Win=43520 Len=0 TSval=950753196 TSecr=130849"
"301","2.834768359","209.85.233.91","10.0.2.155","TLSv1.2","1484","Server Hello"
"302","2.834786021","10.0.2.155","209.85.233.91","TCP","66","45918  >  443 [ACK] Seq=226 Ack=1419 Win=32128 Len=0 TSval=130858 TSecr=950753196"
"303","2.834808292","209.85.233.91","10.0.2.155","TCP","1484","443  >  45918 [ACK] Seq=1419 Ack=226 Win=43520 Len=1418 TSval=950753196 TSecr=130849 [TCP segment of a reassembled PDU]"
"304","2.834818875","10.0.2.155","209.85.233.91","TCP","66","45918  >  443 [ACK] Seq=226 Ack=2837 Win=35072 Len=0 TSval=130858 TSecr=950753196"
"305","2.834828369","209.85.233.91","10.0.2.155","TLSv1.2","1484","Certificate [TCP segment of a reassembled PDU]"
"306","2.834835078","209.85.233.91","10.0.2.155","TLSv1.2","182","Server Key Exchange, Server Hello Done"
"307","2.834842499","10.0.2.155","209.85.233.91","TCP","66","45918  >  443 [ACK] Seq=226 Ack=4255 Win=37888 Len=0 TSval=130858 TSecr=950753196"
"308","2.834851873","10.0.2.155","209.85.233.91","TCP","66","45918  >  443 [ACK] Seq=226 Ack=4371 Win=37888 Len=0 TSval=130858 TSecr=950753196"
"309","2.839068270","10.0.2.155","209.85.233.91","TLSv1.2","308","Client Key Exchange, Change Cipher Spec, Encrypted Handshake Message, Encrypted Handshake Message"
"310","2.842538533","10.0.2.155","209.85.233.91","TLSv1.2","111","Application Data"
"311","2.843847942","10.0.2.155","209.85.233.91","TLSv1.2","587","Application Data, Application Data, Application Data, Application Data"
"312","2.858355285","209.85.233.95","10.0.2.155","TCP","66","443  >  60026 [ACK] Seq=4678 Ack=742 Win=44800 Len=0 TSval=105834197 TSecr=130849"
"313","2.866482662","209.85.233.91","10.0.2.155","TLSv1.2","379","New Session Ticket, Change Cipher Spec, Encrypted Handshake Message"
"314","2.867162508","209.85.233.91","10.0.2.155","TLSv1.2","127","Application Data"
"315","2.867266198","10.0.2.155","209.85.233.91","TCP","66","45918  >  443 [ACK] Seq=1034 Ack=4745 Win=40832 Len=0 TSval=130866 TSecr=950753233"
"316","2.867608954","10.0.2.155","209.85.233.91","TLSv1.2","96","Application Data"
"317","2.871274115","209.85.233.91","10.0.2.155","TCP","66","443  >  45918 [ACK] Seq=4745 Ack=1034 Win=45824 Len=0 TSval=950753238 TSecr=130860"
"318","2.875244127","209.85.233.91","10.0.2.155","TLSv1.2","96","Application Data"
"319","2.876125527","209.85.233.91","10.0.2.155","TLSv1.2","345","Application Data"
"320","2.876138392","209.85.233.91","10.0.2.155","TLSv1.2","286","Application Data"
"321","2.876193741","10.0.2.155","209.85.233.91","TCP","66","45918  >  443 [ACK] Seq=1064 Ack=5274 Win=46464 Len=0 TSval=130869 TSecr=950753239"
"322","2.876807549","209.85.233.91","10.0.2.155","TLSv1.2","134","Application Data, Application Data"
"323","2.877223651","10.0.2.155","209.85.233.91","TLSv1.2","104","Application Data"
"324","2.885206442","10.0.1.67","10.0.15.255","NBNS","92","Name query NB BRW9453304E9B4B<00>"
"325","2.891614938","64.233.162.153","10.0.2.155","TLSv1.2","335","Application Data"
"326","2.891632907","10.0.2.155","64.233.162.153","TCP","66","50572  >  443 [ACK] Seq=660 Ack=3697 Win=43520 Len=0 TSval=130872 TSecr=4252270368"
"327","2.893833451","64.233.162.153","10.0.2.155","TLSv1.2","221","Application Data, Application Data"
"328","2.893849395","10.0.2.155","64.233.162.153","TCP","66","50572  >  443 [ACK] Seq=660 Ack=3852 Win=46336 Len=0 TSval=130873 TSecr=4252270368"
"329","2.893869304","64.233.162.153","10.0.2.155","TLSv1.2","104","Application Data"
"330","2.893874281","10.0.2.155","64.233.162.153","TCP","66","50572  >  443 [ACK] Seq=660 Ack=3890 Win=46336 Len=0 TSval=130873 TSecr=4252270368"
"331","2.894269291","10.0.2.155","64.233.162.153","TLSv1.2","104","Application Data"
"332","2.904480800","209.85.233.91","10.0.2.155","TCP","66","443  >  45918 [ACK] Seq=5342 Ack=1102 Win=45824 Len=0 TSval=950753271 TSecr=130866"
"333","2.948796002","HuaweiTe_0b:51:7b","LiteonTe_6b:2c:4b","ARP","56","Who has 10.0.0.201? Tell 10.0.1.135"
"334","2.963263789","64.233.162.153","10.0.2.155","TCP","66","443  >  50572 [ACK] Seq=3890 Ack=698 Win=44800 Len=0 TSval=4252270394 TSecr=130873"
"335","2.987396562","10.0.1.133","224.0.0.251","MDNS","91","Standard query response 0x0000 A, cache flush 10.0.1.133"
"336","2.988783861","10.0.1.139","224.0.0.251","MDNS","91","Standard query response 0x0000 A, cache flush 10.0.1.139"
"337","2.990667688","10.0.1.139","224.0.0.251","MDNS","91","Standard query response 0x0000 A, cache flush 10.0.1.139"
"338","2.992148675","10.0.1.139","224.0.0.251","MDNS","91","Standard query response 0x0000 A, cache flush 10.0.1.139"
"339","2.993538917","10.0.1.139","224.0.0.251","MDNS","91","Standard query response 0x0000 A, cache flush 10.0.1.139"
"340","2.995158327","10.0.1.133","224.0.0.251","MDNS","91","Standard query response 0x0000 A, cache flush 10.0.1.133"
"341","3.398296465","10.0.1.168","239.255.255.250","SSDP","179","M-SEARCH * HTTP/1.1 "
"342","3.401202196","10.0.1.168","224.0.0.251","MDNS","75","Standard query 0x0000 PTR _ssh._tcp.local, ""QM"" question"
"343","3.601904735","10.0.2.139","230.0.0.1","UDP","92","6666  >  6666 Len=50"
"344","3.603767141","10.0.1.136","224.0.0.251","MDNS","136","Standard query 0x0000 A MacBook-Pro-Andrej-2.local, ""QM"" question AAAA MacBook-Pro-Andrej-2.local, ""QM"" question AAAA fe80::466:a953:7aeb:68ce A 10.0.1.100"
"345","3.605414288","10.0.1.67","10.0.15.255","NBNS","92","Name query NB BRW9453304E9B4B<00>"
"346","3.609287360","10.0.1.100","224.0.0.251","MDNS","395","Standard query response 0x0000 TXT PTR MacBook Pro\\302\\240\\342\\200\\224 \\320\\220\\320\\275\\320\\264\\321\\200\\320\\265\\320\\271 (2)._ssh._tcp.local TXT, cache flush SRV, cache flush 0 0 22 MacBook-Pro-Andrej-2.local AAAA, cache flush fe80::466:a953:7aeb:68ce A, cache flush 10.0.1.100 NSEC, cache flush MacBook Pro\\302\\240\\342\\200\\224 \\320\\220\\320\\275\\320\\264\\321\\200\\320\\265\\320\\271 (2)._ssh._tcp.local NSEC, cache flush MacBook-Pro-Andrej-2.local OPT"
"347","3.806736082","10.0.1.139","224.0.0.251","MDNS","91","Standard query response 0x0000 A, cache flush 10.0.1.139"
"348","3.909474420","10.0.1.139","224.0.0.251","MDNS","91","Standard query response 0x0000 A, cache flush 10.0.1.139"
"349","4.217892130","10.0.2.144","239.255.255.250","SSDP","179","M-SEARCH * HTTP/1.1 "
"350","4.426601252","10.0.1.67","10.0.15.255","NBNS","92","Name query NB BRW9453304E9B4B<00>"
"351","4.427876059","10.0.1.67","224.0.0.252","LLMNR","75","Standard query 0x3db8 A BRW9453304E9B4B"
"352","4.429364870","10.0.2.67","255.255.255.255","UDP","82","60437  >  1947 Len=40"
"353","4.627051603","10.0.2.139","230.0.0.1","UDP","92","6666  >  6666 Len=50"
"354","4.628763189","fe80::bcd3:77a7:a992:3f4a","ff02::1:3","LLMNR","94","Standard query 0x1f4d A admin-\\321\\200\\321\\237\\321\\200\\321\\231"
"355","4.630051239","10.0.1.66","224.0.0.252","LLMNR","74","Standard query 0x1f4d A admin-\\321\\200\\321\\237\\321\\200\\321\\231"
"356","4.631652956","fe80::bcd3:77a7:a992:3f4a","ff02::1:3","LLMNR","94","Standard query 0x52f8 AAAA admin-\\321\\200\\321\\237\\321\\200\\321\\231"
"357","4.632843539","10.0.1.66","224.0.0.252","LLMNR","74","Standard query 0x52f8 AAAA admin-\\321\\200\\321\\237\\321\\200\\321\\231"
"358","4.830693803","10.0.1.67","224.0.0.252","LLMNR","75","Standard query 0x3db8 A BRW9453304E9B4B"
"359","5.035880852","fe80::bcd3:77a7:a992:3f4a","ff02::1:3","LLMNR","94","Standard query 0x52f8 AAAA admin-\\321\\200\\321\\237\\321\\200\\321\\231"
"360","5.037385349","fe80::bcd3:77a7:a992:3f4a","ff02::1:3","LLMNR","94","Standard query 0x1f4d A admin-\\321\\200\\321\\237\\321\\200\\321\\231"
"361","5.038734053","10.0.1.66","224.0.0.252","LLMNR","74","Standard query 0x52f8 AAAA admin-\\321\\200\\321\\237\\321\\200\\321\\231"
"362","5.039982196","10.0.1.66","224.0.0.252","LLMNR","74","Standard query 0x1f4d A admin-\\321\\200\\321\\237\\321\\200\\321\\231"
"363","5.240587303","10.0.1.67","10.0.15.255","NBNS","92","Name query NB BRW9453304E9B4B<00>"
"364","5.242905328","10.0.1.197","239.255.255.250","SSDP","216","M-SEARCH * HTTP/1.1 "
"365","5.445480144","10.0.2.139","230.0.0.1","UDP","92","6666  >  6666 Len=50"
"366","5.855085406","10.0.1.67","10.0.15.255","NBNS","92","Name query NB BRW9453304E9B4B<00>"
"367","6.061857355","10.0.2.153","255.255.255.255","DHCP","342","DHCP Inform   - Transaction ID 0x5bf94a8e"
"368","6.264678212","10.0.2.118","224.0.0.251","MDNS","103","Standard query 0x0000 PTR _googlecast._tcp.local, ""QU"" question PTR _233637DE._sub._googlecast._tcp.local, ""QU"" question"
"369","6.267291938","10.0.1.197","239.255.255.250","SSDP","216","M-SEARCH * HTTP/1.1 "
"370","6.469305258","10.0.1.168","224.0.0.251","MDNS","75","Standard query 0x0000 PTR _ssh._tcp.local, ""QM"" question"
"371","6.472021854","10.0.1.140","224.0.0.251","MDNS","103","Standard query 0x0001 PTR _358E83DC._sub._googlecast._tcp.local, ""QU"" question PTR _googlecast._tcp.local, ""QU"" question"
"372","6.473888668","10.0.1.140","224.0.0.251","MDNS","103","Standard query 0x0001 PTR _358E83DC._sub._googlecast._tcp.local, ""QU"" question PTR _googlecast._tcp.local, ""QU"" question"
"373","6.475325567","10.0.2.139","230.0.0.1","UDP","92","6666  >  6666 Len=50"
"374","6.674502389","10.0.2.67","10.0.15.255","NBNS","92","Name query NB ISATAP<00>"
"375","6.676102993","10.0.2.67","224.0.0.252","LLMNR","66","Standard query 0x634b A isatap"
"376","6.680328069","10.0.1.100","224.0.0.251","MDNS","395","Standard query response 0x0000 TXT PTR MacBook Pro\\302\\240\\342\\200\\224 \\320\\220\\320\\275\\320\\264\\321\\200\\320\\265\\320\\271 (2)._ssh._tcp.local TXT, cache flush SRV, cache flush 0 0 22 MacBook-Pro-Andrej-2.local AAAA, cache flush fe80::466:a953:7aeb:68ce A, cache flush 10.0.1.100 NSEC, cache flush MacBook Pro\\302\\240\\342\\200\\224 \\320\\220\\320\\275\\320\\264\\321\\200\\320\\265\\320\\271 (2)._ssh._tcp.local NSEC, cache flush MacBook-Pro-Andrej-2.local OPT"
"377","7.083658229","10.0.2.67","224.0.0.252","LLMNR","66","Standard query 0x634b A isatap"
"378","7.288927757","10.0.2.118","224.0.0.251","MDNS","103","Standard query 0x0000 PTR _googlecast._tcp.local, ""QM"" question PTR _233637DE._sub._googlecast._tcp.local, ""QM"" question"
"379","7.291127841","10.0.2.144","239.255.255.250","SSDP","179","M-SEARCH * HTTP/1.1 "
"380","7.494868015","10.0.2.67","10.0.15.255","NBNS","92","Name query NB ISATAP<00>"
"381","7.496399328","10.0.1.140","224.0.0.251","MDNS","103","Standard query 0x0002 PTR _358E83DC._sub._googlecast._tcp.local, ""QM"" question PTR _googlecast._tcp.local, ""QM"" question"
"382","7.498098982","10.0.1.140","224.0.0.251","MDNS","103","Standard query 0x0002 PTR _358E83DC._sub._googlecast._tcp.local, ""QM"" question PTR _googlecast._tcp.local, ""QM"" question"
"383","7.499556207","10.0.2.139","230.0.0.1","UDP","92","6666  >  6666 Len=50"
